{
    "<page title>": "Used Casio Exilim EX Z55 5 0 MP Professional Digital Camera \u00e2\u0080\u0093 Silver | eBay",
    "additional features": "AE/FE Lock, AF Lock, Alarm Function, Audio Recording, Auto Daylight Savings Time, Auto Power Save, Built-In Speaker, DPOF Support, Date/Time Stamp, Digital Image Rotation, Digital Noise Reduction, Direct Print, Histogram Display, PRINT Image Matching, PictBridge Support, Resizing an Image",
    "auto focus type": "TTL contrast detection",
    "brand": "Casio",
    "camera flash features": "Flash +/- Compensation",
    "camera type": "Point & Shoot",
    "connector types": "Docking station, USB",
    "country of manufacture": "Japan",
    "depth": "0.9 in.",
    "digital video format": "AVI",
    "digital zoom": "4x",
    "display rotation": "Built-in",
    "display size": "2.5\"",
    "display type": "LCD",
    "effective flash range": "0.4 m - 2.6 m",
    "expansion slot": "1 x SD Memory Card",
    "exposure compensation": "\u00c2\u00b12 EV range, in 1/3 EV steps",
    "exposure metering": "Multi-Segment",
    "exposure modes": "Automatic, Program",
    "flash modes": "Auto Mode, Fill-in Mode, OFF mode, Red-eye Reduction",
    "flash type": "Built-in flash",
    "focal length equivalent to 35mm camera": "35 - 105mm",
    "focus adjustment": "Automatic, Manual",
    "height": "2.3 in.",
    "light sensitivity": "ISO 100, ISO 200, ISO 400, ISO 50, ISO auto",
    "light sensitivity max": "400",
    "macro focus range": "6-50cm",
    "max shutter speed": "1/2000 sec",
    "megapixels": "5.0 MP",
    "microphone type": "Microphone - built-in",
    "min shutter speed": "4 sec",
    "model": "EX-Z55",
    "mpn": "EX-Z55",
    "operating system supported": "Apple Mac OS 9.0 or later, Apple Mac OS X, MS Windows 2000, MS Windows 98, MS Windows 98 SE, MS Windows ME, MS Windows XP",
    "optical viewfinder type": "Real-image zoom",
    "optical zoom": "3x",
    "product information": "The EX-Z55 produces beautifully detailed images and is easy to use. A high performance CCD and 5-million pixels of resolution provide sharp images, while the 3-segment telescoping 3X optical zoom lens provides plenty of resolution. And you get it all in a thin design. The EX-Z55 allows you to take up to 400 shots (continuous recording) on a single charge. Its 2.5-inch LCD monitor screen provides a clear view of subjects as you compose images for recording.The EX-Z55 is designed for versatile, but simple operation. The Best Shot Scenes allow you to select a scene resembling the image you are trying to record. The camera then is configured automatically including recording mode, Auto Focus setting, and more. An on screen grid allows you turn on a display of grid lines to compose images better. Automatic focus features include Auto Macro and 7-point Multi AF to ensure images are captured in focus every time. Finding and manipulating images is easy using the full-month calendar screen, 0.1 second image scrolling, and image rotation features.The EX-Z55 lets you do more with your images after you record them. The bundled USB cable provides easy connection to a computer, just place the camera onto the cradle and press the SB button to automatically transfer images from camera memory to a computer. Or you can connect directly to a printer that supports PictBridge, without going through a computer. The EX-Z55 is also compatible with PRINT Image Matching and Exif Print for high-fidelity print images.Sleek and small with a highly fashionable aluminum alloy body houses a 3X optical zoom lens in a thin, stylish, 5 megapixel digital camera with a 2.5\" LCD.The EX-Z55 is packed with a powerful collection of features and functions for enhanced performance. Key extras include 9.3 MB built-in memory, Favorite folder for image retention, and key customization that allows you to assign parameters for easier operation.\nProduct Highlights Video\nProduct Identifiers BrandCasio ModelEX-Z55 MPNEX-Z55\nKey Features Camera TypePoint & Shoot Optical Zoom3x Digital Zoom4x Sensor Resolution5.0 MP Screen Size2.5\"\nOptical Sensor Sensor Size1/2.5\" Sensor TypeCCD\nLens System Macro Focus Range6-50cm Focus AdjustmentAutomatic, Manual Auto Focus typeTTL contrast detection Focal Length Equivalent to 35mm Camera35 - 105mm\nExposure Max Shutter Speed1/2000 sec Min Shutter Speed4 sec Exposure compensation\u00c2\u00b12 EV range, in 1/3 EV steps Exposure MeteringMulti-Segment Exposure ModesAutomatic, Program Light SensitivityISO 100, ISO 200, ISO 400, ISO 50, ISO auto Light Sensitivity Max400\nCamera Flash Flash TypeBuilt-in flash Red Eye ReductionYes Effective Flash Range0.4 m - 2.6 m Camera Flash FeaturesFlash +/- Compensation Flash ModesAuto Mode, Fill-in Mode, OFF mode, Red-eye Reduction\nMemory / Storage Supported Flash MemoryMultiMediaCard, SD Memory Card\nViewfinder Viewfinder TypeOptical Optical Viewfinder TypeReal-image zoom\nDimensions Depth0.9 in. Height2.3 in. Width3.4 in. Weight4.64 Oz.\nDisplay Display TypeLCD Display RotationBuilt-in Screen DetailsLCD display - TFT active matrix - 2.5\" - color Display Size2.5\"\nMicrophone Microphone TypeMicrophone - built-in\nConnections Connector TypesDocking station, USB Expansion Slot1 x SD Memory Card\nSystem Requirements for PC Connection Operating System SupportedApple Mac OS 9.0 or later, Apple Mac OS X, MS Windows 2000, MS Windows 98, MS Windows 98 SE, MS Windows ME, MS Windows XP\nFile Format Digital Video FormatAVI Still Image FormatJPEG\nOther Features Additional FeaturesAE/FE Lock, AF Lock, Alarm Function, Audio Recording, Auto Daylight Savings Time, Auto Power Save, Built-In Speaker, DPOF Support, Date/Time Stamp, Digital Image Rotation, Digital Noise Reduction, Direct Print, Histogram Display, PRINT Image Matching, PictBridge Support, Resizing an Image Shooting ModesFrame Movie Mode\nMiscellaneous Shooting ProgramsCandlelight portrait, Children, Collection, Coupling shot, Document, Fireworks, Flower, Food, Natural green, Night portrait, Night scene, Party/indoor, Pet, Portrait mode, Portrait with scenery, Pre-shot, Scenery, Sundown, Text, Twilight mode Special EffectsBlack & White, Sepia, Whiteboard Video CaptureAVI - 320 x 240 - 15 fps - 30 sec - with 9.3MB built-in memory",
    "red eye reduction": "Yes",
    "screen details": "LCD display - TFT active matrix - 2.5\" - color",
    "screen size": "2.5\"",
    "sensor resolution": "5.0 MP",
    "sensor size": "1/2.5\"",
    "sensor type": "CCD",
    "shooting modes": "Frame Movie Mode",
    "shooting programs": "Candlelight portrait, Children, Collection, Coupling shot, Document, Fireworks, Flower, Food, Natural green, Night portrait, Night scene, Party/indoor, Pet, Portrait mode, Portrait with scenery, Pre-shot, Scenery, Sundown, Text, Twilight mode",
    "special effects": "Black & White, Sepia, Whiteboard",
    "still image format": "JPEG",
    "supported flash memory": "MultiMediaCard, SD Memory Card",
    "type": "Point & Shoot",
    "video capture": "AVI - 320 x 240 - 15 fps - 30 sec - with 9.3MB built-in memory",
    "viewfinder type": "Optical",
    "weight": "4.64 Oz.",
    "width": "3.4 in."
}