{
    "<page title>": "Nikon D5300 Black Body Kit with AF s DX Zoom Nikkor 18 55mm F 3 5 5 6g VR Expres 018208015191 | eBay",
    "ac power adapter": "EH-5b (Optional)",
    "angle of view": "170.0\u00c2\u00b0",
    "aspect ratio": [
        "3:2",
        "16:9"
    ],
    "audio recording": "Built-in Mic: With Video, Stereo,\nOptional External Mic: With Video,",
    "autofocus points": "Phase Detection: 39",
    "battery": "1x EN-EL14 Rechargeable Lithium-Ion Battery Pack, 7.4VDC, 1030mAh",
    "bit depth": "14-bit",
    "brand": "Nikon",
    "builtin flash": "Yes",
    "camera format": "DX / (1.5x Crop Factor)",
    "camera type": "Digital SLR with Interchangeable lenses",
    "condition": "New: A brand-new, unused, unopened, undamaged item in its original packaging (where packaging is\napplicable). Packaging should be the same as what is found in a retail store, unless the item is handmade or was packaged by the manufacturer in non-retail packaging, such as an unprinted box or plastic bag. See the seller's listing for full details.\nSee all condition definitions- opens in a new window or tab\n... Read moreabout the condition",
    "connectivity": "1/8\" Microphone, AV Output, HDMI C (Mini), USB 2.0",
    "continuous shooting": "Up to 5 fps",
    "continuous shooting time": "1920 x 1080\n@ 60 fps: 20 min.\n@ 30 fps: 29 min.",
    "dedicated flash system": "iTTL",
    "dimensions wxhxd": "4.9 x 3.9 x 3.0\" / 125.0 x 98.0 x 76.0 mm",
    "diopter adjustment": "- 1.7 to +1 m",
    "display screen": "3.2\" Rear Screen Swivel LCD (1,037,000)",
    "dust reduction system": "Yes",
    "exposure control": "Auto\nManual",
    "exposure modes": "Modes: Aperture Priority, Auto, Manual, Programmed Auto, Scene Modes, Shutter Priority\nMetering Range: EV 0.0 - EV 20.0\nCompensation: -5 EV to +5 EV (in .3 or .5 EV steps)",
    "external flash connection": "Hot Shoe",
    "file formats": "Still Images: JPEG, RAW\nMovies: MOV, MPEG-4 AVC/H.264\nAudio: Linear PCM",
    "file size": "1920 x 1080p (Full HD)\n1280 x 720p (HD)\n640 x 424p (SD)",
    "flash compensation": "-3 EV to +1 EV (in .3 or .5 EV steps)",
    "flash modes": "Modes: Auto\nAuto/Red-eye Reduction\nFill-in\nOff\nRear Curtain/Slow Sync\nRear Sync\nRed-eye Reduction\nSlow Sync\nSlow Sync./Red-eye Reduction\nCompensation: -3 EV to +1 EV (in .3 or .5 EV steps)",
    "focus": "Auto\nManual\nContinuous Auto",
    "focus mode": "Single-servo AF (S), Continuous-servo AF (C),",
    "focus type": "Auto & Manual",
    "frame rate": "@ 1920 x 1080: 60 fps, 50 fps, 30 fps, 25 fps, 24 fps\n@ 1280 x 720: 60 fps, 50 fps\n@ 640 x 424: 30 fps, 25 fps",
    "guide no": "42.65' (13 m) ISO100",
    "imaging": "Camera Type Digital SLR with Interchangeable lenses Lens Mount Nikon F Camera Format DX / (1.5x Crop Factor) Pixels Actual: 24.78 Megapixel\nEffective: 24.2 Megapixel Max Resolution 24MP: 6000 x 4000 @ 3:2 Other Resolutions 13.5MP: 4496 x 3000 @ 3:2\n6MP: 2992 x 2000 @ 3:2 Aspect Ratio 3:2 Sensor Type / Size CMOS, 23.5 x 15.6 mm File FormatsStill Images: JPEG, RAW\nMovies: MOV, MPEG-4 AVC/H.264\nAudio: Linear PCM Bit Depth 14-bit Dust Reduction System Yes Noise Reduction Yes Memory Card Type SD\nSDHC\nSDXC Focus Control Focus Type Auto & Manual Focus Mode Single-servo AF (S), Continuous-servo AF (C), Autofocus Points Phase Detection: 39 Viewfinder/Display Viewfinder Type Pentamirror Viewfinder Coverage 95% Viewfinder Magnification Approx. 0.82x Diopter Adjustment - 1.7 to +1 m Display Screen 3.2\" Rear Screen Swivel LCD (1,037,000) Screen Coverage 100% Angle of View 170.0\u00c2\u00b0 Live View Yes Exposure Control ISO Sensitivity Auto, 100-12800 (Extended Mode: 100-25600) Shutter Type: Electronic & Mechanical\nSpeed: 30 - 1/4000 sec, Bulb Mode Remote Control MC-DC2 (Optional) Mirror Lock-Up Yes Metering Method 3D Color Matrix Metering, Center-weighted average metering, Spot metering Exposure Modes Modes: Aperture Priority, Auto, Manual, Programmed Auto, Scene Modes, Shutter Priority\nMetering Range: EV 0.0 - EV 20.0\nCompensation: -5 EV to +5 EV (in .3 or .5 EV steps) White Balance Modes Auto, Cloudy, Direct Sunlight, Flash, Fluorescent, Incandescent, Preset Manual, Shade Flash Flash Modes Modes: Auto\nAuto/Red-eye Reduction\nFill-in\nOff\nRear Curtain/Slow Sync\nRear Sync\nRed-eye Reduction\nSlow Sync\nSlow Sync./Red-eye Reduction\nCompensation: -3 EV to +1 EV (in .3 or .5 EV steps) Built-in Flash Yes Guide No. 42.65' (13 m) ISO100 Max Sync Speed 1 / 200 sec Flash Compensation -3 EV to +1 EV (in .3 or .5 EV steps) Dedicated Flash System iTTL External Flash Connection Hot Shoe AV Recording Video Recording Yes File Size 1920 x 1080p (Full HD)\n1280 x 720p (HD)\n640 x 424p (SD) Aspect Ratio 16:9 Frame Rate @ 1920 x 1080: 60 fps, 50 fps, 30 fps, 25 fps, 24 fps\n@ 1280 x 720: 60 fps, 50 fps\n@ 640 x 424: 30 fps, 25 fps Exposure Control Auto\nManual Focus Auto\nManual\nContinuous Auto Continuous Shooting Time1920 x 1080\n@ 60 fps: 20 min.\n@ 30 fps: 29 min. Audio Recording Built-in Mic: With Video, Stereo,\nOptional External Mic: With Video, Performance Continuous Shooting Up to 5 fps Self Timer 2 sec, 5 sec, 10 sec, 20 sec\nNumber of Shots: 1-9 Interval Recording Yes In-Camera Image Editing Color Balance, Color Outline, Color Sketch, D-Lighting, Edit Movie, Filter Effects, Fisheye, Image Overlay, Miniature Effect, Monochrome, NEF (RAW) Processing, Perspective Control, Quick Retouch, Red-eye Correction, Resize Image, Selective Color, Side-by-Side Comparison, Straighten, Trim Connectivity 1/8\" Microphone, AV Output, HDMI C (Mini), USB 2.0 Wi-Fi Capable Yes Power Battery 1x EN-EL14 Rechargeable Lithium-Ion Battery Pack, 7.4VDC, 1030mAh AC Power Adapter EH-5b (Optional) Operating/Storage TemperatureOperating\n32 to 104\u00c2\u00b0F (0 to 40\u00c2\u00b0C) Physical Dimensions (WxHxD) 4.9 x 3.9 x 3.0\" / 125.0 x 98.0 x 76.0 mm Weight 1.06 lb / 480 g body only",
    "incamera image editing": "Color Balance, Color Outline, Color Sketch, D-Lighting, Edit Movie, Filter Effects, Fisheye, Image Overlay, Miniature Effect, Monochrome, NEF (RAW) Processing, Perspective Control, Quick Retouch, Red-eye Correction, Resize Image, Selective Color, Side-by-Side Comparison, Straighten, Trim",
    "interval recording": "Yes",
    "iso sensitivity": "Auto, 100-12800 (Extended Mode: 100-25600)",
    "lens mount": "Nikon F",
    "live view": "Yes",
    "max resolution": "24MP: 6000 x 4000 @ 3:2",
    "max sync speed": "1 / 200 sec",
    "megapixels": "24.2 MP",
    "memory card type": "SD\nSDHC\nSDXC",
    "metering method": "3D Color Matrix Metering, Center-weighted average metering, Spot metering",
    "mirror lockup": "Yes",
    "model": "D5300",
    "mpn": "1519",
    "noise reduction": "Yes",
    "operatingstorage temperature": "Operating\n32 to 104\u00c2\u00b0F (0 to 40\u00c2\u00b0C)",
    "other resolutions": "13.5MP: 4496 x 3000 @ 3:2\n6MP: 2992 x 2000 @ 3:2",
    "pixels": "Actual: 24.78 Megapixel\nEffective: 24.2 Megapixel",
    "remote control": "MC-DC2 (Optional)",
    "screen coverage": "100%",
    "screen size": "3.2\"",
    "self timer": "2 sec, 5 sec, 10 sec, 20 sec\nNumber of Shots: 1-9",
    "sensor type  size": "CMOS, 23.5 x 15.6 mm",
    "shutter": "Type: Electronic & Mechanical\nSpeed: 30 - 1/4000 sec, Bulb Mode",
    "type": "Digital SLR",
    "upc": "018208015191",
    "video recording": "Yes",
    "viewfinder coverage": "95%",
    "viewfinder magnification": "Approx. 0.82x",
    "viewfinder type": "Pentamirror",
    "warranty": "1 Year Seller Warranty",
    "weight": "1.06 lb / 480 g body only",
    "white balance modes": "Auto, Cloudy, Direct Sunlight, Flash, Fluorescent, Incandescent, Preset Manual, Shade",
    "wifi capable": "Yes"
}