{
    "<page title>": "L K HP Photosmart M415 5 2 MP Digital Camera Silver | eBay",
    "additional features": "AE/FE Lock, AF Lock, Audio Recording, DPOF Support, Date/Time Stamp, Direct Print, Not Interchangeable Lenses, PictBridge Support, Red eye Fix, Red-eye Correction, USB, With Tripod Mount",
    "auto focus type": "TTL contrast detection",
    "battery form factor": "Standard form factor",
    "brand": "HP",
    "bundled items": "Case or Bag, Memory Card, Strap (Neck or Wrist)",
    "camera flash features": "Auto Flash, Fill-in Flash, Flash Off, Red-eye Reduction Flash, Slow Sync",
    "camera type": "Point & Shoot",
    "connector types": "1 x DC power input, 1 x USB, 1 x docking station",
    "continuous shooting speed": "2 frames per second",
    "depth": "1.44 in.",
    "digital video format": "MPEG-1",
    "digital zoom": "6x",
    "display rotation": "Built-in",
    "display size": "1.5\"",
    "display type": "LCD",
    "effective flash range": "3.8 m",
    "expansion slot": "1 x SD Memory Card",
    "exposure compensation": "\u00c2\u00b12 EV range, in 1/2 EV steps",
    "exposure metering": "Center-Weighted",
    "exposure modes": "Automatic, Program",
    "flash modes": "Auto Mode, Fill-in Mode, Night Mode, OFF mode, Red-eye Reduction",
    "flash type": "Built-in flash",
    "focal length equivalent to 35mm camera": "36 - 108mm",
    "focus adjustment": "Automatic",
    "height": "2.12 in.",
    "integrated memory size": "16 MB",
    "light sensitivity": "ISO 100, ISO 200, ISO 400, ISO auto",
    "light sensitivity max": "400",
    "macro focus range": "10-80cm",
    "max operating temperature": "50 \u00c2\u00b0C",
    "max shutter speed": "1/2000 sec",
    "max video resolution": "320 x 240",
    "microphone operation mode": "Mono",
    "microphone type": "Microphone - built-in - electret condenser - mono",
    "min operating temperature": "0 \u00c2\u00b0C",
    "min shutter speed": "2 sec",
    "model": "M415",
    "mpn": "L2021A#ABA",
    "operating system supported": "Apple Mac OS X 10.1.5, Apple Mac OS X 10.2.x or later, Apple Mac OS X 10.3.x, MS Windows 2000, MS Windows XP, Microsoft Windows 2000, Microsoft Windows 98, Microsoft Windows 98SE, Microsoft Windows ME, Microsoft Windows XP",
    "optical viewfinder type": "Real-image zoom",
    "optical zoom": "3x",
    "product information": "HP introduces its most fundamental camera with 5MP, the PhotoSmart M415 with 3x optical zoom and 6x digital zoom. With a 1.5 inch TFT screen, choice of ISO levels, assorted effects, in-built red eye removal, it proves to be a highly efficient yet simplistic digital camera. Moreover, the dynamic lighting system and 8 shooting modes justify its suitability for the casual or more serious photographer.\nProduct Identifiers BrandHP ModelM415 MPNL2021A#ABA\nKey Features Camera TypePoint & Shoot Optical Zoom3x Digital Zoom6x Sensor Resolution5.2 MP Screen Size1.5\"\nOptical Sensor Sensor Size1/2.5\" Sensor TypeCCD\nLens System Macro Focus Range10-80cm Focus AdjustmentAutomatic Auto Focus typeTTL contrast detection Focal Length Equivalent to 35mm Camera36 - 108mm\nExposure Max Shutter Speed1/2000 sec Min Shutter Speed2 sec Exposure compensation\u00c2\u00b12 EV range, in 1/2 EV steps Exposure MeteringCenter-Weighted Exposure ModesAutomatic, Program Light SensitivityISO 100, ISO 200, ISO 400, ISO auto Light Sensitivity Max400\nCamera Flash Flash TypeBuilt-in flash Red Eye ReductionYes Effective Flash Range3.8 m Camera Flash FeaturesAuto Flash, Fill-in Flash, Flash Off, Red-eye Reduction Flash, Slow Sync Flash ModesAuto Mode, Fill-in Mode, Night Mode, OFF mode, Red-eye Reduction\nMemory / Storage Integrated Memory size16 MB Supported Flash MemoryBuilt-in, MultiMediaCard, SD Card, SD Memory Card\nViewfinder Viewfinder TypeOptical Optical Viewfinder TypeReal-image zoom\nDimensions Depth1.44 in. Height2.12 in. Width4.28 in. Weight5.3 Oz.\nDisplay Display TypeLCD Display RotationBuilt-in Screen DetailsLCD display - TFT active matrix - 1.5\" - color Display Size1.5\"\nMicrophone Microphone TypeMicrophone - built-in - electret condenser - mono Microphone Operation ModeMono\nConnections Connector Types1 x DC power input, 1 x USB, 1 x docking station Expansion Slot1 x SD Memory Card\nSystem Requirements for PC Connection Operating System SupportedApple Mac OS X 10.1.5, Apple Mac OS X 10.2.x or later, Apple Mac OS X 10.3.x, MS Windows 2000, MS Windows XP, Microsoft Windows 2000, Microsoft Windows 98, Microsoft Windows 98SE, Microsoft Windows ME, Microsoft Windows XP\nBattery Battery Form FactorStandard form factor\nFile Format Digital Video FormatMPEG-1 Still Image FormatJPEG\nResolution Max Video Resolution320 x 240\nEnvironmental Parameters Min Operating Temperature0 \u00c2\u00b0C Max Operating Temperature50 \u00c2\u00b0C\nOther Features Additional FeaturesAE/FE Lock, AF Lock, Audio Recording, DPOF Support, Date/Time Stamp, Direct Print, Not Interchangeable Lenses, PictBridge Support, Red eye Fix, Red-eye Correction, USB, With Tripod Mount Shooting ModesFrame Movie Mode\nMiscellaneous Shooting ProgramsAction, Beach/snow, Landscape, Macro, Portrait mode, Snap shot Special EffectsBlack & White, Sepia White BalanceAuto, Daylight / Sunny (Preset), Fluorescent (Preset), Shade (Preset), Tungsten (Preset) Continuous Shooting Speed2 frames per second Video CaptureMPEG - 288 x 216 - 15 fps",
    "red eye reduction": "Yes",
    "screen details": "LCD display - TFT active matrix - 1.5\" - color",
    "screen size": "1.5\"",
    "sensor resolution": "5.2 MP",
    "sensor size": "1/2.5\"",
    "sensor type": "CCD",
    "shooting modes": "Frame Movie Mode",
    "shooting programs": "Action, Beach/snow, Landscape, Macro, Portrait mode, Snap shot",
    "special effects": "Black & White, Sepia",
    "still image format": "JPEG",
    "supported flash memory": "Built-in, MultiMediaCard, SD Card, SD Memory Card",
    "type": "Point & Shoot",
    "video capture": "MPEG - 288 x 216 - 15 fps",
    "viewfinder type": "Optical",
    "weight": "5.3 Oz.",
    "white balance": "Auto, Daylight / Sunny (Preset), Fluorescent (Preset), Shade (Preset), Tungsten (Preset)",
    "width": "4.28 in."
}