{
    "<page title>": "Good Condition Canon PowerShot in Original Packaging | eBay",
    "autofocus system": "TTL Autofocus",
    "brand": "Canon",
    "builtin flash": "Auto, Auto w/ Red-eye Reduction, Flash On, Flash On w/ Red-eye Reduction, Flash Off, FE lock, Slow Synchro",
    "bundled items": "Memory Card",
    "condition": "Used: An item that has been used previously. The item may have some signs of cosmetic wear, but is fully\noperational and functions as intended. This item may be a floor model or store return that has been used. See the seller\u00e2\u0080\u0099s listing for full details and description of any imperfections.\nSee all condition definitions- opens in a new window or tab\n... Read moreabout the condition",
    "continuous shooting": "Approx. 1.3 fps (Large/Fine)",
    "digital zoom": "4x",
    "effective pixels": "Approx. 8.0 Megapixels",
    "exposure compensation": "+/-2 stops in 1/3-stop increments",
    "exposure control method": "Program AE, Auto ISO Shift; AE Lock",
    "file format": "Design rule for camera file system, DPOF Version 1.1",
    "flash exposure compensation": "+/-2 stops in 1/3-stop increments",
    "flash range": "1.0-13.1 ft./30cm-4.0m (W), 1.0-6.6 ft./30cm-2.0m (T) (when sensitivity is set to ISO Auto)",
    "focal length": "4.6-17.3mm f/2.8-5.8 (35mm film equivalent: 28-105mm)",
    "focusing range": "Normal: 1.5 ft./45cm-infinity\nMacro: 1.2 in.-2.0 ft./3-60cm (WIDE), 1.0-2.0 ft./30-60cm (TELE)\nDigital Macro: 1.2 in.-2.0 ft./3-60cm (W)",
    "jpeg compression mode": "Still Image: Exif 2.2 (JPEG)\nMovie: AVI (Image: Motion JPEG; Audio: WAVE [Monaural])",
    "lcd coverage": "100%",
    "lcd monitor": "3.0-inch low-temperature polycrystalline silicon TFT color LCD with wide viewing angle",
    "lcd pixels": "Approx. 230,000 pixels",
    "light metering method": "Evaluative*, Center-weighted average, Spot**\n* Control to incorporate facial brightness in Face Detection AF\n** Metering frame is fixed to the center",
    "manufacturer warranty": "No",
    "maximum aperture": "f/2.8 (W) - f/5.8 (T)",
    "model": "SD870 IS",
    "optical viewfinder": "None",
    "optical zoom": "3x",
    "recycling time": "10 sec. or less (battery voltage=3.7V)",
    "self timer": "Activates shutter after an approx. 2-sec./10-sec. delay, Custom",
    "sensitivity": "Auto, High ISO Auto, ISO 80/100/200/400/800/1600 equivalent(Standard Output Sensitivity. Recommended Exposure Index)",
    "shooting modes": "Auto, Camera M, Special Scene (Portrait, Foliage, Snow, Beach, Fireworks, Aquarium, Underwater, Indoor, Kids & Pets, Night Snapshot), Color Accent, Color Swap, Digital Macro, Stitch Assist, Movie",
    "shutter speed": "15-1/1600 sec.; Long Shutter operates with noise reduction when manually set at 1-15 sec.",
    "storage media": "SD/SDHC Memory Card, MultiMediaCard, MMC Plus Card, HC MMC Plus Card",
    "total pixels": "Approx. 8.3 Megapixels",
    "type": [
        "8.0 Megapixel, 1/2.5 inch type Charge Coupled Device (CCD)",
        "Compact digital still camera with built-in flash, 3.8x Optical/4x Digital/15x Combined Zoom with Optical Image Stabilizer (IS) System"
    ],
    "type of camera": "TypeCompact digital still camera with built-in flash, 3.8x Optical/4x Digital/15x Combined Zoom with Optical Image Stabilizer (IS) System Image Capture Device Type8.0 Megapixel, 1/2.5 inch type Charge Coupled Device (CCD) Total PixelsApprox. 8.3 Megapixels Effective PixelsApprox. 8.0 Megapixels Lens Focal Length4.6-17.3mm f/2.8-5.8 (35mm film equivalent: 28-105mm) Digital Zoom4x Focusing RangeNormal: 1.5 ft./45cm-infinity\nMacro: 1.2 in.-2.0 ft./3-60cm (WIDE), 1.0-2.0 ft./30-60cm (TELE)\nDigital Macro: 1.2 in.-2.0 ft./3-60cm (W) Autofocus SystemTTL Autofocus Viewfinders Optical ViewfinderNone LCD Monitor3.0-inch low-temperature polycrystalline silicon TFT color LCD with wide viewing angle LCD PixelsApprox. 230,000 pixels LCD Coverage100% Aperture and Shutter Maximum Aperturef/2.8 (W) - f/5.8 (T) Shutter Speed15-1/1600 sec.; Long Shutter operates with noise reduction when manually set at 1-15 sec. Exposure Control SensitivityAuto, High ISO Auto, ISO 80/100/200/400/800/1600 equivalent(Standard Output Sensitivity. Recommended Exposure Index) Light Metering MethodEvaluative*, Center-weighted average, Spot**\n* Control to incorporate facial brightness in Face Detection AF\n** Metering frame is fixed to the center\nExposure Control MethodProgram AE, Auto ISO Shift; AE Lock Exposure Compensation+/-2 stops in 1/3-stop increments White Balance White Balance ControlAuto, Preset (Daylight, Cloudy, Tungsten, Fluorescent, Fluorescent H), Custom Flash Built-in FlashAuto, Auto w/ Red-eye Reduction, Flash On, Flash On w/ Red-eye Reduction, Flash Off, FE lock, Slow Synchro Flash Range1.0-13.1 ft./30cm-4.0m (W), 1.0-6.6 ft./30cm-2.0m (T) (when sensitivity is set to ISO Auto) Recycling Time10 sec. or less (battery voltage=3.7V) Flash Exposure Compensation+/-2 stops in 1/3-stop increments Shooting Specifications Shooting ModesAuto, Camera M, Special Scene (Portrait, Foliage, Snow, Beach, Fireworks, Aquarium, Underwater, Indoor, Kids & Pets, Night Snapshot), Color Accent, Color Swap, Digital Macro, Stitch Assist, Movie Self TimerActivates shutter after an approx. 2-sec./10-sec. delay, Custom Wireless ControlNot available Continuous ShootingApprox. 1.3 fps (Large/Fine) Image Storage Storage MediaSD/SDHC Memory Card, MultiMediaCard, MMC Plus Card, HC MMC Plus Card File FormatDesign rule for camera file system, DPOF Version 1.1 JPEG Compression ModeStill Image: Exif 2.2 (JPEG)\nMovie: AVI (Image: Motion JPEG; Audio: WAVE [Monaural]) Number of Recording PixelsStill Image: 3,264 x 2,448 (Large), 2,592 x 1.944 (Medium 1), 2,048 x 1,536 (Medium 2), 1,600 x 1,200 (Medium 3), 640 x 480 (Small), 3,264 x 1,832 (Widescreen)\nMovie: 640 x 480 (30 fps/30 fps LP), 320 x 240 (30 fps) available up to 4GB or 60 minutes, 640 x 480 (2 hours at 0.5 fps/1 fps), 160 x 120 (3 min. at 15 fps)",
    "white balance control": "Auto, Preset (Daylight, Cloudy, Tungsten, Fluorescent, Fluorescent H), Custom",
    "wireless control": "Not available"
}