{
    "<page title>": "Canon PowerShot A520 4 0 MP Digital Camera 013803047837 | eBay",
    "additional features": "AE/FE Lock, AF Lock, Audio Recording, Auto Power Save, Built-In Speaker, DPOF Support, Date/Time Stamp, Digital Image Rotation, Direct Print, Histogram Display, Not Interchangeable Lenses, Orientation Detection, PictBridge Support, RGB Primary Color Filter, USB, With Tripod Mount",
    "auto focus type": "TTL contrast detection",
    "battery form factor": "Standard form factor",
    "brand": "Canon",
    "camera flash features": "AF Illuminator, Auto Flash, Fill-in Flash, Flash +/- Compensation, Flash Off, Red-eye Reduction Flash",
    "camera type": "Point & Shoot",
    "condition": "Used: An item that has been used previously. The item may have some signs of cosmetic wear, but is fully\noperational and functions as intended. This item may be a floor model or store return that has been used. See the seller\u00e2\u0080\u0099s listing for full details and description of any imperfections.\nSee all condition definitions- opens in a new window or tab\n... Read moreabout the condition",
    "connector types": "1 x DC power input, 1 x USB, 1 x composite video/audio output",
    "continuous shooting speed": "1.9 frames per second",
    "depth": "1.51 in.",
    "digital video format": "AVI, Motion JPEG",
    "digital zoom": "3.6x",
    "display rotation": "Built-in",
    "display size": "1.8\"",
    "display type": "LCD",
    "effective flash range": "0.3 m - 3.5 m",
    "expansion slot": "1 x SD Memory Card",
    "exposure compensation": "\u00c2\u00b12 EV range, in 1/3 EV steps",
    "exposure metering": "Center-Weighted, Evaluative, Spot",
    "exposure modes": "Aperture-Priority, Automatic, Manual, Program, Shutter-Priority",
    "flash modes": "Auto Mode, Fill-in Mode, OFF mode, Red-eye Reduction, Slow Synchro",
    "flash type": "Built-in flash",
    "focal length equivalent to 35mm camera": "35 - 140mm",
    "focus adjustment": "Autofocus & Manual Focus, Automatic, Manual",
    "height": "2.52 in.",
    "light sensitivity": "ISO 100, ISO 200, ISO 400, ISO 50, ISO auto",
    "light sensitivity max": "400",
    "macro focus range": "5-45cm",
    "max operating temperature": "40 \u00c2\u00b0C",
    "max shutter speed": "1/2000 sec",
    "max video resolution": "640 x 480",
    "megapixels": "4.0 MP",
    "microphone type": "Microphone - built-in",
    "min operating temperature": "0 \u00c2\u00b0C",
    "min shutter speed": "15 sec",
    "model": "A520",
    "mpn": "9715A043",
    "operating system supported": "Apple Mac OS X 10.0.1 or later, MS Windows 2000, MS Windows 98, MS Windows 98 SE, MS Windows ME, MS Windows XP, Microsoft Windows 2000, Microsoft Windows 98SE, Microsoft Windows ME, Microsoft Windows XP",
    "optical viewfinder type": "Real-image zoom",
    "optical zoom": "4x",
    "product information": "A powerful 4x zoom is just the start of this affordable digital marvel. Easy enough for the whole family to use, and with manual functions and optional accessories for your creative side.Versatility is the name of the game for the 4.0 Megapixel PowerShot A520. It is delightfully easy for the whole family to use, yet incorporates a multitude of advanced features and manual modes to challenge the most inquisitive user.With a powerful Canon original 4x zoom and 20 shooting modes, including 8 special scene modes, at your disposal, you can cover any shooting situation from a sweeping panorama to the tiniest details on an intricate flower. The special scene modes are stored shooting presets ideal in tricky shooting conditions when you don't want to use the manual controls. There is even an 'Underwater' mode for use with the exciting optional waterproof case.Take up to 3-minute movie clips, complete with sound recording and fun playback on the large 1.8\" LCD monitor. For very high definition playback on a TV, the camera can also record up to 30 second VGA clips.Every function on the PowerShot A520 works with you to get great results. 9-point AiAF keeps everything sharply focused - even with off-center subjects. Canon Visionary Technology combines in the form of a superb quality lens, precision sensor and super fast processor to ensure accurate colors and high clarity images. To speed up focusing and optimize exposures, the camera analyzes the scene and makes setting adjustments even before the shutter release is pressed.A Print/Share button makes printing direct to any PictBridge or Canon Direct Print compatible printer a breeze, and simplifies uploads to any Windows PC. When connected to a Canon SELPHY Compact Photo Printer, the PowerShot A520 allows you to print a sequence of movie clip frames, and produce your own ID photos.ZoomBrowser EX (for Windows) and ImageBrowser (for Macintosh) software helps you arrange photo albums, crop photographs and adjust contrast and brightness with ease.To help you get more out of your camera, the range of optional accessories includes a 40m depth waterproof case, large capacity rechargeable batteries, wide and tele-converter lenses and a High-Power Flash for extending night shooting range.\nProduct Highlights Video\nProduct Identifiers BrandCanon ModelA520 MPN9715A043 UPC013803047837, 013803047844\nKey Features Camera TypePoint & Shoot Optical Zoom4x Digital Zoom3.6x Sensor Resolution4.0 MP Screen Size1.8\"\nOptical Sensor Sensor Size1/2.5\" Sensor TypeCCD\nLens System Macro Focus Range5-45cm Focus AdjustmentAutofocus & Manual Focus, Automatic, Manual Auto Focus typeTTL contrast detection Focal Length Equivalent to 35mm Camera35 - 140mm\nExposure Max Shutter Speed1/2000 sec Min Shutter Speed15 sec Exposure compensation\u00c2\u00b12 EV range, in 1/3 EV steps Exposure MeteringCenter-Weighted, Evaluative, Spot Exposure ModesAperture-Priority, Automatic, Manual, Program, Shutter-Priority Light SensitivityISO 100, ISO 200, ISO 400, ISO 50, ISO auto Light Sensitivity Max400\nCamera Flash Flash TypeBuilt-in flash Red Eye ReductionYes Effective Flash Range0.3 m - 3.5 m Camera Flash FeaturesAF Illuminator, Auto Flash, Fill-in Flash, Flash +/- Compensation, Flash Off, Red-eye Reduction Flash Flash ModesAuto Mode, Fill-in Mode, OFF mode, Red-eye Reduction, Slow Synchro\nMemory / Storage Supported Flash MemoryMultiMediaCard, SD Card, SD Memory Card\nViewfinder Viewfinder TypeOptical Optical Viewfinder TypeReal-image zoom\nDimensions Depth1.51 in. Height2.52 in. Width3.57 in. Weight6.35 Oz.\nDisplay Display TypeLCD Display RotationBuilt-in Screen DetailsLCD display - TFT active matrix - 1.8\" - color Display Size1.8\"\nMicrophone Microphone TypeMicrophone - built-in\nConnections Connector Types1 x DC power input, 1 x USB, 1 x composite video/audio output Expansion Slot1 x SD Memory Card\nSystem Requirements for PC Connection Operating System SupportedApple Mac OS X 10.0.1 or later, MS Windows 2000, MS Windows 98, MS Windows 98 SE, MS Windows ME, MS Windows XP, Microsoft Windows 2000, Microsoft Windows 98SE, Microsoft Windows ME, Microsoft Windows XP\nBattery Battery Form FactorStandard form factor\nFile Format Digital Video FormatAVI, Motion JPEG Still Image FormatJPEG\nResolution Max Video Resolution640 x 480\nEnvironmental Parameters Min Operating Temperature0 \u00c2\u00b0C Max Operating Temperature40 \u00c2\u00b0C\nOther Features Additional FeaturesAE/FE Lock, AF Lock, Audio Recording, Auto Power Save, Built-In Speaker, DPOF Support, Date/Time Stamp, Digital Image Rotation, Direct Print, Histogram Display, Not Interchangeable Lenses, Orientation Detection, PictBridge Support, RGB Primary Color Filter, USB, With Tripod Mount Shooting ModesFrame Movie Mode\nMiscellaneous Shooting ProgramsBeach, Beach/snow, Fireworks, Foliage, Hi-speed shutter, Indoor, Kids & pets, Landscape, Night scene, Night snapshot, Portrait mode, Slow shutter, Snow, Stitch assist, Underwater Special EffectsBlack & White, Low Sharpening, Neutral, Sepia, Vivid White BalanceAuto, Cloudy (Preset), Daylight / Sunny (Preset), Fluorescent (Preset), Manual, Tungsten (Preset) Continuous Shooting Speed1.9 frames per second",
    "red eye reduction": "Yes",
    "screen details": "LCD display - TFT active matrix - 1.8\" - color",
    "screen size": "1.8\"",
    "sensor resolution": "4.0 MP",
    "sensor size": "1/2.5\"",
    "sensor type": "CCD",
    "shooting modes": "Frame Movie Mode",
    "shooting programs": "Beach, Beach/snow, Fireworks, Foliage, Hi-speed shutter, Indoor, Kids & pets, Landscape, Night scene, Night snapshot, Portrait mode, Slow shutter, Snow, Stitch assist, Underwater",
    "special effects": "Black & White, Low Sharpening, Neutral, Sepia, Vivid",
    "still image format": "JPEG",
    "supported flash memory": "MultiMediaCard, SD Card, SD Memory Card",
    "upc": "013803047837, 013803047844",
    "viewfinder type": "Optical",
    "weight": "6.35 Oz.",
    "white balance": "Auto, Cloudy (Preset), Daylight / Sunny (Preset), Fluorescent (Preset), Manual, Tungsten (Preset)",
    "width": "3.57 in."
}