{
    "<page title>": "Sale Brand New Nikon D7100 Black Body Only Digital SLR Camera Express 017856441659 | eBay",
    "brand": "Nikon",
    "compatible lenses": "Compatible with AF NIKKOR lenses, including type G and D lenses (some restrictions apply to PC lenses) and\nDX lenses, AI-P NIKKOR lenses, and non-CPU AI lenses (A and M modes only). IX NIKKOR lenses,\nlenses for the F3AF, and non-AI lenses can not be used.\nThe electronic rangefinder can be used with lenses that have a maximum aperture of f/5.6 or faster\n(the electronic rangefinder supports the center 1 focus point with lenses that have a maximum aperture of f/8 or faster).",
    "condition": "New: A brand-new, unused, unopened, undamaged item in its original packaging (where packaging is\napplicable). Packaging should be the same as what is found in a retail store, unless the item is handmade or was packaged by the manufacturer in non-retail packaging, such as an unprinted box or plastic bag. See the seller's listing for full details.\nSee all condition definitions- opens in a new window or tab\n... Read moreabout the condition",
    "depthoffield preview": "Pressing depth-of-field preview button stops lens aperture down to value selected by user\n(A and M modes) or by camera (other modes)",
    "diopter adjustment": "-2 - +1 m-1",
    "dustreduction system": "Image sensor cleaning, Image Dust Off reference data (optional Capture NX 2 software required)",
    "effective angle of view": "Nikon DX format; focal length in 35 mm [135] format equivalent to approx. 1.5x that of lenses with",
    "effective pixels": "24.1 million",
    "eyepoint": "19.5 mm (-1.0 m-1; from center surface of viewfinder eyepiece lens)",
    "file format": "NEF (RAW): 12 or 14 bit, lossless compressed or compressed JPEG: JPEG-Baseline compliant with fine (approx. 1 : 4),",
    "file system": "DCF (Design Rule for Camera File System) 2.0, DPOF (Digital Print Order Format),\nExif (Exchangeable Image File Format for Digital Still Cameras) 2.3, PictBridge",
    "flash sync speed": "X=1/250 s; synchronizes with shutter at 1/320 s or slower\n(flash range drops at speeds between 1/250 and 1/320 s)",
    "focusing screen": "Type B BriteView Clear Matte Mark II screen with AF area brackets (framing grid can be displayed)",
    "frame coverage": "Approx. 100% horizontal and 100% vertical",
    "image sensor": "23.5 x 15.6 mm CMOS sensor",
    "image size pixels": "DX (24 x 16) image area 6000 x 4000 (L), 4496 x 3000 (M),\n2992 x 2000 (S) 1.3x (18 x 12) image area 4800 x 3200 (L), 3600 x 2400 (M),\n2400 x 1600 (S) Photographs with image area of DX (24 x 16) taken in movie live view 6000 x 3368 (L),\n4494 x 2528 (M), 2992 x 1860 (S) Photographs with image area of 1.3x (18 x 12)\ntaken in movie live view 4800 x 2696 (L), 3600 x 2024 (M), 2400 x 1344 (S)",
    "lens aperture": "Instant return, electronically controlled",
    "lens mount": "Nikon F mount (with AF coupling and AF contacts)",
    "magnification": "Approx. 0.94x (50 mm f/1.4 lens at infinity, -1.0 m-1)",
    "media": "SD (Secure Digital) and UHS-I compliant SDHC and SDXC memory cards",
    "megapixels": "24.1 MP",
    "model": "D7100",
    "mpn": "1513",
    "picture control system": "Standard, Neutral, Vivid, Monochrome, Portrait, Landscape; selected Picture Control can be modified;\nstorage for custom Picture Controls",
    "reflex mirror": "Quick return",
    "release mode": "single frame (S), continuous low speed (CL), continuous high speed (CH), quiet shutter-release (Q),\nself-timer, mirror up (MUP); interval timer photography supported",
    "screen size": "3.2\"",
    "selftimer": "2 s, 5 s, 10 s, 20 s; 1 - 9 exposures at intervals of 0.5, 1, 2, or 3 s",
    "speed": "1/8000 - 30 s in steps of 1/3 or 1/2 EV, bulb, time, X250",
    "total pixels": "24.69 million",
    "type": "Digital SLR",
    "typesinglelens reflex digital camera": "Lens mountNikon F mount (with AF coupling and AF contacts) Effective angle of viewNikon DX format; focal length in 35 mm [135] format equivalent to approx. 1.5x that of lenses with Effective pixels24.1 million Image sensor23.5 x 15.6 mm CMOS sensor Total pixels24.69 million Dust-reduction SystemImage sensor cleaning, Image Dust Off reference data (optional Capture NX 2 software required) Image size (pixels)DX (24 x 16) image area 6000 x 4000 (L), 4496 x 3000 (M),\n2992 x 2000 (S) 1.3x (18 x 12) image area 4800 x 3200 (L), 3600 x 2400 (M),\n2400 x 1600 (S) Photographs with image area of DX (24 x 16) taken in movie live view 6000 x 3368 (L),\n4494 x 2528 (M), 2992 x 1860 (S) Photographs with image area of 1.3x (18 x 12)\ntaken in movie live view 4800 x 2696 (L), 3600 x 2024 (M), 2400 x 1344 (S) File formatNEF (RAW): 12 or 14 bit, lossless compressed or compressed JPEG: JPEG-Baseline compliant with fine (approx. 1 : 4), Picture Control SystemStandard, Neutral, Vivid, Monochrome, Portrait, Landscape; selected Picture Control can be modified;\nstorage for custom Picture Controls MediaSD (Secure Digital) and UHS-I compliant SDHC and SDXC memory cards Double slotSlot 2 can be used for overflow or backup storage or for separate storage of copies created using\nNEF+JPEG; pictures can be copied between cards. File systemDCF (Design Rule for Camera File System) 2.0, DPOF (Digital Print Order Format),\nExif (Exchangeable Image File Format for Digital Still Cameras) 2.3, PictBridge ViewfinderEye-level pentaprism single-lens reflex viewfinder Frame coverageApprox. 100% horizontal and 100% vertical MagnificationApprox. 0.94x (50 mm f/1.4 lens at infinity, -1.0 m-1) Eyepoint19.5 mm (-1.0 m-1; from center surface of viewfinder eyepiece lens) Diopter adjustment-2 - +1 m-1 Focusing screenType B BriteView Clear Matte Mark II screen with AF area brackets (framing grid can be displayed) Reflex mirrorQuick return Depth-of-field previewPressing depth-of-field preview button stops lens aperture down to value selected by user\n(A and M modes) or by camera (other modes) Lens apertureInstant return, electronically controlled Compatible lensesCompatible with AF NIKKOR lenses, including type G and D lenses (some restrictions apply to PC lenses) and\nDX lenses, AI-P NIKKOR lenses, and non-CPU AI lenses (A and M modes only). IX NIKKOR lenses,\nlenses for the F3AF, and non-AI lenses can not be used.\nThe electronic rangefinder can be used with lenses that have a maximum aperture of f/5.6 or faster\n(the electronic rangefinder supports the center 1 focus point with lenses that have a maximum aperture of f/8 or faster). TypeElectronically-controlled vertical-travel focal-plane shutter Speed1/8000 - 30 s in steps of 1/3 or 1/2 EV, bulb, time, X250 Flash sync speedX=1/250 s; synchronizes with shutter at 1/320 s or slower\n(flash range drops at speeds between 1/250 and 1/320 s) Release modesingle frame (S), continuous low speed (CL), continuous high speed (CH), quiet shutter-release (Q),\nself-timer, mirror up (MUP); interval timer photography supported Approximate frame advance rateJPEG and 12-bit NEF (RAW) images recorded with DX (24 x 16) selected for Image area\nL: 1 - 6 fps, CH: 6 fps JPEG and 12-bit NEF (RAW) images recorded with 1.3x (18 x 12)\nselected for Image area CL: 1 - 6 fps, CH: 7 fps 14-bit NEF (RAW) images recorded with DX (24 x 16)\nselected for Image area CL: 1 - 5 fps, CH: 5 fps 14-bit NEF (RAW) images recorded with 1.3x (18 x 12) Self-timer2 s, 5 s, 10 s, 20 s; 1 - 9 exposures at intervals of 0.5, 1, 2, or 3 s Remote control modes (ML-L3)Delayed remote, quick-response remote, remote mirror-up",
    "upc": "017856441659",
    "viewfinder": "Eye-level pentaprism single-lens reflex viewfinder",
    "warranty": "1 Year Seller Warranty"
}