{
    "35mm zoom lens": "35 - 210 mm",
    "<page title>": "Canon PowerShot G7 10 0 MP Digital Camera Faulty Damaged Parts or Repair 843477007185 | eBay",
    "aperture range": "f2.8/f4.8(w/t)",
    "battery life": "220 Images",
    "battery type": "NB-2LH",
    "brand": "Canon",
    "builtin microphone": "With Built-in Microphone",
    "builtin speaker": "With Built-in Speaker",
    "camera resolution": "10.0 MP",
    "camera type": "Compact",
    "colour": "Black",
    "compression modes": "Fine, Normal, SuperFine",
    "compression type": "DPOF 1.1, EXIF 2.2, JPEG",
    "condition": "For parts or not working: An item that does not function as intended and is not fully operational. This includes items that\nare defective in ways that render them difficult to use, items that require service or repair, or items missing essential components. See the seller\u00e2\u0080\u0099s listing for full details.\nSee all condition definitions- opens in a new window or tab\n... Read moreabout the condition",
    "depth": "4.24 cm",
    "digital zoom": "4x",
    "features": "USB 2.0, Not Interchangeable Lenses, Standard, Without LCD Protected Position",
    "file size high res": "0.12MB (1067 images on 128MB card)",
    "file size low res": "2.29MB (about 56 images on 128MB card)",
    "flash functions": "Auto Flash, Flash Off, Forced On, Red-eye Reduction Flash, Slow Sync",
    "flash type": "Built-In",
    "focal length": "7.4 - 44.4 mm",
    "focus range": "19.2 in. to Infinity (w)",
    "focus type": "Autofocus",
    "frames per second": "2 Frames",
    "height": "7.19 cm",
    "image resolutions": "1600 x 1200, 2272 x 1704, 2816 x 2112, 3648 x 2048, 3648 x 2736, 640 x 480",
    "image sensor type": "CCD",
    "interchangeable lens": "Not Interchangeable Lenses",
    "interface type": "USB 2.0",
    "iso speed rating": "800, 100, 200, 400, 1600, Auto",
    "iso speeds": "100, 1600, 200, 400, 800, Auto",
    "lcd display size inches": "2.5\"",
    "lcd protected position": "Without LCD Protected Position",
    "lcd screen": "With LCD Screen",
    "lcd screen resolution": "207000 pixels",
    "lcd screen size": "2.5\"",
    "macro focus range": "0.39 - 19.2 in. (w)",
    "max movie length": "Without Limit (Depends on the camera free memory size)",
    "megapixels": "10.0 MP",
    "memory card format": "MultiMedia, SD Card",
    "memory type": "MMC, Multimedia Card, SD, SD Card",
    "model": "G7",
    "mpn": "1285B001",
    "optical zoom": [
        "6x",
        "6x"
    ],
    "product information": "The Canon PowerShot G7 is a compact 10.0 MP digital camera, with a CCD image sensor and DIGIC III image processor which enables you to capture photographs clearly. With a 6x optical zoom, this Canon camera brings distant objects closer without compromising on sharpness. The optical image stabilizer in the Canon PowerShot G7 lets you shoot blur-free videos despite jerks. Featuring a 2.5-inch LCD display, this Canon camera lets you easily frame shots as well as view the captured photos and videos. This compact digital camera supports various scene modes, letting you be creative with captured images. Moreover, the Red-Eye Reduction function in this digital camera automatically corrects the red-eye effect caused due to flash. With a high ISO sensitivity (up to 1600), this Canon camera captures clear photos even in low-light conditions.\nProduct Identifiers BrandCanon ModelG7 MPN1285B001 UPC843477007185\nKey Features Camera TypeCompact Optical Zoom6x Digital Zoom4x Resolution10.0 MP LCD Screen Size2.5\" Weight0.32 Kg\nLens Interchangeable LensNot Interchangeable Lenses Optical Zoom6x 35mm Zoom Lens35 - 210 mm Focus TypeAutofocus Focus Range19.2 in. to Infinity (w) Macro Focus Range0.39 - 19.2 in. (w) Focal Length7.4 - 44.4 mm\nImage Quality Image Sensor TypeCCD Camera Resolution10.0 MP Image Resolutions1600 x 1200, 2272 x 1704, 2816 x 2112, 3648 x 2048, 3648 x 2736, 640 x 480\nVideo Video Resolutions1024 x 768, 160 x 120, 320 x 240, 640 x 480 (VGA) Video Speed30 fps Max Movie LengthWithout Limit (Depends on the camera free memory size) Video FormatAVI, Motion JPEG\nExposure Control Aperture Rangef2.8/f4.8(w/t) Shutter Speed1/2000 - 1/15Sec. White BalanceAuto, Cloudy (Preset), Daylight / Sunny (Preset), Fluorescent (Preset), Manual, Tungsten (Preset) Frames Per Second2 Frames\nStorage Memory TypeMMC, Multimedia Card, SD, SD Card Compression ModesFine, Normal, SuperFine Compression TypeDPOF 1.1, EXIF 2.2, JPEG File Size (High Res.)0.12MB (1067 images on 128MB card) File Size (Low Res.)2.29MB (about 56 images on 128MB card)\nFlash ISO Speeds100, 1600, 200, 400, 800, Auto Flash TypeBuilt-In Flash FunctionsAuto Flash, Flash Off, Forced On, Red-eye Reduction Flash, Slow Sync\nViewfinder / Display ViewfinderOptical LCD ScreenWith LCD Screen LCD Screen Resolution207000 pixels LCD Protected PositionWithout LCD Protected Position\nInterfaces Interface TypeUSB 2.0 Video InterfaceVideo Out\nPower Supply Battery TypeNB-2LH Battery Life220 Images\nIncluded Features WaterproofNo TouchScreenNo Self Timer10 Sec., 2 Sec. Built-in MicrophoneWith Built-in Microphone Built-in SpeakerWith Built-in Speaker\nDimensions Height7.19 cm Width10.64 cm Depth4.24 cm\nMiscellaneous ColourBlack Release Date2006",
    "release date": "2006",
    "resolution": "10.0 MP",
    "self timer": "10 Sec., 2 Sec.",
    "shutter speed": "1/2000 - 1/15Sec.",
    "touchscreen": "No",
    "type": "Compact",
    "upc": "843477007185",
    "video format": "AVI, Motion JPEG",
    "video interface": "Video Out",
    "video resolutions": "1024 x 768, 160 x 120, 320 x 240, 640 x 480 (VGA)",
    "video speed": "30 fps",
    "viewfinder": "Optical",
    "waterproof": "No",
    "weight": "0.32 Kg",
    "white balance": "Auto, Cloudy (Preset), Daylight / Sunny (Preset), Fluorescent (Preset), Manual, Tungsten (Preset)",
    "width": "10.64 cm"
}