{
    "35mm zoom lens": "35 - 210 mm",
    "<page title>": "Canon PowerShot G9 12 1 MP Digital Camera Faulty Damaged Parts or Repair 013803083675 | eBay",
    "aperture range": "f2.8/f4.8(w/t)",
    "battery life": "240 Images",
    "battery type": "NB-2LH, Proprietary Li-Ion",
    "brand": "Canon",
    "builtin microphone": "With Built-in Microphone",
    "builtin speaker": "With Built-in Speaker",
    "camera resolution": "12.1 MP",
    "camera type": "Compact",
    "colour": "Black",
    "compression modes": "Fine, Normal, SuperFine, Uncompressed",
    "compression type": "DPOF 1.1, EXIF 2.2, JPEG",
    "condition": "For parts or not working: An item that does not function as intended and is not fully operational. This includes items that\nare defective in ways that render them difficult to use, items that require service or repair, or items missing essential components. See the seller\u00e2\u0080\u0099s listing for full details.\nSee all condition definitions- opens in a new window or tab\n... Read moreabout the condition",
    "depth": "4.24 cm",
    "digital zoom": "4x",
    "features": "USB 2.0, Image Stabilization, Face Detection, Not Interchangeable Lenses, Standard, Without LCD Protected Position",
    "file size high res": "5.21MB (25 images on 128MB card)",
    "file size low res": "0.08MB (about 1600 images on 128MB card)",
    "flash functions": "Auto Flash, Fill-in Flash, Flash Off, Forced On, Rear Sync Flash, Red-eye Reduction Flash, Slow Sync",
    "flash type": "Built-In",
    "focal length": "7.4 - 44.4 mm",
    "focus range": "19.2 in. to Infinity (w)",
    "focus type": "Autofocus",
    "frames per second": "1.5 Frames",
    "height": "7.19 cm",
    "image resolutions": "1600 x 1200, 2592 x 1944, 3264 x 2448, 4000 x 2248, 4000 x 3000, 640 x 480",
    "image sensor type": "CCD",
    "interchangeable lens": "Not Interchangeable Lenses",
    "interface type": "Mini-USB, USB 2.0",
    "iso speed rating": "800, 100, 200, 400, 1600, Auto",
    "iso speeds": "100, 1600, 200, 400, 800, Auto",
    "lcd display size inches": "3\"",
    "lcd protected position": "Without LCD Protected Position",
    "lcd screen": "With LCD Screen",
    "lcd screen resolution": "230000 pixels",
    "lcd screen size": "3\"",
    "macro focus range": "0.39 - 19.2 in. (w)",
    "max movie length": "Without Limit (Depends on the camera free memory size)",
    "megapixels": "12.1 MP",
    "memory type": "Multimedia Card, SD Card, SDHC Card",
    "model": "G9",
    "mpn": "POWERSHOTG9",
    "optical zoom": [
        "6x",
        "6x"
    ],
    "product information": "The Canon PowerShot G9 is a compact powerhouse of a camera. 6x optical zoom and Canon optical image stabilization are packed in with superior, DIGIC III image processing. iSAPS Technology uses an internal database of thousands of photographs to calculate the best possible focus, exposure, and white-balance for taking that perfect shot. The Canon PowerShot G9 sports a large, 3 inch LCD screen that provides a wide angle look at your work and utilizes an anti-glare, anti-scratch coating to protect your hardware from accidental nicks and scratches.\nProduct Identifiers BrandCanon ModelG9 MPNPOWERSHOTG9 UPC013803083675\nKey Features Camera TypeCompact Optical Zoom6x Digital Zoom4x Resolution12.1 MP LCD Screen Size3\" Weight0.32 Kg\nLens Interchangeable LensNot Interchangeable Lenses Optical Zoom6x 35mm Zoom Lens35 - 210 mm Focus TypeAutofocus Focus Range19.2 in. to Infinity (w) Macro Focus Range0.39 - 19.2 in. (w) Focal Length7.4 - 44.4 mm\nImage Quality Image Sensor TypeCCD Camera Resolution12.1 MP Image Resolutions1600 x 1200, 2592 x 1944, 3264 x 2448, 4000 x 2248, 4000 x 3000, 640 x 480\nVideo Video Resolutions1024 x 768, 160 x 120, 320 x 240, 640 x 480 (VGA) Video Speed15 fps Max Movie LengthWithout Limit (Depends on the camera free memory size) Video FormatAVI, MPEG, Motion JPEG\nExposure Control Aperture Rangef2.8/f4.8(w/t) Shutter Speed1/2500 - 1/15Sec. White BalanceAuto, Cloudy (Preset), Daylight / Sunny (Preset), Flash (Preset), Fluorescent (Preset), Manual, Tungsten (Preset), Underwater (Preset) Frames Per Second1.5 Frames\nStorage Memory TypeMultimedia Card, SD Card, SDHC Card Compression ModesFine, Normal, SuperFine, Uncompressed Compression TypeDPOF 1.1, EXIF 2.2, JPEG File Size (High Res.)5.21MB (25 images on 128MB card) File Size (Low Res.)0.08MB (about 1600 images on 128MB card)\nFlash ISO Speeds100, 1600, 200, 400, 800, Auto Flash TypeBuilt-In Flash FunctionsAuto Flash, Fill-in Flash, Flash Off, Forced On, Rear Sync Flash, Red-eye Reduction Flash, Slow Sync\nViewfinder / Display ViewfinderOptical LCD ScreenWith LCD Screen LCD Screen Resolution230000 pixels LCD Protected PositionWithout LCD Protected Position\nInterfaces Interface TypeMini-USB, USB 2.0 Video InterfaceVideo Out\nPower Supply Battery TypeNB-2LH, Proprietary Li-Ion Battery Life240 Images\nIncluded Features WaterproofNo TouchScreenNo Self Timer10 Sec., 2 Sec. Built-in MicrophoneWith Built-in Microphone Built-in SpeakerWith Built-in Speaker\nDimensions Height7.19 cm Width10.64 cm Depth4.24 cm\nMiscellaneous ColourBlack",
    "resolution": "12.1 MP",
    "self timer": "10 Sec., 2 Sec.",
    "shutter speed": "1/2500 - 1/15Sec.",
    "touchscreen": "No",
    "type": "Compact",
    "upc": "013803083675",
    "video format": "AVI, MPEG, Motion JPEG",
    "video interface": "Video Out",
    "video resolutions": "1024 x 768, 160 x 120, 320 x 240, 640 x 480 (VGA)",
    "video speed": "15 fps",
    "viewfinder": "Optical",
    "waterproof": "No",
    "weight": "0.32 Kg",
    "white balance": "Auto, Cloudy (Preset), Daylight / Sunny (Preset), Flash (Preset), Fluorescent (Preset), Manual, Tungsten (Preset), Underwater (Preset)",
    "width": "10.64 cm"
}