{
    "<page title>": "Nikon D80 10 2 MP Digital SLR Camera Body Only Faulty Damaged Parts or Repair 018208254125 | eBay",
    "battery life": "2700 Images",
    "battery type": "Rechargeable Li-Ion Battery",
    "brand": "Nikon",
    "camera resolution": "10.2 MP",
    "camera type": "Digital SLR",
    "colour": "Black",
    "compression modes": "Basic, Fine, Normal, Uncompressed",
    "compression type": "DCF, DCF 2.0, DPOF, EXIF 2.1, EXIF 2.21, JPEG, Raw Image",
    "condition": "For parts or not working: An item that does not function as intended and is not fully operational. This includes items that\nare defective in ways that render them difficult to use, items that require service or repair, or items missing essential components. See the seller\u00e2\u0080\u0099s listing for full details.\nSee all condition definitions- opens in a new window or tab\n... Read moreabout the condition",
    "depth": "7.62 cm",
    "file size high res": "17.2MB (7 images on 128MB card)",
    "file size low res": "0.3MB (about 427 images on 128MB card)",
    "flash functions": "Auto Flash, Fill-in Flash, Flash Off, Manual, Rear Sync Flash, Red-eye Reduction Flash, Slow Sync",
    "flash type": "Built-In & External",
    "frames per second": "3 Frames",
    "height": "10.41 cm",
    "image resolutions": "1936 x 1296, 2896 x 1944, 3872 x 2592",
    "image sensor type": "CCD",
    "interface type": "USB 2.0",
    "iso speed rating": "1600, 100, 3200",
    "iso speeds": "100, 1600, 3200",
    "lcd display size inches": "2.5\"",
    "lcd protected position": "Without LCD Protected Position",
    "lcd screen": "With LCD Screen",
    "lcd screen resolution": "230000 pixels",
    "lcd screen size": "2.5\"",
    "megapixels": "10.2 MP",
    "memory type": "SD, SD Card, SDHC, SDHC Card",
    "model": "D80",
    "mpn": "9405",
    "product identifiers": "BrandNikon ModelD80 MPN9405 UPC018208254125\nKey Features Camera TypeDigital SLR Resolution10.2 MP LCD Screen Size2.5\" Weight0.58 Kg\nImage Quality Image Sensor TypeCCD Camera Resolution10.2 MP Image Resolutions1936 x 1296, 2896 x 1944, 3872 x 2592\nExposure Control Shutter Speed1/4000 - 1/30Sec. White BalanceAuto, Colour Temperature Adjust, Daylight / Sunny (Preset), Flash (Preset), Fluorescent (Preset), Incandescent (Preset), Manual, Shade (Preset) Frames Per Second3 Frames\nStorage Memory TypeSD, SD Card, SDHC, SDHC Card Compression ModesBasic, Fine, Normal, Uncompressed Compression TypeDCF, DCF 2.0, DPOF, EXIF 2.1, EXIF 2.21, JPEG, Raw Image File Size (High Res.)17.2MB (7 images on 128MB card) File Size (Low Res.)0.3MB (about 427 images on 128MB card)\nFlash ISO Speeds100, 1600, 3200 Flash TypeBuilt-In & External Flash FunctionsAuto Flash, Fill-in Flash, Flash Off, Manual, Rear Sync Flash, Red-eye Reduction Flash, Slow Sync\nViewfinder / Display ViewfinderOptical LCD ScreenWith LCD Screen LCD Screen Resolution230000 pixels LCD Protected PositionWithout LCD Protected Position\nInterfaces Interface TypeUSB 2.0 Video InterfaceVideo Out\nPower Supply Battery TypeRechargeable Li-Ion Battery Battery Life2700 Images\nIncluded Features WaterproofNo TouchScreenNo Self Timer10 Sec., 2 Sec., 20 Sec., 5 Sec. Tripod MountWith Tripod Mount\nDimensions Height10.41 cm Width13.21 cm Depth7.62 cm\nMiscellaneous ColourBlack Release Date2006",
    "release date": "2006",
    "resolution": "10.2 MP",
    "self timer": "10 Sec., 2 Sec., 20 Sec., 5 Sec.",
    "shutter speed": "1/4000 - 1/30Sec.",
    "touchscreen": "No",
    "tripod mount": "With Tripod Mount",
    "type": "Digital SLR",
    "upc": "018208254125",
    "video interface": "Video Out",
    "viewfinder": "Optical",
    "waterproof": "No",
    "weight": "0.58 Kg",
    "white balance": "Auto, Colour Temperature Adjust, Daylight / Sunny (Preset), Flash (Preset), Fluorescent (Preset), Incandescent (Preset), Manual, Shade (Preset)",
    "width": "13.21 cm"
}