{
    "<page title>": "Nikon D80 Digital SLR Camera Black w 18 55mm Lens 55 200mm Lens 254129425 | eBay",
    "aperture range": "f3/f5.6(w/t)",
    "battery life": "2700 Images",
    "battery type": "Rechargeable Li-Ion Battery",
    "brand": "Nikon",
    "bundled items": "Battery, Lens, Lens Filter, Memory Card",
    "camera resolution": "10.2 MP",
    "camera type": "Digital SLR",
    "colour": "Black",
    "compression modes": "Basic, Fine, Normal, Uncompressed",
    "compression type": "DCF, DCF 2.0, DPOF, EXIF 2.1, EXIF 2.21, JPEG, Raw Image",
    "condition": "Used: An item that has been used previously. The item may have some signs of cosmetic wear, but is fully\noperational and functions as intended. This item may be a floor model or store return that has been used. See the seller\u00e2\u0080\u0099s listing for full details and description of any imperfections.\nSee all condition definitions- opens in a new window or tab\n... Read moreabout the condition",
    "depth": "7.62 cm",
    "file size high res": "17.2MB (7 images on 128MB card)",
    "file size low res": "0.3MB (about 427 images on 128MB card)",
    "flash functions": "Auto Flash, Fill-in Flash, Flash Off, Front Sync Flash, Manual, Rear Sync Flash, Red-eye Reduction Flash, Slow Sync",
    "flash type": "Built-In & External",
    "focus type": "Autofocus",
    "frames per second": "3 Frames",
    "height": "10.41 cm",
    "image resolutions": "1936 x 1296, 2896 x 1944, 3872 x 2592",
    "image sensor type": "CCD",
    "interchangeable lens": "Interchangeable Lenses",
    "interface type": "USB 2.0",
    "iso speed rating": "1600, 100, 3200",
    "iso speeds": "100, 1600, 3200",
    "lcd display size inches": "2.5\"",
    "lcd protected position": "Without LCD Protected Position",
    "lcd screen": "With LCD Screen",
    "lcd screen resolution": "230000 pixels",
    "lcd screen size": "2.5\"",
    "megapixels": "10.2 MP",
    "memory card format": "SDHC Card",
    "memory type": "SD, SD Card, SDHC, SDHC Card",
    "model": "D80",
    "mpn": "228949",
    "optical zoom": [
        "3x",
        "3x"
    ],
    "product information": "The Nikon D80 SLR Digital Camera features a 10.2 effective megapixel DX Format CCD image sensor, providing a high level of resolution and sharp detail, so users can have the freedom to crop creatively and print impressive enlargements.\nProduct Identifiers BrandNikon ModelD80 MPN228949 UPC254129425\nKey Features Camera TypeDigital SLR Optical Zoom3x Resolution10.2 MP LCD Screen Size2.5\" Weight0.58 Kg\nLens Interchangeable LensInterchangeable Lenses Optical Zoom3x Focus TypeAutofocus\nImage Quality Image Sensor TypeCCD Camera Resolution10.2 MP Image Resolutions1936 x 1296, 2896 x 1944, 3872 x 2592\nExposure Control Aperture Rangef3/f5.6(w/t) Shutter Speed1/4000 - 1/30Sec. White BalanceAuto, Colour Temperature Adjust, Daylight / Sunny (Preset), Flash (Preset), Fluorescent (Preset), Incandescent (Preset), Manual, Shade (Preset) Frames Per Second3 Frames\nStorage Memory TypeSD, SD Card, SDHC, SDHC Card Compression ModesBasic, Fine, Normal, Uncompressed Compression TypeDCF, DCF 2.0, DPOF, EXIF 2.1, EXIF 2.21, JPEG, Raw Image File Size (High Res.)17.2MB (7 images on 128MB card) File Size (Low Res.)0.3MB (about 427 images on 128MB card)\nFlash ISO Speeds100, 1600, 3200 Flash TypeBuilt-In & External Flash FunctionsAuto Flash, Fill-in Flash, Flash Off, Front Sync Flash, Manual, Rear Sync Flash, Red-eye Reduction Flash, Slow Sync\nViewfinder / Display ViewfinderOptical LCD ScreenWith LCD Screen LCD Screen Resolution230000 pixels LCD Protected PositionWithout LCD Protected Position\nInterfaces Interface TypeUSB 2.0 Video InterfaceVideo Out\nPower Supply Battery TypeRechargeable Li-Ion Battery Battery Life2700 Images\nIncluded Features WaterproofNo TouchScreenNo Self Timer10 Sec., 2 Sec., 20 Sec., 5 Sec. Tripod MountWith Tripod Mount\nDimensions Height10.41 cm Width13.21 cm Depth7.62 cm\nMiscellaneous ColourBlack Release Date2006",
    "release date": "2006",
    "resolution": "10.2 MP",
    "self timer": "10 Sec., 2 Sec., 20 Sec., 5 Sec.",
    "shutter speed": "1/4000 - 1/30Sec.",
    "touchscreen": "No",
    "tripod mount": "With Tripod Mount",
    "type": "Digital SLR",
    "upc": "254129425",
    "video interface": "Video Out",
    "viewfinder": "Optical",
    "waterproof": "No",
    "weight": "0.58 Kg",
    "white balance": "Auto, Colour Temperature Adjust, Daylight / Sunny (Preset), Flash (Preset), Fluorescent (Preset), Incandescent (Preset), Manual, Shade (Preset)",
    "width": "13.21 cm"
}