{
    "<page title>": "Vivitar ViviCam 6300 6 0 MP Digital Camera Silver | eBay",
    "additional features": "Audio Recording, Auto Power Save, Date/Time Stamp, Not Interchangeable Lenses, PictBridge Support, USB, With Tripod Mount",
    "auto focus type": "TTL contrast detection",
    "battery form factor": "Standard form factor",
    "brand": "Vivitar",
    "bundled items": "Case or Bag, Flash, Strap (Neck or Wrist)",
    "camera flash features": "Auto Flash, Fill-in Flash, Flash Off, Red-eye Reduction Flash",
    "camera type": "Point & Shoot",
    "condition": "Used: An item that has been used previously. The item may have some signs of cosmetic wear, but is fully\noperational and functions as intended. This item may be a floor model or store return that has been used. See the seller\u00e2\u0080\u0099s listing for full details and description of any imperfections.\nSee all condition definitions- opens in a new window or tab\n... Read moreabout the condition",
    "connector types": "1 x DC power input, 1 x USB, 1 x composite video/audio output",
    "depth": "1.18 in.",
    "digital video format": "AVI, MPEG",
    "digital zoom": "4x",
    "display rotation": "Built-in",
    "display size": "2\"",
    "display type": "LCD",
    "expansion slot": "1 x SD Memory Card",
    "exposure compensation": "\u00c2\u00b12 EV range, in 1/3 EV steps",
    "exposure metering": "Center-Weighted, Spot",
    "exposure modes": "Automatic, Program",
    "flash modes": "Auto Mode, Fill-in Mode, OFF mode, Red-eye Reduction",
    "flash type": "Built-in flash",
    "focal length equivalent to 35mm camera": "36 - 108mm",
    "focus adjustment": "Automatic, Fixed Focus, Manual",
    "height": "2.36 in.",
    "integrated memory size": "16 MB",
    "light sensitivity": "ISO 100, ISO 200, ISO 50, ISO auto",
    "light sensitivity max": "200",
    "macro focus range": "6cm",
    "max video resolution": "320 x 240",
    "megapixels": "6.0 MP",
    "microphone operation mode": "Mono",
    "microphone type": "Microphone - built-in - electret condenser - mono",
    "model": "6300",
    "mpn": "60418",
    "operating system supported": "Apple Mac OS 9, Apple Mac OS X, Microsoft Windows 2000, Microsoft Windows 98SE, Microsoft Windows ME, Microsoft Windows XP",
    "optical viewfinder type": "Real-image zoom",
    "optical zoom": "3x",
    "product information": "A stylish and compact 6 megapixels digital camera with built-in flash offering a choice of still image and video clip modes.\nProduct Identifiers BrandVivitar Model6300 MPN60418\nKey Features Camera TypePoint & Shoot Optical Zoom3x Digital Zoom4x Sensor Resolution6.0 MP Screen Size2\"\nOptical Sensor Sensor TypeCCD\nLens System Macro Focus Range6cm Focus AdjustmentAutomatic, Fixed Focus, Manual Auto Focus typeTTL contrast detection Focal Length Equivalent to 35mm Camera36 - 108mm\nExposure Exposure compensation\u00c2\u00b12 EV range, in 1/3 EV steps Exposure MeteringCenter-Weighted, Spot Exposure ModesAutomatic, Program Light SensitivityISO 100, ISO 200, ISO 50, ISO auto Light Sensitivity Max200\nCamera Flash Flash TypeBuilt-in flash Red Eye ReductionYes Camera Flash FeaturesAuto Flash, Fill-in Flash, Flash Off, Red-eye Reduction Flash Flash ModesAuto Mode, Fill-in Mode, OFF mode, Red-eye Reduction\nMemory / Storage Integrated Memory size16 MB Supported Flash MemoryBuilt-in, SD Card, SD Memory Card\nViewfinder Viewfinder TypeOptical Optical Viewfinder TypeReal-image zoom\nDimensions Depth1.18 in. Height2.36 in. Width3.35 in. Weight4.48 Oz.\nDisplay Display TypeLCD Display RotationBuilt-in Screen DetailsLCD display - TFT active matrix - 2\" - color Display Size2\"\nMicrophone Microphone TypeMicrophone - built-in - electret condenser - mono Microphone Operation ModeMono\nConnections Connector Types1 x DC power input, 1 x USB, 1 x composite video/audio output Expansion Slot1 x SD Memory Card\nSystem Requirements for PC Connection Operating System SupportedApple Mac OS 9, Apple Mac OS X, Microsoft Windows 2000, Microsoft Windows 98SE, Microsoft Windows ME, Microsoft Windows XP\nBattery Battery Form FactorStandard form factor\nFile Format Digital Video FormatAVI, MPEG Still Image FormatJPEG\nResolution Max Video Resolution320 x 240\nOther Features Additional FeaturesAudio Recording, Auto Power Save, Date/Time Stamp, Not Interchangeable Lenses, PictBridge Support, USB, With Tripod Mount Webcam CapabilityYes Shooting ModesFrame Movie Mode\nMiscellaneous Shooting ProgramsLandscape, Night scene, Portrait mode, Sports mode White BalanceAuto, Cloudy (Preset), Daylight / Sunny (Preset), Fluorescent (Preset), Sunset (Preset), Tungsten (Preset) Video CaptureAVI - 320 x 240 - 41 sec - with 16MB built-in memory",
    "red eye reduction": "Yes",
    "screen details": "LCD display - TFT active matrix - 2\" - color",
    "screen size": "2\"",
    "sensor resolution": "6.0 MP",
    "sensor type": "CCD",
    "shooting modes": "Frame Movie Mode",
    "shooting programs": "Landscape, Night scene, Portrait mode, Sports mode",
    "still image format": "JPEG",
    "supported flash memory": "Built-in, SD Card, SD Memory Card",
    "video capture": "AVI - 320 x 240 - 41 sec - with 16MB built-in memory",
    "viewfinder type": "Optical",
    "weight": "4.48 Oz.",
    "white balance": "Auto, Cloudy (Preset), Daylight / Sunny (Preset), Fluorescent (Preset), Sunset (Preset), Tungsten (Preset)",
    "width": "3.35 in."
}