{
    "<page title>": "Konica Minolta DiMAGE S404 4 0 MP Digital Camera Silver | eBay",
    "additional features": "AE/FE Lock, AF Lock, Audio Recording, Auto Power Save, Built-In Speaker, DPOF Support, Date/Time Stamp, Direct Print, Not Interchangeable Lenses, PRINT Image Matching, RGB Primary Color Filter, USB, With Tripod Mount",
    "auto focus type": "TTL contrast detection",
    "battery form factor": "Standard form factor",
    "brand": "Konica Minolta",
    "bundled items": "Flash, Lens, Memory Card",
    "camera flash features": "Auto Flash, Fill-in Flash, Flash Off, Red-eye Reduction Flash",
    "camera type": "Point & Shoot",
    "connector types": "1 x DC power input, 1 x USB, 1 x composite video/audio output",
    "continuous shooting speed": "1.6 frames per second",
    "country/region of manufacture": "Japan",
    "depth": "2.3 in.",
    "digital video format": "MJPEG, QuickTime",
    "digital zoom": "2x",
    "display rotation": "Built-in",
    "display size": "1.8\"",
    "display type": "LCD",
    "expansion slot": "1 x CompactFlash Card - type I",
    "exposure compensation": "\u00c2\u00b12 EV range, in 1/3 EV steps",
    "exposure metering": "Multi-Segment, Spot",
    "exposure modes": "Automatic, Bulb, Manual, Program",
    "flash modes": "Auto Mode, Fill-in Mode, OFF mode, Red-eye Reduction",
    "flash type": "Built-in flash",
    "focal length equivalent to 35mm camera": "35 - 140mm",
    "focus adjustment": "Autofocus & Manual Focus, Automatic, Manual",
    "height": "2.54 in.",
    "integrated memory size": "32 MB ( SDRAM )",
    "light sensitivity": "ISO 100, ISO 200, ISO 400, ISO 64",
    "light sensitivity max": "400",
    "macro focus range": "16-60cm",
    "max shutter speed": "1/1000 sec",
    "max video resolution": "320 x 240",
    "megapixels": "4.0 MP",
    "microphone operation mode": "Mono",
    "microphone type": "Microphone - built-in - mono",
    "min shutter speed": "15 sec",
    "model": "S414",
    "mpn": "2781-301",
    "operating system supported": "Apple Mac OS 9, Apple Mac OS X, MS Windows 2000, MS Windows ME, MS Windows XP, Microsoft Windows 2000, Microsoft Windows 98, Microsoft Windows 98SE, Microsoft Windows ME, Microsoft Windows XP",
    "optical viewfinder type": "Real-image zoom",
    "optical zoom": "4x",
    "product identifiers": "BrandKonica Minolta ModelS414 MPN74305834\nKey Features Camera TypePoint & Shoot Optical Zoom4x Digital Zoom2x Sensor Resolution4.0 MP Screen Size1.8\"\nOptical Sensor Sensor Size1/1.8\" Sensor TypeCCD\nLens System Macro Focus Range16-60cm Focus AdjustmentAutofocus & Manual Focus, Automatic, Manual Auto Focus typeTTL contrast detection Focal Length Equivalent to 35mm Camera35 - 140mm\nExposure Max Shutter Speed1/1000 sec Min Shutter Speed15 sec Exposure compensation\u00c2\u00b12 EV range, in 1/3 EV steps Exposure MeteringMulti-Segment, Spot Exposure ModesAutomatic, Bulb, Manual, Program Light SensitivityISO 100, ISO 200, ISO 400, ISO 64 Light Sensitivity Max400\nCamera Flash Flash TypeBuilt-in flash Red Eye ReductionYes Camera Flash FeaturesAuto Flash, Fill-in Flash, Flash Off, Red-eye Reduction Flash Flash ModesAuto Mode, Fill-in Mode, OFF mode, Red-eye Reduction\nMemory / Storage Integrated Memory size32 MB ( SDRAM ) Supported Flash MemoryCompactFlash, CompactFlash Card Type I\nViewfinder Viewfinder TypeOptical, Optical (Through-the-lens) Optical Viewfinder TypeReal-image zoom\nDimensions Depth2.3 in. Height2.54 in. Width4.47 in. Weight7.1 Oz.\nDisplay Display TypeLCD Display RotationBuilt-in Screen DetailsLCD display - TFT active matrix - 1.8\" - color Display Size1.8\"\nMicrophone Microphone TypeMicrophone - built-in - mono Microphone Operation ModeMono\nConnections Connector Types1 x DC power input, 1 x USB, 1 x composite video/audio output Expansion Slot1 x CompactFlash Card - type I\nSystem Requirements for PC Connection Operating System SupportedApple Mac OS 9, Apple Mac OS X, MS Windows 2000, MS Windows ME, MS Windows XP, Microsoft Windows 2000, Microsoft Windows 98, Microsoft Windows 98SE, Microsoft Windows ME, Microsoft Windows XP\nBattery Battery Form FactorStandard form factor\nFile Format Digital Video FormatMJPEG, QuickTime Still Image FormatJPEG, TIFF\nResolution Max Video Resolution320 x 240\nOther Features Additional FeaturesAE/FE Lock, AF Lock, Audio Recording, Auto Power Save, Built-In Speaker, DPOF Support, Date/Time Stamp, Direct Print, Not Interchangeable Lenses, PRINT Image Matching, RGB Primary Color Filter, USB, With Tripod Mount Shooting ModesFrame Movie Mode\nMiscellaneous Shooting ProgramsLandscape, Macro, Night portrait, Portrait mode, Text Special EffectsBlack & White, Neutral, Sepia, Solarization, Vivid White BalanceAuto Continuous Shooting Speed1.6 frames per second",
    "red eye reduction": "Yes",
    "screen details": "LCD display - TFT active matrix - 1.8\" - color",
    "screen size": "1.8\"",
    "sensor resolution": "4.0 MP",
    "sensor size": "1/1.8\"",
    "sensor type": "CCD",
    "shooting modes": "Frame Movie Mode",
    "shooting programs": "Landscape, Macro, Night portrait, Portrait mode, Text",
    "special effects": "Black & White, Neutral, Sepia, Solarization, Vivid",
    "still image format": "JPEG, TIFF",
    "supported flash memory": "CompactFlash, CompactFlash Card Type I",
    "type": "Point & Shoot",
    "viewfinder type": "Optical, Optical (Through-the-lens)",
    "weight": "7.1 Oz.",
    "white balance": "Auto",
    "width": "4.47 in."
}