{
    "35mm zoom lens": "36 - 108 mm",
    "<page title>": "Canon IXUS 430 Digital ELPH S410 4 0 MP Digital Camera Silver 013803037517 | eBay",
    "aperture range": "f2.8/f4.9(w/t)",
    "battery life": "440 Images",
    "battery type": "Proprietary Lithium",
    "brand": "Canon",
    "builtin microphone": "With Built-in Microphone",
    "builtin speaker": "With Built-in Speaker",
    "bundled items": "Memory Card",
    "camera resolution": "4.0 MP",
    "camera type": "Compact",
    "colour": "Silver",
    "compression modes": "Fine, Normal, SuperFine",
    "compression type": "JPEG",
    "condition": "Used: An item that has been used previously. The item may have some signs of cosmetic wear, but is fully\noperational and functions as intended. This item may be a floor model or store return that has been used. See the seller\u00e2\u0080\u0099s listing for full details and description of any imperfections.\nSee all condition definitions- opens in a new window or tab\n... Read moreabout the condition",
    "depth": "2.77 cm",
    "digital zoom": "3.6x",
    "features": "Sound Recording, Video Recording",
    "file size high res": "1.96MB (65 images on 128MB card)",
    "file size low res": "0.08MB (about 1600 images on 128MB card)",
    "flash functions": "Auto Flash, Flash Off, Red-eye Reduction Flash, Slow Sync",
    "flash type": "Built-In",
    "focal length": "7.4 - 22.2 mm",
    "focus range": "18 in. to Infinity (w) / 18 in. (t)",
    "focus type": "Autofocus & Fixed Focus",
    "frames per second": "2.2 Frames",
    "height": "5.69 cm",
    "image resolutions": "1024 x 768, 1600 x 1200, 2272 x 1704, 640 x 480",
    "image sensor type": "CCD",
    "interchangeable lens": "Not Interchangeable Lenses",
    "interface type": "USB",
    "iso speed rating": "100, 200, 50, 400, Auto",
    "iso speeds": "100, 200, 400, 50, Auto",
    "lcd display size (inches)": "1.5\"",
    "lcd protected position": "Without LCD Protected Position",
    "lcd screen": "With LCD Screen",
    "lcd screen resolution": "118000 pixels",
    "lcd screen size": "1.5\"",
    "macro focus range": "2 - 18 in. (w) / 12 - 18 in. (t)",
    "max movie length": "180 Seconds",
    "megapixels": "4.0 MP",
    "memory card format": "CompactFlash Card Type I",
    "memory type": "CompactFlash Card Type I",
    "model": "430 / Digital ELPH S410",
    "mpn": "PowerShot S410",
    "optical zoom": [
        "3x",
        "3x"
    ],
    "product identifiers": "BrandCanon Model430 / Digital ELPH S410 MPNPowerShot S410 UPC013803037517\nKey Features Camera TypeCompact Optical Zoom3x Digital Zoom3.6x Resolution4.0 MP LCD Screen Size1.5\" Weight0.18 Kg\nLens Interchangeable LensNot Interchangeable Lenses Optical Zoom3x 35mm Zoom Lens36 - 108 mm Focus TypeAutofocus & Fixed Focus Focus Range18 in. to Infinity (w) / 18 in. (t) Macro Focus Range2 - 18 in. (w) / 12 - 18 in. (t) Focal Length7.4 - 22.2 mm\nImage Quality Image Sensor TypeCCD Camera Resolution4.0 MP Image Resolutions1024 x 768, 1600 x 1200, 2272 x 1704, 640 x 480\nVideo Video Resolutions160 x 120, 320 x 240 Video Speed15 fps Max Movie Length180 Seconds Video FormatAVI\nExposure Control Aperture Rangef2.8/f4.9(w/t) Shutter Speed1/2000 - 1/15Sec. White BalanceAuto, Cloudy (Preset), Daylight / Sunny (Preset), Fluorescent (Preset), Tungsten (Preset) Frames Per Second2.2 Frames\nStorage Memory TypeCompactFlash Card Type I Compression ModesFine, Normal, SuperFine Compression TypeJPEG File Size (High Res.)1.96MB (65 images on 128MB card) File Size (Low Res.)0.08MB (about 1600 images on 128MB card)\nFlash ISO Speeds100, 200, 400, 50, Auto Flash TypeBuilt-In Flash FunctionsAuto Flash, Flash Off, Red-eye Reduction Flash, Slow Sync\nViewfinder / Display ViewfinderOptical (Through-the-lens) LCD ScreenWith LCD Screen LCD Screen Resolution118000 pixels LCD Protected PositionWithout LCD Protected Position\nInterfaces Interface TypeUSB Video InterfaceVideo Out\nPower Supply Battery TypeProprietary Lithium Battery Life440 Images\nIncluded Features WaterproofNo TouchScreenNo Self Timer10 Sec., 2 Sec. Built-in MicrophoneWith Built-in Microphone Built-in SpeakerWith Built-in Speaker Tripod MountWith Tripod Mount\nDimensions Height5.69 cm Width8.71 cm Depth2.77 cm\nMiscellaneous ColourSilver",
    "resolution": "4.0 MP",
    "self timer": "10 Sec., 2 Sec.",
    "shutter speed": "1/2000 - 1/15Sec.",
    "touchscreen": "No",
    "tripod mount": "With Tripod Mount",
    "upc": "013803037517",
    "video format": "AVI",
    "video interface": "Video Out",
    "video resolutions": "160 x 120, 320 x 240",
    "video speed": "15 fps",
    "viewfinder": "Optical (Through-the-lens)",
    "waterproof": "No",
    "weight": "0.18 Kg",
    "white balance": "Auto, Cloudy (Preset), Daylight / Sunny (Preset), Fluorescent (Preset), Tungsten (Preset)",
    "width": "8.71 cm"
}