{
    "<page title>": "Sanyo VPC X1200 12 0 MP Digital Camera Black 086483073403 | eBay",
    "additional features": "Audio Recording, Automatic Face Tracking, DPOF Support, Direct Print, Exif Print Support, Smile Capture",
    "battery form factor": "Manufacturer specific",
    "brand": "Sanyo",
    "bundled items": "Memory Card",
    "camera type": "Point & Shoot",
    "condition": "Used: An item that has been used previously. The item may have some signs of cosmetic wear, but is fully\noperational and functions as intended. This item may be a floor model or store return that has been used. See the seller\u00e2\u0080\u0099s listing for full details and description of any imperfections.\nSee all condition definitions- opens in a new window or tab\n... Read moreabout the condition",
    "connector types": "1 x USB, 1 x composite video/audio output",
    "depth": "0.7 in.",
    "digital video format": "QuickTime",
    "digital zoom": "4x",
    "display rotation": "Built-in",
    "display size": "2.7\"",
    "display type": "LCD",
    "expansion slot": "1 x SD Memory Card",
    "exposure modes": "Automatic, Program",
    "face detection": "Yes",
    "flash modes": "Auto Mode, Fill-in Mode, OFF mode, Red-eye Reduction",
    "flash type": "Built-in flash",
    "focal length equivalent to 35mm camera": "38 - 114mm",
    "focus adjustment": "Automatic, Manual",
    "height": "2.2 in.",
    "integrated memory size": "52 MB",
    "light sensitivity": "ISO 100, ISO 1600, ISO 200, ISO 3200 (4Mpix), ISO 400, ISO 64, ISO 800",
    "light sensitivity max": "3200",
    "macro focus range": "5-80cm",
    "manufacturer warranty": "No",
    "max shutter speed": "1/5000 sec",
    "megapixels": "12.0 MP",
    "microphone type": "Microphone - built-in",
    "min shutter speed": "1/2 sec",
    "model": "X1200",
    "mpn": "VPC-X1200BK",
    "operating system supported": "Apple Mac OS 9.0 or later, MS Windows Vista, MS Windows XP",
    "optical zoom": "3x",
    "product information": "Smile and face detectionDigital blur correction on playback (EIS)Digital image stabilizer: videoScreen captureHigh-speed sequential modeAF seeker\nProduct Identifiers BrandSanyo ModelX1200 MPNVPC-X1200BK UPC086483073403, 86483073403\nKey Features Camera TypePoint & Shoot Optical Zoom3x Digital Zoom4x Sensor Resolution12.0 MP Screen Size2.7\"\nOptical Sensor Sensor Size1/2.3\" Sensor TypeCCD\nLens System Macro Focus Range5-80cm Focus AdjustmentAutomatic, Manual Focal Length Equivalent to 35mm Camera38 - 114mm\nExposure Max Shutter Speed1/5000 sec Min Shutter Speed1/2 sec Exposure ModesAutomatic, Program Light SensitivityISO 100, ISO 1600, ISO 200, ISO 3200 (4Mpix), ISO 400, ISO 64, ISO 800 Light Sensitivity Max3200\nCamera Flash Flash TypeBuilt-in flash Red Eye ReductionYes Flash ModesAuto Mode, Fill-in Mode, OFF mode, Red-eye Reduction\nMemory / Storage Integrated Memory size52 MB Supported Flash MemorySD Memory Card, SDHC Memory Card\nViewfinder Viewfinder TypeNone\nDimensions Depth0.7 in. Height2.2 in. Width3.7 in. Weight3.5 Oz.\nDisplay Display TypeLCD Display RotationBuilt-in Screen DetailsLCD display - TFT active matrix - 2.7\" - color Display Size2.7\"\nMicrophone Microphone TypeMicrophone - built-in\nConnections Connector Types1 x USB, 1 x composite video/audio output Expansion Slot1 x SD Memory Card\nSystem Requirements for PC Connection Operating System SupportedApple Mac OS 9.0 or later, MS Windows Vista, MS Windows XP\nBattery Battery Form FactorManufacturer specific\nFile Format Digital Video FormatQuickTime Still Image FormatJPEG, TIFF\nOther Features Additional FeaturesAudio Recording, Automatic Face Tracking, DPOF Support, Direct Print, Exif Print Support, Smile Capture Face DetectionYes Shooting ModesFrame Movie Mode\nMiscellaneous Shooting ProgramsFireworks, Lamp, Landscape, Night mode, Portrait mode, Sports mode Special EffectsHigh contrast, Monochrome, Sepia, Vivid",
    "red eye reduction": "Yes",
    "screen details": "LCD display - TFT active matrix - 2.7\" - color",
    "screen size": "2.7\"",
    "sensor resolution": "12.0 MP",
    "sensor size": "1/2.3\"",
    "sensor type": "CCD",
    "shooting modes": "Frame Movie Mode",
    "shooting programs": "Fireworks, Lamp, Landscape, Night mode, Portrait mode, Sports mode",
    "special effects": "High contrast, Monochrome, Sepia, Vivid",
    "still image format": "JPEG, TIFF",
    "supported flash memory": "SD Memory Card, SDHC Memory Card",
    "type": "Point & Shoot",
    "upc": "086483073403, 86483073403",
    "viewfinder type": "None",
    "weight": "3.5 Oz.",
    "width": "3.7 in."
}