{
    "<page title>": "Sony Digital Camera DSC P10 5MP 3X Zoom Silver Cyber Shot | eBay",
    "additional features": "Audio Recording, Auto Power Save, Built-In Speaker, Date/Time Stamp, Multi-Picture Burst, Not Interchangeable Lenses, RGB Primary Color Filter, USB 2.0 Compatibility, With Tripod Mount",
    "auto focus type": "TTL contrast detection",
    "brand": "Sony",
    "camera flash features": "Auto Flash, Flash Off, Red-eye Reduction Flash, Slow Sync",
    "camera type": "Point & Shoot",
    "connector types": "1 x DC power input, 1 x USB, 1 x composite video/audio output",
    "country of manufacture": "Japan",
    "depth": "1.38 in.",
    "digital video format": "MPEG-1",
    "digital zoom": "2x",
    "display rotation": "Built-in",
    "display size": "1.5\"",
    "display type": "LCD",
    "effective flash range": "0.4 m - 3.8 m",
    "expansion slot": "1 x Memory Stick PRO",
    "exposure compensation": "\u00b12 EV range, in 1/3 EV steps",
    "exposure metering": "Multi-Segment, Spot",
    "exposure modes": "Automatic, Manual, Program",
    "flash modes": "Auto Mode, Fill-in Mode, OFF mode, Slow Synchro",
    "flash type": "Built-in flash",
    "focal length equivalent to 35mm camera": "38 - 114mm",
    "focus adjustment": "Autofocus & Manual Focus, Automatic, Manual",
    "height": "2.03 in.",
    "light sensitivity": "ISO 100, ISO 200, ISO 400",
    "light sensitivity max": "400",
    "macro focus range": "10-50cm",
    "max shutter speed": "1/2000 sec",
    "max video resolution": "640 x 480",
    "megapixels": "5.0 MP",
    "microphone operation mode": "Mono",
    "microphone type": "Microphone - built-in - electret condenser - mono",
    "min shutter speed": "2 sec",
    "model": "DSC-P10",
    "mpn": "S2791636",
    "operating system supported": "Apple Mac OS 8, Apple Mac OS 9, Apple Mac OS X, Microsoft Windows 2000, Microsoft Windows 98, Microsoft Windows 98SE, Microsoft Windows ME, Microsoft Windows XP",
    "optical viewfinder type": "Real-image zoom",
    "optical zoom": "3x",
    "product information": "You won't believe how much camera you get for your money with Sony's new Cyber-shot DSC-P10. This remarkable digital still camera combines unrivaled image quality with compact Sony design, delivering 5.0 megapixel resolution (effective) with a 3X optical/4x Smart Zoom lens and intelligent features, like 3-Area Multi-Point AF (Auto-Focus) and Continuous AF for sharply-focused shots even in low-light or active conditions. 16-Frame Multi-Burst function captures 16 320x240 frames with 3 selectable intervals for convenient motion analysis. You can also take MPEG movies and record voice memos for your photos. The DSC-P10 also features a lightning-fast USB 2.0 interface for high-speed transfer. It is Memory Stick Pro compatible with included 32MB Memory Stick Pro Media.\nProduct Highlights\nVideo\nProduct Identifiers\nBrand\nSony\nModel\nDSC-P10\nMPN\nS2791636\nUPC\n0027242626515, 081097002382, 405420811463\nKey Features\nCamera Type\nPoint & Shoot\nOptical Zoom\n3x\nDigital Zoom\n2x\nSensor Resolution\n5.0 MP\nScreen Size\n1.5\"\nOptical Sensor\nSensor Size\n1/1.8\"\nSensor Type\nCCD\nLens System\nMacro Focus Range\n10-50cm\nFocus Adjustment\nAutofocus & Manual Focus, Automatic, Manual\nAuto Focus type\nTTL contrast detection\nFocal Length Equivalent to 35mm Camera\n38 - 114mm\nExposure\nMax Shutter Speed\n1/2000 sec\nMin Shutter Speed\n2 sec\nExposure compensation\n\u00b12 EV range, in 1/3 EV steps\nExposure Metering\nMulti-Segment, Spot\nExposure Modes\nAutomatic, Manual, Program\nLight Sensitivity\nISO 100, ISO 200, ISO 400\nLight Sensitivity Max\n400\nCamera Flash\nFlash Type\nBuilt-in flash\nRed Eye Reduction\nYes\nEffective Flash Range\n0.4 m - 3.8 m\nCamera Flash Features\nAuto Flash, Flash Off, Red-eye Reduction Flash, Slow Sync\nFlash Modes\nAuto Mode, Fill-in Mode, OFF mode, Slow Synchro\nMemory / Storage\nSupported Flash Memory\nMemory Stick, Memory Stick PRO\nViewfinder\nViewfinder Type\nOptical, Optical (Through-the-lens)\nOptical Viewfinder Type\nReal-image zoom\nDimensions\nDepth\n1.38 in.\nHeight\n2.03 in.\nWidth\n4.25 in.\nWeight\n6.07 Oz.\nDisplay\nDisplay Type\nLCD\nDisplay Rotation\nBuilt-in\nScreen Details\nLCD display - TFT active matrix - 1.5\" - color\nDisplay Size\n1.5\"\nMicrophone\nMicrophone Type\nMicrophone - built-in - electret condenser - mono\nMicrophone Operation Mode\nMono\nConnections\nConnector Types\n1 x DC power input, 1 x USB, 1 x composite video/audio output\nExpansion Slot\n1 x Memory Stick PRO\nSystem Requirements for PC Connection\nOperating System Supported\nApple Mac OS 8, Apple Mac OS 9, Apple Mac OS X, Microsoft Windows 2000, Microsoft Windows 98, Microsoft Windows 98SE, Microsoft Windows ME, Microsoft Windows XP\nFile Format\nDigital Video Format\nMPEG-1\nStill Image Format\nGIF, JPEG\nResolution\nMax Video Resolution\n640 x 480\nOther Features\nAdditional Features\nAudio Recording, Auto Power Save, Built-In Speaker, Date/Time Stamp, Multi-Picture Burst, Not Interchangeable Lenses, RGB Primary Color Filter, USB 2.0 Compatibility, With Tripod Mount\nShooting Modes\nFrame Movie Mode\nMiscellaneous\nShooting Programs\nBeach/snow, Fireworks, Hi-speed shutter, Landscape, Twilight mode, Twilight portrait\nSpecial Effects\nBlack & White, Negative Art, Sepia, Solarization\nWhite Balance\nAuto, Cloudy (Preset), Daylight / Sunny (Preset), Flash (Preset), Fluorescent (Preset), Incandescent (Preset)",
    "red eye reduction": "Yes",
    "screen details": "LCD display - TFT active matrix - 1.5\" - color",
    "screen size": "1.5\"",
    "sensor resolution": "5.0 MP",
    "sensor size": "1/1.8\"",
    "sensor type": "CCD",
    "shooting modes": "Frame Movie Mode",
    "shooting programs": "Beach/snow, Fireworks, Hi-speed shutter, Landscape, Twilight mode, Twilight portrait",
    "special effects": "Black & White, Negative Art, Sepia, Solarization",
    "still image format": "GIF, JPEG",
    "supported flash memory": "Memory Stick, Memory Stick PRO",
    "type": "Point & Shoot",
    "upc": "0027242626515, 081097002382, 405420811463",
    "viewfinder type": "Optical, Optical (Through-the-lens)",
    "weight": "6.07 Oz.",
    "white balance": "Auto, Cloudy (Preset), Daylight / Sunny (Preset), Flash (Preset), Fluorescent (Preset), Incandescent (Preset)",
    "width": "4.25 in."
}