{
    "162 megapixel dxformat cmos image sensor": [
        "Delivers lifelike images with vivid colors, reduced noise and smooth tonal gradations.",
        "Delivers lifelike images with vivid colors, reduced noise and smooth tonal gradations."
    ],
    "4 fps continuous shooting": [
        "Enables you to capture fast-moving action at four frames per second.",
        "Enables you to capture fast-moving action at four frames per second."
    ],
    "<page title>": "Nikon D5100 16 2MP DSLR Kit w 18 55mm Lens Case and Remote Shutter Release 018208254781 | eBay",
    "additional features": "HDMI, HDR (High Dynamic Range) Function, Not Interchangeable Lenses, USB 2.0, With Tripod Mount",
    "analog video format": "NTSC",
    "auto focus type": "TTL contrast detection",
    "battery description": "EN-EL14 Rechargeable Li-ion Battery",
    "brand": "Nikon",
    "bundled items": "Case or Bag",
    "camera flash features": "Auto Flash, Flash Off, Front Sync Flash, Manual, Rear Sync Flash, Red-eye Reduction Flash, Slow Sync",
    "camera type": "Digital SLR",
    "condition": "New other (see details): A new, unused item with absolutely no signs of wear. The item may be missing the original packaging,\nor in the original packaging but not sealed. The item may be a factory second or a new, unused item with defects.\u00c2 See the seller\u00e2\u0080\u0099s listing for full details and description of any imperfections.\nSee all condition definitions- opens in a new window or tab\n... Read moreabout the condition",
    "connector types": "1 x HDMI output",
    "continuous shooting speed": "4 frames per second",
    "depth": "3.1 in.",
    "digital video format": "H.264, MOV, MPEG-4",
    "display size": "3\"",
    "display type": "LCD",
    "dmovie  full hd 1080p movie clips": [
        "A dedicated movie-record button right next to the shutter-release makes it easy to keep the camera steady when you switch between recording stills and movies. AF-F mode keeps everything in focus, and the camera's vari-angle monitor and Special Effects mode enable unique shots. The camera supports use of an external microphone and offers 30p, 25p and 24p frame rates.",
        "A dedicated movie-record button right next to the shutter-release makes it easy to keep the camera steady when you switch between recording stills and movies. AF-F mode keeps everything in focus, and the camera's vari-angle monitor and Special Effects mode enable unique shots. The camera supports use of an external microphone and offers 30p, 25p and 24p frame rates."
    ],
    "dual integrated dust reduction system": [
        "Image Sensor Cleaning and Airflow Control systems keep dust away from the camera's image sensor for clear, spot-free images.",
        "Image Sensor Cleaning and Airflow Control systems keep dust away from the camera's image sensor for clear, spot-free images."
    ],
    "expeed 2 image processing engine": [
        "Optimizes the camera's technologies for superior performance and maximum image quality.",
        "Optimizes the camera's technologies for superior performance and maximum image quality."
    ],
    "exposure metering": "3D color matrix II",
    "exposure modes": "Aperture-Priority, Automatic, Bulb, Manual, Program, Shutter-Priority",
    "extensive incamera retouch menu": [
        "Lets you edit and enhance photos and movies in the camera. Offers a range of effects and filters including Perspective Control, Soft Focus and Color Outline, which transforms your photo into a line drawing.",
        "Lets you edit and enhance photos and movies in the camera. Offers a range of effects and filters including Perspective Control, Soft Focus and Color Outline, which transforms your photo into a line drawing."
    ],
    "flash modes": "Rear Curtain Sync, Red-eye Reduction, Slow Synchro",
    "flash type": "Built-In",
    "focal length range": "4mm - 6mm",
    "focus adjustment": "Autofocus & Manual Focus, Automatic",
    "hdr high dynamic range imaging": [
        "Delivers exquisitely detailed shots of high-contrast scenes. Takes two shots within a single shutter release to create an image with an extremely wide dynamic range, low noise and rich color gradation.",
        "Delivers exquisitely detailed shots of high-contrast scenes. Takes two shots within a single shutter release to create an image with an extremely wide dynamic range, low noise and rich color gradation."
    ],
    "hdtv compatibility": [
        "This camera features a built-in HDMI connector with HDMI-CEC support so you can view your photos and movies on any HDTV and control playback features using your TV's remote control.",
        "This camera features a built-in HDMI connector with HDMI-CEC support so you can view your photos and movies on any HDTV and control playback features using your TV's remote control."
    ],
    "height": "3.8 in.",
    "infrared front and back receiver": [
        "Helps prevent image blur when shooting close-ups and self-portraits.",
        "Helps prevent image blur when shooting close-ups and self-portraits."
    ],
    "lens for sd": "AF-S VR 18-55mm",
    "lens system features": "VR (Vibration Reduction)",
    "light sensitivity": "100\u00e2\u0080\u00936400",
    "light sensitivity max": "6400",
    "live view with scene auto selector": [
        "Makes it easy to compose images using the vari-angle LCD monitor. Scene Auto Selector will select the best mode for the scene and subject you want to capture. Boasts easily selectable AF modes, including Face Priority AF that detects and tracks faces within the frame.",
        "Makes it easy to compose images using the vari-angle LCD monitor. Scene Auto Selector will select the best mode for the scene and subject you want to capture. Boasts easily selectable AF modes, including Face Priority AF that detects and tracks faces within the frame."
    ],
    "max shutter speed": "30 sec",
    "max video resolution": "1920 X 1080",
    "megapixels": "16.2 MP",
    "microphone type": "3.5mm Mic input",
    "min shutter speed": "30 sec",
    "model": "D5100",
    "mpn": "25478",
    "operating system supported": "Microsoft Windows 7",
    "optical zoom": "3x",
    "product identifiers": "BrandNikon ModelD5100 MPN25478 UPC018208254781\nKey Features Camera TypeDigital SLR Optical Zoom3x Sensor Resolution16.2 MP Screen Size3\"\nOptical Sensor Sensor TypeCMOS\nLens System Lens For SDAF-S VR 18-55mm Focal Length Range4mm - 6mm Focus AdjustmentAutofocus & Manual Focus, Automatic Lens System FeaturesVR (Vibration Reduction) Auto Focus typeTTL contrast detection\nExposure Max Shutter Speed30 sec Min Shutter Speed30 sec Exposure Metering3D color matrix II Exposure ModesAperture-Priority, Automatic, Bulb, Manual, Program, Shutter-Priority Light Sensitivity100\u00e2\u0080\u00936400 Light Sensitivity Max6400\nCamera Flash Flash TypeBuilt-In Camera Flash FeaturesAuto Flash, Flash Off, Front Sync Flash, Manual, Rear Sync Flash, Red-eye Reduction Flash, Slow Sync Flash ModesRear Curtain Sync, Red-eye Reduction, Slow Synchro\nMemory / Storage Supported Flash MemorySD Card, SD Memory Card, SDHC Card, SDHC Memory Card, SDXC Card, SDXC Memory Card\nViewfinder Viewfinder TypeDigital Viewfinder - Field Coverage95% Approx. Viewfinder Magnification0.78x Approx.\nDimensions Depth3.1 in. Height3.8 in. Width5 in. Weight19.7 Oz.\nDisplay Display TypeLCD Display Size3\"\nMicrophone Microphone Type3.5mm Mic input\nConnections Connector Types1 x HDMI output\nSystem Requirements for PC Connection Operating System SupportedMicrosoft Windows 7\nBattery Battery DescriptionEN-EL14 Rechargeable Li-ion Battery\nFile Format Digital Video FormatH.264, MOV, MPEG-4 Still Image FormatDCF 2.0, DPOF, EXIF 2.3, JPEG, Raw Image\nResolution Max Video Resolution1920 X 1080\nOther Features Additional FeaturesHDMI, HDR (High Dynamic Range) Function, Not Interchangeable Lenses, USB 2.0, With Tripod Mount\nMiscellaneous Special EffectsColor sketch White BalanceAuto, Cloudy (Preset), Daylight / Sunny (Preset), Flash (Preset), Fluorescent (Preset), Incandescent (Preset), Manual, Shade (Preset) Continuous Shooting Speed4 frames per second Analog Video FormatNTSC",
    "razorsharp 11point autofocus system": [
        "Offers fast and precise autofocus coverage across the frame. Four AF-area modes, including 3D-tracking AF, deliver sharp results, whether your subject is off-center, moving fast or completely unpredictable.",
        "Offers fast and precise autofocus coverage across the frame. Four AF-area modes, including 3D-tracking AF, deliver sharp results, whether your subject is off-center, moving fast or completely unpredictable."
    ],
    "scene modes": [
        "Scene Modes automatically adjust camera settings, including Picture Controls and active D-Lighting, to take the guesswork out of tricky photo situations and deliver optimal results. Simply turn the mode dial to SCENE to access the most commonly used modes. Sample photos appear on the display to help you select the right mode.",
        "Scene Modes automatically adjust camera settings, including Picture Controls and active D-Lighting, to take the guesswork out of tricky photo situations and deliver optimal results. Simply turn the mode dial to SCENE to access the most commonly used modes. Sample photos appear on the display to help you select the right mode."
    ],
    "screen size": "3\"",
    "sensor resolution": "16.2 MP",
    "sensor type": "CMOS",
    "special effects": "Color sketch",
    "special effects mode": [
        "Lets you shoot distinctive still images and movies using a special effect. Offers a range of effects, including Color Sketch, Miniature effect, Night Vision and Selective Color that lets you emphasize up to three colors of your choice and turns the rest of the image to monochrome.",
        "Lets you shoot distinctive still images and movies using a special effect. Offers a range of effects, including Color Sketch, Miniature effect, Night Vision and Selective Color that lets you emphasize up to three colors of your choice and turns the rest of the image to monochrome."
    ],
    "still image format": "DCF 2.0, DPOF, EXIF 2.3, JPEG, Raw Image",
    "supported flash memory": "SD Card, SD Memory Card, SDHC Card, SDHC Memory Card, SDXC Card, SDXC Memory Card",
    "upc": "018208254781",
    "viewfinder  field coverage": "95% Approx.",
    "viewfinder magnification": "0.78x Approx.",
    "viewfinder type": "Digital",
    "weight": "19.7 Oz.",
    "white balance": "Auto, Cloudy (Preset), Daylight / Sunny (Preset), Flash (Preset), Fluorescent (Preset), Incandescent (Preset), Manual, Shade (Preset)",
    "width": "5 in."
}