{
    "3d features": "Active 3D Technology",
    "3d technology": "Full 3D",
    "<page title>": "New 4K Samsung UN55HU9000F 55\" Full 3D UHD LED LCD Internet TV | eBay",
    "additional features": "3D Glasses Included, Eco Sensor, Game Mode, v-Chip",
    "audio type": "Surround",
    "brand": "Samsung",
    "builtin tuner": "ATSC, QAM",
    "condition": "New: A brand-new, unused, unopened, undamaged item in its original packaging (where packaging is\napplicable). Packaging should be the same as what is found in a retail store, unless the item is handmade or was packaged by the manufacturer in non-retail packaging, such as an unprinted box or plastic bag. See the seller's listing for full details.\nSee all condition definitions- opens in a new window or tab\n... Read moreabout the condition",
    "definition": "UHDTV",
    "depth": "3.7 in.",
    "display resolution": "3840 x 2160 pixels",
    "display technology": "LED LCD",
    "exterior color": "Silver",
    "front input connectors": "Component x 1, Composite x 2, HDMI x 4, RS-232C x 1, USB Port",
    "height": "28.5 in.",
    "model": "UN55HU9000F",
    "mpn": "UN55HU9000FXZA",
    "number of speakers": "4",
    "product identifiers": "BrandSamsung ModelUN55HU9000F MPNUN55HU9000FXZA\nKey Features TV TypeFlat-Panel Display TechnologyLED LCD Screen Size55\" DefinitionUHDTV Display Resolution3840 x 2160 pixels 3D TechnologyFull 3D WiFi ConnectionBuilt-in WiFi Smart TV FeaturesSmart Hub, Signature Services, Smart Content, ConnectShare, AllShare, Built-in Wi Fi\nTechnical Features Refresh Rate1440 Hz Screen TypeNon-Flat Screen Built-in TunerATSC, QAM\nConnectivity Front Input ConnectorsComponent x 1, Composite x 2, HDMI x 4, RS-232C x 1, USB Port\nAudio Features Number Of Speakers4 Audio TypeSurround\nDimensions Height28.5 in. Width48.5 in. Depth3.7 in. Weight44.5 lbs\nMiscellaneous Exterior ColorSilver Additional Features3D Glasses Included, Eco Sensor, Game Mode, v-Chip",
    "refresh rate": "1440 Hz",
    "screen size": "55\"",
    "screen type": "Non-Flat Screen",
    "smart tv features": "Smart Hub, Signature Services, Smart Content, ConnectShare, AllShare, Built-in Wi Fi",
    "tv type": "Flat-Panel",
    "weight": "44.5 lbs",
    "width": "48.5 in.",
    "wifi connection": "Built-in WiFi"
}