{
    "3d features": "Passive 3D Technology",
    "3d technology": "Full 3D",
    "<page title>": "Sony Bravia KDL 70R550A 70 034 Full 3D 1080p HD LED LCD Internet TV | eBay",
    "about the brand": "Sony is a Japan-based corporate group focused on the electronics, entertainment and financial service sectors. The company consists of various subsidiaries including Sony Computer Entertainment, Sony Music Entertainment, Sony Corporation and many more, as Sony Corporation is nowadays one of the leading manufacturers of electronic products for both the consumer and professional markets. Worldwide-known for its reliable, high-quality devices such as cameras, laptops, mobile phones and tablets, Sony is noted to be the third-largest manufacturer of televisions as well. In 2005 the company introduced its in-house brand BRAVIA which offers high-definition LCD TVs in a wide range of screen sizes.",
    "additional features": "Wi-Fi Enabled",
    "aspect ratio": "16:9",
    "brand": "Sony",
    "definition": "HDTV",
    "display resolution": "1920 x 1080 pixels",
    "display technology": "LED LCD",
    "exterior color": "Black",
    "family line": "Bravia",
    "max resolution": "1080p",
    "model": "KDL-70R550A",
    "mpn": "KDL-70R550A",
    "number of speakers": "2",
    "product highlights": "Video User Manual About The BrandSony is a Japan-based corporate group focused on the electronics, entertainment and financial service sectors. The company consists of various subsidiaries including Sony Computer Entertainment, Sony Music Entertainment, Sony Corporation and many more, as Sony Corporation is nowadays one of the leading manufacturers of electronic products for both the consumer and professional markets. Worldwide-known for its reliable, high-quality devices such as cameras, laptops, mobile phones and tablets, Sony is noted to be the third-largest manufacturer of televisions as well. In 2005 the company introduced its in-house brand BRAVIA which offers high-definition LCD TVs in a wide range of screen sizes.\nProduct Identifiers BrandSony Family LineBravia ModelKDL-70R550A MPNKDL-70R550A UPC027242863408\nKey Features TV TypeFlat-Panel Display TechnologyLED LCD Screen Size70\" DefinitionHDTV Aspect Ratio16:9 Resolution1080p Display Resolution1920 x 1080 pixels 3D TechnologyFull 3D WiFi ConnectionBuilt-in WiFi Smart TV FeaturesInternet Browsing\nAudio Features Number Of Speakers2\nMiscellaneous Exterior ColorBlack Additional FeaturesWi-Fi Enabled",
    "resolution": "1080p",
    "screen size": "70\"",
    "smart tv features": "Internet Browsing",
    "tv type": "Flat-Panel",
    "upc": "027242863408",
    "wifi connection": "Built-in WiFi"
}