{
    "3d technology": "3D Not Supported",
    "<page title>": "Coby LEDTV3916 39 inch 1080p 60Hz LED HDTV Black Brand New 716829983966 | eBay",
    "about the brand": "Coby Electronics Corporation\u00c2 was founded in 1991 by Young Dong Lee and was a well-known manufacturer of consumer electronics products. The company's initial headquarter was in an industrial area of\u00c2 Maspeth, Queens, while in 2008 it was moved to\u00c2 New York.\u00c2 Coby\u00e2\u0080\u0099s extensive production line included reliable home and portable audio and video electronics such as LCD televisions, internet tablets, DVD and MP3 players, digital picture frames, and surround-sound home theater systems.",
    "additional features": "Headphone Jack",
    "aspect ratio": "16:9",
    "audio type": "Stereo",
    "brand": "Coby",
    "brightness": "500 cd/m\u00c2\u00b2\u00c2\u00b0",
    "builtin tuner": "ATSC, NTSC, QAM",
    "condition": "New: A brand-new, unused, unopened, undamaged item in its original packaging (where packaging is\napplicable). Packaging should be the same as what is found in a retail store, unless the item is handmade or was packaged by the manufacturer in non-retail packaging, such as an unprinted box or plastic bag. See the seller's listing for full details.\nSee all condition definitions- opens in a new window or tab\n... Read moreabout the condition",
    "definition": "HDTV",
    "depth": "3.7 in.",
    "display resolution": "1920 x 1080 pixels",
    "display technology": "LED LCD",
    "energy star": "Energy Star Compliant",
    "exterior color": "Black",
    "hdcp support": "With HDCP Support",
    "height": "21.6 in.",
    "max. resolution": "1080p",
    "model": "LEDTV3916",
    "mpn": "LEDTV3916",
    "number of speakers": "2",
    "parental control": "V-Chip",
    "product highlights": "About The BrandCoby Electronics Corporation\u00c2 was founded in 1991 by Young Dong Lee and was a well-known manufacturer of consumer electronics products. The company's initial headquarter was in an industrial area of\u00c2 Maspeth, Queens, while in 2008 it was moved to\u00c2 New York.\u00c2 Coby\u00e2\u0080\u0099s extensive production line included reliable home and portable audio and video electronics such as LCD televisions, internet tablets, DVD and MP3 players, digital picture frames, and surround-sound home theater systems.\nProduct Identifiers BrandCoby ModelLEDTV3916 MPNLEDTV3916 UPC716829983966\nKey Features TV TypeFlat-Panel Display TechnologyLED LCD Screen Size39\" DefinitionHDTV Aspect Ratio16:9 Resolution1080p Display Resolution1920 x 1080 pixels 3D Technology3D Not Supported Smart TV FeaturesNot Supported\nTechnical Features Viewing Angle176\u00c2\u00b0 Built-in TunerATSC, NTSC, QAM Supported Resolutions1080p (HDTV) Brightness500 cd/m\u00c2\u00b2\u00c2\u00b0 HDCP SupportWith HDCP Support\nPower Energy StarEnergy Star Compliant\nAudio Features Number Of Speakers2 Speaker Power2 x 10 Watt Audio TypeStereo\nDimensions Height21.6 in. Width35 in. Depth3.7 in.\nMiscellaneous Parental ControlV-Chip Room TypeCommercial Space, Living Room Remote Control Type (originally supplied by manufacturer)Standard Exterior ColorBlack Additional FeaturesHeadphone Jack",
    "remote control type originally supplied by manufacturer": "Standard",
    "resolution": "1080p",
    "room type": "Commercial Space, Living Room",
    "screen size": "39\"",
    "smart tv features": "Not Supported",
    "speaker power": "2 x 10 Watt",
    "supported resolutions": "1080p (HDTV)",
    "tv type": "Flat-Panel",
    "upc": "716829983966",
    "viewing angle": "176\u00c2\u00b0",
    "width": "35 in."
}