{
    "<page title>": "Samsung Digimax S800 8 1 MP Digital Camera Silver 044701006152 | eBay",
    "additional features": "Audio Recording, Auto Power Save, Built-In Speaker, DPOF Support, Date/Time Stamp, Digital Image Rotation, Direct Print, PictBridge Support, Resizing an Image, USB 2.0 Compatibility",
    "auto focus type": "TTL contrast detection",
    "battery form factor": "Standard form factor",
    "brand": "Samsung",
    "bundled items": "Case or Bag, Flash, Memory Card, Strap (Neck or Wrist)",
    "camera flash features": "AF Illuminator",
    "camera type": "Point & Shoot",
    "condition": "New other (see details): A new, unused item with absolutely no signs of wear. The item may be missing the original packaging,\nor in the original packaging but not sealed. The item may be a factory second or a new, unused item with defects.\u00c2 See the seller\u00e2\u0080\u0099s listing for full details and description of any imperfections.\nSee all condition definitions- opens in a new window or tab\n... Read moreabout the condition",
    "connector types": "1 x USB, 1 x composite video/audio output, 1 x docking station",
    "countryregion of manufacture": "Russian Federation",
    "depth": "1.1 in.",
    "digital video format": "AVI",
    "digital zoom": "5x",
    "display rotation": "Built-in",
    "display size": "2.4\"",
    "effective flash range": "0.2 m - 3 m",
    "expansion slot": "1 x SD Memory Card",
    "exposure compensation": "\u00c2\u00b12 EV range, in 1/2 EV steps",
    "exposure metering": "Multi-Segment, Spot",
    "exposure modes": "Automatic, Manual, Program",
    "flash modes": "Auto Mode, Fill-in Mode, OFF mode, Red-eye Reduction, Slow Synchro",
    "flash type": "Built-in flash",
    "focal length equivalent to 35mm camera": "35 - 105mm",
    "focus adjustment": "Automatic",
    "height": "2.4 in.",
    "light sensitivity": "ISO 100, ISO 200, ISO 400, ISO 50, ISO auto",
    "light sensitivity max": "400",
    "macro focus range": "4-80cm",
    "manufacturer warranty": "\u00d0\u009d\u00d0\u00b5\u00d1\u0082",
    "max shutter speed": "1/1500 sec",
    "megapixels": "8.1 MP",
    "microphone type": "Microphone - built-in",
    "min shutter speed": "8 sec",
    "model": "S800",
    "mpn": "CG730222C",
    "operating system supported": "Apple Mac OS 9.0 or later, Apple Mac OS X 10.0 - 10.4, MS Windows 2000, MS Windows 98, MS Windows 98 SE, MS Windows ME, MS Windows XP",
    "optical zoom": "3x",
    "product information": "The Digimax S800 is a high-resolution digital camera that is equipped with a true-color filtered 8.1 mega-pixel CCD. You can use the Digimax S800 to produce even better images and take detailed photos for printing up to poster size. In addition, the Digimax S800 has a 3x optical and 5x digital zoom giving 15x total zoom when combined.The Digimax S800 has a large 2.4\"LCD for improved contrast and color reproduction, allowing you to enjoy a wider and clearer image.The Digimax S800 has some intriguing special effect functions - including Highlight, Photo Frame, and Composite Shot - that give you unique, and sometimes amusing, shooting experiences beyond conventional picture-taking. You can access each of these special effects with just one touch of the \"E\" button.When it is set to Auto Mode, the Digimax S800 automatically adjusts the shooting distance and focus from between 5cm to infinity, helping the picture taker to get better pictures more easily. The user does not need to activate the Macro function separately in order to take pictures as close as 5cm.The powerful video capability of the Digimax S800 delivers a \"Camcorder like\" experience. For a more enhanced movie shooting experience, the Digimax S800 uses MPEG-4, the high-compression high-quality video format, which can record for up to 3 - 4 times longer than the traditional video formats used in many other digital cameras. With powerful video recording in VGA (640 x 480) at 30fps, it provides a wider screen view and clearer video quality. These movies can even be viewed on the TV.The Digimax S800 has a Movies Stabilizer function, which helps maintain steady recording of a subject by means of automatic detection and correction of lateral and vertical camera movements of the camera.The Successive Recording function of the Digimax S800, which is based on exclusive Samsung technology, allows you to pause and resume video recording as desired and merge those multiple movie into a single file.For easier editing of movies, the Digimax S800 allows you to select and save only the desired part into a new file during playback, on the camera. The Digimax S800 also allows you to capture a still image during video playback.The family-friendly mode dial - with Night, Portrait and Children modes - makes it easier to get great shots of the family by giving in stand access to the appropriate mode for each individual situation. Children mode, with its open aperture and fast shutter speeds, lets you 'freeze' children in fast moving action shots. Night mode automatically uses the slow synchronization function to help you get clearer and brighter pictures at night. When using Portrait mode, you get more pleasing people pictures with improved red-eye reduction.The Digimax S800's print button makes direct printing easier than ever. Simply connect the S800 to any PictBridge compatible photo printer, press the illuminated print button and print! Also use the button to transfer images directly to a computer.\nProduct Highlights Video\nProduct Identifiers BrandSamsung ModelS800 MPNCG730222C UPC044701006152\nKey Features Camera TypePoint & Shoot Optical Zoom3x Digital Zoom5x Sensor Resolution8.1 MP Screen Size2.4\"\nOptical Sensor Sensor Size1/1.8\" Sensor TypeCCD\nLens System Macro Focus Range4-80cm Focus AdjustmentAutomatic Auto Focus typeTTL contrast detection Focal Length Equivalent to 35mm Camera35 - 105mm\nExposure Max Shutter Speed1/1500 sec Min Shutter Speed8 sec Exposure compensation\u00c2\u00b12 EV range, in 1/2 EV steps Exposure MeteringMulti-Segment, Spot Exposure ModesAutomatic, Manual, Program Light SensitivityISO 100, ISO 200, ISO 400, ISO 50, ISO auto Light Sensitivity Max400\nCamera Flash Flash TypeBuilt-in flash Red Eye ReductionYes Effective Flash Range0.2 m - 3 m Camera Flash FeaturesAF Illuminator Flash ModesAuto Mode, Fill-in Mode, OFF mode, Red-eye Reduction, Slow Synchro\nMemory / Storage Supported Flash MemoryMultiMediaCard, SD Memory Card\nDimensions Depth1.1 in. Height2.4 in. Width3.9 in. Weight169 Oz.\nDisplay Display RotationBuilt-in Screen DetailsLCD display - 2.4\" - color Display Size2.4\"\nMicrophone Microphone TypeMicrophone - built-in\nConnections Connector Types1 x USB, 1 x composite video/audio output, 1 x docking station Expansion Slot1 x SD Memory Card\nSystem Requirements for PC Connection Operating System SupportedApple Mac OS 9.0 or later, Apple Mac OS X 10.0 - 10.4, MS Windows 2000, MS Windows 98, MS Windows 98 SE, MS Windows ME, MS Windows XP\nBattery Battery Form FactorStandard form factor\nFile Format Digital Video FormatAVI Still Image FormatJPEG\nOther Features Additional FeaturesAudio Recording, Auto Power Save, Built-In Speaker, DPOF Support, Date/Time Stamp, Digital Image Rotation, Direct Print, PictBridge Support, Resizing an Image, USB 2.0 Compatibility Shooting ModesFrame Movie Mode\nMiscellaneous Shooting ProgramsBack light, Beach/snow, Children, Dawn/dusk, Fireworks, Landscape, Night scene, Portrait mode, Sunset Special EffectsBlack & White, Blue, Green, Negative, Neutral, Red, Sepia, Soft, Vivid",
    "red eye reduction": "Yes",
    "screen details": "LCD display - 2.4\" - color",
    "screen size": "2.4\"",
    "sensor resolution": "8.1 MP",
    "sensor size": "1/1.8\"",
    "sensor type": "CCD",
    "shooting modes": "Frame Movie Mode",
    "shooting programs": "Back light, Beach/snow, Children, Dawn/dusk, Fireworks, Landscape, Night scene, Portrait mode, Sunset",
    "special effects": "Black & White, Blue, Green, Negative, Neutral, Red, Sepia, Soft, Vivid",
    "still image format": "JPEG",
    "supported flash memory": "MultiMediaCard, SD Memory Card",
    "type": "Point & Shoot",
    "upc": "044701006152",
    "weight": "169 Oz.",
    "width": "3.9 in."
}