{
    "<page title>": "Mint Kodak EasyShare CX7300 3 2 MP Digital Camera with Printer Dock 6000 EXTRAS | eBay",
    "additional features": [
        "Auto Power Save, Date/Time Stamp, Not Interchangeable Lenses, USB, With Tripod Mount",
        "Auto Power Save, Date/Time Stamp, Not Interchangeable Lenses, USB, With Tripod Mount"
    ],
    "battery form factor": [
        "Standard form factor",
        "Standard form factor"
    ],
    "brand": [
        "Kodak",
        "Kodak"
    ],
    "camera flash features": [
        "Auto Flash, Fill-in Flash, Flash Off, Red-eye Reduction Flash",
        "Auto Flash, Fill-in Flash, Flash Off, Red-eye Reduction Flash"
    ],
    "camera type": [
        "Point & Shoot",
        "Point & Shoot"
    ],
    "connector types": [
        "1 x USB, 1 x docking station",
        "1 x USB, 1 x docking station"
    ],
    "continuous shooting speed": [
        "0.5 frames per second",
        "0.5 frames per second"
    ],
    "depth": [
        "1.6 in.",
        "1.6 in."
    ],
    "digital video format": [
        "QuickTime",
        "QuickTime"
    ],
    "digital zoom": [
        "3x",
        "3x"
    ],
    "display rotation": [
        "Built-in",
        "Built-in"
    ],
    "display size": [
        "1.6\"",
        "1.6\""
    ],
    "display type": [
        "LCD",
        "LCD"
    ],
    "effective flash range": [
        "0.8 m - 2.4 m",
        "0.8 m - 2.4 m"
    ],
    "expansion slot": [
        "1 x SD Memory Card",
        "1 x SD Memory Card"
    ],
    "exposure compensation": [
        "\u00c2\u00b12 EV range, in 1/2 EV steps",
        "\u00c2\u00b12 EV range, in 1/2 EV steps"
    ],
    "exposure metering": [
        "Center-Weighted, Multi-Segment",
        "Center-Weighted, Multi-Segment"
    ],
    "exposure modes": [
        "Automatic, Program",
        "Automatic, Program"
    ],
    "flash modes": [
        "Auto Mode, Fill-in Mode, OFF mode, Red-eye Reduction",
        "Auto Mode, Fill-in Mode, OFF mode, Red-eye Reduction"
    ],
    "flash type": [
        "Built-in flash",
        "Built-in flash"
    ],
    "focal length equivalent to 35mm camera": [
        "37mm",
        "37mm"
    ],
    "focus adjustment": [
        "Fixed Focus",
        "Fixed Focus"
    ],
    "height": [
        "2.6 in.",
        "2.6 in."
    ],
    "integrated memory size": [
        "16 MB",
        "16 MB"
    ],
    "light sensitivity": [
        "ISO 100, ISO 140, ISO 200, ISO auto, ISO auto (100-200)",
        "ISO 100, ISO 140, ISO 200, ISO auto, ISO auto (100-200)"
    ],
    "light sensitivity max": [
        "200",
        "200"
    ],
    "max operating temperature": [
        "40 \u00c2\u00b0C",
        "40 \u00c2\u00b0C"
    ],
    "max shutter speed": [
        "1/2300 sec",
        "1/2300 sec"
    ],
    "max video resolution": [
        "320 x 240",
        "320 x 240"
    ],
    "microphone type": [
        "None",
        "None"
    ],
    "min operating temperature": [
        "0 \u00c2\u00b0C",
        "0 \u00c2\u00b0C"
    ],
    "min shutter speed": [
        "1/2 sec",
        "1/2 sec"
    ],
    "model": [
        "CX7300",
        "CX7300"
    ],
    "mpn": [
        "CX7300",
        "CX7300"
    ],
    "operating system supported": [
        "Apple Mac OS X 10.2.1 or later, MS Windows 2000, MS Windows 98, MS Windows 98 SE, MS Windows ME, MS Windows XP, Microsoft Windows 2000, Microsoft Windows 98, Microsoft Windows 98SE, Microsoft Windows ME, Microsoft Windows XP",
        "Apple Mac OS X 10.2.1 or later, MS Windows 2000, MS Windows 98, MS Windows 98 SE, MS Windows ME, MS Windows XP, Microsoft Windows 2000, Microsoft Windows 98, Microsoft Windows 98SE, Microsoft Windows ME, Microsoft Windows XP"
    ],
    "optical viewfinder type": [
        "Real-image",
        "Real-image"
    ],
    "optical zoom": [
        "3x",
        "3x"
    ],
    "product information": "The Kodak EasyShare CX7300 digital camera is always ready to shoot, and with 3.2 MP you can make high-quality prints up to 11\"x14\". Kodak Color Science inside means consistently great pictures. Auto white balance provides accurate color in all types of lighting conditions. 3X continuous digital zoom lets you get in closer without losing image quality.\nProduct Identifiers BrandKodak ModelCX7300 MPNCX7300 UPC041778095461, 041778486689, 41778095461\nKey Features Camera TypePoint & Shoot Optical Zoom3x Digital Zoom3x Sensor Resolution3.2 MP Screen Size1.6\"\nOptical Sensor Sensor Size1/2.7\" Sensor TypeCCD\nLens System Focus AdjustmentFixed Focus Focal Length Equivalent to 35mm Camera37mm\nExposure Max Shutter Speed1/2300 sec Min Shutter Speed1/2 sec Exposure compensation\u00c2\u00b12 EV range, in 1/2 EV steps Exposure MeteringCenter-Weighted, Multi-Segment Exposure ModesAutomatic, Program Light SensitivityISO 100, ISO 140, ISO 200, ISO auto, ISO auto (100-200) Light Sensitivity Max200\nCamera Flash Flash TypeBuilt-in flash Red Eye ReductionYes Effective Flash Range0.8 m - 2.4 m Camera Flash FeaturesAuto Flash, Fill-in Flash, Flash Off, Red-eye Reduction Flash Flash ModesAuto Mode, Fill-in Mode, OFF mode, Red-eye Reduction\nMemory / Storage Integrated Memory size16 MB Supported Flash MemoryBuilt-in, MultiMediaCard, SD Card, SD Memory Card\nViewfinder Viewfinder TypeOptical, Optical (Through-the-lens) Optical Viewfinder TypeReal-image\nDimensions Depth1.6 in. Height2.6 in. Width4.1 in. Weight5.2 Oz.\nDisplay Display TypeLCD Display RotationBuilt-in Screen DetailsLCD display - TFT active matrix - 1.6\" - color Display Size1.6\"\nMicrophone Microphone TypeNone\nConnections Connector Types1 x USB, 1 x docking station Expansion Slot1 x SD Memory Card\nSystem Requirements for PC Connection Operating System SupportedApple Mac OS X 10.2.1 or later, MS Windows 2000, MS Windows 98, MS Windows 98 SE, MS Windows ME, MS Windows XP, Microsoft Windows 2000, Microsoft Windows 98, Microsoft Windows 98SE, Microsoft Windows ME, Microsoft Windows XP\nBattery Battery Form FactorStandard form factor\nFile Format Digital Video FormatQuickTime Still Image FormatJPEG\nResolution Max Video Resolution320 x 240\nEnvironmental Parameters Min Operating Temperature0 \u00c2\u00b0C Max Operating Temperature40 \u00c2\u00b0C\nOther Features Additional FeaturesAuto Power Save, Date/Time Stamp, Not Interchangeable Lenses, USB, With Tripod Mount Shooting ModesFrame Movie Mode\nMiscellaneous Shooting ProgramsNight mode Special EffectsBlack & White, Sepia White BalanceAutomatic Continuous Shooting Speed0.5 frames per second",
    "red eye reduction": [
        "Yes",
        "Yes"
    ],
    "screen details": [
        "LCD display - TFT active matrix - 1.6\" - color",
        "LCD display - TFT active matrix - 1.6\" - color"
    ],
    "screen size": [
        "1.6\"",
        "1.6\""
    ],
    "sensor resolution": [
        "3.2 MP",
        "3.2 MP"
    ],
    "sensor size": [
        "1/2.7\"",
        "1/2.7\""
    ],
    "sensor type": [
        "CCD",
        "CCD"
    ],
    "shooting modes": [
        "Frame Movie Mode",
        "Frame Movie Mode"
    ],
    "shooting programs": [
        "Night mode",
        "Night mode"
    ],
    "special effects": [
        "Black & White, Sepia",
        "Black & White, Sepia"
    ],
    "still image format": [
        "JPEG",
        "JPEG"
    ],
    "supported flash memory": [
        "Built-in, MultiMediaCard, SD Card, SD Memory Card",
        "Built-in, MultiMediaCard, SD Card, SD Memory Card"
    ],
    "upc": [
        "041778095461, 041778486689, 41778095461",
        "041778095461, 041778486689, 41778095461"
    ],
    "viewfinder type": [
        "Optical, Optical (Through-the-lens)",
        "Optical, Optical (Through-the-lens)"
    ],
    "weight": [
        "5.2 Oz.",
        "5.2 Oz."
    ],
    "white balance": [
        "Automatic",
        "Automatic"
    ],
    "width": [
        "4.1 in.",
        "4.1 in."
    ]
}