{
    "<page title>": "Sony W800 Compact Camera with 5x Optical Zoom - Digital Cameras - Photo - Visual | ILGS.net",
    "accessories included": [
        "Rechargeable Battery Pack NP-BN;AC AdaptorAC-UB10C;Wrist Strap;Multi USB cable;Instruction Manual",
        "Rechargeable Battery Pack NP-BN;AC AdaptorAC-UB10C;Wrist Strap;Multi USB cable;Instruction Manual"
    ],
    "battery type": "Rechargeable Battery Pack NP-BN",
    "builtin flash": "Yes",
    "camera shutter speed": "iAuto (2 - 1/1500) / Program Auto (1 - 1/1500)",
    "colour of product": [
        "Black",
        "Black",
        "Black"
    ],
    "compatible memory cards": [
        "Memory Stick\u2122 Duo;Memory Stick PRO Duo\u2122;Memory Stick PRO Duo\u2122(high speed);Memory Stick PRO HG Duo\u2122;Memory Stick XC-HG Duo\u2122;Memory Stick Micro;Memory Stick Micro (Mark2);SD Memory Card;SDHC Memory Card;SDXC Memory Card;microSD Memory Card;microSDHC Memory Card;microSDXC Memory Card",
        "Memory Stick Duo;Memory Stick PRO Duo\u2122;Memory Stick PRO Duo\u2122(high speed);Memory Stick PRO HG Duo\u2122;Memory Stick XC-HG Duo\u2122;Memory Stick Micro;Memory Stick Micro (Mark2);SD Memory Card;SDHC Memory Card;SDXC Memory Card;microSD Memory Card;microSDHC Memory Card;microSDXC Memory Card"
    ],
    "dimensions w x d x h": "96.8 x 20.8 x 55.5 mm",
    "display": "2.7'' (6.7 cm) (4:3) / 230,400 dots / Xtra Fine / TFT LCD",
    "ean": "4905524978681",
    "flash exposure compensation": "+/- 2.0 EV (1/3 EV steps)",
    "flash modes": "Auto,Flash On,Flash Off\nAuto / Flash On / Slow Synchro / Flash Off / Advanced Flash",
    "focal length range ff": "4.6 - 23 mm",
    "image processor": "Sorry, this data isn\u2032t available",
    "internal memory": [
        "Approx. 29MB",
        "29mb"
    ],
    "iso sensitivity": [
        "Auto/100/200/400/800/1600/3200",
        "Auto: (ISO100-800 level)\nISO 100-3200"
    ],
    "lcd screen size": "2.7",
    "lens system": [
        "Sony Lens",
        "Sony Lens"
    ],
    "light metering": "Multi Pattern",
    "manufacturer": "Sony",
    "megapixel": "20.1",
    "optical zoom": [
        "5x",
        "5 x"
    ],
    "pdf url": "No",
    "picture effects": [
        "Still: Toy camera / Pop Color / Partial Color / Soft High-key, Movie: Toy camera, Pop Color, Partial Color, Soft High-key",
        "Still: Toy camera / Pop Color / Partial Color / Soft High-key, Movie: Toy camera, Pop Color, Partial Color, Soft High-key"
    ],
    "product promotion": "N/A",
    "recording format": [
        "Still Images: JPEG (DCF, Exif, MPF Baseline) compliant, DPOF compatible",
        "Still Images: JPEG (DCF, Exif, MPF Baseline) compliant, DPOF compatible"
    ],
    "reviews": "No",
    "scene modes": "Night Portrait, Landscape, Portrait, Beach, Snow",
    "selftimer": "Off / 10sec. / 2sec. / portrait1 / portrait2",
    "sensor type": [
        "1/2.3\" type (7.76mm) Super HAD CCD",
        "1/2.3 type (7.76mm) Super HAD CCD"
    ],
    "shooting modes": "Intelligent Auto, Panorama, Program Auto, Easy Shooting, Picture Effect, Scene Selection, Steady shot, Party",
    "short description": "Digital compact camera with 5x optical zoom, a 26mm wide-angle lens, a 20.1MP sensor, & SteadyShot",
    "sku": "DSCW800B.CEH",
    "specification": "Picture qualitySensor type1/2.3\" type (7.76mm) Super HAD CCDLens systemFocal length range (f-f)4.6 - 23 mmOptical zoom5xLight exposureISO sensitivityAuto: (ISO100-800 level)\nISO 100-3200Light meteringMulti PatternFlashFlash modesAuto,Flash On,Flash Off\nAuto / Flash On / Slow Synchro / Flash Off / Advanced FlashFlash exposure compensation+/- 2.0 EV (1/3 EV steps)MemoryCompatible memory cardsMemory Stick\u2122 Duo;Memory Stick PRO Duo\u2122;Memory Stick PRO Duo\u2122(high speed);Memory Stick PRO HG Duo\u2122;Memory Stick XC-HG Duo\u2122;Memory Stick Micro;Memory Stick Micro (Mark2);SD Memory Card;SDHC Memory Card;SDXC Memory Card;microSD Memory Card;microSDHC Memory Card;microSDXC Memory CardDisplayDisplay2.7'' (6.7 cm) (4:3) / 230,400 dots / Xtra Fine / TFT LCDViewfinderViewfinder type?CameraColour of productBlackPlayback modesSlideshow with MusicWhite balanceAuto, Daylight, Cloudy, Incandescent, FlashScene modesNight Portrait, Landscape, Portrait, Beach, SnowShooting modesIntelligent Auto, Panorama, Program Auto, Easy Shooting, Picture Effect, Scene Selection, Steady shot, PartyTechnical detailsPlayback modesSlideshow with MusicAccessories includedRechargeable Battery Pack NP-BN;AC AdaptorAC-UB10C;Wrist Strap;Multi USB cable;Instruction ManualRecording formatStill Images: JPEG (DCF, Exif, MPF Baseline) compliant, DPOF compatibleLens systemSony LensPicture effectsStill: Toy camera / Pop Color / Partial Color / Soft High-key, Movie: Toy camera, Pop Color, Partial Color, Soft High-keyDesignColour of productBlackTechnical detailsSelf-timerOff / 10sec. / 2sec. / portrait1 / portrait2Image processorSorry, this data isn\u2032t availableF-number (relative aperture)F3.2 - 6.4 Flash typeSorry, this data isn\u2032t availableSteadyShotEIS (without GYRO)Shutter speediAuto (2 - 1/1500) / Program Auto (1 - 1/1500)Display brightness control5(Bright) / 4 / 3 / 2 / 1(Dark)Built-in WiFi?Effective megapixels20.1 MPDimensions (WxHxD)96.8 x 55.5 x 20.8 mmBattery lifeUp to 200 shots / 100 minutesInternal memoryApprox. 29MBOther featuresAccessories includedRechargeable Battery Pack NP-BN;AC AdaptorAC-UB10C;Wrist Strap;Multi USB cable;Instruction ManualRecording formatStill Images: JPEG (DCF, Exif, MPF Baseline) compliant, DPOF compatibleLens systemSony LensPicture effectsStill: Toy camera / Pop Color / Partial Color / Soft High-key, Movie: Toy camera, Pop Color, Partial Color, Soft High-key",
    "steadyshot": "EIS (without GYRO)",
    "viewfinder type": "?",
    "weight": "125 g",
    "white balance": "Auto, Daylight, Cloudy, Incandescent, Flash"
}