{
    "<page title>": "Sony W800 Compact Camera with 5x Optical Zoom - Digital Cameras - Photo - Visual | ILGS.net",
    "ac adapter included": "Yes",
    "auto focusing af modes": "Centre weighted Auto Focus, Face tracking, Multi Point Auto Focus, Tracking Auto Focus",
    "batteries included": "Yes",
    "battery charger included": "Yes",
    "battery life cipa standard": "200 shots",
    "battery type": "NP-BN",
    "builtin flash": "Yes",
    "camera shutter speed max": "2s",
    "camera shutter speed min": "0.000666s",
    "camera type": "Compact",
    "colour of product": [
        "Silver",
        "Silver"
    ],
    "compatible memory cards": "MicroSD (TransFlash), MicroSDHC, MicroSDXC, MS Duo, MS Micro (M2), MS PRO Duo, MS Pro-HG Duo, MS XC-HG Duo, SD, SDHC, SDXC",
    "depth": "2.08 cm",
    "digital zoom": "40x",
    "display": "LCD",
    "display diagonal": "6.86 cm (2.7\")",
    "display resolution numeric": "230400 pixels",
    "ean": "4905524978698",
    "flash modes": "Auto, Flash off, Flash on, Slow synchronization",
    "focal length range ff": "4.6 - 23 mm",
    "full hd": "No",
    "hdmi": [
        "No",
        "No"
    ],
    "height": "5.55 cm",
    "image sensor size": "25.4/58.4 mm (1/2.3\")",
    "image stabilizer": "Yes",
    "internal memory": "29 MB",
    "iso sensitivity": "Auto",
    "iso sensitivity max": "3200",
    "iso sensitivity min": "100",
    "light exposure correction": "\u00b1 2EV (1/3EV step)",
    "manufacturer": "Sony",
    "maximum image resolution": "5152 x 3864 pixels",
    "maximum video resolution": "640 x 480 pixels",
    "megapixel": "20.1 MP",
    "motion jpeg frame rate": "30 fps",
    "optical zoom": "5x",
    "pdf url": "No",
    "power source type": "Battery",
    "product promotion": "N/A",
    "reviews": "No",
    "scene modes": "Night Portrait, Landscape, Portrait, Beach, Snow",
    "sensor type": "CCD",
    "short description": "20.1MP, 1/2.3\" CCD, 4.6 - 23mm, ISO 100 - 3200, 6.858 cm (2.7 \") LCD, 29MB",
    "sku": "DSCW800S.CEH",
    "specification": "Picture qualityImage sensor size25.4/58.4 mm (1/2.3\")Still image resolution(s)5152 x 3864\n3648 x 2736\n2592 x 1944\n5152 x 2896\n1920 x 1080Image stabilizerYesMaximum image resolution5152 x 3864 pixelsSensor typeCCDCamera typeCompactMegapixel20.1 MPLens systemFocal length range (f-f)4.6 - 23 mmDigital zoom40xOptical zoom5xFocusingAuto focusing (AF) modesCentre weighted Auto Focus, Face tracking, Multi Point Auto Focus, Tracking Auto FocusLight exposureISO sensitivityAutoLight exposure correction\u00b1 2EV (1/3EV step)ISO sensitivity (min)100ISO sensitivity (max)3200ShutterCamera shutter speed (min)0.000666sCamera shutter speed (max)2sFlashFlash modesAuto, Flash off, Flash on, Slow synchronizationBuilt-in flashYesVideoVideo resolutions320 x 240, 640 x 480 pixelsMotion JPEG frame rate30 fpsFull HDNoMaximum video resolution640 x 480 pixelsMemoryInternal memory29 MBCompatible memory cardsMicroSD (TransFlash), MicroSDHC, MicroSDXC, MS Duo, MS Micro (M2), MS PRO Duo, MS Pro-HG Duo, MS XC-HG Duo, SD, SDHC, SDXCDisplayDisplayLCDDisplay diagonal6.86 cm (2.7\")Display resolution (numeric)230400 pixelsPorts & interfacesHDMINoCameraColour of productSilverWhite balanceAuto, Daylight, Cloudy, Incandescent, FlashScene modesNight Portrait, Landscape, Portrait, Beach, SnowBatteryBattery life (CIPA standard)200 shotsBattery typeNP-BNPower source typeBatteryTechnical detailsHDMINoDesignColour of productSilverWeight & dimensionsWidth9.68 cmDepth2.08 cmHeight5.55 cmWeight109gWeight (including battery)125gPackaging contentBattery charger includedYesBatteries includedYesAC adapter includedYes",
    "still image resolutions": "5152 x 3864\n3648 x 2736\n2592 x 1944\n5152 x 2896\n1920 x 1080",
    "video resolutions": "320 x 240, 640 x 480 pixels",
    "weight": "109g",
    "weight including battery": "125g",
    "white balance": "Auto, Daylight, Cloudy, Incandescent, Flash",
    "width": "9.68 cm"
}