{
    "<page title>": "Fujifilm FinePix S9200 - Digital Cameras - Photo - Visual | ILGS.net",
    "audio system": [
        "Stereo",
        "Stereo"
    ],
    "batteries included": "Yes",
    "battery life cipa standard": "300 shots",
    "battery technology": "Alkaline",
    "builtin flash": "Yes",
    "cables included": "USB",
    "camera file system": "DCF, DPOF",
    "camera shutter speed max": "8s",
    "camera shutter speed min": "0.000588s",
    "camera shutter type": "Electronic, Mechanical",
    "camera type": "Bridge",
    "colour of product": [
        "Black",
        "Black"
    ],
    "combined zoom": "100x",
    "compatible memory cards": "SD, SDHC, SDXC",
    "depth": "11.62 cm",
    "digital zoom": "2x",
    "display": "LCD",
    "display diagonal": "7.62 cm (3\")",
    "display resolution numeric": "201000 pixels",
    "ean": "4547410262803",
    "flash modes": "Auto, Forced on, Slow synchronization, Suppressed",
    "flash range tele": "2.5 - 3.6m",
    "flash range wide": "0.4 - 7m",
    "focal length range ff": "4.3 - 215 mm",
    "focus": "TTL",
    "focus adjustment": "Auto",
    "full hd": "Yes",
    "hdmi": [
        "Yes",
        "Yes"
    ],
    "hdmi connector type": "Mini",
    "height": "8.69 cm",
    "histogram": "Yes",
    "image sensor size": "25.4/58.4 mm (1/2.3\")",
    "image stabilizer": "Yes",
    "image stabilizer location": [
        "Lens",
        "Lens"
    ],
    "internal memory": "38 MB",
    "iso sensitivity": "100, 200, 400, 800, 1600, 3200, 6400, 12800, Auto",
    "iso sensitivity max": "12800",
    "iso sensitivity min": "100",
    "lens structure elementsgroups": "17/12",
    "light exposure control": "Program AE",
    "light exposure correction": "\u00b1 2EV (1/3EV step)",
    "light exposure modes": "Aperture priority AE, Auto, Manual, Shutter priority AE",
    "light metering": "Evaluative (Multi-pattern), Spot",
    "manufacturer": "Fujifilm",
    "maximum aperture": "6.5",
    "maximum focal length 35mm film equiv": "120 cm",
    "maximum image resolution": "4608 x 3456 pixels",
    "maximum video resolution": "1920 x 1080 pixels",
    "megapixel": "16.2 MP",
    "minimum aperture": "2.9",
    "minimum focal length 35mm film equiv": "2.4 cm",
    "operating temperature tt": "0 - 40 \u00b0C",
    "optical zoom": "50x",
    "pdf url": "No",
    "power source type": "Battery",
    "product promotion": "N/A",
    "selftimer": "2, 10s",
    "sensor type": "CMOS",
    "short description": "16.2MP, 1/2.3\" CMOS, 50x(2x digital), 7.62 cm (3 \") LCD",
    "sku": "P10NC12610A",
    "smile detection": "Yes",
    "specification": "Picture qualityImage sensor size25.4/58.4 mm (1/2.3\")Supported aspect ratios1:1, 3:2, 4:3, 16:9Still image resolution(s)L : (4:3) 4608 x 3456 / (3:2) 4608 x 3072 / (16:9) 4608 x 2592 / (1:1) 3456 x 3456\nM : (4:3) 3264 x 2448 / (3:2) 3264 x 2176 / (16:9) 3264 x 1840 / (1:1) 2432 x 2432\nS : (4:3) 2304 x 1728 / (3:2) 2304 x 1536 / (16:9) 1920 x 1080 / (1:1) 1728 x 1728Image stabilizerYesImage stabilizer locationLensMaximum image resolution4608 x 3456 pixelsSensor typeCMOSCamera typeBridgeMegapixel16.2 MPLens systemFocal length range (f-f)4.3 - 215 mmMinimum focal length (35mm film equiv)2.4 cmMaximum focal length (35mm film equiv)120 cmMinimum aperture2.9Maximum aperture6.5Lens structure (elements/groups)17/12Combined zoom100xDigital zoom2xOptical zoom50xFocusingFocusTTLFocus adjustmentAutoSmile detectionYesLight exposureISO sensitivity100, 200, 400, 800, 1600, 3200, 6400, 12800, AutoLight exposure modesAperture priority AE, Auto, Manual, Shutter priority AELight exposure controlProgram AELight exposure correction\u00b1 2EV (1/3EV step)Light meteringEvaluative (Multi-pattern), SpotISO sensitivity (min)100ISO sensitivity (max)12800ShutterCamera shutter speed (min)0.000588sCamera shutter speed (max)8sCamera shutter typeElectronic, MechanicalFlashFlash modesAuto, Forced on, Slow synchronization, SuppressedBuilt-in flashYesFlash range (wide)0.4 - 7mFlash range (tele)2.5 - 3.6mVideoVideo resolutions640 x 480, 1280 x 720, 1920 x 1080 pixelsFull HDYesMaximum video resolution1920 x 1080 pixelsAudioAudio systemStereoMemoryInternal memory38 MBCompatible memory cardsSD, SDHC, SDXCDisplayDisplayLCDDisplay diagonal7.62 cm (3\")Display resolution (numeric)201000 pixelsViewfinderViewfinder typeElectricalViewfinder screen size5.08 mm (0.2\")Ports & interfacesUSB version2.0HDMI connector typeMiniHDMIYesNetworkingWi-Fi standards802.11b, 802.11g, 802.11nWi-FiYesCameraImage stabilizer locationLensColour of productBlackWhite balanceCustom modes, Fine, Fluorescent, Fluorescent H, Fluorescent L, Incandescent, ShadeSelf-timer2, 10sHistogramYesCamera file systemDCF, DPOFBatteryBattery technologyAlkalineBattery life (CIPA standard)300 shotsPower source typeBatteryTechnical detailsWrist strap includedYesHDMIYesAudio systemStereoDesignColour of productBlackOperational conditionsOperating temperature (T-T)0 - 40 \u00b0CWeight & dimensionsWidth12.26 cmDepth11.62 cmHeight8.69 cmWeight577gWeight (including battery)670gPackaging contentWrist strap includedYesCables includedUSBBatteries includedYes",
    "still image resolutions": "L : (4:3) 4608 x 3456 / (3:2) 4608 x 3072 / (16:9) 4608 x 2592 / (1:1) 3456 x 3456\nM : (4:3) 3264 x 2448 / (3:2) 3264 x 2176 / (16:9) 3264 x 1840 / (1:1) 2432 x 2432\nS : (4:3) 2304 x 1728 / (3:2) 2304 x 1536 / (16:9) 1920 x 1080 / (1:1) 1728 x 1728",
    "supported aspect ratios": "1:1, 3:2, 4:3, 16:9",
    "usb version": "2.0",
    "video resolutions": "640 x 480, 1280 x 720, 1920 x 1080 pixels",
    "viewfinder type": "Electrical",
    "weight": "577g",
    "weight including battery": "670g",
    "white balance": "Custom modes, Fine, Fluorescent, Fluorescent H, Fluorescent L, Incandescent, Shade",
    "width": "12.26 cm",
    "wifi": "Yes",
    "wifi standards": "802.11b, 802.11g, 802.11n",
    "wrist strap included": [
        "Yes",
        "Yes"
    ]
}