{
    "<page title>": "Canon PowerShot SX600 HS - Digital Cameras - Photo - Visual | ILGS.net",
    "analog signal format system": "NTSC, PAL",
    "audio formats supported": "AAC",
    "auto exposure ae lock": "Yes",
    "auto focus af assist beam": "Yes",
    "auto focus af lock": "Yes",
    "auto focusing af modes": "Continuous Auto Focus, Face detection, Servo Auto Focus, Single Auto Focus, Tracking Auto Focus",
    "batteries included": "Yes",
    "battery charger included": "Yes",
    "battery life cipa standard": "290 shots",
    "battery technology": "Lithium-Ion (Li-Ion)",
    "battery type": [
        "NB-6LH",
        "Lithium (NB-6LH)"
    ],
    "box contents": "PowerShot SX600 HS Battery Pack NB-6LH Wrist Strap WS-800 User Manual Kit Battery Charger CB-2LYE AC Cable",
    "builtin flash": [
        "Yes",
        "Auto Manual Flash On / Off Slow Synchro"
    ],
    "builtin microphone": "Yes",
    "builtin processor": [
        "DIGIC 4+ iSAPS",
        "DIGIC 4+ iSAPS",
        "DIGIC 4+ iSAPS"
    ],
    "bundled software": [
        "ImageBrowser EX",
        "ImageBrowser EX"
    ],
    "camera file system": "DPOF 1.1, Exif 2.3",
    "camera shutter speed max": "15s",
    "camera shutter speed min": "0.0005s",
    "camera type": "Compact",
    "closest focusing distance": "0.05m",
    "colour of product": [
        "White",
        "White",
        "White"
    ],
    "combined zoom": "72x",
    "compatible memory cards": [
        "SD, SDHC, SDXC",
        "SD SDHC SDXC"
    ],
    "depth": "2.6 cm",
    "digital zoom": "4x",
    "dimensions w x d x h": "103.8 x 26.0 x 61.0 mm mm",
    "direct printing": [
        "Yes",
        "Yes",
        "Yes"
    ],
    "display": "TFT",
    "display diagonal": "7.62 cm (3\")",
    "display resolution numeric": "461000 pixels",
    "ean": "8714574616124",
    "external flash connector": "Yes",
    "field of view": "100%",
    "flash exposure compensation": "Yes",
    "flash exposure lock": "Yes",
    "flash modes": "Auto, Flash off, Flash on, Manual, Red-eye reduction, Slow synchronization",
    "flash range tele": "1 - 2m",
    "flash range wide": "0.5 - 3.5m",
    "flash syncspeed": "1/2000s",
    "focal length range ff": "4.5 - 81 mm",
    "focus": "TTL",
    "full hd": "Yes",
    "hand strap": "Yes",
    "hdmi": [
        "Yes",
        "Yes"
    ],
    "hdmi connector type": "Micro",
    "height": "6.1 cm",
    "image formats supported": "JPG",
    "image sensor size": "25.4/58.4 mm (1/2.3\")",
    "image stabilizer": "Yes",
    "image stabilizer location": [
        "Lens",
        "Lens"
    ],
    "interface": "Hi-Speed USB (MTP PTP) dedicated connector (Mini-B compatible) HDMI Micro Connector (HDMI-CEC compatible) A/V output (PAL/NTSC) Wi-Fi (IEEE802.11b/g/n) (2.4 GHz only) with NFC support",
    "iso sensitivity": [
        "100, 200, 400, 800, 1600, 3200, Auto",
        "AUTO 100 200 400 800 1600 3200"
    ],
    "iso sensitivity max": "3200",
    "iso sensitivity min": "100",
    "lcd screen size": "3.0",
    "lens structure elementsgroups": "11/8",
    "light exposure correction": "\u00b1 2EV (1/3EV step)",
    "light metering": "Centre-weighted, Evaluative (Multi-pattern), Spot",
    "mac operating systems supported": [
        "Mac OS X 10.7 Lion, Mac OS X 10.8 Mountain Lion, Mac OS X 10.9 Mavericks",
        "Mac OS X 10.7 Lion, Mac OS X 10.8 Mountain Lion, Mac OS X 10.9 Mavericks"
    ],
    "manufacturer": "Canon",
    "maximum aperture": "3.8",
    "maximum focal length 35mm film equiv": "40 cm",
    "maximum image resolution": "4608 x 3456 pixels",
    "maximum video resolution": "1920 x 1080 pixels",
    "megapixel": [
        "16 MP",
        "16"
    ],
    "memory slots": "1",
    "minimum aperture": "6.9",
    "minimum focal length 35mm film equiv": "2.5 cm",
    "motion jpeg frame rate": "30 fps",
    "near field communication nfc": "Yes",
    "number of batteries supported": "1",
    "on screen display osd languages": "ARA, CHI (SIMPL), CHI (TR), CZE, DAN, DEU, DUT, ENG, ESP, FIN, FRE, GRE, HEB, HUN, ITA, JPN, KOR, NOR, POL, POR, RUM, RUS, SWE, THA, TUR, UKR",
    "operating relative humidity hh": "10 - 90%",
    "operating temperature tt": "0 - 40 \u00b0C",
    "optical zoom": [
        "18x",
        "18 x"
    ],
    "orientation sensor": "Yes",
    "pdf url": "No",
    "photo effects": "Black&White, Neutral, Positive film, Vivid",
    "pictbridge": "Yes",
    "playback zoom max": "10x",
    "power source type": "Battery",
    "product promotion": "N/A",
    "scene modes": "Fireworks, Portrait, Snow",
    "selftimer": "2, 10s",
    "sensor type": "CMOS",
    "short description": "PowerShot SX600 HS - CMOS 1/2.3\", 16MP, 4608 x 3456, DIGIC 4+ iSAPS, 4.5 - 81.0 mm, f/3.8 - f/6.9, 7.5 cm (3.0\") PureColor II G (TFT), (Full HD) 1920 x 1080, USB2.0, HDMI-micro, Wi-Fi (IEEE802.11b/g/n), SD, SDHC, SDXC, 188g",
    "sku": "9341B012AA",
    "specification": "Picture qualityImage sensor size25.4/58.4 mm (1/2.3\")Still image resolution(s)4608 x 3456, 3264 x 2448, 2048 x 1536, 640 x 480, 4608 x 2592, 3264 x 1832, 1920 x 1080, 640 x 360, 4608 x 3072, 3264 x 2176, 2048 x 1368, 640 x 424, 3456 x 3456, 2448 x 2448, 1536 x 1536, 480 x 480Image stabilizerYesImage stabilizer locationLensImage formats supportedJPGMaximum image resolution4608 x 3456 pixelsSensor typeCMOSCamera typeCompactMegapixel16 MPLens systemFocal length range (f-f)4.5 - 81 mmMinimum focal length (35mm film equiv)2.5 cmMaximum focal length (35mm film equiv)40 cmMinimum aperture6.9Maximum aperture3.8Lens structure (elements/groups)11/8Combined zoom72xDigital zoom4xOptical zoom18xFocusingFocusTTLAuto focusing (AF) modesContinuous Auto Focus, Face detection, Servo Auto Focus, Single Auto Focus, Tracking Auto FocusClosest focusing distance0.05mAuto Focus (AF) lockYesAuto Focus (AF) assist beamYesLight exposureISO sensitivity100, 200, 400, 800, 1600, 3200, AutoLight exposure correction\u00b1 2EV (1/3EV step)Light meteringCentre-weighted, Evaluative (Multi-pattern), SpotAuto Exposure (AE) lockYesISO sensitivity (min)100ISO sensitivity (max)3200ShutterCamera shutter speed (min)0.0005sCamera shutter speed (max)15sFlashFlash modesAuto, Flash off, Flash on, Manual, Red-eye reduction, Slow synchronizationBuilt-in flashYesFlash sync-speed1/2000sFlash range (wide)0.5 - 3.5mFlash range (tele)1 - 2mFlash exposure lockYesFlash exposure compensationYesExternal flash connectorYesVideoVideo resolutions640 x 480, 1280 x 720, 1920 x 1080 pixelsVideo formats supportedH.264, MP4, MPEG4Motion JPEG frame rate30 fpsFull HDYesAnalog signal format systemNTSC, PALMaximum video resolution1920 x 1080 pixelsAudioBuilt-in microphoneYesAudio formats supportedAACMemoryCompatible memory cardsSD, SDHC, SDXCMemory slots1DisplayDisplayTFTDisplay diagonal7.62 cm (3\")Display resolution (numeric)461000 pixelsField of view100%Ports & interfacesUSB version2.0HDMI connector typeMicroPictBridgeYesUSB connector typeMini-USB BHDMIYesNetworkingWi-Fi standards802.11b, 802.11g, 802.11nNear Field Communication (NFC)YesWi-FiYesCameraImage stabilizer locationLensColour of productWhiteWhite balanceAuto, Cloudy, Custom modes, Daylight, Fluorescent, Fluorescent H, TungstenScene modesFireworks, Portrait, SnowPhoto effectsBlack&White, Neutral, Positive film, VividSelf-timer2, 10sPlayback zoom (max)10xOrientation sensorYesOn Screen Display (OSD) languagesARA, CHI (SIMPL), CHI (TR), CZE, DAN, DEU, DUT, ENG, ESP, FIN, FRE, GRE, HEB, HUN, ITA, JPN, KOR, NOR, POL, POR, RUM, RUS, SWE, THA, TUR, UKRDirect printingYesCamera file systemDPOF 1.1, Exif 2.3Built-in processorDIGIC 4+ iSAPSBatteryBattery technologyLithium-Ion (Li-Ion)Battery life (CIPA standard)290 shotsBattery typeNB-6LHNumber of batteries supported1Power source typeBatteryOperating system/softwareWindows operating systems supportedWindows 7 Home Basic, Windows 7 Home Basic x64, Windows 7 Home Premium, Windows 7 Home Premium x64, Windows 7 Professional, Windows 7 Professional x64, Windows 7 Starter, Windows 7 Starter x64, Windows 7 Ultimate, Windows 7 Ultimate x64, Windows 8, Windows 8 Enterprise, Windows 8 Enterprise x64, Windows 8 Pro, Windows 8 Pro x64, Windows 8 x64, Windows Vista Business, Windows Vista Business x64, Windows Vista Enterprise, Windows Vista Enterprise x64, Windows Vista Home Basic, Windows Vista Home Basic x64, Windows Vista Home Premium, Windows Vista Home Premium x64, Windows Vista Ultimate, Windows Vista Ultimate x64, Windows XP Home, Windows XP Home x64, Windows XP Professional, Windows XP Professional x64Mac operating systems supportedMac OS X 10.7 Lion, Mac OS X 10.8 Mountain Lion, Mac OS X 10.9 MavericksBundled softwareImageBrowser EXTechnical detailsHDMIYesDirect printingYesProcessorBuilt-in processorDIGIC 4+ iSAPSDesignColour of productWhitePerformanceDirect printingYesBuilt-in processorDIGIC 4+ iSAPSOperational conditionsOperating temperature (T-T)0 - 40 \u00b0COperating relative humidity (H-H)10 - 90%System requirementsWindows operating systems supportedWindows 7 Home Basic, Windows 7 Home Basic x64, Windows 7 Home Premium, Windows 7 Home Premium x64, Windows 7 Professional, Windows 7 Professional x64, Windows 7 Starter, Windows 7 Starter x64, Windows 7 Ultimate, Windows 7 Ultimate x64, Windows 8, Windows 8 Enterprise, Windows 8 Enterprise x64, Windows 8 Pro, Windows 8 Pro x64, Windows 8 x64, Windows Vista Business, Windows Vista Business x64, Windows Vista Enterprise, Windows Vista Enterprise x64, Windows Vista Home Basic, Windows Vista Home Basic x64, Windows Vista Home Premium, Windows Vista Home Premium x64, Windows Vista Ultimate, Windows Vista Ultimate x64, Windows XP Home, Windows XP Home x64, Windows XP Professional, Windows XP Professional x64Mac operating systems supportedMac OS X 10.7 Lion, Mac OS X 10.8 Mountain Lion, Mac OS X 10.9 MavericksWeight & dimensionsWidth10.38 cmDepth2.6 cmHeight6.1 cmWeight188gPackaging contentBundled softwareImageBrowser EXHand strapYesBattery charger includedYesBatteries includedYes",
    "still image resolutions": "4608 x 3456, 3264 x 2448, 2048 x 1536, 640 x 480, 4608 x 2592, 3264 x 1832, 1920 x 1080, 640 x 360, 4608 x 3072, 3264 x 2176, 2048 x 1368, 640 x 424, 3456 x 3456, 2448 x 2448, 1536 x 1536, 480 x 480",
    "usb connector type": "Mini-USB B",
    "usb version": "2.0",
    "video formats supported": "H.264, MP4, MPEG4",
    "video resolutions": "640 x 480, 1280 x 720, 1920 x 1080 pixels",
    "warranty": "1 Year",
    "weight": [
        "188g",
        "188 g"
    ],
    "white balance": "Auto, Cloudy, Custom modes, Daylight, Fluorescent, Fluorescent H, Tungsten",
    "width": "10.38 cm",
    "wifi": [
        "Yes",
        "Yes"
    ],
    "wifi standards": "802.11b, 802.11g, 802.11n",
    "windows operating systems supported": [
        "Windows 7 Home Basic, Windows 7 Home Basic x64, Windows 7 Home Premium, Windows 7 Home Premium x64, Windows 7 Professional, Windows 7 Professional x64, Windows 7 Starter, Windows 7 Starter x64, Windows 7 Ultimate, Windows 7 Ultimate x64, Windows 8, Windows 8 Enterprise, Windows 8 Enterprise x64, Windows 8 Pro, Windows 8 Pro x64, Windows 8 x64, Windows Vista Business, Windows Vista Business x64, Windows Vista Enterprise, Windows Vista Enterprise x64, Windows Vista Home Basic, Windows Vista Home Basic x64, Windows Vista Home Premium, Windows Vista Home Premium x64, Windows Vista Ultimate, Windows Vista Ultimate x64, Windows XP Home, Windows XP Home x64, Windows XP Professional, Windows XP Professional x64",
        "Windows 7 Home Basic, Windows 7 Home Basic x64, Windows 7 Home Premium, Windows 7 Home Premium x64, Windows 7 Professional, Windows 7 Professional x64, Windows 7 Starter, Windows 7 Starter x64, Windows 7 Ultimate, Windows 7 Ultimate x64, Windows 8, Windows 8 Enterprise, Windows 8 Enterprise x64, Windows 8 Pro, Windows 8 Pro x64, Windows 8 x64, Windows Vista Business, Windows Vista Business x64, Windows Vista Enterprise, Windows Vista Enterprise x64, Windows Vista Home Basic, Windows Vista Home Basic x64, Windows Vista Home Premium, Windows Vista Home Premium x64, Windows Vista Ultimate, Windows Vista Ultimate x64, Windows XP Home, Windows XP Home x64, Windows XP Professional, Windows XP Professional x64"
    ]
}