{
    "<page title>": "Sony WX350 Compact Camera with 20x Optical Zoom - Digital Cameras - Photo - Visual | ILGS.net",
    "ac adapter included": "Yes",
    "auto focusing af modes": "Contrast Detection Auto Focus, Single Auto Focus",
    "auto mode focusing range tele": "2 - ?",
    "auto mode focusing range wide": "0.05 - ?",
    "batteries included": "Yes",
    "battery life cipa standard": "470 shots",
    "battery life max": "3.92h",
    "battery type": [
        "NP-BX1",
        "Lithium N"
    ],
    "box contents": "Rechargeable Battery Pack(NP-BN1) Battery Charger Multi Connector Cable Power Cord Wrist Strap CD-ROM",
    "brightness adjustment": "Yes",
    "builtin flash": [
        "Yes",
        "Yes"
    ],
    "builtin microphone": "Yes",
    "cables included": "USB",
    "camera shutter speed": "iAuto(2 - 1/1.600) / Program Auto(1 - 1/1.600)",
    "camera shutter speed max": "4s",
    "camera shutter speed min": "0.00017s",
    "camera type": "Compact",
    "colour of product": [
        "White",
        "White",
        "White"
    ],
    "compatible memory cards": [
        "MicroSD (TransFlash), MicroSDHC, MicroSDXC, MS Duo, MS PRO Duo, MS Pro-HG, MS Pro-HG Duo, MS XC-HG Duo, SD, SDHC, SDXC",
        "SD/SDHC/SDXC"
    ],
    "contrast adjustment": "Yes",
    "depth": "2.57 cm",
    "digital zoom": [
        "8 x",
        "80x"
    ],
    "dimensions w x d x h": "90.7 x 16.7 x 51.5 mm",
    "display": "TFT",
    "display diagonal": "7.62 cm (3\")",
    "display resolution numeric": "460800 pixels",
    "durable": "No",
    "ean": "4905524981087",
    "flash modes": "Auto, Flash off, Flash on, Slow synchronization",
    "flash range tele": "2 - 2.4m",
    "flash range wide": "0.2 - 4.3m",
    "focal length range ff": "4.3 - 86 mm",
    "focus adjustment": "Auto",
    "full hd": "Yes",
    "hdmi": [
        "Yes",
        "Yes"
    ],
    "hdmi connector type": "Micro",
    "height": "5.49 cm",
    "image sensor size": "25.4/58.4 mm (1/2.3\")",
    "image stabilizer": "Yes",
    "iso sensitivity": "80, 100, 200, 400, 800, 1600, 3200, 6400, 12800",
    "iso sensitivity max": "12800",
    "iso sensitivity min": "80",
    "lcd screen size": "2.7",
    "lens structure elementsgroups": "11/10",
    "light exposure correction": "\u00b1 2EV (1/3EV step)",
    "macro focusing range tele": "2 - ?",
    "macro focusing range wide": "0.05 - ?",
    "manufacturer": "Sony",
    "maximum aperture": "3.5",
    "maximum image resolution": "4896 x 3264 pixels",
    "maximum video resolution": "1920 x 1080 pixels",
    "megapixel": [
        "14.1",
        "18.2 MP"
    ],
    "minimum aperture": "6.5",
    "near field communication nfc": "Yes",
    "number of batteries supported": "1",
    "optical zoom": [
        "4 x",
        "20x"
    ],
    "pdf url": "No",
    "power source type": "Battery",
    "product promotion": "N/A",
    "quick start guide": [
        "Yes",
        "Yes"
    ],
    "scene modes": "Backlight, Beach, Fireworks, Landscape, Night portrait, Pet, Portrait, Snow",
    "selftimer": "2, 10s",
    "sensor type": [
        "1/2.3 type",
        "CMOS"
    ],
    "shooting modes": "Auto, Manual, Movie",
    "short description": "DSC-WX350 - 18.2 MP, 1/2.3 type (7.82mm) Exmor R CMOS, 20x(Optical Zoom), 7.62 cm (3.0 \") TFT, Memory Stick XC-HG Duo/SDXC, BIONZ X, Micro USB, Micro HDMI, WI-FI, NFC",
    "sku": "DSCWX350W.CEH",
    "specification": "Picture qualityImage sensor size25.4/58.4 mm (1/2.3\")Supported aspect ratios1:1, 3:2, 4:3, 16:9Still image resolution(s)4896 x 3264, 3648 x 2432, 2592 x 1728, 4896 x 3672, 3648 x 2736, 2592 x 1944, 4896 x 2752, 3648 x 2056, 1920 x 1080, 3664 x 3664, 2736 x 2736, 1920 x 1920, 7152 x 1080, 4912 x 1920, 4912 x 1080, 3424 x 1920, 11520 x 1080Image stabilizerYesMaximum image resolution4896 x 3264 pixelsSensor typeCMOSCamera typeCompactMegapixel18.2 MPLens systemFocal length range (f-f)4.3 - 86 mmMinimum aperture6.5Maximum aperture3.5Lens structure (elements/groups)11/10Digital zoom80xOptical zoom20xFocusingFocus adjustmentAutoAuto focusing (AF) modesContrast Detection Auto Focus, Single Auto FocusMacro focusing range (wide)0.05 - ?Macro focusing range (tele)2 - ?Auto Mode focusing range (wide)0.05 - ?Auto Mode focusing range (tele)2 - ?Light exposureISO sensitivity80, 100, 200, 400, 800, 1600, 3200, 6400, 12800Light exposure correction\u00b1 2EV (1/3EV step)ISO sensitivity (min)80ISO sensitivity (max)12800ShutterCamera shutter speed (min)0.00017sCamera shutter speed (max)4sFlashFlash modesAuto, Flash off, Flash on, Slow synchronizationBuilt-in flashYesFlash range (wide)0.2 - 4.3mFlash range (tele)2 - 2.4mVideoVideo resolutions640 x 480, 1440 x 1080, 1920 x 1080 pixelsFull HDYesMaximum video resolution1920 x 1080 pixelsAudioBuilt-in microphoneYesVoice recordingYesMemoryCompatible memory cardsMicroSD (TransFlash), MicroSDHC, MicroSDXC, MS Duo, MS PRO Duo, MS Pro-HG, MS Pro-HG Duo, MS XC-HG Duo, SD, SDHC, SDXCDisplayDisplayTFTDisplay diagonal7.62 cm (3\")Display resolution (numeric)460800 pixelsPorts & interfacesUSB version2.0HDMI connector typeMicroUSB connector typeMicro-USB BHDMIYesNetworkingWi-Fi standards802.11b, 802.11g, 802.11nNear Field Communication (NFC)YesWi-FiYesCameraColour of productWhiteWhite balanceAuto, Cloudy, Custom modes, Daylight, Flash, Fluorescent, IncandescentScene modesBacklight, Beach, Fireworks, Landscape, Night portrait, Pet, Portrait, SnowShooting modesAuto, Manual, MovieSelf-timer2, 10sContrast adjustmentYesTripod mountableYesBrightness adjustmentYesBatteryBattery life (CIPA standard)470 shotsBattery life (max)3.92hBattery typeNP-BX1Number of batteries supported1Power source typeBatteryTechnical detailsWrist strap includedYesQuick start guideYesHDMIYesDesignColour of productWhiteWeight & dimensionsWidth9.6 cmDepth2.57 cmHeight5.49 cmWeight137gWeight (including battery)164gPackaging contentWrist strap includedYesQuick start guideYesCables includedUSBBatteries includedYesAC adapter includedYes",
    "still image resolutions": "4896 x 3264, 3648 x 2432, 2592 x 1728, 4896 x 3672, 3648 x 2736, 2592 x 1944, 4896 x 2752, 3648 x 2056, 1920 x 1080, 3664 x 3664, 2736 x 2736, 1920 x 1920, 7152 x 1080, 4912 x 1920, 4912 x 1080, 3424 x 1920, 11520 x 1080",
    "supported aspect ratios": "1:1, 3:2, 4:3, 16:9",
    "tripod mountable": "Yes",
    "usb connector type": "Micro-USB B",
    "usb version": "2.0",
    "video resolutions": "640 x 480, 1440 x 1080, 1920 x 1080 pixels",
    "voice recording": "Yes",
    "weight": [
        "137g",
        "100 g"
    ],
    "weight including battery": "164g",
    "white balance": "Auto, Cloudy, Custom modes, Daylight, Flash, Fluorescent, Incandescent",
    "width": "9.6 cm",
    "wifi": "Yes",
    "wifi standards": "802.11b, 802.11g, 802.11n",
    "wrist strap included": [
        "Yes",
        "Yes"
    ]
}