{
    "<page title>": "Canon EOS 100D - Digital Cameras - Photo - Visual | ILGS.net",
    "analog signal format system": "NTSC, PAL",
    "auto exposure ae lock": "Yes",
    "auto focus af assist beam": "Yes",
    "auto focus af lock": "Yes",
    "auto focus af points": "9",
    "auto focusing af modes": "Face detection, Face tracking",
    "batteries included": "Yes",
    "battery level indicator": [
        "Yes",
        "Yes"
    ],
    "battery life cipa standard": "380 shots",
    "battery technology": "Lithium-Ion (Li-Ion)",
    "battery type": [
        "LP-E12",
        "Rechargeable Li-ion Battery"
    ],
    "builtin flash": "Yes",
    "builtin processor": [
        "DIGIC 5",
        "DIGIC 5",
        "DIGIC 5"
    ],
    "bundled software": [
        "ImageBrowser EX, PhotoStitch, EOS Utility, Picture Style Editor",
        "ImageBrowser EX, PhotoStitch, EOS Utility, Picture Style Editor"
    ],
    "camera file system": "DPOF 1.1, Exif 2.3",
    "camera playback": "Highlights, Movie, Single image, Slide show",
    "camera shutter speed max": "30s",
    "camera shutter speed min": "0.00025s",
    "camera shutter type": "Electronic",
    "camera type": "SLR Body",
    "colour of product": [
        "Black",
        "Black",
        "Black"
    ],
    "compatible memory cards": [
        "SD, SDHC, SDXC",
        "SDHC"
    ],
    "custom colour": "Yes",
    "depth": "6.94 cm",
    "dimensions w x d x h": "116.8 x 69.4 x 90.7 mm",
    "dioptre correction": "Yes",
    "display": "LCD",
    "display diagonal": "7.62 cm (3\")",
    "display resolution numeric": "1040000 pixels",
    "ean": "8714574602653",
    "external flash connector": "Yes",
    "field of view": "100%",
    "flash exposure compensation": "Yes",
    "flash exposure correction": "\u00b12EV (1/2, 1/3 EV step)",
    "flash exposure lock": "Yes",
    "flash guide number": "9.4m",
    "flash modes": "Auto, Manual, Red-eye reduction",
    "flash recharging time": "3s",
    "flash syncspeed": "1/200s",
    "focus": "TTL",
    "focus adjustment": "Auto/Manual",
    "full hd": "Yes",
    "hdmi": [
        "Yes",
        "Yes"
    ],
    "hdmi connector type": "Mini",
    "hdmi ports quantity": [
        "1",
        "1",
        "1"
    ],
    "height": "9.07 cm",
    "histogram": "Yes",
    "image formats supported": "JPG",
    "iso sensitivity": [
        "100, 200, 400, 800, 1600, 3200, 6400, Auto",
        "AUTO(100-6400) 100-12800 in 1-stop increments"
    ],
    "iso sensitivity max": "6400",
    "iso sensitivity min": "100",
    "lcd screen size": "3",
    "lens mount interface": "Canon EF, Canon EF-S",
    "light exposure correction": "\u00b1 5EV (1/3EV step)",
    "light exposure modes": "Aperture priority AE, Auto, Shutter priority AE",
    "light metering": "Centre-weighted, Evaluative (Multi-pattern), Spot",
    "live view": "Yes",
    "mac operating systems supported": [
        "Mac OS X 10.6 Snow Leopard, Mac OS X 10.7 Lion, Mac OS X 10.8 Mountain Lion",
        "Mac OS X 10.6 Snow Leopard, Mac OS X 10.7 Lion, Mac OS X 10.8 Mountain Lion"
    ],
    "magnification": "0.87x",
    "manufacturer": "Canon",
    "material": [
        "Aluminium, Glass, Polycarbonate, Rubber",
        "Aluminium, Glass, Polycarbonate, Rubber"
    ],
    "maximum image resolution": "5184 x 3456 pixels",
    "maximum video resolution": "1920 x 1080 pixels",
    "megapixel": [
        "18 MP",
        "18"
    ],
    "memory slots": "1",
    "microphone in": "Yes",
    "number of batteries supported": "1",
    "on screen display osd languages": "ARA, CHI (SIMPL), CHI (TR), CZE, DAN, DEU, DUT, ENG, ESP, FIN, FRE, GRE, HUN, ITA, JPN, KOR, NOR, POL, POR, RUM, RUS, SWE, THA, TUR, UKR",
    "operating relative humidity hh": "5 - 85%",
    "operating temperature tt": "0 - 45 \u00b0C",
    "orientation sensor": "Yes",
    "pdf url": "No",
    "photo effects": "Black&White, Neutral",
    "pictbridge": "Yes",
    "playback zoom max": "10x",
    "power source type": "Battery, USB",
    "product promotion": "N/A",
    "scene modes": "Candlelight, Children, Close-up (macro), Landscape, Night portrait, Portrait, Sports",
    "sensor type": [
        "22.3 x 14.9mm CMOS",
        "CMOS"
    ],
    "shooting modes": "Aperture priority, Auto, Manual, Program, Shutter priority",
    "short description": "EOS 100D - Body, 18MP, 22.3 x 14.9mm CMOS, DIGIC 5, EF/EF-S, ISO Auto (100-6400), 7.7cm (3.0\") 3:2 Clear View II TFT 1040K, 5184x3456, SD, SDHC, SDXC, 407g",
    "sku": "8576B014AA",
    "specification": "Picture qualitySupported aspect ratios3:2, 4:3, 16:9Still image resolution(s)480 x 480, 720 x 400, 720 x 480, 1280 x 1280, 1696 x 1280, 1728 x 1728, 1920 x 1080, 1920 x 1280, 2304 x 1728, 2304 x 2304, 2592 x 1456, 2592 x 1728, 3072 x 2304, 3456 x 1944, 3456 x 2304, 3456 x 3456, 4608 x 3456, 5184 x 2912, 5184 x 3456Total megapixels18.5 MPImage formats supportedJPGMaximum image resolution5184 x 3456 pixelsSensor typeCMOSCamera typeSLR BodyMegapixel18 MPLens systemLens mount interfaceCanon EF, Canon EF-SFocusingFocusTTLFocus adjustmentAuto/ManualAuto focusing (AF) modesFace detection, Face trackingAuto Focus (AF) points9Auto Focus (AF) lockYesAuto Focus (AF) assist beamYesLight exposureISO sensitivity100, 200, 400, 800, 1600, 3200, 6400, AutoLight exposure modesAperture priority AE, Auto, Shutter priority AELight exposure correction\u00b1 5EV (1/3EV step)Light meteringCentre-weighted, Evaluative (Multi-pattern), SpotAuto Exposure (AE) lockYesISO sensitivity (min)100ISO sensitivity (max)6400ShutterCamera shutter speed (min)0.00025sCamera shutter speed (max)30sCamera shutter typeElectronicFlashFlash modesAuto, Manual, Red-eye reductionBuilt-in flashYesFlash sync-speed1/200sFlash recharging time3sFlash guide number9.4mFlash exposure lockYesFlash exposure correction\u00b12EV (1/2, 1/3 EV step)Flash exposure compensationYesExternal flash connectorYesVideoVideo resolutions640 x 480, 1280 x 720, 1920 x 1080 pixelsVideo formats supportedH.264, MOVFull HDYesAnalog signal format systemNTSC, PALMaximum video resolution1920 x 1080 pixelsMemoryCompatible memory cardsSD, SDHC, SDXCMemory slots1DisplayDisplayLCDDisplay diagonal7.62 cm (3\")Display resolution (numeric)1040000 pixelsField of view100%ViewfinderViewfinder typeElectricalMagnification0.87xPorts & interfacesUSB version2.0HDMI connector typeMiniMicrophone inYesPictBridgeYesUSB 2.0 ports quantity1HDMI ports quantity1HDMIYesCameraColour of productBlackWhite balanceAuto, Cloudy, Custom modes, Daylight, Flash, Fluorescent, Shade, TungstenScene modesCandlelight, Children, Close-up (macro), Landscape, Night portrait, Portrait, SportsShooting modesAperture priority, Auto, Manual, Program, Shutter priorityPhoto effectsBlack&White, NeutralCamera playbackHighlights, Movie, Single image, Slide showPlayback zoom (max)10xOrientation sensorYesOn Screen Display (OSD) languagesARA, CHI (SIMPL), CHI (TR), CZE, DAN, DEU, DUT, ENG, ESP, FIN, FRE, GRE, HUN, ITA, JPN, KOR, NOR, POL, POR, RUM, RUS, SWE, THA, TUR, UKRLive viewYesHistogramYesDioptre correctionYesCustom colourYesCamera file systemDPOF 1.1, Exif 2.3Built-in processorDIGIC 5BatteryBattery technologyLithium-Ion (Li-Ion)Battery life (CIPA standard)380 shotsBattery typeLP-E12Number of batteries supported1Battery level indicatorYesPower source typeBattery, USBOperating system/softwareWindows operating systems supportedWindows 7 Home Basic, Windows 7 Home Basic x64, Windows 7 Home Premium, Windows 7 Home Premium x64, Windows 7 Professional, Windows 7 Professional x64, Windows 7 Starter, Windows 7 Starter x64, Windows 7 Ultimate, Windows 7 Ultimate x64, Windows 8, Windows 8 Enterprise, Windows 8 Enterprise x64, Windows 8 Pro, Windows 8 Pro x64, Windows 8 x64, Windows XP Home, Windows XP Home x64, Windows XP Professional, Windows XP Professional x64Mac operating systems supportedMac OS X 10.6 Snow Leopard, Mac OS X 10.7 Lion, Mac OS X 10.8 Mountain LionBundled softwareImageBrowser EX, PhotoStitch, EOS Utility, Picture Style EditorTechnical detailsUSB 2.0 ports quantity1HDMI ports quantity1MaterialAluminium, Glass, Polycarbonate, RubberHDMIYesBattery level indicatorYesProcessorBuilt-in processorDIGIC 5DesignMaterialAluminium, Glass, Polycarbonate, RubberColour of productBlackPerformanceBuilt-in processorDIGIC 5Operational conditionsOperating temperature (T-T)0 - 45 \u00b0COperating relative humidity (H-H)5 - 85%System requirementsWindows operating systems supportedWindows 7 Home Basic, Windows 7 Home Basic x64, Windows 7 Home Premium, Windows 7 Home Premium x64, Windows 7 Professional, Windows 7 Professional x64, Windows 7 Starter, Windows 7 Starter x64, Windows 7 Ultimate, Windows 7 Ultimate x64, Windows 8, Windows 8 Enterprise, Windows 8 Enterprise x64, Windows 8 Pro, Windows 8 Pro x64, Windows 8 x64, Windows XP Home, Windows XP Home x64, Windows XP Professional, Windows XP Professional x64Mac operating systems supportedMac OS X 10.6 Snow Leopard, Mac OS X 10.7 Lion, Mac OS X 10.8 Mountain LionWeight & dimensionsWidth11.68 cmDepth6.94 cmHeight9.07 cmWeight (including battery)407gPackaging contentBundled softwareImageBrowser EX, PhotoStitch, EOS Utility, Picture Style EditorBatteries includedYesOther featuresUSB 2.0 ports quantity1HDMI ports quantity1",
    "still image resolutions": "480 x 480, 720 x 400, 720 x 480, 1280 x 1280, 1696 x 1280, 1728 x 1728, 1920 x 1080, 1920 x 1280, 2304 x 1728, 2304 x 2304, 2592 x 1456, 2592 x 1728, 3072 x 2304, 3456 x 1944, 3456 x 2304, 3456 x 3456, 4608 x 3456, 5184 x 2912, 5184 x 3456",
    "supported aspect ratios": "3:2, 4:3, 16:9",
    "total megapixels": "18.5 MP",
    "type": "Body Only",
    "usb 20 ports quantity": [
        "1",
        "1",
        "1"
    ],
    "usb version": "2.0",
    "video formats supported": "H.264, MOV",
    "video resolutions": "640 x 480, 1280 x 720, 1920 x 1080 pixels",
    "viewfinder type": "Electrical",
    "warranty": "1 Year",
    "weight": "407 g",
    "weight including battery": "407g",
    "white balance": [
        "Auto, Cloudy, Custom modes, Daylight, Flash, Fluorescent, Shade, Tungsten",
        "Auto white balance with the imaging sensor"
    ],
    "width": "11.68 cm",
    "windows operating systems supported": [
        "Windows 7 Home Basic, Windows 7 Home Basic x64, Windows 7 Home Premium, Windows 7 Home Premium x64, Windows 7 Professional, Windows 7 Professional x64, Windows 7 Starter, Windows 7 Starter x64, Windows 7 Ultimate, Windows 7 Ultimate x64, Windows 8, Windows 8 Enterprise, Windows 8 Enterprise x64, Windows 8 Pro, Windows 8 Pro x64, Windows 8 x64, Windows XP Home, Windows XP Home x64, Windows XP Professional, Windows XP Professional x64",
        "Windows 7 Home Basic, Windows 7 Home Basic x64, Windows 7 Home Premium, Windows 7 Home Premium x64, Windows 7 Professional, Windows 7 Professional x64, Windows 7 Starter, Windows 7 Starter x64, Windows 7 Ultimate, Windows 7 Ultimate x64, Windows 8, Windows 8 Enterprise, Windows 8 Enterprise x64, Windows 8 Pro, Windows 8 Pro x64, Windows 8 x64, Windows XP Home, Windows XP Home x64, Windows XP Professional, Windows XP Professional x64"
    ]
}