{
    "<page title>": "Samsung GALAXY GC100 - Digital Cameras - Photo - Visual | ILGS.net",
    "audio formats supported": "3GA, AAC, AIFF, FLAC, M4A, MP3, OGG, WAV, WMA",
    "auto focusing af modes": "Centre weighted Auto Focus, Face detection, Multi Point Auto Focus",
    "battery capacity": "1650 mAh",
    "battery life max": "280h",
    "bluetooth": "Yes",
    "bluetooth version": "4.0",
    "builtin flash": "Yes",
    "camera shutter speed max": "16s",
    "camera shutter speed min": "0.0005s",
    "camera type": "Compact",
    "colour of product": [
        "Black",
        "Black"
    ],
    "compatible memory cards": "MicroSD (TransFlash)",
    "data network": "3G, GSM, HSPA+",
    "depth": "12.87 cm",
    "display": "TFT",
    "display diagonal": "12.19 cm (4.8\")",
    "display resolution": "1280 x 720 pixels",
    "ean": "8806085298705",
    "flash exposure correction": "\u00b11EV (1/2 EV step)",
    "flash modes": "Auto, Fill-in, Flash off, Red-eye reduction, Slow synchronization",
    "flash range tele": "0.5 - 5.1m",
    "flash range wide": "0.2 - 6.2m",
    "flash recharging time": "4s",
    "focal length range ff": "4.1 - 86.1 mm",
    "focus": "TTL",
    "focus adjustment": "Auto",
    "full hd": "Yes",
    "hdmi": [
        "No",
        "No"
    ],
    "height": "1.91 cm",
    "image sensor size": "25.4/58.4 mm (1/2.3\")",
    "image stabilizer": "Yes",
    "internal memory": "3870 MB",
    "iso sensitivity": "100, 200, 400, 800, 1600, 3200, Auto",
    "iso sensitivity max": "3200",
    "iso sensitivity min": "100",
    "light exposure control": "Program AE",
    "light exposure correction": "\u00b1 2EV (1/3EV step)",
    "light exposure modes": "Aperture priority AE, Auto, Manual, Shutter priority AE",
    "light metering": "Centre-weighted, Evaluative (Multi-pattern), Spot",
    "macro focusing range tele": "1.5 - 3.5m",
    "macro focusing range wide": "0.1 - 0.8m",
    "manufacturer": "Samsung",
    "maximum focal length 35mm film equiv": "48.3 cm",
    "maximum image resolution": "4608 x 3456 pixels",
    "maximum memory card size": "64 GB",
    "maximum video resolution": "1920 x 1080 pixels",
    "megapixel": "16.3 MP",
    "minimum focal length 35mm film equiv": "2.3 cm",
    "motion jpeg frame rate": "30 fps",
    "normal focusing range": "0.8 - ?",
    "optical zoom": "21x",
    "pdf url": "No",
    "photo effects": "Antique, Black&White, Fader, Negative film, Pastel, Solarisation",
    "power source type": "Battery",
    "product promotion": "N/A",
    "scene modes": "Backlight, Close-up (macro), Fireworks, Landscape, Night, Panorama, Portrait, Sunset",
    "sensor type": "CMOS",
    "short description": "1/2.3\" BSI CMOS, 17MP, 12.192 cm (4.8 \") HD Super Clear LCD, 1280 x 720, 3.87GB, USB 2.0, MicroSD, 1650mAh, Android 4.1 (Jellybean)",
    "sku": "EK-GC100ZKABTU",
    "specification": "Picture qualityImage sensor size25.4/58.4 mm (1/2.3\")Still image resolution(s)16M : 4608 x 3456, 14MP : 4608 x 3072, 12M W : 4608 x 2592, 10M : 3648 x 2736, 5M : 2592 x 1944, 3M : 1984 x 1488, 2MW : 1920 x 1080, 1M : 1024 x 768Image stabilizerYesTotal megapixels17 MPMaximum image resolution4608 x 3456 pixelsSensor typeCMOSCamera typeCompactMegapixel16.3 MPLens systemFocal length range (f-f)4.1 - 86.1 mmMinimum focal length (35mm film equiv)2.3 cmMaximum focal length (35mm film equiv)48.3 cmOptical zoom21xFocusingFocusTTLFocus adjustmentAutoAuto focusing (AF) modesCentre weighted Auto Focus, Face detection, Multi Point Auto FocusNormal focusing range0.8 - ?Manual focusing range (wide)0.1 - ?Manual focusing range (tele)1.5 - ?Macro focusing range (wide)0.1 - 0.8mMacro focusing range (tele)1.5 - 3.5mLight exposureISO sensitivity100, 200, 400, 800, 1600, 3200, AutoLight exposure modesAperture priority AE, Auto, Manual, Shutter priority AELight exposure controlProgram AELight exposure correction\u00b1 2EV (1/3EV step)Light meteringCentre-weighted, Evaluative (Multi-pattern), SpotISO sensitivity (min)100ISO sensitivity (max)3200ShutterCamera shutter speed (min)0.0005sCamera shutter speed (max)16sFlashFlash modesAuto, Fill-in, Flash off, Red-eye reduction, Slow synchronizationBuilt-in flashYesFlash recharging time4sFlash range (wide)0.2 - 6.2mFlash range (tele)0.5 - 5.1mFlash exposure correction\u00b11EV (1/2 EV step)VideoVideo resolutions320 x 240, 640 x 480, 768 x 512, 1280 x 720, 1920 x 1080 pixelsVideo formats supported3GP, AVI, FLV, MKV, MP4, WEBM, WMVMotion JPEG frame rate30 fpsFull HDYesMaximum video resolution1920 x 1080 pixelsAudioAudio formats supported3GA, AAC, AIFF, FLAC, M4A, MP3, OGG, WAV, WMAMemoryInternal memory3870 MBCompatible memory cardsMicroSD (TransFlash)Maximum memory card size64 GBDisplayDisplayTFTDisplay diagonal12.19 cm (4.8\")Display resolution1280 x 720 pixelsTouch sensitive screenYesPorts & interfacesUSB version2.0Headphone outputs1USB connector typeMicro-USB BHDMINoNetworkingData network3G, GSM, HSPA+Wi-Fi standards802.11a, 802.11b, 802.11g, 802.11nBluetoothYesBluetooth version4.0Wi-FiYesCameraColour of productBlackWhite balanceAuto, Cloudy, Custom modes, Daylight, Fluorescent H, Fluorescent L, TungstenScene modesBacklight, Close-up (macro), Fireworks, Landscape, Night, Panorama, Portrait, SunsetPhoto effectsAntique, Black&White, Fader, Negative film, Pastel, SolarisationBatteryBattery capacity1650 mAhBattery life (max)280hPower source typeBatteryTechnical detailsHDMINoDesignColour of productBlackWeight & dimensionsWidth7.08 cmDepth12.87 cmHeight1.91 cmWeight300g",
    "still image resolutions": "16M : 4608 x 3456, 14MP : 4608 x 3072, 12M W : 4608 x 2592, 10M : 3648 x 2736, 5M : 2592 x 1944, 3M : 1984 x 1488, 2MW : 1920 x 1080, 1M : 1024 x 768",
    "total megapixels": "17 MP",
    "touch sensitive screen": "Yes",
    "usb connector type": "Micro-USB B",
    "usb version": "2.0",
    "video formats supported": "3GP, AVI, FLV, MKV, MP4, WEBM, WMV",
    "video resolutions": "320 x 240, 640 x 480, 768 x 512, 1280 x 720, 1920 x 1080 pixels",
    "weight": "300g",
    "white balance": "Auto, Cloudy, Custom modes, Daylight, Fluorescent H, Fluorescent L, Tungsten",
    "width": "7.08 cm",
    "wifi": "Yes",
    "wifi standards": "802.11a, 802.11b, 802.11g, 802.11n"
}