{
    "<page title>": "Sony RX100 Digital compact camera - Digital Cameras - Photo - Visual | ILGS.net",
    "ac adapter included": "Yes",
    "auto focusing af modes": "Centre weighted Auto Focus, Face tracking, Flexible Spot Auto Focus, Multi Point Auto Focus",
    "batteries included": "Yes",
    "battery charger included": "Yes",
    "battery technology": "Lithium-Ion (Li-Ion)",
    "battery type": [
        "NP-BX1",
        "Lithium-ion"
    ],
    "box contents": "rechargeable battery Micro USB cable wrist strap instruction manual AC adaptor",
    "builtin flash": [
        "Yes",
        "YES"
    ],
    "cables included": "USB",
    "camera shutter speed": "iAuto(4 - 1/2000) / Program Auto(1 - 1/2000)",
    "camera shutter speed max": "30s",
    "camera shutter speed min": "0.0005s",
    "camera type": "Compact",
    "colour of product": [
        "Black",
        "Black",
        "Black"
    ],
    "compatible memory cards": [
        "MS Duo, MS PRO Duo, MS PRO Duo HS, MS Pro-HG Duo, SD, SDHC, SDXC",
        "Memory Stick Duo / Memory Stick PRO Duo / Memory Stick PRO Duo (high speed) / Memory Stick PRO HG Duo / Memory Stick Micro / Memory Stick Micro (mark 2)/ SD Memory Card / SDHC Memory Card / SDXC Memory Card / microSD Memory Card / microSDHC Memory Card"
    ],
    "dcin jack": "Yes",
    "depth": "5.81 cm",
    "digital zoom": [
        "54x",
        "20M Approx.14x / 10M Approx.20x / 5M Approx.28x / VGA Approx.54 x"
    ],
    "dimensions w x d x h": "101.6 x 35.9 x 58.1 mm",
    "display": "LCD",
    "display diagonal": "7.62 cm (3\")",
    "display resolution numeric": "1229000 pixels",
    "durable": "No",
    "ean": "4905524895193",
    "flash modes": "Auto, Fill-in, Flash off, Flash on, Slow synchronization",
    "flash range tele": "0.55 - 6.3m",
    "flash range wide": "0.3 - 17.1m",
    "focal length range ff": "28 - 146 mm",
    "freeze proof": "NO",
    "full hd": "Yes",
    "hand strap": "Yes",
    "hdmi": [
        "Yes",
        "Yes"
    ],
    "hdmi connector type": "Micro",
    "hdmi ports quantity": [
        "1",
        "1",
        "1"
    ],
    "height": "3.59 cm",
    "image sensor size": "25.4/50.8 mm (1/2\")",
    "image sensor size w x h": "13.2 x 8.8 mm",
    "image stabilizer": "Yes",
    "iso sensitivity": [
        "125, 200, 400, 800, 1600, 3200",
        "Auto (ISO125-6400 selectable with upper / lower limit)125/200/400/800/1600/3200/6400 (Extendableto ISO80/100)Multi-Frame NR:Auto(ISO125-25600)"
    ],
    "lcd screen size": "3",
    "lens structure elementsgroups": "7/6",
    "light exposure correction": "\u00b1 3EV (1/3EV step)",
    "light exposure modes": "Auto, Manual",
    "manufacturer": "Sony",
    "maximum aperture": "4.9",
    "maximum focal length 35mm film equiv": "14.6 cm",
    "maximum image resolution": "5472 x 3648 pixels",
    "maximum video resolution": "1920 x 1080 pixels",
    "megapixel": [
        "20.2 MP",
        "20.2"
    ],
    "minimum aperture": "1.8",
    "minimum focal length 35mm film equiv": "2.8 cm",
    "number of batteries supported": "1",
    "optical zoom": [
        "3.6x",
        "3.6 x"
    ],
    "pdf url": "No",
    "photo effects": "Art, Black&White, Negative film",
    "power source type": "Battery",
    "product promotion": "N/A",
    "scene modes": "Fireworks, Landscape, Night, Night portrait, Portrait, Sports, Sunset, Twilight",
    "selftimer": "2, 10s",
    "sensor type": [
        "CMOS",
        "Exmor CMOS Sensor"
    ],
    "shock proof": "NO",
    "short description": "1.0-type 20.2 megapixels Exmor CMOS, F1.8 lens, 3.6x optical zoom, Full HD 50p, 7.5cm (3.0\") LCD",
    "sku": "DSCRX100.CEH",
    "specification": "Picture qualityImage sensor size25.4/50.8 mm (1/2\")Still image resolution(s)2592 x 1944, 2736 x 1824, 3648 x 2056, 3648 x 2736, 3888 x 2592, 5472 x 3080Image stabilizerYesTotal megapixels20.9 MPImage sensor size (W x H)13.2 x 8.8 mmMaximum image resolution5472 x 3648 pixelsSensor typeCMOSCamera typeCompactMegapixel20.2 MPLens systemFocal length range (f-f)28 - 146 mmMinimum focal length (35mm film equiv)2.8 cmMaximum focal length (35mm film equiv)14.6 cmMinimum aperture1.8Maximum aperture4.9Lens structure (elements/groups)7/6Digital zoom54xOptical zoom3.6xFocusingAuto focusing (AF) modesCentre weighted Auto Focus, Face tracking, Flexible Spot Auto Focus, Multi Point Auto FocusLight exposureISO sensitivity125, 200, 400, 800, 1600, 3200Light exposure modesAuto, ManualLight exposure correction\u00b1 3EV (1/3EV step)ShutterCamera shutter speed (min)0.0005sCamera shutter speed (max)30sFlashFlash modesAuto, Fill-in, Flash off, Flash on, Slow synchronizationBuilt-in flashYesFlash range (wide)0.3 - 17.1mFlash range (tele)0.55 - 6.3mVideoVideo resolutions640 x 480, 1440 x 1080, 1920 x 1080 pixelsVideo formats supportedAVCHD, MP4Full HDYesMaximum video resolution1920 x 1080 pixelsMemoryCompatible memory cardsMS Duo, MS PRO Duo, MS PRO Duo HS, MS Pro-HG Duo, SD, SDHC, SDXCDisplayDisplayLCDDisplay diagonal7.62 cm (3\")Display resolution (numeric)1229000 pixelsViewfinderViewfinder typeElectricalPorts & interfacesUSB version2.0HDMI connector typeMicroUSB 2.0 ports quantity1HDMI ports quantity1DC-in jackYesHDMIYesCameraColour of productBlackWhite balanceAuto, Cloudy, Daylight, Fluorescent, Incandescent, ShadeScene modesFireworks, Landscape, Night, Night portrait, Portrait, Sports, Sunset, TwilightPhoto effectsArt, Black&White, Negative filmSelf-timer2, 10sBatteryBattery technologyLithium-Ion (Li-Ion)Battery typeNP-BX1Number of batteries supported1Power source typeBatteryTechnical detailsUSB 2.0 ports quantity1HDMI ports quantity1HDMIYesDesignColour of productBlackWeight & dimensionsWidth10.16 cmDepth5.81 cmHeight3.59 cmWeight240gPackaging contentHand strapYesCables includedUSBBattery charger includedYesBatteries includedYesAC adapter includedYesOther featuresUSB 2.0 ports quantity1HDMI ports quantity1",
    "still image resolutions": "2592 x 1944, 2736 x 1824, 3648 x 2056, 3648 x 2736, 3888 x 2592, 5472 x 3080",
    "total megapixels": "20.9 MP",
    "usb 20 ports quantity": [
        "1",
        "1",
        "1"
    ],
    "usb version": "2.0",
    "video capability": "YES",
    "video formats supported": "AVCHD, MP4",
    "video resolutions": "640 x 480, 1440 x 1080, 1920 x 1080 pixels",
    "viewfinder type": "Electrical",
    "warranty": "1 Year",
    "water proof": "NO",
    "weight": [
        "240g",
        "213 g"
    ],
    "white balance": "Auto, Cloudy, Daylight, Fluorescent, Incandescent, Shade",
    "width": "10.16 cm"
}