{
    "<page title>": "Canon EOS 1200D + EF-S 18-55mm f/3.5-5.6 IS II - Digital Cameras - Photo - Visual | ILGS.net",
    "auto focus af assist beam": "No",
    "auto focus af lock": "Yes",
    "auto focus af points": "9",
    "auto focus af points selection": "Auto, Manual",
    "auto focusing af modes": "Servo Auto Focus",
    "batteries included": "Yes",
    "battery charger included": "Yes",
    "battery life cipa standard": "500 shots",
    "battery technology": "Lithium-Ion (Li-Ion)",
    "battery type": "Rechargeable Li-ion Battery LP-E10",
    "brightness adjustment": "Yes",
    "builtin flash": [
        "Yes",
        "Yes"
    ],
    "cables included": "AC, USB",
    "camera file system": "DCF 2.0",
    "camera shutter speed min": "0.000250s",
    "camera shutter type": "Electronic",
    "camera type": "SLR Kit",
    "closest focusing distance": "0.25m",
    "colour of product": [
        "Black",
        "Black",
        "Black"
    ],
    "compatible memory cards": [
        "SD, SDHC, SDXC",
        "SD SDHC SDXC"
    ],
    "depth": "7.79 cm",
    "dimensions w x d x h": "129.6 x 77.9 x 99.7 mm",
    "dioptre correction": "Yes",
    "direct printing": [
        "Yes",
        "Yes",
        "Yes"
    ],
    "display": "TFT",
    "display diagonal": "7.62 cm (3\")",
    "ean": "8714574618234",
    "external flash connector": "Yes",
    "filter size": "5.8 cm",
    "flash exposure compensation": "Yes",
    "flash exposure correction": "\u00b12EV (1/2, 1/3 EV step)",
    "flash exposure lock": "Yes",
    "flash modes": "Auto, Flash off, Flash on",
    "flash recharging time": "2s",
    "focus": "TTL",
    "full hd": "Yes",
    "hdmi": [
        "Yes",
        "Yes"
    ],
    "hdmi connector type": "Mini",
    "height": "9.97 cm",
    "histogram": "Yes",
    "image formats supported": "JPEG XR, RAW",
    "image processor": "DIGIC 4+",
    "image sensor size w x h": "22.3 x 14.9 mm",
    "image stabilizer": "Yes",
    "image stabilizer location": [
        "Lens",
        "Lens"
    ],
    "iso sensitivity": [
        "100, 125, 160, 200, 250, 320, 400, 500, 640, 800, 1000, 1250, 1600, 2000, 2250, 2500, 3200, 4000, 5000, 6400",
        "AUTO(100-6400) 100-6400 in 1-stop increments ISO can be expanded to H: 12800 During Movie shooting: Auto (100-6400) 100-6400 (Whole stop increments)"
    ],
    "iso sensitivity max": "6400",
    "iso sensitivity min": "100",
    "languages support": [
        "ARA, CHI (SIMPL), CHI (TR), CZE, DAN, DEU, DUT, ENG, ESP, FIN, FRE, GRE, HUN, ITA, JPN, KOR, NOR, POL, POR, RUM, RUS, SWE, THA, TUR, UKR",
        "ARA, CHI (SIMPL), CHI (TR), CZE, DAN, DEU, DUT, ENG, ESP, FIN, FRE, GRE, HUN, ITA, JPN, KOR, NOR, POL, POR, RUM, RUS, SWE, THA, TUR, UKR"
    ],
    "lcd screen size": "3",
    "lens mount interface": "Canon EF, Canon EF-S",
    "lens structure elementsgroups": "11/9",
    "lens system": "EF/EF-S",
    "lens type": "18-55mm",
    "light exposure modes": "Auto, Manual",
    "light metering": "Centre-weighted, Evaluative (Multi-pattern)",
    "live view": "Yes",
    "magnification": "0.34x",
    "manufacturer": "Canon",
    "material": [
        "Carbon, Glass, Polycarbonate",
        "Carbon, Glass, Polycarbonate"
    ],
    "maximum aperture": "38",
    "maximum focal length 35mm film equiv": "8.8 cm",
    "maximum image resolution": "5184 x 3456 pixels",
    "maximum video resolution": "1920 x 1080 pixels",
    "megapixel": [
        "18 MP",
        "18"
    ],
    "minimum aperture": "22",
    "minimum focal length 35mm film equiv": "2.9 cm",
    "mounting type": "Bayonet",
    "number of diaphragm blades": "6",
    "operating relative humidity hh": "0 - 85%",
    "operating temperature tt": "0 - 40 \u00b0C",
    "orientation sensor": "Yes",
    "pdf url": "http://pdfs.icecat.biz/pdf/40844843-4113.pdf",
    "pictbridge": "Yes",
    "power source type": "Battery",
    "product promotion": "N/A",
    "scene modes": "Close-up (macro), Landscape, Night portrait, Sports",
    "selftimer": "2, 10s",
    "sensor format": "Advanced Photo System type-C (APS-C)",
    "sensor type": [
        "DIGIC 4",
        "CMOS"
    ],
    "shooting modes": "Aperture priority, Auto, Manual, Movie, Program, Scene, Shutter priority",
    "short description": "18MP, 22.3 x 14.9mm, 3:2, CMOS, APS-C, TFT, 7.62 cm (3 \")",
    "sku": "9127B027AA",
    "specification": "Picture qualitySensor formatAdvanced Photo System type-C (APS-C)Supported aspect ratios1:1, 3:2, 4:3, 16:9Still image resolution(s)JPEG 3:2: (L) 5184x3456, (M) 3456x2304, (S1) 2592x1728, (S2) 1920x1280, (S3) 720x480\nJPEG 4:3: (L) 4608x3456, (M) 3072x2304, (S1) 2304x1728, (S2) 1696x1280, (S3) 640x480\nJPEG 16:9: (L) 5184x2912, (M) 3456x1944, (S1) 2592x1456 (S2) 1920x1080, (S3) 720x400\nJPEG 1:1: (L) 3456x3456, (M) 2304x2304, (S1) 1728x1728, (S2) 1280x1280, (S3) 480x480Image stabilizerYesTotal megapixels18.7 MPImage sensor size (W x H)22.3 x 14.9 mmImage stabilizer locationLensImage formats supportedJPEG XR, RAWMaximum image resolution5184 x 3456 pixelsSensor typeCMOSCamera typeSLR KitMegapixel18 MPLens systemMounting typeBayonetMinimum focal length (35mm film equiv)2.9 cmMaximum focal length (35mm film equiv)8.8 cmMinimum aperture22Maximum aperture38Lens structure (elements/groups)11/9Number of diaphragm blades6Lens mount interfaceCanon EF, Canon EF-SFilter size5.8 cmFocusingFocusTTLAuto focusing (AF) modesServo Auto FocusClosest focusing distance0.25mAuto Focus (AF) points selectionAuto, ManualAuto Focus (AF) points9Auto Focus (AF) lockYesAuto Focus (AF) assist beamNoLight exposureISO sensitivity100, 125, 160, 200, 250, 320, 400, 500, 640, 800, 1000, 1250, 1600, 2000, 2250, 2500, 3200, 4000, 5000, 6400Light exposure modesAuto, ManualLight meteringCentre-weighted, Evaluative (Multi-pattern)ISO sensitivity (min)100ISO sensitivity (max)6400ShutterCamera shutter speed (min)0.000250sCamera shutter typeElectronicFlashFlash modesAuto, Flash off, Flash onBuilt-in flashYesFlash recharging time2sFlash exposure lockYesFlash exposure correction\u00b12EV (1/2, 1/3 EV step)Flash exposure compensationYesExternal flash connectorYesVideoVideo resolutions640 x 480, 1280 x 720, 1920 x 1080 pixelsVideo formats supportedH.264Full HDYesMaximum video resolution1920 x 1080 pixelsMemoryCompatible memory cardsSD, SDHC, SDXCDisplayDisplayTFTDisplay diagonal7.62 cm (3\")ViewfinderMagnification0.34xPorts & interfacesHDMI connector typeMiniPictBridgeYesHDMIYesCameraImage stabilizer locationLensColour of productBlackWhite balanceCloudy, Custom modes, Daylight, Flash, Fluorescent L, Shade, TungstenScene modesClose-up (macro), Landscape, Night portrait, SportsShooting modesAperture priority, Auto, Manual, Movie, Program, Scene, Shutter prioritySelf-timer2, 10sOrientation sensorYesLive viewYesLanguages supportARA, CHI (SIMPL), CHI (TR), CZE, DAN, DEU, DUT, ENG, ESP, FIN, FRE, GRE, HUN, ITA, JPN, KOR, NOR, POL, POR, RUM, RUS, SWE, THA, TUR, UKRHistogramYesDirect printingYesDioptre correctionYesCamera file systemDCF 2.0Brightness adjustmentYesBatteryBattery technologyLithium-Ion (Li-Ion)Battery life (CIPA standard)500 shotsPower source typeBatteryTechnical detailsWrist strap includedYesMaterialCarbon, Glass, PolycarbonateLanguages supportARA, CHI (SIMPL), CHI (TR), CZE, DAN, DEU, DUT, ENG, ESP, FIN, FRE, GRE, HUN, ITA, JPN, KOR, NOR, POL, POR, RUM, RUS, SWE, THA, TUR, UKRHDMIYesDirect printingYesDesignMaterialCarbon, Glass, PolycarbonateColour of productBlackPerformanceDirect printingYesOperational conditionsOperating temperature (T-T)0 - 40 \u00b0COperating relative humidity (H-H)0 - 85%Weight & dimensionsWidth12.96 cmDepth7.79 cmHeight9.97 cmWeight (including battery)680gPackaging contentWrist strap includedYesCables includedAC, USBBattery charger includedYesBatteries includedYesTechnical detailsImage processorDIGIC 4+",
    "still image resolutions": "JPEG 3:2: (L) 5184x3456, (M) 3456x2304, (S1) 2592x1728, (S2) 1920x1280, (S3) 720x480\nJPEG 4:3: (L) 4608x3456, (M) 3072x2304, (S1) 2304x1728, (S2) 1696x1280, (S3) 640x480\nJPEG 16:9: (L) 5184x2912, (M) 3456x1944, (S1) 2592x1456 (S2) 1920x1080, (S3) 720x400\nJPEG 1:1: (L) 3456x3456, (M) 2304x2304, (S1) 1728x1728, (S2) 1280x1280, (S3) 480x480",
    "supported aspect ratios": "1:1, 3:2, 4:3, 16:9",
    "total megapixels": "18.7 MP",
    "type": "Digital SLR",
    "video capability": "Yes",
    "video formats supported": "H.264",
    "video resolutions": "640 x 480, 1280 x 720, 1920 x 1080 pixels",
    "weight": "480 g",
    "weight including battery": "680g",
    "white balance": "Cloudy, Custom modes, Daylight, Flash, Fluorescent L, Shade, Tungsten",
    "width": "12.96 cm",
    "wrist strap included": [
        "Yes",
        "Yes"
    ]
}