{
    "<page title>": "Canon PowerShot SX700 HS - Digital Cameras - Photo - Visual | ILGS.net",
    "auto exposure ae lock": "Yes",
    "auto focus af assist beam": "Yes",
    "auto focus af lock": "Yes",
    "auto focusing af modes": "Continuous Auto Focus, Face detection, Servo Auto Focus, Single Auto Focus, Tracking Auto Focus",
    "battery life cipa standard": "250 shots",
    "battery technology": "Lithium-Ion (Li-Ion)",
    "battery type": "Rechargeable Li-ion Battery NB-6LH",
    "builtin flash": [
        "Yes",
        "Yes"
    ],
    "builtin microphone": "Yes",
    "builtin processor": [
        "DIGIC 6",
        "DIGIC 6",
        "DIGIC 6"
    ],
    "camera file system": "DPOF 1.1, Exif 2.3",
    "camera shutter speed": "1 \u2013 1/3200 sec. (factory default) 15 \u2013 1/3200 sec. (total range \u2013 varies by shooting mode)",
    "camera shutter speed max": "0.0003125s",
    "camera shutter speed min": "15s",
    "camera type": "Compact",
    "closest focusing distance": "0.01m",
    "colour of product": [
        "Red",
        "Red",
        "Red"
    ],
    "combined zoom": "120x",
    "compatible memory cards": [
        "SD SDHC SDXC",
        "SD, SDHC, SDXC"
    ],
    "depth": "3.48 cm",
    "digital zoom": [
        "60 x",
        "4x"
    ],
    "dimensions w x d x h": "112.7 x 34.8 x 65.8 mm",
    "display": "TFT",
    "display diagonal": "7.62 cm (3\")",
    "ean": "8714574617534",
    "flash exposure compensation": "Yes",
    "flash exposure lock": "Yes",
    "flash modes": "Auto, Flash off, Flash on, Manual, Red-eye reduction, Slow synchronization",
    "flash range tele": "1 - 2m",
    "flash range wide": "0.5 - 3.5m",
    "flash syncspeed": "0.0005s",
    "focal length range ff": "4.5 - 135 mm",
    "focus": "TTL",
    "focus adjustment": "Auto/Manual",
    "full hd": "Yes",
    "hdmi": [
        "Yes",
        "Yes"
    ],
    "hdmi connector type": "Micro",
    "height": "6.58 cm",
    "histogram": "Yes",
    "image sensor size": "25.4/58.4 mm (1/2.3\")",
    "image stabilizer": "Yes",
    "iso sensitivity": [
        "AUTO 100 200 400 800 1600 3200",
        "100, 200, 400, 800, 1600, 3200, Auto"
    ],
    "iso sensitivity max": "3200",
    "iso sensitivity min": "100",
    "languages support": [
        "Multi",
        "Multi"
    ],
    "lcd screen size": "3",
    "lens structure elementsgroups": "13/10",
    "light exposure correction": "\u00b1 2EV (1/3EV step)",
    "light exposure modes": "Aperture priority AE, Auto, Manual, Shutter priority AE",
    "light metering": "Centre-weighted, Evaluative (Multi-pattern), Spot",
    "mac operating systems supported": [
        "Mac OS X 10.7 Lion, Mac OS X 10.8 Mountain Lion, Mac OS X 10.9 Mavericks",
        "Mac OS X 10.7 Lion, Mac OS X 10.8 Mountain Lion, Mac OS X 10.9 Mavericks"
    ],
    "manufacturer": "Canon",
    "maximum aperture": "6.9",
    "maximum focal length 35mm film equiv": "75 cm",
    "maximum image resolution": "4608 x 3456 pixels",
    "maximum video resolution": "1920 x 1080 pixels",
    "megapixel": [
        "16.1",
        "16.1 MP"
    ],
    "memory slots": "1",
    "minimum aperture": "3.2",
    "minimum focal length 35mm film equiv": "2.5 cm",
    "number of batteries supported": "1",
    "operating relative humidity hh": "10 - 90%",
    "operating temperature tt": "0 - 40 \u00b0C",
    "optical zoom": [
        "30x",
        "30 x"
    ],
    "pdf url": "No",
    "photo effects": "Black&White, Neutral, Positive film, Sepia, Skin tones, Vivid",
    "pictbridge": "Yes",
    "power source type": "Battery",
    "product promotion": "N/A",
    "resolution at capture speed": [
        "1280\u00d7720@30fps, 1920x1080@30fps, 1920x1080@60fps, 640x480@30fps",
        "1280\u00d7720@30fps, 1920x1080@30fps, 1920x1080@60fps, 640x480@30fps"
    ],
    "scene modes": "Fireworks, Portrait, Snow, Sports",
    "selftimer": "2, 10s",
    "sensor type": [
        "DIGIC 6 with iSAPS technology",
        "CMOS"
    ],
    "short description": "16.1 MP (4608 x 3456 max.), 1/2.3\" CMOS, 30x optical/4x digital zoom, ISO 100-3200, 7.62 cm (3 \") TFT, USB 2.0, HDMI, 269 g, Red",
    "sku": "9339B014AA",
    "specification": "Picture qualityImage sensor size25.4/58.4 mm (1/2.3\")Supported aspect ratios1:1, 3:2, 4:3, 16:9Still image resolution(s)4608 x 3456, 3264 x 2448, 2048 x 1536, 640 x 480, 4608 x 2592, 3264 x 1832, 1920 x 1080, 640 x 360, 4608 x 3072, 3264 x 2176, 2048 x 1368, 640 x 424, 3456 x 3456, 2448 x 2448, 1536 x 1536, 480 x 480Image stabilizerYesMaximum image resolution4608 x 3456 pixelsSensor typeCMOSCamera typeCompactMegapixel16.1 MPLens systemFocal length range (f-f)4.5 - 135 mmMinimum focal length (35mm film equiv)2.5 cmMaximum focal length (35mm film equiv)75 cmMinimum aperture3.2Maximum aperture6.9Lens structure (elements/groups)13/10Combined zoom120xDigital zoom4xOptical zoom30xFocusingFocusTTLFocus adjustmentAuto/ManualAuto focusing (AF) modesContinuous Auto Focus, Face detection, Servo Auto Focus, Single Auto Focus, Tracking Auto FocusClosest focusing distance0.01mAuto Focus (AF) lockYesAuto Focus (AF) assist beamYesLight exposureISO sensitivity100, 200, 400, 800, 1600, 3200, AutoLight exposure modesAperture priority AE, Auto, Manual, Shutter priority AELight exposure correction\u00b1 2EV (1/3EV step)Light meteringCentre-weighted, Evaluative (Multi-pattern), SpotAuto Exposure (AE) lockYesISO sensitivity (min)100ISO sensitivity (max)3200ShutterCamera shutter speed (min)15sCamera shutter speed (max)0.0003125sFlashFlash modesAuto, Flash off, Flash on, Manual, Red-eye reduction, Slow synchronizationBuilt-in flashYesFlash sync-speed0.0005sFlash range (wide)0.5 - 3.5mFlash range (tele)1 - 2mFlash exposure lockYesFlash exposure compensationYesVideoVideo resolutions320 x 240, 640 x 480, 1280 x 720, 1920 x 1080 pixelsResolution at capture speed1280\u00d7720@30fps, 1920x1080@30fps, 1920x1080@60fps, 640x480@30fpsVideo formats supportedMP4Full HDYesMaximum video resolution1920 x 1080 pixelsAudioBuilt-in microphoneYesMemoryCompatible memory cardsSD, SDHC, SDXCMemory slots1DisplayDisplayTFTDisplay diagonal7.62 cm (3\")Ports & interfacesUSB version2.0HDMI connector typeMicroPictBridgeYesUSB connector typeMini-USB BHDMIYesNetworkingWi-Fi standards802.11b, 802.11g, 802.11nWi-FiYesCameraColour of productRedWhite balanceAuto, Cloudy, Custom modes, Daylight, Fluorescent, Fluorescent H, TungstenScene modesFireworks, Portrait, Snow, SportsPhoto effectsBlack&White, Neutral, Positive film, Sepia, Skin tones, VividSelf-timer2, 10sLanguages supportMultiHistogramYesCamera file systemDPOF 1.1, Exif 2.3Built-in processorDIGIC 6BatteryBattery technologyLithium-Ion (Li-Ion)Battery life (CIPA standard)250 shotsNumber of batteries supported1Power source typeBatteryOperating system/softwareWindows operating systems supportedWindows 7 Home Basic, Windows 7 Home Basic x64, Windows 7 Home Premium, Windows 7 Home Premium x64, Windows 7 Professional, Windows 7 Professional x64, Windows 7 Starter, Windows 7 Starter x64, Windows 7 Ultimate, Windows 7 Ultimate x64, Windows 8, Windows 8 Enterprise, Windows 8 Enterprise x64, Windows 8 Pro, Windows 8 Pro x64, Windows 8 x64, Windows 8.1, Windows 8.1 Enterprise, Windows 8.1 Enterprise x64, Windows 8.1 Pro, Windows 8.1 Pro x64, Windows 8.1 x64, Windows Vista Business, Windows Vista Business x64, Windows Vista Enterprise, Windows Vista Enterprise x64, Windows Vista Home Basic, Windows Vista Home Basic x64, Windows Vista Home Premium, Windows Vista Home Premium x64, Windows Vista Ultimate, Windows Vista Ultimate x64, Windows XP Home, Windows XP Home x64, Windows XP Professional, Windows XP Professional x64Mac operating systems supportedMac OS X 10.7 Lion, Mac OS X 10.8 Mountain Lion, Mac OS X 10.9 MavericksTechnical detailsResolution at capture speed1280\u00d7720@30fps, 1920x1080@30fps, 1920x1080@60fps, 640x480@30fpsLanguages supportMultiHDMIYesProcessorBuilt-in processorDIGIC 6DesignColour of productRedPerformanceBuilt-in processorDIGIC 6Operational conditionsOperating temperature (T-T)0 - 40 \u00b0COperating relative humidity (H-H)10 - 90%System requirementsWindows operating systems supportedWindows 7 Home Basic, Windows 7 Home Basic x64, Windows 7 Home Premium, Windows 7 Home Premium x64, Windows 7 Professional, Windows 7 Professional x64, Windows 7 Starter, Windows 7 Starter x64, Windows 7 Ultimate, Windows 7 Ultimate x64, Windows 8, Windows 8 Enterprise, Windows 8 Enterprise x64, Windows 8 Pro, Windows 8 Pro x64, Windows 8 x64, Windows 8.1, Windows 8.1 Enterprise, Windows 8.1 Enterprise x64, Windows 8.1 Pro, Windows 8.1 Pro x64, Windows 8.1 x64, Windows Vista Business, Windows Vista Business x64, Windows Vista Enterprise, Windows Vista Enterprise x64, Windows Vista Home Basic, Windows Vista Home Basic x64, Windows Vista Home Premium, Windows Vista Home Premium x64, Windows Vista Ultimate, Windows Vista Ultimate x64, Windows XP Home, Windows XP Home x64, Windows XP Professional, Windows XP Professional x64Mac operating systems supportedMac OS X 10.7 Lion, Mac OS X 10.8 Mountain Lion, Mac OS X 10.9 MavericksWeight & dimensionsWidth11.27 cmDepth3.48 cmHeight6.58 cmWeight (including battery)269g",
    "still image resolutions": "4608 x 3456, 3264 x 2448, 2048 x 1536, 640 x 480, 4608 x 2592, 3264 x 1832, 1920 x 1080, 640 x 360, 4608 x 3072, 3264 x 2176, 2048 x 1368, 640 x 424, 3456 x 3456, 2448 x 2448, 1536 x 1536, 480 x 480",
    "supported aspect ratios": "1:1, 3:2, 4:3, 16:9",
    "usb connector type": "Mini-USB B",
    "usb version": "2.0",
    "video capability": "Yes",
    "video formats supported": "MP4",
    "video resolutions": "320 x 240, 640 x 480, 1280 x 720, 1920 x 1080 pixels",
    "weight": "269 g",
    "weight including battery": "269g",
    "white balance": "Auto, Cloudy, Custom modes, Daylight, Fluorescent, Fluorescent H, Tungsten",
    "width": "11.27 cm",
    "wifi": [
        "Built-In",
        "Yes"
    ],
    "wifi standards": "802.11b, 802.11g, 802.11n",
    "windows operating systems supported": [
        "Windows 7 Home Basic, Windows 7 Home Basic x64, Windows 7 Home Premium, Windows 7 Home Premium x64, Windows 7 Professional, Windows 7 Professional x64, Windows 7 Starter, Windows 7 Starter x64, Windows 7 Ultimate, Windows 7 Ultimate x64, Windows 8, Windows 8 Enterprise, Windows 8 Enterprise x64, Windows 8 Pro, Windows 8 Pro x64, Windows 8 x64, Windows 8.1, Windows 8.1 Enterprise, Windows 8.1 Enterprise x64, Windows 8.1 Pro, Windows 8.1 Pro x64, Windows 8.1 x64, Windows Vista Business, Windows Vista Business x64, Windows Vista Enterprise, Windows Vista Enterprise x64, Windows Vista Home Basic, Windows Vista Home Basic x64, Windows Vista Home Premium, Windows Vista Home Premium x64, Windows Vista Ultimate, Windows Vista Ultimate x64, Windows XP Home, Windows XP Home x64, Windows XP Professional, Windows XP Professional x64",
        "Windows 7 Home Basic, Windows 7 Home Basic x64, Windows 7 Home Premium, Windows 7 Home Premium x64, Windows 7 Professional, Windows 7 Professional x64, Windows 7 Starter, Windows 7 Starter x64, Windows 7 Ultimate, Windows 7 Ultimate x64, Windows 8, Windows 8 Enterprise, Windows 8 Enterprise x64, Windows 8 Pro, Windows 8 Pro x64, Windows 8 x64, Windows 8.1, Windows 8.1 Enterprise, Windows 8.1 Enterprise x64, Windows 8.1 Pro, Windows 8.1 Pro x64, Windows 8.1 x64, Windows Vista Business, Windows Vista Business x64, Windows Vista Enterprise, Windows Vista Enterprise x64, Windows Vista Home Basic, Windows Vista Home Basic x64, Windows Vista Home Premium, Windows Vista Home Premium x64, Windows Vista Ultimate, Windows Vista Ultimate x64, Windows XP Home, Windows XP Home x64, Windows XP Professional, Windows XP Professional x64"
    ]
}