{
    "<page title>": "Samsung NX 30 + 18-55mm F3.5-5.6 OIS III - Digital Cameras - Photo - Visual | ILGS.net",
    "analog signal format system": "NTSC, PAL",
    "audio formats supported": "AAC",
    "auto focusing af modes": "Continuous Auto Focus, Single Auto Focus",
    "battery capacity": "1410 mAh",
    "battery life cipa standard": "360 shots",
    "battery life max": "3h",
    "battery type": "BP1410",
    "builtin microphone": "Yes",
    "camera playback": "Movie, Single image, Slide show, Thumbnails",
    "camera shutter speed max": "0.000125s",
    "camera shutter speed min": "0.25s",
    "camera shutter type": "Electronic",
    "camera type": "Bridge",
    "colour of product": [
        "Black",
        "Black"
    ],
    "compatible memory cards": "SD, SDHC, SDXC",
    "depth": "12.7 cm",
    "display": "AMOLED",
    "display diagonal": "7.62 cm (3\")",
    "display resolution": "720 x 480 pixels",
    "display resolution numeric": "1037000 pixels",
    "ean": "8806085978430",
    "field of view": "100%",
    "filter size": "5.8 cm",
    "focal length range ff": "18 - 55 mm",
    "focus": "TTL",
    "full hd": "Yes",
    "hdmi": [
        "Yes",
        "Yes"
    ],
    "hdmi version": "1.4a",
    "height": "9.55 cm",
    "image sensor size w x h": "23.5 x 15.7 mm",
    "image stabilizer location": [
        "Lens",
        "Lens"
    ],
    "iso sensitivity": "100, 200, 400, 800, 1600, 3200, 6400, 12800, 25600, Auto",
    "iso sensitivity max": "25600",
    "iso sensitivity min": "100",
    "lens mount interface": "Samsung NX",
    "light exposure correction": "\u00b1 3EV (1/3EV step)",
    "magnification": "0.96x",
    "manufacturer": "Samsung",
    "maximum aperture": "5.6",
    "maximum image resolution": "5472 x 3648 pixels",
    "maximum video resolution": "1920 x 1080 pixels",
    "megapixel": "20.3 MP",
    "memory slots": "1",
    "minimum aperture": "3.5",
    "motion jpeg frame rate": "60 fps",
    "near field communication nfc": "Yes",
    "normal focusing range": "11m",
    "number of batteries supported": "1",
    "operating relative humidity hh": "5 - 85%",
    "operating temperature tt": "0 - 40 \u00b0C",
    "pdf url": "No",
    "power source type": "Battery",
    "product promotion": "N/A",
    "scene modes": "Landscape, Portrait",
    "sensor format": "Advanced Photo System type-C (APS-C)",
    "sensor type": "CMOS",
    "shooting modes": "Aperture priority, Auto, Program, Shutter priority",
    "short description": "NX 30, 20.3MP, APS-C, 7.62 cm (3 \") AMOLED, HDMI, NFC, WLAN + 18 - 55mm F3.5 - 5.6 OIS III",
    "sku": "EV-NX30ZZBGBGB",
    "specification": "Picture qualitySensor formatAdvanced Photo System type-C (APS-C)Still image resolution(s)5472 x 3648, 3888 x 2592, 2976 x1984, 1728x 1152, 2736 x 1824, 5472 x 3080, 3712 x 2088, 2944 x 1656, 1920 x 1080, 3648 x 3648, 2640 x 2640, 2000 x 2000, 1024 x 1024, 5472 x 3648, 2688 x 1512, 1920 x 1080Total megapixels21.6 MPImage sensor size (W x H)23.5 x 15.7 mmImage stabilizer locationLensMaximum image resolution5472 x 3648 pixelsSensor typeCMOSCamera typeBridgeMegapixel20.3 MPLens systemFocal length range (f-f)18 - 55 mmMinimum aperture3.5Maximum aperture5.6Lens mount interfaceSamsung NXFilter size5.8 cmFocusingFocusTTLAuto focusing (AF) modesContinuous Auto Focus, Single Auto FocusNormal focusing range11mLight exposureISO sensitivity100, 200, 400, 800, 1600, 3200, 6400, 12800, 25600, AutoLight exposure correction\u00b1 3EV (1/3EV step)ISO sensitivity (min)100ISO sensitivity (max)25600ShutterCamera shutter speed (min)0.25sCamera shutter speed (max)0.000125sCamera shutter typeElectronicVideoVideo resolutions320 x 240, 640 x 480, 1280 x 720, 1920 x 810, 1920 x 1080 pixelsVideo formats supportedH.264, MP4Motion JPEG frame rate60 fpsFull HDYesAnalog signal format systemNTSC, PALMaximum video resolution1920 x 1080 pixelsAudioBuilt-in microphoneYesAudio formats supportedAACMemoryCompatible memory cardsSD, SDHC, SDXCMemory slots1DisplayDisplayAMOLEDDisplay diagonal7.62 cm (3\")Display resolution720 x 480 pixelsDisplay resolution (numeric)1037000 pixelsVari-angle LCD displayYesTouch sensitive screenYesField of view100%ViewfinderMagnification0.96xPorts & interfacesUSB version2.0HDMI version1.4aHDMIYesNetworkingNear Field Communication (NFC)YesWi-FiYesCameraImage stabilizer locationLensColour of productBlackWhite balanceAuto, Cloudy, Custom modes, Daylight, Flash, Fluorescent, Manual, TungstenScene modesLandscape, PortraitShooting modesAperture priority, Auto, Program, Shutter priorityCamera playbackMovie, Single image, Slide show, ThumbnailsBatteryBattery voltage7.6VBattery life (CIPA standard)360 shotsBattery capacity1410 mAhBattery life (max)3hBattery typeBP1410Number of batteries supported1Power source typeBatteryTechnical detailsHDMIYesDesignColour of productBlackOperational conditionsOperating temperature (T-T)0 - 40 \u00b0COperating relative humidity (H-H)5 - 85%Weight & dimensionsWidth4.17 cmDepth12.7 cmHeight9.55 cmWeight375g",
    "still image resolutions": "5472 x 3648, 3888 x 2592, 2976 x1984, 1728x 1152, 2736 x 1824, 5472 x 3080, 3712 x 2088, 2944 x 1656, 1920 x 1080, 3648 x 3648, 2640 x 2640, 2000 x 2000, 1024 x 1024, 5472 x 3648, 2688 x 1512, 1920 x 1080",
    "total megapixels": "21.6 MP",
    "touch sensitive screen": "Yes",
    "usb version": "2.0",
    "variangle lcd display": "Yes",
    "video formats supported": "H.264, MP4",
    "video resolutions": "320 x 240, 640 x 480, 1280 x 720, 1920 x 810, 1920 x 1080 pixels",
    "weight": "375g",
    "white balance": "Auto, Cloudy, Custom modes, Daylight, Flash, Fluorescent, Manual, Tungsten",
    "width": "4.17 cm",
    "wifi": "Yes"
}