{
    "<page title>": "Sony WX300 Digital compact camera - Digital Cameras - Photo - Visual | ILGS.net",
    "accessories included": [
        "Rechargeable Battery Pack (NP-BX1), AC Adaptor (AC-UB10/UB10B), Micro USB cable, Wrist Strap, Instruction Manual, AC Power Cord",
        "Rechargeable Battery Pack (NP-BX1), AC Adaptor (AC-UB10/UB10B), Micro USB cable, Wrist Strap, Instruction Manual, AC Power Cord"
    ],
    "auto focus af assist beam": "Auto / Off",
    "auto focusing af modes": "Yes",
    "av output": "No",
    "battery type": "No",
    "bundled software": [
        "PlayMemories Home",
        "PlayMemories Home"
    ],
    "camera file system": "Yes",
    "camera shutter speed": "iAuto(4\" - 1/1600) / Program Auto(1\" - 1/1600)",
    "colour of product": [
        "Red",
        "Red"
    ],
    "contrast adjustment": "No",
    "depth": "2.57 cm",
    "digital zoom": "18M Appro.80 / 10M Appro.107 / 5M Appro.151 / VGA Appro.306 / 13M Appro.80 / 2M Appro.204x",
    "display": "TFT ClearPhoto",
    "display diagonal": "190.5 cm (7.5cm)",
    "display resolution numeric": "460.800 pixels",
    "ean": "4905524940060",
    "electrical viewfinder": [
        "No",
        "No"
    ],
    "face detection": [
        "Yes",
        "Yes"
    ],
    "filter size": "No",
    "flash modes": "Auto / Flash On / Slow Synchro / Flash Off / Advanced Flash",
    "focal length range ff": "4.3 - 86 mm",
    "focus": "3.5-6.5",
    "gps": [
        "No",
        "No",
        "No"
    ],
    "height": "5.49 cm",
    "histogram": "Yes",
    "iso sensitivity": "ISO80-3200(iAuto), ISO80-12800(Superior Auto), ISO80-1600(Program Auto)",
    "light exposure control": "\u00b1 2.0EV, 1/3EV step",
    "light metering": "Yes",
    "manual focus": [
        "No",
        "No"
    ],
    "manufacturer": "Sony",
    "megapixel": "Approx. 18.2 MP",
    "on screen display osd languages": "English, French, German, Spanish, Italian, Portuguese, Dutch, Swedish, Norwegian, Danish, Finnish, Polish, Czech, Hungarian, Turkish, Greek, Bulgarian, Croatian, Romanian",
    "optical viewfinder": [
        "No",
        "No"
    ],
    "optical zoom": "20x",
    "panorama": [
        "Y\nN",
        "Y\nN"
    ],
    "pdf url": "No",
    "pictbridge": "No",
    "picture effects": [
        "HDR Painting, Richtone Monochrome, Miniature, Toy camera, Pop Color, Partial Color, Soft High-key, Watercolor, Illustration",
        "HDR Painting, Richtone Monochrome, Miniature, Toy camera, Pop Color, Partial Color, Soft High-key, Watercolor, Illustration"
    ],
    "playback zoom max": "YES",
    "product promotion": "N/A",
    "recording format": [
        "Y\nJPEG",
        "Y\nJPEG"
    ],
    "reviews": "No",
    "saturation adjustment": "No",
    "scene modes": "Soft Snap / Soft Skin / Anti Motion Blur / Backlight Correction HDR / Night Portrait / Night Scene / High Sensitivity / Handheld Twilight / Beach / Snow / Fireworks / Gourmet / Pet Mode / Landscape",
    "sensor type": "Exmor R CMOS Sensor",
    "short description": "More detail even in low-light wiht 20x optical zoom and Exmor R\u2122 CMOS sensor, 18.2MP, Full HD, Intelligent Auto, Wi-Fi",
    "sku": "DSCWX300R.CEH",
    "smile detection": "Yes",
    "specification": "Picture qualityOptical sensor size1/0.0906 mm (1/2.3\")Still image resolution(s)YesSensor typeExmor R CMOS SensorMegapixelApprox. 18.2 MPLens systemFocal length range (f-f)4.3 - 86 mmFilter sizeNoDigital zoom18M Appro.80 / 10M Appro.107 / 5M Appro.151 / VGA Appro.306 / 13M Appro.80 / 2M Appro.204xOptical zoom20xFocusingFocus3.5-6.5Auto focusing (AF) modesYesSmile detectionYesAuto Focus (AF) assist beamAuto / OffLight exposureISO sensitivityISO80-3200(iAuto), ISO80-12800(Superior Auto), ISO80-1600(Program Auto)Light exposure control\u00b1 2.0EV, 1/3EV stepLight meteringYesFlashFlash modesAuto / Flash On / Slow Synchro / Flash Off / Advanced FlashDisplayDisplayTFT ClearPhotoDisplay diagonal190.5 cm (7.5cm)Display resolution (numeric)460.800 pixelsPorts & interfacesPictBridgeNoAV outputNoCameraColour of productRedWhite balanceY\nAuto,Daylight,Cloudy,Incandescent,FlashScene modesSoft Snap / Soft Skin / Anti Motion Blur / Backlight Correction HDR / Night Portrait / Night Scene / High Sensitivity / Handheld Twilight / Beach / Snow / Fireworks / Gourmet / Pet Mode / LandscapeContrast adjustmentNoSaturation adjustmentNoStart-up timeApprox. 2 sec.Playback zoom (max)YES On Screen Display (OSD) languagesEnglish, French, German, Spanish, Italian, Portuguese, Dutch, Swedish, Norwegian, Danish, Finnish, Polish, Czech, Hungarian, Turkish, Greek, Bulgarian, Croatian, RomanianHistogramYesGPSNoCamera file systemYesSharpness levelsNoBatteryBattery typeNoOperating system/softwareBundled softwarePlayMemories HomeTechnical detailsAccessories includedRechargeable Battery Pack (NP-BX1), AC Adaptor (AC-UB10/UB10B), Micro USB cable, Wrist Strap, Instruction Manual, AC Power CordStart-up timeApprox. 2 sec.WaterproofNoUSB 2.0 connectorsYesTrimmingYesRecording mediaSD Memory Card / SDHC Memory Card / SDXC Memory Card / microSD Memory Card* / microSDHC Memory Card* / microSDXC Memory Card*\nMemory Stick Duo / Memory Stick PRO Duo / Memory Stick PRO Duo (high speed) / Memory Stick PRO HG Duo / Memory Stick XC-HG Duo / Memory Stick Micro* / Memory Stick Micro (mark 2)*Recording formatY\nJPEGPanoramaY\nNOptical viewfinderNoManual focusNoMacro focusing rangeiAuto:AF(W:Approx.5cm(0.16') - ?, T:Approx.200cm(6.56') - ?) / Program Auto:AF(W:Approx.5cm(0.16') - ?, T:Approx.200cm(6.56') - ?)GPSNoFace detectionYesElectrical viewfinderNoConversion functionNoBattery packLithium NBattery LED indicatorNoAperture priority AEN\niAuto(F3.5/F8.0(W), 2 steps with ND Filter) / Program Auto(F3.5/F8.0(W), 2 steps with ND Filter)Red-eye correctionAuto / On / OffSupplied batteryNP-BX1Still image size(18M, 4896 x 3672)YesStill image size(16M, 4608 x 3456)NoStill image size (VGA, 640 x 480)YesStill image size (9.0M, 3456 x 2592)NoStill image size (8.0M, 3264 x 2448)NoStill image size (7.2M, 3072 x 2304)NoStill image size (5.0M, 2592 x 1944)YesStill image size (3:2 mode, 4000 x 2672)NoStill image size (3:2 mode, 3648 x 2432)NoStill image size (3:2 mode, 3456 x 2304)NoStill image size (3.1M, 2048 x 1536)NoStill image size (16:9 mode, 4896 x 2752)YesStill image size (16:9 mode, 4608 x 2592)NoStill image size (16:9 mode, 4320 x 2432)NoStill image size (16:9 mode, 4000 x 2248)NoStill Image size (16:9 mode, 1920 x 1080)YesStill image size (14M, 4320 x 3240)NoStill image size (13M, 4224 x 3168)NoStill image size (12M, 4000 x 3000)NoSpot Auto Focus (AF)YesSony G lens compatibleYesSoft skin effectYesSlideshow with musicYesSlideshow playbackYesSlideshow movieYesShop front modeNoPrint image matchingYesPicture transfer protocol (PTP)NoPicture effectsHDR Painting, Richtone Monochrome, Miniature, Toy camera, Pop Color, Partial Color, Soft High-key, Watercolor, IllustrationNR slow shutterNoMulti use Terminal with HDMulti Terminal, Hi-Speed USB(USB2.0), Micro HDMIMulti use terminalYesMulti Point Auto Focus (AF)YesMoving image size (640x480, 25fps, 3Mbps)YesMoving image size (320x240, 30fps)NoMoving image size (1920x1080, 60p, 28Mbps)NoMoving image size (1920x1080, 50i, 24Mbps)YesMoving image size (1920x1080, 50i, 17Mbps)YesMoving image size (1440x1080, 25fps, 12Mbps)NoMoving image size (1280x720, 30fps, 9Mbps)NoMoving image size (1280x720, 25fps, 6Mbps)YesManual apertureNoIndex playback16 / 25 imagesImage rotationYesHD PlaybackUnder 18M(4,896\u00d73,672)Hand Shake AlertNoFlexible Spot Auto Focus (AF)NoExposure warning indicatorNoDisk/Memory Stick remaining indicatorNoDigital Print Order Format (DPOF)YesCue and ReviewYesClear RAW Noise ReductionNoClear image zoom18M Approx.40x / 10M Approx.53x / 5M Approx.75x / VGA Approx.306x / 13M(16:9) Approx.40x / 2M(16:9) Approx.102xCarl Zeiss Vario-Tessar LensNoBurst ModeApprox.10 fpsBurst intervalApprox.0.1 sec.(10 shots)Bionz processorYesBacklight correctionYesBackground defocusYesAuto image rotationYesAuto grouping and & Best picture recognitionYesAuto daylight synchronized flashNoAuto bright monitoringNo3D modeNo2D Panorama360\u00b0(11,520 x 1,080) / HR(10,480x4,096) / Wide(7,152 x 1,080/4,912 x 1,920) / Standard(4,912 x 1,080/3,424 x 1,920)Moving Image Size (640x480, 30fps, 3Mbps)NoDistance limitations using flashISO Auto: Approx.0.2m - 4.3m(7 7/8 \" - 14 ft 1 3/8 \")(W) / Approx.2.0m - 2.4 m(6ft 6 3/4 \" - 7 ft 10 1/2 \")(T), ISO3200: > Approx.6.1 m(20 ft 1/4 \")(W) / Approx.3.4 m(11 ft 1 7/8 \")(T)DesignColour of productRedPerformanceGPSNoWeight & dimensionsWidth9.6 cmDepth2.57 cmHeight5.49 cmWeight166\n139 gPackaging contentBundled softwarePlayMemories HomeTechnical detailsOptical sensor size1/0.0906 mm (1/2.3\")SteadyShotSteadyShot capability,Optical SteadyShot capabilityOther featuresAccessories includedRechargeable Battery Pack (NP-BX1), AC Adaptor (AC-UB10/UB10B), Micro USB cable, Wrist Strap, Instruction Manual, AC Power CordWaterproofNoUSB 2.0 connectorsYesTrimmingYesRecording mediaSD Memory Card / SDHC Memory Card / SDXC Memory Card / microSD Memory Card* / microSDHC Memory Card* / microSDXC Memory Card*\nMemory Stick Duo / Memory Stick PRO Duo / Memory Stick PRO Duo (high speed) / Memory Stick PRO HG Duo / Memory Stick XC-HG Duo / Memory Stick Micro* / Memory Stick Micro (mark 2)*Recording formatY\nJPEGPanoramaY\nNOptical viewfinderNoManual focusNoMacro focusing rangeiAuto:AF(W:Approx.5cm(0.16') - ?, T:Approx.200cm(6.56') - ?) / Program Auto:AF(W:Approx.5cm(0.16') - ?, T:Approx.200cm(6.56') - ?)Focal length (35mm film equivalent)25 - 500 mmFace detectionYesElectrical viewfinderNoConversion functionNoCamera shutter speediAuto(4\" - 1/1600) / Program Auto(1\" - 1/1600)Battery packLithium NBattery LED indicatorNoAperture priority AEN\niAuto(F3.5/F8.0(W), 2 steps with ND Filter) / Program Auto(F3.5/F8.0(W), 2 steps with ND Filter)Red-eye correctionAuto / On / OffSupplied batteryNP-BX1Still image size(18M, 4896 x 3672)YesStill image size(16M, 4608 x 3456)NoStill image size (VGA, 640 x 480)YesStill image size (9.0M, 3456 x 2592)NoStill image size (8.0M, 3264 x 2448)NoStill image size (7.2M, 3072 x 2304)NoStill image size (5.0M, 2592 x 1944)YesStill image size (3:2 mode, 4000 x 2672)NoStill image size (3:2 mode, 3648 x 2432)NoStill image size (3:2 mode, 3456 x 2304)NoStill image size (3.1M, 2048 x 1536)NoStill image size (16:9 mode, 4896 x 2752)YesStill image size (16:9 mode, 4608 x 2592)NoStill image size (16:9 mode, 4320 x 2432)NoStill image size (16:9 mode, 4000 x 2248)NoStill Image size (16:9 mode, 1920 x 1080)YesStill image size (14M, 4320 x 3240)NoStill image size (13M, 4224 x 3168)NoStill image size (12M, 4000 x 3000)NoSpot Auto Focus (AF)YesSony G lens compatibleYesSoft skin effectYesSlideshow with musicYesSlideshow playbackYesSlideshow movieYesShop front modeNoPrint image matchingYesPicture transfer protocol (PTP)NoPicture effectsHDR Painting, Richtone Monochrome, Miniature, Toy camera, Pop Color, Partial Color, Soft High-key, Watercolor, IllustrationNR slow shutterNoMulti use Terminal with HDMulti Terminal, Hi-Speed USB(USB2.0), Micro HDMIMulti use terminalYesMulti Point Auto Focus (AF)YesMoving image size (640x480, 25fps, 3Mbps)YesMoving image size (320x240, 30fps)NoMoving image size (1920x1080, 60p, 28Mbps)NoMoving image size (1920x1080, 50i, 24Mbps)YesMoving image size (1920x1080, 50i, 17Mbps)YesMoving image size (1440x1080, 25fps, 12Mbps)NoMoving image size (1280x720, 30fps, 9Mbps)NoMoving image size (1280x720, 25fps, 6Mbps)YesManual apertureNoIndex playback16 / 25 imagesImage rotationYesHD PlaybackUnder 18M(4,896\u00d73,672)Hand Shake AlertNoFlexible Spot Auto Focus (AF)NoExposure warning indicatorNoDisk/Memory Stick remaining indicatorNoDigital Print Order Format (DPOF)YesCue and ReviewYesClear RAW Noise ReductionNoClear image zoom18M Approx.40x / 10M Approx.53x / 5M Approx.75x / VGA Approx.306x / 13M(16:9) Approx.40x / 2M(16:9) Approx.102xCarl Zeiss Vario-Tessar LensNoBurst ModeApprox.10 fpsBurst intervalApprox.0.1 sec.(10 shots)Bionz processorYesBacklight correctionYesBackground defocusYesAuto image rotationYesAuto grouping and & Best picture recognitionYesAuto daylight synchronized flashNoAuto bright monitoringNo3D modeNo2D Panorama360\u00b0(11,520 x 1,080) / HR(10,480x4,096) / Wide(7,152 x 1,080/4,912 x 1,920) / Standard(4,912 x 1,080/3,424 x 1,920)Moving Image Size (640x480, 30fps, 3Mbps)NoDistance limitations using flashISO Auto: Approx.0.2m - 4.3m(7 7/8 \" - 14 ft 1 3/8 \")(W) / Approx.2.0m - 2.4 m(6ft 6 3/4 \" - 7 ft 10 1/2 \")(T), ISO3200: > Approx.6.1 m(20 ft 1/4 \")(W) / Approx.3.4 m(11 ft 1 7/8 \")(T)",
    "steadyshot": "SteadyShot capability,Optical SteadyShot capability",
    "still image resolutions": "Yes",
    "trimming": [
        "Yes",
        "Yes"
    ],
    "waterproof": [
        "No",
        "No"
    ],
    "weight": "166\n139 g",
    "white balance": "Y\nAuto,Daylight,Cloudy,Incandescent,Flash",
    "width": "9.6 cm"
}