{
    "<page title>": "Sony HX60 Compact Camera with 30x Optical Zoom - Digital Cameras - Photo - Visual | ILGS.net",
    "ac adapter included": "Yes",
    "analog signal format system": "NTSC, PAL",
    "audio formats supported": "AC3",
    "audio system": [
        "Stereo",
        "Stereo"
    ],
    "auto focusing af modes": "Continuous Auto Focus, Single Auto Focus",
    "auto mode focusing range tele": "2.0 - ?",
    "auto mode focusing range wide": "0.05 - ?",
    "batteries included": "Yes",
    "battery life cipa standard": "380 shots",
    "battery type": "NP-BX1",
    "brightness adjustment": "Yes",
    "builtin flash": "Yes",
    "builtin microphone": "Yes",
    "cables included": "USB",
    "camera shutter speed": "iAuto (4 - 1/1600) / Program Auto (1 - 1/1600) / Aperture Priority (8 - 1/1600) / Shutter Priority (30 - 1/1600) / Manual (30 - 1/1600)",
    "camera type": "Compact",
    "colour of product": [
        "Black",
        "Black",
        "Black"
    ],
    "compatible memory cards": [
        "MS Duo, MS PRO Duo, MS PRO Duo Mark 2, MS Pro-HG Duo, SD, SDHC, SDXC",
        "Memory Stick Duo;Memory Stick PRO Duo\u2122;Memory Stick PRO Duo\u2122(high speed);Memory Stick PRO HG Duo\u2122;Memory Stick XC-HG Duo\u2122;Memory Stick Micro;Memory Stick Micro (Mark2);SD Memory Card;SDHC Memory Card;SDXC Memory Card;microSD Memory Card;microSDHC Memory Card;microSDXC Memory Card"
    ],
    "contrast adjustment": "Yes",
    "depth": "3.83 cm",
    "dimensions w x d x h": "108.1 x 38.3 x 63.6 mm",
    "display": "LCD",
    "display diagonal": "7.62 cm (3\")",
    "display resolution numeric": "921600 pixels",
    "ean": "4905524980110",
    "flash modes": "Auto, Flash off, Flash on, Slow synchronization",
    "flash range tele": "2 - 3m",
    "flash range wide": "0.25 - 5.6m",
    "focal length range ff": "4.3 - 129 mm",
    "full hd": "Yes",
    "gps": [
        "No",
        "No",
        "No"
    ],
    "hdmi": [
        "Yes",
        "Yes"
    ],
    "hdmi connector type": "Micro",
    "height": "6.36 cm",
    "image formats supported": "JPG",
    "image sensor size": "25.4/58.4 mm (1/2.3\")",
    "image stabilizer": "Yes",
    "iso sensitivity": [
        "80, 100, 200, 400, 800, 1600, 3200, 6400, 12800, Auto",
        "Auto (ISO80-3200 selectable with upper / lower limit) 80/100/200/400/800/1600/3200 Multi-Frame NR:Auto (ISO80-3200) 100/200/400/800/1600/3200/6400 /12800"
    ],
    "iso sensitivity max": "12800",
    "iso sensitivity min": "80",
    "lcd screen size": "3",
    "lens structure elementsgroups": "11/10",
    "light exposure correction": "\u00b1 2EV (1/3EV step)",
    "macro focusing range tele": "2.0 - ?",
    "macro focusing range wide": "0.05 - ?",
    "manufacturer": "Sony",
    "maximum aperture": "3.5",
    "maximum image resolution": "5184 x 3456 pixels",
    "maximum video resolution": "1920 x 1080 pixels",
    "megapixel": [
        "20.4 MP",
        "20.4"
    ],
    "minimum aperture": "6.3",
    "motion jpeg frame rate": "30 fps",
    "near field communication nfc": "Yes",
    "number of batteries supported": "1",
    "optical zoom": [
        "30 x",
        "30x"
    ],
    "pdf url": "No",
    "power source type": "Battery",
    "product promotion": "N/A",
    "quick start guide": [
        "Yes",
        "Yes"
    ],
    "scene modes": "Beach, Fireworks, Landscape, Night portrait, Portrait, Snow",
    "selftimer": "2, 10s",
    "sensor type": [
        "1/2.3 type (7.82mm) Exmor R CMOS sensor",
        "CMOS"
    ],
    "short description": "20.4MP, 1/2.3 type (7.82mm) Exmor R CMOS, Sony G, 30x Opt. Zoom) 3.0\" TFT, MS XC-HG Duo/SDXC, BIONZ X, MicroUSB, MicroHDMI, Wi-Fi, NFC, 272g",
    "sku": "DSCHX60B.CEH",
    "specification": "Picture qualityImage sensor size25.4/58.4 mm (1/2.3\")Supported aspect ratios1:1, 3:2, 4:3, 16:9Still image resolution(s)5184 x 3456, 3648 x 2432, 2592 x 1728, 5184 x 3888, 3648 x 2736, 2592 x 1944, 5184 x 2920, 3648 x 2056, 1920 x 1080, 3888 x 3888, 2736 x 2736, 1920 x 1920, 7152 x 1080, 4912 x 1920, 4912 1080, 3424 x 1920, 11520 x 1080Image stabilizerYesImage formats supportedJPGMaximum image resolution5184 x 3456 pixelsSensor typeCMOSCamera typeCompactMegapixel20.4 MPLens systemFocal length range (f-f)4.3 - 129 mmMinimum aperture6.3Maximum aperture3.5Lens structure (elements/groups)11/10Optical zoom30xFocusingAuto focusing (AF) modesContinuous Auto Focus, Single Auto FocusMacro focusing range (wide)0.05 - ?Macro focusing range (tele)2.0 - ?Auto Mode focusing range (wide)0.05 - ?Auto Mode focusing range (tele)2.0 - ?Light exposureISO sensitivity80, 100, 200, 400, 800, 1600, 3200, 6400, 12800, AutoLight exposure correction\u00b1 2EV (1/3EV step)ISO sensitivity (min)80ISO sensitivity (max)12800FlashFlash modesAuto, Flash off, Flash on, Slow synchronizationBuilt-in flashYesFlash range (wide)0.25 - 5.6mFlash range (tele)2 - 3mVideoVideo resolutions640 x 480, 1440 x 1080, 1920 x 1080 pixelsVideo formats supportedMP4Motion JPEG frame rate30 fpsFull HDYesAnalog signal format systemNTSC, PALMaximum video resolution1920 x 1080 pixelsAudioBuilt-in microphoneYesVoice recordingYesAudio systemStereoAudio formats supportedAC3MemoryCompatible memory cardsMS Duo, MS PRO Duo, MS PRO Duo Mark 2, MS Pro-HG Duo, SD, SDHC, SDXCDisplayDisplayLCDDisplay diagonal7.62 cm (3\")Display resolution (numeric)921600 pixelsViewfinderViewfinder typeNoPorts & interfacesUSB version2.0HDMI connector typeMicroHDMIYesNetworkingWi-Fi standards802.11b, 802.11g, 802.11nNear Field Communication (NFC)YesWi-FiYesCameraColour of productBlackWhite balanceAuto, Custom modes, Daylight, Flash, Fluorescent, IncandescentScene modesBeach, Fireworks, Landscape, Night portrait, Portrait, SnowSelf-timer2, 10sContrast adjustmentYesTripod mountableYesGPSNoBrightness adjustmentYesBatteryBattery life (CIPA standard)380 shotsBattery typeNP-BX1Number of batteries supported1Power source typeBatteryOperating system/softwareWindows operating systems supportedYesTechnical detailsQuick start guideYesHDMIYesGPSNoAudio systemStereoDesignColour of productBlackPerformanceGPSNoSystem requirementsWindows operating systems supportedYesWeight & dimensionsWidth10.81 cmDepth3.83 cmHeight6.36 cmWeight246gWeight (including battery)272gPackaging contentQuick start guideYesCables includedUSBBatteries includedYesAC adapter includedYes",
    "still image resolutions": "5184 x 3456, 3648 x 2432, 2592 x 1728, 5184 x 3888, 3648 x 2736, 2592 x 1944, 5184 x 2920, 3648 x 2056, 1920 x 1080, 3888 x 3888, 2736 x 2736, 1920 x 1920, 7152 x 1080, 4912 x 1920, 4912 1080, 3424 x 1920, 11520 x 1080",
    "supported aspect ratios": "1:1, 3:2, 4:3, 16:9",
    "tripod mountable": "Yes",
    "usb version": "2.0",
    "video capability": "Yes",
    "video formats supported": "MP4",
    "video resolutions": "640 x 480, 1440 x 1080, 1920 x 1080 pixels",
    "viewfinder type": "No",
    "voice recording": "Yes",
    "weight": [
        "246g",
        "272 g"
    ],
    "weight including battery": "272g",
    "white balance": "Auto, Custom modes, Daylight, Flash, Fluorescent, Incandescent",
    "width": "10.81 cm",
    "wifi": [
        "Built-In",
        "Yes"
    ],
    "wifi standards": "802.11b, 802.11g, 802.11n",
    "windows operating systems supported": [
        "Yes",
        "Yes"
    ]
}