{
    "<page title>": "Samsung NX 300 - Digital Cameras - Photo - Visual | ILGS.net",
    "analog signal format system": "NTSC, PAL",
    "antidust function": "Yes",
    "audio formats supported": "AAC",
    "auto focusing af modes": "Continuous Auto Focus, Single Auto Focus",
    "battery capacity": "1130 mAh",
    "battery life cipa standard": "320 shots",
    "battery life max": "2.66h",
    "battery type": "BP1130",
    "builtin flash": "Yes",
    "builtin microphone": "Yes",
    "builtin processor": [
        "DRIMe IV",
        "DRIMe IV",
        "DRIMe IV"
    ],
    "camera file system": "DPOF 1.1, Exif 2.21",
    "camera playback": "Movie, Single image",
    "camera shutter speed max": "0.000166667s",
    "camera shutter speed min": "30s",
    "camera type": "MILC",
    "colour of product": [
        "Brown",
        "Brown"
    ],
    "compatible memory cards": "SD, SDHC, SDXC",
    "depth": "4.07 cm",
    "display": "AMOLED",
    "display diagonal": "8.41 cm (3.31\")",
    "display resolution": "800 x 400 pixels",
    "display resolution numeric": "768000 pixels",
    "ean": "8806085664012",
    "field of view": "100%",
    "flash modes": "Auto, Fill-in, Forced off, Red-eye reduction",
    "flash syncspeed": "1/180s",
    "frame rate": [
        "60 fps",
        "60 fps"
    ],
    "full hd": "Yes",
    "gps": [
        "Yes",
        "Yes",
        "Yes"
    ],
    "hdmi": [
        "Yes",
        "Yes"
    ],
    "hdmi ports quantity": [
        "1",
        "1",
        "1"
    ],
    "hdmi version": "1.4a",
    "height": "6.37 cm",
    "histogram": "Yes",
    "image editing": "Crop, Resizing, Rotating",
    "image formats supported": "JPG, RAW",
    "image quality adjustment": "Brightness, Contrast",
    "iso sensitivity": "100, 200, 400, 800, 1600, 12800, 25600",
    "iso sensitivity max": "25600",
    "iso sensitivity min": "100",
    "lens mount interface": "Samsung NX",
    "light exposure correction": "\u00b1 3EV (1/3EV step)",
    "light metering": "Centre-weighted, Evaluative (Multi-pattern), Spot",
    "manufacturer": "Samsung",
    "maximum image resolution": "5472 x 3648 pixels",
    "maximum video resolution": "1920 x 1080 pixels",
    "megapixel": "20.3 MP",
    "minimum hard disk space": "250 MB",
    "minimum processor": "Intel Core 2 Duo 1.66 GHz / AMD Athlon X2 Dual-Core 2.2 GHz",
    "minimum ram": "512 MB",
    "number of batteries supported": "1",
    "on screen display osd languages": "ARA, CHI (SIMPL), CHI (TR), CZE, DAN, DEU, DUT, ESP, EST, FIN, FRE, GRE, HUN, ITA, KOR, LAV, NOR, POL, POR, SWE, THA, TUR",
    "operating relative humidity hh": "5 - 85%",
    "pdf url": "No",
    "power source type": "Battery",
    "product promotion": "N/A",
    "saturation adjustment": "Yes",
    "scene modes": "Fireworks, Landscape, Night, Panorama, Sunset",
    "sensor type": "CMOS",
    "shooting modes": "Aperture priority, Auto, Lens priority, Manual, Program, Shutter priority",
    "short description": "NX300 - 20.3 MP, CMOS 23.5 x 15.7 mm, 8.4074 cm (3.31 \") AMOLED (800 x 480), SDXC, GPS, Wi-Fi 802.11b/g/n, HDMI 1.4a",
    "sku": "EV-NX300ZBAVGB",
    "specification": "Picture qualitySupported aspect ratios3:2, 16:9Still image resolution(s)1024 x 1024, 1728 x 1152, 1920 x 1080, 2000 x 2000, 2112 x 2112, 2640 x 2640, 2736 x 1824, 2944 x 1656, 2976 x 1984, 3648 x 3648, 3712 x 2088, 3888 x 2592, 5472 x 3080Total megapixels21.6 MPImage formats supportedJPG, RAWMaximum image resolution5472 x 3648 pixelsSensor typeCMOSCamera typeMILCMegapixel20.3 MPLens systemLens mount interfaceSamsung NXFocusingAuto focusing (AF) modesContinuous Auto Focus, Single Auto FocusLight exposureISO sensitivity100, 200, 400, 800, 1600, 12800, 25600Light exposure correction\u00b1 3EV (1/3EV step)Light meteringCentre-weighted, Evaluative (Multi-pattern), SpotISO sensitivity (min)100ISO sensitivity (max)25600ShutterCamera shutter speed (min)30sCamera shutter speed (max)0.000166667sFlashFlash modesAuto, Fill-in, Forced off, Red-eye reductionBuilt-in flashYesFlash sync-speed1/180sVideoVideo resolutions320 x 240, 640 x 480, 1280 x 720, 1920 x 810, 1920 x 1080 pixelsVideo formats supportedH.264, MP4, MPEG4Full HDYesAnalog signal format systemNTSC, PALMaximum video resolution1920 x 1080 pixelsAudioBuilt-in microphoneYesVoice recordingYesAudio formats supportedAACMemoryCompatible memory cardsSD, SDHC, SDXCDisplayDisplayAMOLEDDisplay diagonal8.41 cm (3.31\")Display resolution800 x 400 pixelsDisplay resolution (numeric)768000 pixelsVari-angle LCD displayYesTouch sensitive screenYesField of view100%Ports & interfacesUSB version2.0HDMI version1.4aUSB 2.0 ports quantity1USB connector typeMicro-USB BHDMI ports quantity1HDMIYesNetworkingWi-Fi standards802.11b, 802.11g, 802.11nWi-FiYesCameraColour of productBrownWhite balanceAuto, Cloudy, Custom modes, Daylight, Flash, Fluorescent, Manual, TungstenScene modesFireworks, Landscape, Night, Panorama, SunsetShooting modesAperture priority, Auto, Lens priority, Manual, Program, Shutter prioritySaturation adjustmentYesCamera playbackMovie, Single imageTripod mountableYesOn Screen Display (OSD) languagesARA, CHI (SIMPL), CHI (TR), CZE, DAN, DEU, DUT, ESP, EST, FIN, FRE, GRE, HUN, ITA, KOR, LAV, NOR, POL, POR, SWE, THA, TURImage quality adjustmentBrightness, ContrastImage editingCrop, Resizing, RotatingHistogramYesGPSYesCamera file systemDPOF 1.1, Exif 2.21Built-in processorDRIMe IVAnti-dust functionYesBatteryBattery life (CIPA standard)320 shotsBattery capacity1130 mAhBattery life (max)2.66hBattery typeBP1130Number of batteries supported1Power source typeBatteryTechnical detailsFrame rate60 fpsUSB 2.0 ports quantity1HDMI ports quantity1HDMIYesGPSYesProcessorBuilt-in processorDRIMe IVDesignColour of productBrownPerformanceGPSYesBuilt-in processorDRIMe IVOperational conditionsOperating relative humidity (H-H)5 - 85%System requirementsMinimum hard disk space250 MBMinimum RAM512 MBMinimum processorIntel Core 2 Duo 1.66 GHz / AMD Athlon X2 Dual-Core 2.2 GHzWeight & dimensionsWidth12.2 cmDepth4.07 cmHeight6.37 cmWeight280gOther featuresFrame rate60 fpsUSB 2.0 ports quantity1HDMI ports quantity1",
    "still image resolutions": "1024 x 1024, 1728 x 1152, 1920 x 1080, 2000 x 2000, 2112 x 2112, 2640 x 2640, 2736 x 1824, 2944 x 1656, 2976 x 1984, 3648 x 3648, 3712 x 2088, 3888 x 2592, 5472 x 3080",
    "supported aspect ratios": "3:2, 16:9",
    "total megapixels": "21.6 MP",
    "touch sensitive screen": "Yes",
    "tripod mountable": "Yes",
    "usb 20 ports quantity": [
        "1",
        "1",
        "1"
    ],
    "usb connector type": "Micro-USB B",
    "usb version": "2.0",
    "variangle lcd display": "Yes",
    "video formats supported": "H.264, MP4, MPEG4",
    "video resolutions": "320 x 240, 640 x 480, 1280 x 720, 1920 x 810, 1920 x 1080 pixels",
    "voice recording": "Yes",
    "weight": "280g",
    "white balance": "Auto, Cloudy, Custom modes, Daylight, Flash, Fluorescent, Manual, Tungsten",
    "width": "12.2 cm",
    "wifi": "Yes",
    "wifi standards": "802.11b, 802.11g, 802.11n"
}