{
    "<page title>": "Sony WX220 Compact Camera with 10x Optical Zoom - Digital Cameras - Photo - Visual | ILGS.net",
    "ac adapter included": "Yes",
    "auto focusing af modes": "Centre weighted Auto Focus, Multi Point Auto Focus, Single Auto Focus",
    "auto mode focusing range tele": "1.5 - ?",
    "auto mode focusing range wide": "0.05 - ?",
    "batteries included": "Yes",
    "battery life cipa standard": "210 shots",
    "battery life max": "1.75h",
    "battery type": "NP-BN",
    "builtin flash": "Yes",
    "builtin microphone": "Yes",
    "cables included": "AC, USB",
    "camera playback": "Movie, Single image, Slide show",
    "camera shutter speed max": "0.000625s",
    "camera shutter speed min": "1s",
    "camera type": "Compact",
    "colour of product": [
        "Black",
        "Black"
    ],
    "compatible memory cards": "MicroSD (TransFlash), MicroSDHC, MicroSDXC, MS Duo, MS Micro (M2), MS PRO Duo, MS Pro-HG Duo, MS XC-HG Duo, SD, SDHC, SDXC",
    "depth": "2.16 cm",
    "digital zoom": "153x",
    "display": "LCD",
    "display diagonal": "6.86 cm (2.7\")",
    "display resolution numeric": "460800 pixels",
    "ean": "4905524980745",
    "flash modes": "Auto, Flash off, Flash on, Slow synchronization",
    "flash range tele": "1.5 - 2.2m",
    "flash range wide": "0.2 - 3.7m",
    "focal length range ff": "4.45 - 44.5 mm",
    "focus adjustment": "Auto",
    "full hd": "Yes",
    "hdmi": [
        "Yes",
        "Yes"
    ],
    "hdmi connector type": "Micro",
    "height": "5.24 cm",
    "image formats supported": "JPG",
    "image processor": "BIONZ X",
    "image sensor size": "25.4/58.4 mm (1/2.3\")",
    "image stabilizer": "Yes",
    "iso sensitivity": "100, 200, 400, 800, 1600, 3200, 6400, Auto",
    "iso sensitivity max": "12800",
    "iso sensitivity min": "100",
    "lens structure elementsgroups": "9/7",
    "light exposure correction": "\u00b1 2EV (1/3EV step)",
    "light exposure modes": "Auto",
    "light metering": "Centre-weighted, Evaluative (Multi-pattern), Spot",
    "manufacturer": "Sony",
    "maximum image resolution": "4896 x 3672 pixels",
    "maximum video resolution": "1920 x 1080 pixels",
    "megapixel": "18.2 MP",
    "motion jpeg frame rate": "50 fps",
    "near field communication nfc": "Yes",
    "optical zoom": "10x",
    "pdf url": "No",
    "photo effects": "Antique, Black&White",
    "power source type": "Battery",
    "product promotion": "N/A",
    "scene modes": "Beach, Fireworks, Food, Landscape, Night, Night portrait, Pet, Portrait, Snow, Twilight",
    "selftimer": "2, 10s",
    "sensor type": "CMOS",
    "shooting modes": "Auto, Movie, Scene",
    "short description": "18.2MP, 1/2.3\" Exmor R CMOS, Sony G lens, f = 4.45 - 44.5 mm, F3.3(W) - 5.9(T), NFC, Wi-Fi",
    "sku": "DSCWX220B.CEH",
    "specification": "Picture qualityImage sensor size25.4/58.4 mm (1/2.3\")Still image resolution(s)3:2 - 16M(4896\u00d73264) / 8.9M(3648\u00d72432) / 4.5M(2592\u00d71728)\n4:3 - 18M(4896\u00d73672) / 10M(3648\u00d72736) / 5M(2592\u00d71944) / VGA\n16:9 - 13M(4896\u00d72752) / 7.5M(3648\u00d72056) / 2.1M(1920\u00d71080)\n1:1 - 13M(3664\u00d73664) / 7.5M(2736\u00d72736) / 3.7M(1920\u00d71920)\n7152\u00d71080 / 4912\u00d71920 / 4912\u00d71080 / 3424\u00d7192 / 11520\u00d71080Image stabilizerYesImage formats supportedJPGMaximum image resolution4896 x 3672 pixelsSensor typeCMOSCamera typeCompactMegapixel18.2 MPLens systemFocal length range (f-f)4.45 - 44.5 mmLens structure (elements/groups)9/7Digital zoom153xOptical zoom10xFocusingFocus adjustmentAutoAuto focusing (AF) modesCentre weighted Auto Focus, Multi Point Auto Focus, Single Auto FocusAuto Mode focusing range (wide)0.05 - ?Auto Mode focusing range (tele)1.5 - ?Light exposureISO sensitivity100, 200, 400, 800, 1600, 3200, 6400, AutoLight exposure modesAutoLight exposure correction\u00b1 2EV (1/3EV step)Light meteringCentre-weighted, Evaluative (Multi-pattern), SpotISO sensitivity (min)100ISO sensitivity (max)12800ShutterCamera shutter speed (min)1sCamera shutter speed (max)0.000625sFlashFlash modesAuto, Flash off, Flash on, Slow synchronizationBuilt-in flashYesFlash range (wide)0.2 - 3.7mFlash range (tele)1.5 - 2.2mVideoVideo resolutions640 x 480, 1440 x 1080, 1920 x 1080 pixelsVideo formats supportedAVCHD, MP4Motion JPEG frame rate50 fpsFull HDYesMaximum video resolution1920 x 1080 pixelsAudioBuilt-in microphoneYesMemoryCompatible memory cardsMicroSD (TransFlash), MicroSDHC, MicroSDXC, MS Duo, MS Micro (M2), MS PRO Duo, MS Pro-HG Duo, MS XC-HG Duo, SD, SDHC, SDXCDisplayDisplayLCDDisplay diagonal6.86 cm (2.7\")Display resolution (numeric)460800 pixelsPorts & interfacesUSB version2.0HDMI connector typeMicroHDMIYesNetworkingWi-Fi standards802.11b, 802.11g, 802.11nNear Field Communication (NFC)YesWi-FiYesCameraColour of productBlackWhite balanceAuto, Cloudy, Custom modes, Daylight, Flash, Fluorescent, IncandescentScene modesBeach, Fireworks, Food, Landscape, Night, Night portrait, Pet, Portrait, Snow, TwilightShooting modesAuto, Movie, ScenePhoto effectsAntique, Black&WhiteSelf-timer2, 10sCamera playbackMovie, Single image, Slide showBatteryBattery life (CIPA standard)210 shotsBattery life (max)1.75hBattery typeNP-BNPower source typeBatteryTechnical detailsHDMIYesDesignColour of productBlackWeight & dimensionsWidth9.23 cmDepth2.16 cmHeight5.24 cmWeight105gWeight (including battery)121gPackaging contentCables includedAC, USBBatteries includedYesAC adapter includedYesTechnical detailsImage processorBIONZ X",
    "still image resolutions": "3:2 - 16M(4896\u00d73264) / 8.9M(3648\u00d72432) / 4.5M(2592\u00d71728)\n4:3 - 18M(4896\u00d73672) / 10M(3648\u00d72736) / 5M(2592\u00d71944) / VGA\n16:9 - 13M(4896\u00d72752) / 7.5M(3648\u00d72056) / 2.1M(1920\u00d71080)\n1:1 - 13M(3664\u00d73664) / 7.5M(2736\u00d72736) / 3.7M(1920\u00d71920)\n7152\u00d71080 / 4912\u00d71920 / 4912\u00d71080 / 3424\u00d7192 / 11520\u00d71080",
    "usb version": "2.0",
    "video formats supported": "AVCHD, MP4",
    "video resolutions": "640 x 480, 1440 x 1080, 1920 x 1080 pixels",
    "weight": "105g",
    "weight including battery": "121g",
    "white balance": "Auto, Cloudy, Custom modes, Daylight, Flash, Fluorescent, Incandescent",
    "width": "9.23 cm",
    "wifi": "Yes",
    "wifi standards": "802.11b, 802.11g, 802.11n"
}