{
    "<page title>": "Canon EOS 70D + 18-55mm IS STM - Digital Cameras - Photo - Visual | ILGS.net",
    "analog signal format system": "NTSC, PAL",
    "auto exposure ae lock": "Yes",
    "auto focus af assist beam": "Yes",
    "auto focus af lock": "Yes",
    "auto focus af points": "19",
    "auto focus af points selection": "Auto",
    "auto focusing af modes": "Face detection, Single Auto Focus",
    "batteries included": "Yes",
    "battery charger included": "Yes",
    "battery level indicator": [
        "Yes",
        "Yes"
    ],
    "battery life cipa standard": "920 shots",
    "battery type": [
        "LP-E6",
        "Rechargeable Li-ion Battery LP-E6"
    ],
    "builtin flash": [
        "Yes",
        "Yes"
    ],
    "builtin microphone": "Yes",
    "builtin processor": [
        "DIGIC 5+",
        "DIGIC 5+",
        "DIGIC 5+"
    ],
    "cables included": "USB",
    "camera file system": "DCF 2.0, DPOF 1.1, Exif 2.3",
    "camera shutter speed max": "30s",
    "camera shutter speed min": "0.000125s",
    "camera type": "SLR Kit",
    "colour of product": [
        "Black",
        "Black",
        "Black"
    ],
    "compatible memory cards": [
        "SD, SDHC, SDXC",
        "SD SDHC or SDXC (UHS-I)card"
    ],
    "depth": "7.85 cm",
    "dimensions w x d x h": "139 x 78.5 x 104.3 mm",
    "dioptre correction": "Yes",
    "display": "LCD",
    "display aspect ratio": "3:2",
    "display diagonal": "7.62 cm (3\")",
    "display resolution numeric": "1040000 pixels",
    "ean": "8714574610665",
    "field of view": "98%",
    "flash exposure compensation": "Yes",
    "flash exposure correction": "\u00b13EV (1/2; 1/3 EV step)",
    "flash exposure lock": "Yes",
    "flash guide number": "12m",
    "flash modes": "Auto, Manual, Red-eye reduction",
    "flash recharging time": "3s",
    "focus": "TTL",
    "focus adjustment": "Auto/Manual",
    "full hd": "Yes",
    "hand strap": "Yes",
    "hdmi": [
        "Yes",
        "Yes"
    ],
    "hdmi connector type": "Mini",
    "height": "10.43 cm",
    "histogram": "Yes",
    "image formats supported": "JPG, RAW",
    "image sensor size w x h": "22.5 x 15 mm",
    "iso sensitivity": [
        "Auto (100-12800)",
        "100, 200, 400, 800, 1600, 3200, 6400, 12800, 25600, Auto"
    ],
    "iso sensitivity max": "25600",
    "iso sensitivity min": "100",
    "languages support": [
        "ARA, CHI (SIMPL), CHI (TR), CZE, DAN, DEU, DUT, ENG, ESP, FIN, FRE, GRE, HUN, ITA, JPN, KOR, NOR, POL, POR, RUS, SWE, THA, TUR, UKR",
        "ARA, CHI (SIMPL), CHI (TR), CZE, DAN, DEU, DUT, ENG, ESP, FIN, FRE, GRE, HUN, ITA, JPN, KOR, NOR, POL, POR, RUS, SWE, THA, TUR, UKR"
    ],
    "lcd screen size": "3",
    "lens mount interface": "Canon EF, Canon EF-S",
    "lens system": "18-55mm Lens Included",
    "light exposure control": "Program AE",
    "light exposure correction": "\u00b15EV (1/2; 1/3 EV step)",
    "light exposure modes": "Aperture priority AE, Auto, Manual, Shutter priority AE",
    "light metering": "Centre-weighted, Evaluative (Multi-pattern), Spot",
    "live view": "Yes",
    "manufacturer": "Canon",
    "maximum image resolution": "5472 x 3648 pixels",
    "maximum video resolution": "1920 x 1080 pixels",
    "megapixel": [
        "20.2",
        "20.2 MP"
    ],
    "memory slots": "1",
    "motion jpeg frame rate": "50 fps",
    "number of batteries supported": "1",
    "operating relative humidity hh": "0 - 85%",
    "operating temperature tt": "0 - 40 \u00b0C",
    "pdf url": "No",
    "pictbridge": "Yes",
    "power source type": "Battery",
    "product promotion": "N/A",
    "scene modes": "Close-up (macro), Landscape, Night, Night portrait, Portrait, Sports, Sunset, Twilight",
    "second display": "No",
    "selftimer": "2, 10s",
    "sensor type": [
        "22.5mm x 15.0mm CMOS",
        "CMOS"
    ],
    "short description": "EOS 70D + 18-55mm IS STM - 20.2MP, CMOS, 3:2 Native, 5472 x 3648 max, 1/8000 - 30 sec, AF, AE, ISO 100-12800 (H: 25600), Video Full HD, PictBridge, USB, HDMI Type C, SD/SDHC /SDXC, WiFi, 7.62 cm (3.0 \") TFT LCD Touchscreen",
    "sku": "8469B031AA",
    "specification": "Picture qualitySupported aspect ratios1:1, 3:2, 16:9Still image resolution(s)480 x 480, 640 x 480, 720 x 480, 1280 x 1280, 1696 x 1280, 1920 x 1080, 1920 x 1280, 2736 x 1824, 2736 x 2736, 3648 x 2048, 3648 x 2432, 3648 x 2736, 3648 x 3648, 5472 x 3080, 5472 x 3648Total megapixels20.9 MPImage sensor size (W x H)22.5 x 15 mmImage formats supportedJPG, RAWMaximum image resolution5472 x 3648 pixelsSensor typeCMOSCamera typeSLR KitMegapixel20.2 MPLens systemLens mount interfaceCanon EF, Canon EF-SFocusingFocusTTLFocus adjustmentAuto/ManualAuto focusing (AF) modesFace detection, Single Auto FocusAuto Focus (AF) points selectionAutoAuto Focus (AF) points19Auto Focus (AF) lockYesAuto Focus (AF) assist beamYesLight exposureISO sensitivity100, 200, 400, 800, 1600, 3200, 6400, 12800, 25600, AutoLight exposure modesAperture priority AE, Auto, Manual, Shutter priority AELight exposure controlProgram AELight exposure correction\u00b15EV (1/2; 1/3 EV step)Light meteringCentre-weighted, Evaluative (Multi-pattern), SpotAuto Exposure (AE) lockYesISO sensitivity (min)100ISO sensitivity (max)25600ShutterCamera shutter speed (min)0.000125sCamera shutter speed (max)30sFlashFlash modesAuto, Manual, Red-eye reductionBuilt-in flashYesFlash recharging time3sFlash guide number12mFlash exposure lockYesFlash exposure correction\u00b13EV (1/2; 1/3 EV step)Flash exposure compensationYesVideoVideo resolutions640 x 480, 1280 x 720, 1920 x 1080 pixelsVideo formats supportedH.264, MOVMotion JPEG frame rate50 fpsFull HDYesAnalog signal format systemNTSC, PALMaximum video resolution1920 x 1080 pixelsAudioBuilt-in microphoneYesMemoryCompatible memory cardsSD, SDHC, SDXCMemory slots1DisplayDisplay aspect ratio3:2DisplayLCDDisplay diagonal7.62 cm (3\")Display resolution (numeric)1040000 pixelsVari-angle LCD displayYesTouch sensitive screenYesSecond displayNoField of view98%Ports & interfacesUSB version2.0HDMI connector typeMiniPictBridgeYesHDMIYesNetworkingWi-FiYesCameraColour of productBlackWhite balanceAuto, Cloudy, Custom modes, Flash, Fluorescent, Shade, TungstenScene modesClose-up (macro), Landscape, Night, Night portrait, Portrait, Sports, Sunset, TwilightSelf-timer2, 10sMulti-shotYesLive viewYesLanguages supportARA, CHI (SIMPL), CHI (TR), CZE, DAN, DEU, DUT, ENG, ESP, FIN, FRE, GRE, HUN, ITA, JPN, KOR, NOR, POL, POR, RUS, SWE, THA, TUR, UKRHistogramYesDioptre correctionYesCamera file systemDCF 2.0, DPOF 1.1, Exif 2.3Built-in processorDIGIC 5+BatteryBattery life (CIPA standard)920 shotsBattery typeLP-E6Number of batteries supported1Battery level indicatorYesPower source typeBatteryTechnical detailsLanguages supportARA, CHI (SIMPL), CHI (TR), CZE, DAN, DEU, DUT, ENG, ESP, FIN, FRE, GRE, HUN, ITA, JPN, KOR, NOR, POL, POR, RUS, SWE, THA, TUR, UKRHDMIYesBattery level indicatorYesProcessorBuilt-in processorDIGIC 5+DesignColour of productBlackPerformanceBuilt-in processorDIGIC 5+Operational conditionsOperating temperature (T-T)0 - 40 \u00b0COperating relative humidity (H-H)0 - 85%Weight & dimensionsWidth13.9 cmDepth7.85 cmHeight10.43 cmWeight755gPackaging contentHand strapYesCables includedUSBBattery charger includedYesBatteries includedYes",
    "still image resolutions": "480 x 480, 640 x 480, 720 x 480, 1280 x 1280, 1696 x 1280, 1920 x 1080, 1920 x 1280, 2736 x 1824, 2736 x 2736, 3648 x 2048, 3648 x 2432, 3648 x 2736, 3648 x 3648, 5472 x 3080, 5472 x 3648",
    "supported aspect ratios": "1:1, 3:2, 16:9",
    "total megapixels": "20.9 MP",
    "touch sensitive screen": "Yes",
    "type": "Single Lens Kit",
    "usb version": "2.0",
    "variangle lcd display": "Yes",
    "video capability": "Yes",
    "video formats supported": "H.264, MOV",
    "video resolutions": "640 x 480, 1280 x 720, 1920 x 1080 pixels",
    "warranty": "1 Year",
    "weatherproof": "No",
    "weight": [
        "755g",
        "755 g"
    ],
    "white balance": [
        "Auto, Cloudy, Custom modes, Flash, Fluorescent, Shade, Tungsten",
        "Auto White Balance with the imaging sensor"
    ],
    "width": "13.9 cm",
    "wifi": "Yes"
}