{
    "<page title>": "Fujifilm S9200 - Digital Cameras - Photo - Visual | ILGS.net",
    "auto focusing af modes": "Continuous Auto Focus, Single Auto Focus, Tracking Auto Focus",
    "batteries included": "Yes",
    "battery life cipa standard": "300 shots",
    "battery technology": "Alkaline",
    "battery type": "AA",
    "builtin microphone": "Yes",
    "cables included": "USB",
    "camera shutter speed max": "8s",
    "camera shutter speed min": "0.00058s",
    "camera shutter type": "Electronic",
    "camera type": "Bridge",
    "colour of product": [
        "White",
        "White"
    ],
    "combined zoom": "100x",
    "compatible memory cards": "SD, SDHC, SDXC",
    "depth": "11.62 cm",
    "digital zoom": "2x",
    "display": "LCD",
    "display diagonal": "7.62 cm (3\")",
    "display resolution numeric": "460000 pixels",
    "ean": "4547410262834",
    "field of view": "97%",
    "flash modes": "Auto, Red-eye reduction, Slow synchronization",
    "focal length range ff": "4.3 - 215 mm",
    "focus": "TTL",
    "focus adjustment": "Auto",
    "full hd": "Yes",
    "hand strap": "Yes",
    "hdmi": [
        "Yes",
        "Yes"
    ],
    "hdmi connector type": "Mini",
    "height": "8.69 cm",
    "image formats supported": "JPG, RAW",
    "image sensor size": "25.4/58.4 mm (1/2.3\")",
    "image stabilizer": "Yes",
    "internal memory": "38 MB",
    "iso sensitivity": "100, 200, 400, 800, 1600, 3200, 6400, 12800",
    "iso sensitivity max": "12800",
    "iso sensitivity min": "100",
    "lens structure elementsgroups": "17/12",
    "lens type": "High power zoom",
    "light exposure control": "Program AE",
    "light exposure correction": "\u00b1 2EV (1/3EV step)",
    "light exposure modes": "Aperture priority AE, Manual, Shutter priority AE",
    "light metering": "Centre-weighted, Evaluative (Multi-pattern)",
    "macro focusing range tele": "3.5 - 5m",
    "macro focusing range wide": "0.07 - 3m",
    "manufacturer": "Fujifilm",
    "maximum aperture": "19",
    "maximum focal length 35mm film equiv": "120 cm",
    "maximum image resolution": "4608 x 3456 pixels",
    "maximum video resolution": "1920 x 1080 pixels",
    "megapixel": "16.2 MP",
    "minimum aperture": "2.9",
    "minimum focal length 35mm film equiv": "2.4 cm",
    "motion jpeg frame rate": "30 fps",
    "number of batteries supported": "4",
    "operating relative humidity hh": "10 - 80%",
    "operating temperature tt": "0 - 40 \u00b0C",
    "optical zoom": "50x",
    "pdf url": "No",
    "pictbridge": "Yes",
    "power source type": "Battery",
    "product promotion": "N/A",
    "scene modes": "Beach, Children, Fireworks, Flower, Landscape, Night, Party (indoor), Portrait, Snow, Sports",
    "selftimer": "2, 10s",
    "sensor type": "CMOS",
    "short description": "16.2MP BSI-CMOS, 50x, 24 x 1200mm, 7.62 cm (3 \") LCD, 12800 ISO, AA",
    "sku": "P10NC12710A",
    "specification": "Picture qualityImage sensor size25.4/58.4 mm (1/2.3\")Supported aspect ratios3:2, 4:3, 16:9Still image resolution(s)4608 x 3456\n4608 x 3072\n4608 x 2592\n3456 x 3456\n3264 x 2448\n3264 x 2176\n3264 x 1840\n2432 x 2432\n2304 x 1728\n2304 x 1536\n1920 x 1080\n1728 x 1728Image stabilizerYesImage formats supportedJPG, RAWMaximum image resolution4608 x 3456 pixelsSensor typeCMOSCamera typeBridgeMegapixel16.2 MPLens systemFocal length range (f-f)4.3 - 215 mmMinimum focal length (35mm film equiv)2.4 cmMaximum focal length (35mm film equiv)120 cmMinimum aperture2.9Maximum aperture19Lens structure (elements/groups)17/12Lens typeHigh power zoomCombined zoom100xDigital zoom2xOptical zoom50xFocusingFocusTTLFocus adjustmentAutoAuto focusing (AF) modesContinuous Auto Focus, Single Auto Focus, Tracking Auto FocusSuper Macro focusing range0.01 - 1mMacro focusing range (wide)0.07 - 3mMacro focusing range (tele)3.5 - 5mLight exposureISO sensitivity100, 200, 400, 800, 1600, 3200, 6400, 12800Light exposure modesAperture priority AE, Manual, Shutter priority AELight exposure controlProgram AELight exposure correction\u00b1 2EV (1/3EV step)Light meteringCentre-weighted, Evaluative (Multi-pattern)ISO sensitivity (min)100ISO sensitivity (max)12800ShutterCamera shutter speed (min)0.00058sCamera shutter speed (max)8sCamera shutter typeElectronicFlashFlash modesAuto, Red-eye reduction, Slow synchronizationVideoVideo resolutions640 x 480, 1280 x 720, 1920 x 1080 pixelsVideo formats supportedH.264, MOVMotion JPEG frame rate30 fpsFull HDYesMaximum video resolution1920 x 1080 pixelsAudioBuilt-in microphoneYesVoice recordingYesMemoryInternal memory38 MBCompatible memory cardsSD, SDHC, SDXCDisplayDisplayLCDDisplay diagonal7.62 cm (3\")Display resolution (numeric)460000 pixelsField of view97%ViewfinderViewfinder typeElectricalPorts & interfacesUSB version2.0HDMI connector typeMiniPictBridgeYesHDMIYesNetworkingWi-Fi standards802.11b, 802.11g, 802.11nWi-FiYesCameraColour of productWhiteWhite balanceAuto, Daylight, Fine, Fluorescent, Incandescent, ShadeScene modesBeach, Children, Fireworks, Flower, Landscape, Night, Party (indoor), Portrait, Snow, SportsSelf-timer2, 10sBatteryBattery technologyAlkalineBattery life (CIPA standard)300 shotsBattery typeAANumber of batteries supported4Power source typeBatteryTechnical detailsHDMIYesDesignColour of productWhiteOperational conditionsOperating temperature (T-T)0 - 40 \u00b0COperating relative humidity (H-H)10 - 80%Weight & dimensionsWidth12.26 cmDepth11.62 cmHeight8.69 cmWeight577gWeight (including battery)670gPackaging contentHand strapYesCables includedUSBBatteries includedYes",
    "still image resolutions": "4608 x 3456\n4608 x 3072\n4608 x 2592\n3456 x 3456\n3264 x 2448\n3264 x 2176\n3264 x 1840\n2432 x 2432\n2304 x 1728\n2304 x 1536\n1920 x 1080\n1728 x 1728",
    "supported aspect ratios": "3:2, 4:3, 16:9",
    "usb version": "2.0",
    "video formats supported": "H.264, MOV",
    "video resolutions": "640 x 480, 1280 x 720, 1920 x 1080 pixels",
    "viewfinder type": "Electrical",
    "voice recording": "Yes",
    "weight": "577g",
    "weight including battery": "670g",
    "white balance": "Auto, Daylight, Fine, Fluorescent, Incandescent, Shade",
    "width": "12.26 cm",
    "wifi": "Yes",
    "wifi standards": "802.11b, 802.11g, 802.11n"
}