{
    "<page title>": "Canon PowerShot G1X - Digital Cameras - Photo - Visual | ILGS.net",
    "analog signal format system": "NTSC, PAL",
    "auto exposure ae lock": "Yes",
    "auto focus af assist beam": "Yes",
    "auto focus af lock": "Yes",
    "auto focus af points": "9",
    "auto focusing af modes": "Continuous Auto Focus, Face detection, Multi Point Auto Focus, Servo Auto Focus, Single Auto Focus, Tracking Auto Focus",
    "batteries included": "Yes",
    "battery charger included": "Yes",
    "battery life cipa standard": "250 shots",
    "battery technology": "Lithium-Ion (Li-Ion)",
    "battery type": [
        "Rechargeable Li-ion Battery NB-10L",
        "NB-10L"
    ],
    "builtin flash": [
        "Yes",
        "Yes"
    ],
    "builtin microphone": "Yes",
    "builtin processor": [
        "DIGIC 5 + iSAPS",
        "DIGIC 5 + iSAPS",
        "DIGIC 5 + iSAPS"
    ],
    "camera file system": "DPOF 1.1, Exif 2.3, RAW",
    "camera playback": "Movie, Single image",
    "camera shutter speed": [
        "1 - 1/4000; 60 - 1/4000s",
        "1 - 1/4000 sec. (factory default) 60 - 1/4000 sec. (total range \u2013 varies by shooting mode)"
    ],
    "camera type": "Bridge",
    "closest focusing distance": "0.2m",
    "colour of product": [
        "Black",
        "Black",
        "Black"
    ],
    "combined zoom": "16x",
    "compatible memory cards": [
        "SD, SDHC, SDXC",
        "SD SDHC SDXC"
    ],
    "depth": "6.47 cm",
    "digital slr": [
        "No",
        "No"
    ],
    "digital zoom": [
        "4x",
        "4 x"
    ],
    "dimensions w x d x h": "116.7 x 64.7 x 80.5 mm",
    "dioptre correction": "Yes",
    "display": "TFT",
    "display diagonal": "7.11 cm (2.8\")",
    "display resolution numeric": "920000 pixels",
    "durable": "No",
    "ean": "8714574577753",
    "external flash connector": "Yes",
    "field of view": "100%",
    "flash exposure compensation": "Yes",
    "flash exposure correction": "\u00b12EV (1/3 EV step)",
    "flash exposure lock": "Yes",
    "flash modes": "Auto, Flash off, Flash on, Red-eye reduction, Slow synchronization",
    "flash range tele": "1 - 3.1m",
    "flash range wide": "0.5 - 7m",
    "flash syncspeed": "1/4000s",
    "focal length range ff": "15.1 - 60.4 mm",
    "focus": "TTL",
    "focus adjustment": "Auto/Manual",
    "full hd": "Yes",
    "hdmi ports quantity": [
        "1",
        "1",
        "1"
    ],
    "height": "8.05 cm",
    "histogram": "Yes",
    "image editing": "Resizing",
    "image sensor size w x h": "18.7 x 14 mm",
    "image stabilizer": "Yes",
    "image stabilizer location": [
        "Lens",
        "Lens"
    ],
    "iso sensitivity": "100, 125, 160, 200, 250, 320, 400, 500, 640, 800, 1000, 1250, 1600, 2000, 2500, 3200, 4000, 5000, 6400, 8000, 10000, 12800, Auto",
    "iso sensitivity max": "12800",
    "iso sensitivity min": "100",
    "lcd screen size": "3",
    "lens structure elementsgroups": "11/10",
    "light exposure control": "Program AE",
    "light exposure correction": "\u00b1 3EV (1/3EV step)",
    "light exposure modes": "Auto",
    "light metering": "Centre-weighted, Evaluative (Multi-pattern), Spot",
    "manufacturer": "Canon",
    "maximum aperture": "5.8",
    "maximum focal length 35mm film equiv": "11.2 cm",
    "maximum image resolution": "4352 x 3264 pixels",
    "maximum video resolution": "1920 x 1080 pixels",
    "megapixel": [
        "14.3 MP",
        "14.3"
    ],
    "memory slots": "1",
    "minimum aperture": "2.8",
    "minimum focal length 35mm film equiv": "2.8 cm",
    "motion jpeg frame rate": "24 fps",
    "number of batteries supported": "1",
    "on screen display osd languages": "ARA, CHI (SIMPL), CHI (TR), CZE, DAN, DEU, DUT, ENG, ESP, FIN, FRE, GRE, HUN, ITA, JPN, KOR, NOR, POL, POR, RUM, RUS, SWE, THA, TUR, UKR",
    "operating relative humidity hh": "10 - 90%",
    "operating temperature tt": "0 - 40 \u00b0C",
    "optical zoom": [
        "4x",
        "4 x"
    ],
    "pdf url": "No",
    "photo effects": "Black&White, Neutral, Positive film, Sepia, Skin tones, Vivid",
    "pictbridge": "Yes",
    "playback zoom max": "10x",
    "power source type": "Battery",
    "product promotion": "N/A",
    "scene modes": "Beach, Children, Fireworks, Landscape, Portrait, Snow, Underwater",
    "selftimer": "2, 10s",
    "sensor type": [
        "CMOS",
        "18.7 mm x 14.0 mm Canon high-sensitivity CMOS"
    ],
    "shooting modes": "Aperture priority, Manual, Movie, Program, Scene, Shutter priority",
    "short description": "PowerShot G1X - 14.3MP, 18.7 x 14.0 mm CMOS, 4352 x 3264, 4x Optical zoom, Full HD Movie, 7.62 cm (3.0 \") TFT LCD, USB 2.0, HDMI, 534g, Black",
    "sku": "5249B011AA",
    "specification": "Picture qualitySupported aspect ratios3:2, 4:3, 16:9Still image resolution(s)384 x 480, 480 x 480, 640 x 360, 640 x 424, 640 x 480, 960 x 1200, 1200 x 1200, 1600 x 1064, 1600 x 1200, 1840 x 2304, 1920 x 1080, 2304 x 2304, 2608 x 3264, 3072 x 1728, 3072 x 2048, 3072 x 2304, 3264 x 3264, 4352 x 2248, 4352 x 2904Image stabilizerYesImage sensor size (W x H)18.7 x 14 mmImage stabilizer locationLensMaximum image resolution4352 x 3264 pixelsSensor typeCMOSCamera typeBridgeMegapixel14.3 MPLens systemFocal length range (f-f)15.1 - 60.4 mmMinimum focal length (35mm film equiv)2.8 cmMaximum focal length (35mm film equiv)11.2 cmMinimum aperture2.8Maximum aperture5.8Lens structure (elements/groups)11/10Combined zoom16xNumber of aspheric elements3Digital zoom4xOptical zoom4xFocusingFocusTTLFocus adjustmentAuto/ManualAuto focusing (AF) modesContinuous Auto Focus, Face detection, Multi Point Auto Focus, Servo Auto Focus, Single Auto Focus, Tracking Auto FocusClosest focusing distance0.2mAuto Focus (AF) points9Auto Focus (AF) lockYesAuto Focus (AF) assist beamYesLight exposureISO sensitivity100, 125, 160, 200, 250, 320, 400, 500, 640, 800, 1000, 1250, 1600, 2000, 2500, 3200, 4000, 5000, 6400, 8000, 10000, 12800, AutoLight exposure modesAutoLight exposure controlProgram AELight exposure correction\u00b1 3EV (1/3EV step)Light meteringCentre-weighted, Evaluative (Multi-pattern), SpotAuto Exposure (AE) lockYesISO sensitivity (min)100ISO sensitivity (max)12800FlashFlash modesAuto, Flash off, Flash on, Red-eye reduction, Slow synchronizationBuilt-in flashYesFlash sync-speed1/4000sFlash range (wide)0.5 - 7mFlash range (tele)1 - 3.1mFlash exposure lockYesFlash exposure correction\u00b12EV (1/3 EV step)Flash exposure compensationYesExternal flash connectorYesVideoVideo resolutions640 x 480, 1280 x 720 pixelsVideo formats supportedH.264, MOVMotion JPEG frame rate24 fpsFull HDYesAnalog signal format systemNTSC, PALMaximum video resolution1920 x 1080 pixelsAudioBuilt-in microphoneYesMemoryCompatible memory cardsSD, SDHC, SDXCMemory slots1DisplayDisplayTFTDisplay diagonal7.11 cm (2.8\")Display resolution (numeric)920000 pixelsVari-angle LCD displayYesField of view100%ViewfinderViewfinder typeOpticalPorts & interfacesPictBridgeYesUSB 2.0 ports quantity1USB connector typeMini-USB BHDMI ports quantity1CameraImage stabilizer locationLensColour of productBlackWhite balanceAuto, Cloudy, Custom modes, Daylight, Flash, Fluorescent, Fluorescent H, Tungsten, UnderwaterScene modesBeach, Children, Fireworks, Landscape, Portrait, Snow, UnderwaterShooting modesAperture priority, Manual, Movie, Program, Scene, Shutter priorityPhoto effectsBlack&White, Neutral, Positive film, Sepia, Skin tones, VividSelf-timer2, 10sCamera playbackMovie, Single imageMulti burst modeYesPlayback zoom (max)10xOn Screen Display (OSD) languagesARA, CHI (SIMPL), CHI (TR), CZE, DAN, DEU, DUT, ENG, ESP, FIN, FRE, GRE, HUN, ITA, JPN, KOR, NOR, POL, POR, RUM, RUS, SWE, THA, TUR, UKRImage editingResizingHistogramYesDioptre correctionYesCamera file systemDPOF 1.1, Exif 2.3, RAWBuilt-in processorDIGIC 5 + iSAPSBatteryBattery technologyLithium-Ion (Li-Ion)Battery life (CIPA standard)250 shotsBattery typeNB-10LNumber of batteries supported1Power source typeBatteryTechnical detailsUSB 2.0 ports quantity1HDMI ports quantity1Video memory capacity29min. 59sec.On/off switchYesDigital SLRNoProcessorBuilt-in processorDIGIC 5 + iSAPSDesignColour of productBlackPerformanceBuilt-in processorDIGIC 5 + iSAPSOperational conditionsOperating temperature (T-T)0 - 40 \u00b0COperating relative humidity (H-H)10 - 90%Weight & dimensionsWidth11.67 cmDepth6.47 cmHeight8.05 cmWeight (including battery)534gPackaging contentBattery charger includedYesBatteries includedYesOther featuresUSB 2.0 ports quantity1Video capabilityYesHDMI ports quantity1Video memory capacity29min. 59sec.On/off switchYesCamera shutter speed1 - 1/4000; 60 - 1/4000sDigital SLRNo",
    "still image resolutions": "384 x 480, 480 x 480, 640 x 360, 640 x 424, 640 x 480, 960 x 1200, 1200 x 1200, 1600 x 1064, 1600 x 1200, 1840 x 2304, 1920 x 1080, 2304 x 2304, 2608 x 3264, 3072 x 1728, 3072 x 2048, 3072 x 2304, 3264 x 3264, 4352 x 2248, 4352 x 2904",
    "supported aspect ratios": "3:2, 4:3, 16:9",
    "usb 20 ports quantity": [
        "1",
        "1",
        "1"
    ],
    "usb connector type": "Mini-USB B",
    "variangle lcd display": "Yes",
    "video capability": [
        "Yes",
        "Yes"
    ],
    "video formats supported": "H.264, MOV",
    "video resolutions": "640 x 480, 1280 x 720 pixels",
    "viewfinder type": "Optical",
    "warranty": "1 Year",
    "weight": "534 g",
    "weight including battery": "534g",
    "white balance": "Auto, Cloudy, Custom modes, Daylight, Flash, Fluorescent, Fluorescent H, Tungsten, Underwater",
    "width": "11.67 cm"
}