{
    "<page title>": "Sony ?6000 Black Body + 16-70mm Mid-Range Zoom Lens - Digital Cameras - Photo - Visual | ILGS.net",
    "ac adapter included": "Yes",
    "audio system": [
        "Stereo",
        "Stereo"
    ],
    "auto focus af assist beam": "Yes",
    "auto focus af lock": "Yes",
    "auto focus af points": "179",
    "auto focus af points selection": "Auto",
    "auto focusing af modes": "Continuous Auto Focus",
    "batteries included": "Yes",
    "battery charger included": "Yes",
    "battery life cipa standard": "360 shots",
    "battery life max": "1.5h",
    "battery type": "NP-FW50",
    "brightness adjustment": "Yes",
    "builtin flash": "Yes",
    "builtin microphone": "Yes",
    "builtin processor": [
        "BIONZ X",
        "BIONZ X",
        "BIONZ X"
    ],
    "cables included": "USB",
    "camera file system": "DCF 2.0, Exif 2.3, RAW",
    "camera shutter speed max": "0.00025s",
    "camera shutter speed min": "30s",
    "camera shutter type": "Electronic",
    "camera type": "MILC",
    "colour of product": [
        "Black",
        "Black"
    ],
    "compatible memory cards": "MS PRO Duo, MS Pro-HG Duo, MS XC-HG Duo, SD, SDHC, SDXC",
    "contrast adjustment": "Yes",
    "depth": "4.51 cm",
    "display": "TFT",
    "display diagonal": "7.62 cm (3\")",
    "display resolution numeric": "921600 pixels",
    "ean": "5013493248403",
    "external flash connector": "Yes",
    "field of view": "100%",
    "flash exposure correction": "\u00b13EV (1/2; 1/3 EV step)",
    "flash modes": "Auto, Fill-in, Flash off, Flash on, Red-eye reduction, Slow synchronization",
    "flash syncspeed": "1/160s",
    "focal length range ff": "17 - 70 mm",
    "full hd": "Yes",
    "hand strap": "Yes",
    "hdmi": [
        "Yes",
        "Yes"
    ],
    "hdmi connector type": "Micro",
    "height": "6.69 cm",
    "histogram": "Yes",
    "image formats supported": "JPG",
    "image processor": "BIONZ X",
    "image sensor size w x h": "23.5 x 15.6 mm",
    "image stabilizer": "Yes",
    "image stabilizer location": [
        "Lens",
        "Lens"
    ],
    "iso sensitivity": "100, 200, 400, 800, 1600, 3200, 6400, 12800, 25600, 51200",
    "iso sensitivity max": "51200",
    "iso sensitivity min": "100",
    "lens mount interface": "Sony E",
    "light exposure control": "Program AE",
    "light exposure correction": "\u00b15EV (1/2; 1/3 EV step)",
    "light exposure modes": "Aperture priority AE, Auto, Manual, Shutter priority AE",
    "light metering": "Centre-weighted, Evaluative (Multi-pattern), Spot",
    "mac operating systems supported": [
        "Mac OS X 10.6 Snow Leopard, Mac OS X 10.7 Lion, Mac OS X 10.8 Mountain Lion, Mac OS X 10.9 Mavericks",
        "Mac OS X 10.6 Snow Leopard, Mac OS X 10.7 Lion, Mac OS X 10.8 Mountain Lion, Mac OS X 10.9 Mavericks"
    ],
    "magnification": "1.07x",
    "manufacturer": "Sony",
    "maximum image resolution": "6000 x 4000 pixels",
    "megapixel": "24.3 MP",
    "near field communication nfc": "Yes",
    "normal focusing range": "0.3 - 3.0m",
    "number of batteries supported": "1",
    "pdf url": "No",
    "photo effects": "Neutral, Vivid",
    "power source type": "Battery",
    "product promotion": "N/A",
    "reviews": "No",
    "saturation adjustment": "Yes",
    "scene modes": "Portrait, Landscape, Sunset, Night Portrait",
    "selftimer": "2, 10s",
    "sensor format": "Advanced Photo System type-C (APS-C)",
    "sensor type": "CMOS",
    "short description": "Body + 16-70mm, 24.3 MP, APS-C type (23.5 x 15.6mm) Exmor APS HD CMOS, 6000 x 4000, Memory Stick XC-HG Duo, SDXC, ISO 100 - 51200, 7.62 cm (3.0 \") TFT",
    "sku": "ILCE6000LBZDI.EU",
    "smile detection": "Yes",
    "specification": "Picture qualitySensor formatAdvanced Photo System type-C (APS-C)Supported aspect ratios3:2, 16:9Still image resolution(s)6000 x 4000, 4240 x 2832, 3008 x 2000, 6000 x 3376, 4240 x 2400, 3008 x 1688, 12416 x 1856, 5536 x 2160, 8192 x 1856, 3872 x 2160Image stabilizerYesTotal megapixels24.7 MPImage sensor size (W x H)23.5 x 15.6 mmImage stabilizer locationLensImage formats supportedJPGMaximum image resolution6000 x 4000 pixelsSensor typeCMOSCamera typeMILCMegapixel24.3 MPLens systemFocal length range (f-f)17 - 70 mmExtra/Smart zoom4xLens mount interfaceSony EFocusingAuto focusing (AF) modesContinuous Auto FocusSmile detectionYesNormal focusing range0.3 - 3.0mAuto Focus (AF) points selectionAutoAuto Focus (AF) points179Auto Focus (AF) lockYesAuto Focus (AF) assist beamYesLight exposureISO sensitivity100, 200, 400, 800, 1600, 3200, 6400, 12800, 25600, 51200Light exposure modesAperture priority AE, Auto, Manual, Shutter priority AELight exposure controlProgram AELight exposure correction\u00b15EV (1/2; 1/3 EV step)Light meteringCentre-weighted, Evaluative (Multi-pattern), SpotISO sensitivity (min)100ISO sensitivity (max)51200ShutterCamera shutter speed (min)30sCamera shutter speed (max)0.00025sCamera shutter typeElectronicFlashFlash modesAuto, Fill-in, Flash off, Flash on, Red-eye reduction, Slow synchronizationBuilt-in flashYesPre-flashYesFlash sync-speed1/160sFlash exposure correction\u00b13EV (1/2; 1/3 EV step)External flash connectorYesVideoVideo resolutions1920 x 1080 pixelsVideo formats supportedAVCHD, H.264, MP4, MPEG4Full HDYesAudioBuilt-in microphoneYesAudio systemStereoMemoryCompatible memory cardsMS PRO Duo, MS Pro-HG Duo, MS XC-HG Duo, SD, SDHC, SDXCDisplayDisplayTFTDisplay diagonal7.62 cm (3\")Display resolution (numeric)921600 pixelsField of view100%ViewfinderViewfinder typeElectricalMagnification1.07xPorts & interfacesHDMI connector typeMicroUSB connector typeUSB BHDMIYesNetworkingNear Field Communication (NFC)YesWi-FiYesCameraImage stabilizer locationLensColour of productBlackWhite balanceAuto, Cloudy, Daylight, Flash, Fluorescent, Incandescent, Shade, UnderwaterScene modesPortrait, Landscape, Sunset, Night PortraitPhoto effectsNeutral, VividSelf-timer2, 10sContrast adjustmentYesSaturation adjustmentYesTripod mountableYesHistogramYesCamera file systemDCF 2.0, Exif 2.3, RAWBuilt-in processorBIONZ XBrightness adjustmentYesBatteryBattery life (CIPA standard)360 shotsBattery life (max)1.5hBattery typeNP-FW50Number of batteries supported1Power source typeBatteryOperating system/softwareWindows operating systems supportedWindows 7 Home Basic, Windows 7 Home Basic x64, Windows 7 Home Premium, Windows 7 Home Premium x64, Windows 7 Professional, Windows 7 Professional x64, Windows 7 Starter, Windows 7 Starter x64, Windows 7 Ultimate, Windows 7 Ultimate x64, Windows 8, Windows 8 Enterprise, Windows 8 Enterprise x64, Windows 8 Pro, Windows 8 Pro x64, Windows 8 x64, Windows 8.1, Windows 8.1 Enterprise, Windows 8.1 Enterprise x64, Windows 8.1 Pro, Windows 8.1 Pro x64, Windows 8.1 x64, Windows Vista Business, Windows Vista Business x64, Windows Vista Enterprise, Windows Vista Enterprise x64, Windows Vista Home Basic, Windows Vista Home Basic x64, Windows Vista Home Premium, Windows Vista Home Premium x64, Windows Vista UltimateMac operating systems supportedMac OS X 10.6 Snow Leopard, Mac OS X 10.7 Lion, Mac OS X 10.8 Mountain Lion, Mac OS X 10.9 MavericksTechnical detailsPre-flashYesHDMIYesAudio systemStereoProcessorBuilt-in processorBIONZ XDesignColour of productBlackPerformanceBuilt-in processorBIONZ XSystem requirementsWindows operating systems supportedWindows 7 Home Basic, Windows 7 Home Basic x64, Windows 7 Home Premium, Windows 7 Home Premium x64, Windows 7 Professional, Windows 7 Professional x64, Windows 7 Starter, Windows 7 Starter x64, Windows 7 Ultimate, Windows 7 Ultimate x64, Windows 8, Windows 8 Enterprise, Windows 8 Enterprise x64, Windows 8 Pro, Windows 8 Pro x64, Windows 8 x64, Windows 8.1, Windows 8.1 Enterprise, Windows 8.1 Enterprise x64, Windows 8.1 Pro, Windows 8.1 Pro x64, Windows 8.1 x64, Windows Vista Business, Windows Vista Business x64, Windows Vista Enterprise, Windows Vista Enterprise x64, Windows Vista Home Basic, Windows Vista Home Basic x64, Windows Vista Home Premium, Windows Vista Home Premium x64, Windows Vista UltimateMac operating systems supportedMac OS X 10.6 Snow Leopard, Mac OS X 10.7 Lion, Mac OS X 10.8 Mountain Lion, Mac OS X 10.9 MavericksWeight & dimensionsWidth12 cmDepth4.51 cmHeight6.69 cmWeight285gWeight (including battery)344gPackaging contentHand strapYesCables includedUSBBattery charger includedYesBatteries includedYesAC adapter includedYesTechnical detailsImage processorBIONZ XSmartphone remote supportYesBuilt-in speaker(s)Yes",
    "still image resolutions": "6000 x 4000, 4240 x 2832, 3008 x 2000, 6000 x 3376, 4240 x 2400, 3008 x 1688, 12416 x 1856, 5536 x 2160, 8192 x 1856, 3872 x 2160",
    "supported aspect ratios": "3:2, 16:9",
    "total megapixels": "24.7 MP",
    "tripod mountable": "Yes",
    "usb connector type": "USB B",
    "video formats supported": "AVCHD, H.264, MP4, MPEG4",
    "video resolutions": "1920 x 1080 pixels",
    "viewfinder type": "Electrical",
    "weight": "285g",
    "weight including battery": "344g",
    "white balance": "Auto, Cloudy, Daylight, Flash, Fluorescent, Incandescent, Shade, Underwater",
    "width": "12 cm",
    "wifi": "Yes",
    "windows operating systems supported": [
        "Windows 7 Home Basic, Windows 7 Home Basic x64, Windows 7 Home Premium, Windows 7 Home Premium x64, Windows 7 Professional, Windows 7 Professional x64, Windows 7 Starter, Windows 7 Starter x64, Windows 7 Ultimate, Windows 7 Ultimate x64, Windows 8, Windows 8 Enterprise, Windows 8 Enterprise x64, Windows 8 Pro, Windows 8 Pro x64, Windows 8 x64, Windows 8.1, Windows 8.1 Enterprise, Windows 8.1 Enterprise x64, Windows 8.1 Pro, Windows 8.1 Pro x64, Windows 8.1 x64, Windows Vista Business, Windows Vista Business x64, Windows Vista Enterprise, Windows Vista Enterprise x64, Windows Vista Home Basic, Windows Vista Home Basic x64, Windows Vista Home Premium, Windows Vista Home Premium x64, Windows Vista Ultimate",
        "Windows 7 Home Basic, Windows 7 Home Basic x64, Windows 7 Home Premium, Windows 7 Home Premium x64, Windows 7 Professional, Windows 7 Professional x64, Windows 7 Starter, Windows 7 Starter x64, Windows 7 Ultimate, Windows 7 Ultimate x64, Windows 8, Windows 8 Enterprise, Windows 8 Enterprise x64, Windows 8 Pro, Windows 8 Pro x64, Windows 8 x64, Windows 8.1, Windows 8.1 Enterprise, Windows 8.1 Enterprise x64, Windows 8.1 Pro, Windows 8.1 Pro x64, Windows 8.1 x64, Windows Vista Business, Windows Vista Business x64, Windows Vista Enterprise, Windows Vista Enterprise x64, Windows Vista Home Basic, Windows Vista Home Basic x64, Windows Vista Home Premium, Windows Vista Home Premium x64, Windows Vista Ultimate"
    ]
}