{
    "<page title>": "Canon EOS 700D + EF-S 18-55mm IS STM - Digital Cameras - Photo - Visual | ILGS.net",
    "analog signal format system": "NTSC, PAL",
    "auto exposure ae lock": "Yes",
    "auto focusing af modes": "Continuous Auto Focus, Servo Auto Focus, Single Auto Focus",
    "batteries included": "Yes",
    "battery technology": "Lithium-Ion (Li-Ion)",
    "battery type": [
        "Rechargeable Li-ion Battery",
        "LP-E8"
    ],
    "builtin flash": "Yes",
    "builtin processor": [
        "DIGIC 5",
        "DIGIC 5",
        "DIGIC 5"
    ],
    "bundled software": [
        "ImageBrowser EX",
        "ImageBrowser EX"
    ],
    "camera file system": "DCF 2.0, DPOF 1.1, Exif 2.3, RAW",
    "camera playback": "Movie, Single image, Slide show",
    "camera shutter speed max": "30s",
    "camera shutter speed min": "0.00025s",
    "camera shutter type": "Electronic",
    "camera type": "SLR Kit",
    "closest focusing distance": "0.25m",
    "colour of product": [
        "Black",
        "Black",
        "Black"
    ],
    "compatible memory cards": [
        "SDHC",
        "SD, SDHC, SDXC"
    ],
    "depth": "7.88 cm",
    "dimensions w x d x h": "133.1 x 78.8 x 99.8 mm",
    "dioptre correction": "Yes",
    "display": "TFT",
    "display diagonal": "7.62 cm (3\")",
    "display resolution numeric": "1040000 pixels",
    "ean": "8714574602516",
    "field of view": "100%",
    "filter size": "5.8 cm",
    "flash exposure compensation": "Yes",
    "flash exposure correction": "\u00b12EV (1/2, 1/3 EV step)",
    "flash exposure lock": "Yes",
    "flash modes": "Auto, Manual, Red-eye reduction",
    "flash syncspeed": "1/200s",
    "focal length range ff": "18 - 55 mm",
    "focus": "TTL",
    "focus adjustment": "Auto/Manual",
    "full hd": "Yes",
    "hdmi": [
        "Yes",
        "Yes"
    ],
    "hdmi connector type": "Mini",
    "hdmi ports quantity": [
        "1",
        "1",
        "1"
    ],
    "height": "9.98 cm",
    "histogram": "Yes",
    "image formats supported": "JPG, RAW",
    "image stabilizer": "Yes",
    "iso sensitivity": [
        "AUTO(100-6400) 100-12800 in 1-stop increments",
        "100, 200, 400, 800, 1600, 3200, 6400, 12800, Auto"
    ],
    "iso sensitivity max": "12800",
    "iso sensitivity min": "100",
    "lcd screen size": "3",
    "lens mount interface": "Canon EF, Canon EF-S",
    "lens structure elementsgroups": "13/11",
    "lens system": "Single Lens Kit",
    "lens type": "EF-S 18-55mm Lens",
    "light exposure control": "Program AE",
    "light exposure correction": "\u00b1 5EV (1/3EV step)",
    "light exposure modes": "Aperture priority AE, Auto, Manual, Shutter priority AE",
    "light metering": "Centre-weighted, Evaluative (Multi-pattern), Spot",
    "live view": "Yes",
    "mac operating systems supported": [
        "Mac OS X 10.6 Snow Leopard, Mac OS X 10.7 Lion, Mac OS X 10.8 Mountain Lion",
        "Mac OS X 10.6 Snow Leopard, Mac OS X 10.7 Lion, Mac OS X 10.8 Mountain Lion"
    ],
    "magnification": "0.85x",
    "manufacturer": "Canon",
    "maximum aperture": "38",
    "maximum focal length 35mm film equiv": "8.8 cm",
    "maximum image resolution": "5184 x 3456 pixels",
    "maximum video resolution": "1920 x 1080 pixels",
    "megapixel": [
        "18 MP",
        "18"
    ],
    "memory slots": "1",
    "microphone in": "Yes",
    "minimum aperture": "3.5",
    "minimum focal length 35mm film equiv": "2.9 cm",
    "motion jpeg frame rate": "29.97 fps",
    "number of batteries supported": "1",
    "number of diaphragm blades": "7",
    "operating relative humidity hh": "10 - 85%",
    "operating temperature tt": "0 - 40 \u00b0C",
    "pdf url": "No",
    "pictbridge": "Yes",
    "playback zoom max": "10x",
    "power source type": "Battery",
    "product promotion": "N/A",
    "quick start guide": [
        "Yes",
        "Yes"
    ],
    "scene modes": "Close-up (macro), Landscape, Night, Night portrait, Portrait, Sports",
    "selftimer": "2, 10s",
    "sensor type": [
        "CMOS",
        "22.3 x 14.9mm CMOS"
    ],
    "shooting modes": "Aperture priority, Auto, Manual, Movie, Program, Scene, Shutter priority",
    "short description": "EOS 700D + EF-S 18-55mm IS STM - 18MP/18.5MP, 5184x3456, TTL-CT-SIR, CMOS, DIGIC 5, EF/EF-S, RAW/JPEG, 1920x1080/30fps, SD/SDHC/SDXC, 580g",
    "sku": "8596B027AA",
    "specification": "Picture qualitySupported aspect ratios3:2, 4:3, 16:9Still image resolution(s)480 x 480, 640 x 480, 720 x 400, 720 x 480, 1280 x 1280, 1696 x 1280, 1728 x 1728, 1920 x 1080, 1920 x 1280, 2304 x 1728, 2304 x 2304, 2592 x 1456, 2592 x 1728, 3072 x 2304, 3456 x 1944, 3456 x 2304, 3456 x 3456, 4608 x 3456, 5184 x 2912, 5184 x 3456Image stabilizerYesTotal megapixels18.5 MPImage formats supportedJPG, RAWMaximum image resolution5184 x 3456 pixelsSensor typeCMOSCamera typeSLR KitMegapixel18 MPLens systemFocal length range (f-f)18 - 55 mmMinimum focal length (35mm film equiv)2.9 cmMaximum focal length (35mm film equiv)8.8 cmMinimum aperture3.5Maximum aperture38Lens structure (elements/groups)13/11Number of diaphragm blades7Lens mount interfaceCanon EF, Canon EF-SFilter size5.8 cmFocusingFocusTTLFocus adjustmentAuto/ManualAuto focusing (AF) modesContinuous Auto Focus, Servo Auto Focus, Single Auto FocusClosest focusing distance0.25mLight exposureISO sensitivity100, 200, 400, 800, 1600, 3200, 6400, 12800, AutoLight exposure modesAperture priority AE, Auto, Manual, Shutter priority AELight exposure controlProgram AELight exposure correction\u00b1 5EV (1/3EV step)Light meteringCentre-weighted, Evaluative (Multi-pattern), SpotAuto Exposure (AE) lockYesISO sensitivity (min)100ISO sensitivity (max)12800ShutterCamera shutter speed (min)0.00025sCamera shutter speed (max)30sCamera shutter typeElectronicFlashFlash modesAuto, Manual, Red-eye reductionBuilt-in flashYesFlash sync-speed1/200sFlash exposure lockYesFlash exposure correction\u00b12EV (1/2, 1/3 EV step)Flash exposure compensationYesVideoVideo resolutions640 x 480, 1280 x 720, 1920 x 1080 pixelsVideo formats supportedH.264Motion JPEG frame rate29.97 fpsFull HDYesAnalog signal format systemNTSC, PALMaximum video resolution1920 x 1080 pixelsMemoryCompatible memory cardsSD, SDHC, SDXCMemory slots1DisplayDisplayTFTDisplay diagonal7.62 cm (3\")Display resolution (numeric)1040000 pixelsVari-angle LCD displayYesTouch sensitive screenYesField of view100%ViewfinderViewfinder typeElectricalMagnification0.85xPorts & interfacesUSB version2.0HDMI connector typeMiniMicrophone inYesPictBridgeYesUSB 2.0 ports quantity1HDMI ports quantity1HDMIYesCameraColour of productBlackWhite balanceAuto, Cloudy, Daylight, Flash, Fluorescent L, Shade, TungstenScene modesClose-up (macro), Landscape, Night, Night portrait, Portrait, SportsShooting modesAperture priority, Auto, Manual, Movie, Program, Scene, Shutter prioritySelf-timer2, 10sCamera playbackMovie, Single image, Slide showPlayback zoom (max)10xLive viewYesHistogramYesDioptre correctionYesCamera file systemDCF 2.0, DPOF 1.1, Exif 2.3, RAWBuilt-in processorDIGIC 5BatteryBattery technologyLithium-Ion (Li-Ion)Battery typeLP-E8Number of batteries supported1Power source typeBatteryOperating system/softwareWindows operating systems supportedWindows 7 Home Basic, Windows 7 Home Basic x64, Windows 7 Home Premium, Windows 7 Home Premium x64, Windows 7 Professional, Windows 7 Professional x64, Windows 7 Starter, Windows 7 Starter x64, Windows 7 Ultimate, Windows 7 Ultimate x64, Windows 8, Windows 8 Enterprise, Windows 8 Enterprise x64, Windows 8 Pro, Windows 8 Pro x64, Windows 8 x64, Windows Vista Business, Windows Vista Business x64, Windows Vista Enterprise, Windows Vista Enterprise x64, Windows Vista Home Basic, Windows Vista Home Basic x64, Windows Vista Home Premium, Windows Vista Home Premium x64, Windows Vista Ultimate, Windows Vista Ultimate x64, Windows XP Home, Windows XP Home x64, Windows XP Professional, Windows XP Professional x64Mac operating systems supportedMac OS X 10.6 Snow Leopard, Mac OS X 10.7 Lion, Mac OS X 10.8 Mountain LionBundled softwareImageBrowser EXTechnical detailsQuick start guideYesUSB 2.0 ports quantity1HDMI ports quantity1HDMIYesProcessorBuilt-in processorDIGIC 5DesignColour of productBlackPerformanceBuilt-in processorDIGIC 5Operational conditionsOperating temperature (T-T)0 - 40 \u00b0COperating relative humidity (H-H)10 - 85%System requirementsWindows operating systems supportedWindows 7 Home Basic, Windows 7 Home Basic x64, Windows 7 Home Premium, Windows 7 Home Premium x64, Windows 7 Professional, Windows 7 Professional x64, Windows 7 Starter, Windows 7 Starter x64, Windows 7 Ultimate, Windows 7 Ultimate x64, Windows 8, Windows 8 Enterprise, Windows 8 Enterprise x64, Windows 8 Pro, Windows 8 Pro x64, Windows 8 x64, Windows Vista Business, Windows Vista Business x64, Windows Vista Enterprise, Windows Vista Enterprise x64, Windows Vista Home Basic, Windows Vista Home Basic x64, Windows Vista Home Premium, Windows Vista Home Premium x64, Windows Vista Ultimate, Windows Vista Ultimate x64, Windows XP Home, Windows XP Home x64, Windows XP Professional, Windows XP Professional x64Mac operating systems supportedMac OS X 10.6 Snow Leopard, Mac OS X 10.7 Lion, Mac OS X 10.8 Mountain LionWeight & dimensionsWidth13.31 cmDepth7.88 cmHeight9.98 cmWeight (including battery)580gPackaging contentQuick start guideYesBundled softwareImageBrowser EXBatteries includedYesOther featuresUSB 2.0 ports quantity1HDMI ports quantity1",
    "still image resolutions": "480 x 480, 640 x 480, 720 x 400, 720 x 480, 1280 x 1280, 1696 x 1280, 1728 x 1728, 1920 x 1080, 1920 x 1280, 2304 x 1728, 2304 x 2304, 2592 x 1456, 2592 x 1728, 3072 x 2304, 3456 x 1944, 3456 x 2304, 3456 x 3456, 4608 x 3456, 5184 x 2912, 5184 x 3456",
    "supported aspect ratios": "3:2, 4:3, 16:9",
    "total megapixels": "18.5 MP",
    "touch sensitive screen": "Yes",
    "type": "Single Lens Kit",
    "usb 20 ports quantity": [
        "1",
        "1",
        "1"
    ],
    "usb version": "2.0",
    "variangle lcd display": "Yes",
    "video formats supported": "H.264",
    "video resolutions": "640 x 480, 1280 x 720, 1920 x 1080 pixels",
    "viewfinder type": "Electrical",
    "weight": "580 g",
    "weight including battery": "580g",
    "white balance": [
        "Auto, Cloudy, Daylight, Flash, Fluorescent L, Shade, Tungsten",
        "Auto white balance with the imaging sensor"
    ],
    "width": "13.31 cm",
    "windows operating systems supported": [
        "Windows 7 Home Basic, Windows 7 Home Basic x64, Windows 7 Home Premium, Windows 7 Home Premium x64, Windows 7 Professional, Windows 7 Professional x64, Windows 7 Starter, Windows 7 Starter x64, Windows 7 Ultimate, Windows 7 Ultimate x64, Windows 8, Windows 8 Enterprise, Windows 8 Enterprise x64, Windows 8 Pro, Windows 8 Pro x64, Windows 8 x64, Windows Vista Business, Windows Vista Business x64, Windows Vista Enterprise, Windows Vista Enterprise x64, Windows Vista Home Basic, Windows Vista Home Basic x64, Windows Vista Home Premium, Windows Vista Home Premium x64, Windows Vista Ultimate, Windows Vista Ultimate x64, Windows XP Home, Windows XP Home x64, Windows XP Professional, Windows XP Professional x64",
        "Windows 7 Home Basic, Windows 7 Home Basic x64, Windows 7 Home Premium, Windows 7 Home Premium x64, Windows 7 Professional, Windows 7 Professional x64, Windows 7 Starter, Windows 7 Starter x64, Windows 7 Ultimate, Windows 7 Ultimate x64, Windows 8, Windows 8 Enterprise, Windows 8 Enterprise x64, Windows 8 Pro, Windows 8 Pro x64, Windows 8 x64, Windows Vista Business, Windows Vista Business x64, Windows Vista Enterprise, Windows Vista Enterprise x64, Windows Vista Home Basic, Windows Vista Home Basic x64, Windows Vista Home Premium, Windows Vista Home Premium x64, Windows Vista Ultimate, Windows Vista Ultimate x64, Windows XP Home, Windows XP Home x64, Windows XP Professional, Windows XP Professional x64"
    ]
}