{
    "<page title>": "Canon EOS EOS-M + EF-M 22mm + EF Adapter - Digital Cameras - Photo - Visual | ILGS.net",
    "ac adapter included": "Yes",
    "analog signal format system": "NTSC, PAL",
    "auto exposure ae lock": "Yes",
    "auto focus af assist beam": "Yes",
    "auto focus af lock": "Yes",
    "auto focus af points": "31",
    "auto focus af points selection": "Auto, Manual",
    "auto focusing af modes": "Face detection, Face tracking",
    "batteries included": "Yes",
    "battery charger included": "Yes",
    "battery life cipa standard": "230 shots",
    "battery technology": "Lithium-Ion (Li-Ion)",
    "battery type": "LP-E12",
    "builtin flash": "No",
    "builtin microphone": "Yes",
    "builtin processor": [
        "DIGIC 5",
        "DIGIC 5",
        "DIGIC 5"
    ],
    "camera file system": "Exif 2.3",
    "camera playback": "Movie, Single image, Slide show",
    "camera shutter speed max": "30s",
    "camera shutter speed min": "0.00025s",
    "camera shutter type": "Electronic, Mechanical",
    "camera type": "SLR Kit",
    "colour of product": [
        "Black",
        "Black"
    ],
    "compatible memory cards": "SD, SDHC, SDXC",
    "dcin jack": "Yes",
    "depth": "3.23 cm",
    "direct printing": [
        "Yes",
        "Yes",
        "Yes"
    ],
    "display": "LCD",
    "display aspect ratio": "3:2",
    "display diagonal": "7.62 cm (3\")",
    "display resolution numeric": "1040000 pixels",
    "ean": "8714574590561",
    "external flash connector": "Yes",
    "filter size": "4.3 cm",
    "flash exposure compensation": "Yes",
    "flash exposure correction": "\u00b12EV (1/2, 1/3 EV step)",
    "flash exposure lock": "Yes",
    "flash syncspeed": "0.005s",
    "focus adjustment": "Auto/Manual",
    "full hd": "Yes",
    "hdmi ports quantity": [
        "1",
        "1",
        "1"
    ],
    "height": "6.65 cm",
    "image formats supported": "JPG, RAW",
    "image stabilizer": "Yes",
    "iso sensitivity": "100, 6400, 12800",
    "iso sensitivity max": "12800",
    "iso sensitivity min": "100",
    "lens mount interface": "Canon EF-M",
    "lens structure elementsgroups": "7/6",
    "light exposure control": "Program AE",
    "light exposure correction": "\u00b1 3EV (1/3EV step)",
    "light exposure modes": "Auto, Manual",
    "mac operating systems supported": [
        "Mac OS X 10.6 Snow Leopard, Mac OS X 10.7 Lion",
        "Mac OS X 10.6 Snow Leopard, Mac OS X 10.7 Lion"
    ],
    "manufacturer": "Canon",
    "maximum image resolution": "5184 x 3456 pixels",
    "maximum video resolution": "1920 x 1080 pixels",
    "megapixel": "18 MP",
    "microphone in": "Yes",
    "minimum aperture": "22",
    "motion jpeg frame rate": "30 fps",
    "number of batteries supported": "1",
    "number of diaphragm blades": "7",
    "operating temperature tt": "0 - 40 \u00b0C",
    "pdf url": "http://pdfs.icecat.biz/pdf/37339999-7639.pdf",
    "pictbridge": "Yes",
    "playback zoom max": "10x",
    "power source type": "AC, Battery",
    "product promotion": "N/A",
    "scene modes": "Close-up (macro), Landscape, Night portrait, Portrait, Sports",
    "selftimer": "2, 10s",
    "sensor type": "CMOS",
    "shooting modes": "Aperture priority, Auto, Manual, Shutter priority",
    "short description": "EOS-M + EF-M 22mm + EF Adapter, 3:2, 18MP, 22.3 x 14.9mm CMOS, 5184 x 3456, PictBridge, 298g",
    "sku": "6609B065AA",
    "specification": "Picture qualitySupported aspect ratios1:1, 3:2, 4:3, 16:9Still image resolution(s)640 x 480, 720 x 400, 720 x 480, 1280 x 1280, 1712 x 1712, 1920 x 1080, 1920 x 1280, 2304 x 1728, 2304 x 2304, 2592 x 1456, 2592 x 1728, 3072 x 2304, 3456 x 1944, 3456 x 2304, 3456 x 3456, 4608 x 3456, 5184 x 2912, 5184 x 3456Image stabilizerYesTotal megapixels18.5 MPImage formats supportedJPG, RAWMaximum image resolution5184 x 3456 pixelsSensor typeCMOSCamera typeSLR KitMegapixel18 MPLens systemMinimum aperture22Lens structure (elements/groups)7/6Number of diaphragm blades7Lens mount interfaceCanon EF-MFilter size4.3 cmFocusingFocus adjustmentAuto/ManualAuto focusing (AF) modesFace detection, Face trackingAuto Focus (AF) points selectionAuto, ManualAuto Focus (AF) points31Auto Focus (AF) lockYesAuto Focus (AF) assist beamYesLight exposureISO sensitivity100, 6400, 12800Light exposure modesAuto, ManualLight exposure controlProgram AELight exposure correction\u00b1 3EV (1/3EV step)Auto Exposure (AE) lockYesISO sensitivity (min)100ISO sensitivity (max)12800ShutterCamera shutter speed (min)0.00025sCamera shutter speed (max)30sCamera shutter typeElectronic, MechanicalFlashBuilt-in flashNoFlash sync-speed0.005sFlash exposure lockYesFlash exposure correction\u00b12EV (1/2, 1/3 EV step)Flash exposure compensationYesExternal flash connectorYesVideoVideo resolutions640 x 480, 1280 x 720, 1920 x 1080 pixelsVideo formats supportedH.264, MOVMotion JPEG frame rate30 fpsFull HDYesAnalog signal format systemNTSC, PALMaximum video resolution1920 x 1080 pixelsAudioBuilt-in microphoneYesMemoryCompatible memory cardsSD, SDHC, SDXCDisplayDisplay aspect ratio3:2DisplayLCDDisplay diagonal7.62 cm (3\")Display resolution (numeric)1040000 pixelsTouch sensitive screenYesPorts & interfacesMicrophone inYesPictBridgeYesUSB 2.0 ports quantity1HDMI ports quantity1DC-in jackYesCameraColour of productBlackWhite balanceCloudy, Custom modes, Daylight, Flash, Fluorescent L, Shade, TungstenScene modesClose-up (macro), Landscape, Night portrait, Portrait, SportsShooting modesAperture priority, Auto, Manual, Shutter prioritySelf-timer2, 10sCamera playbackMovie, Single image, Slide showPlayback zoom (max)10xDirect printingYesCamera file systemExif 2.3Built-in processorDIGIC 5BatteryBattery technologyLithium-Ion (Li-Ion)Battery life (CIPA standard)230 shotsBattery typeLP-E12Number of batteries supported1Power source typeAC, BatteryOperating system/softwareWindows operating systems supportedYesMac operating systems supportedMac OS X 10.6 Snow Leopard, Mac OS X 10.7 LionTechnical detailsUSB 2.0 ports quantity1HDMI ports quantity1Direct printingYesProcessorBuilt-in processorDIGIC 5DesignColour of productBlackPerformanceDirect printingYesBuilt-in processorDIGIC 5Operational conditionsOperating temperature (T-T)0 - 40 \u00b0CSystem requirementsWindows operating systems supportedYesMac operating systems supportedMac OS X 10.6 Snow Leopard, Mac OS X 10.7 LionWeight & dimensionsWidth10.86 cmDepth3.23 cmHeight6.65 cmWeight (including battery)298gPackaging contentBattery charger includedYesBatteries includedYesAC adapter includedYesOther featuresUSB 2.0 ports quantity1HDMI ports quantity1",
    "still image resolutions": "640 x 480, 720 x 400, 720 x 480, 1280 x 1280, 1712 x 1712, 1920 x 1080, 1920 x 1280, 2304 x 1728, 2304 x 2304, 2592 x 1456, 2592 x 1728, 3072 x 2304, 3456 x 1944, 3456 x 2304, 3456 x 3456, 4608 x 3456, 5184 x 2912, 5184 x 3456",
    "supported aspect ratios": "1:1, 3:2, 4:3, 16:9",
    "total megapixels": "18.5 MP",
    "touch sensitive screen": "Yes",
    "usb 20 ports quantity": [
        "1",
        "1",
        "1"
    ],
    "video formats supported": "H.264, MOV",
    "video resolutions": "640 x 480, 1280 x 720, 1920 x 1080 pixels",
    "weight including battery": "298g",
    "white balance": "Cloudy, Custom modes, Daylight, Flash, Fluorescent L, Shade, Tungsten",
    "width": "10.86 cm",
    "windows operating systems supported": [
        "Yes",
        "Yes"
    ]
}