{
    "<page title>": "Samsung WB 350F - Digital Cameras - Photo - Visual | ILGS.net",
    "analog signal format system": "NTSC, PAL",
    "audio system": [
        "Mono",
        "Mono"
    ],
    "auto focusing af modes": "Centre weighted Auto Focus, Face detection, Multi Point Auto Focus, Tracking Auto Focus",
    "auto mode focusing range tele": "3.5 - ?",
    "auto mode focusing range wide": "0.8 - ?",
    "battery life cipa standard": "310 shots",
    "battery life max": "2.6h",
    "battery type": "SLB-10A",
    "builtin microphone": "Yes",
    "camera file system": "DCF, Exif 2.21",
    "camera playback": "Movie, Single image, Slide show, Thumbnails",
    "camera shutter speed max": "0.0005s",
    "camera shutter speed min": "16s",
    "camera type": "Compact",
    "colour of product": [
        "White",
        "White"
    ],
    "compatible memory cards": "MicroSD (TransFlash), MicroSDHC, MicroSDXC",
    "dcin jack": "Yes",
    "depth": "2.5 cm",
    "digital zoom": "5x",
    "display": "TFT",
    "display diagonal": "7.62 cm (3\")",
    "display resolution numeric": "460000 pixels",
    "ean": "N/A",
    "flash modes": "Auto, Fill-in, Flash off, Red-eye reduction, Slow synchronization",
    "flash range tele": "0.5 - 2.9m",
    "flash range wide": "0.3 - 4.1m",
    "flash recharging time": "4s",
    "focal length range ff": "4.1 - 86.1 mm",
    "focus": "TTL",
    "focus adjustment": "Auto/Manual",
    "full hd": "Yes",
    "hdmi": [
        "No",
        "No"
    ],
    "height": "6.51 cm",
    "image formats supported": "EXIF, JPG",
    "image sensor size": "25.4/58.4 mm (1/2.3\")",
    "image stabilizer": "Yes",
    "internal memory": "9.5 MB",
    "iso sensitivity": "80, 100, 200, 400, 800, 1600, 3200, Auto",
    "iso sensitivity max": "3200",
    "iso sensitivity min": "80",
    "light exposure control": "Program AE",
    "light exposure correction": "\u00b1 2EV (1/3EV step)",
    "light exposure modes": "Aperture priority AE, Auto, Manual, Shutter priority AE",
    "light metering": "Centre-weighted, Evaluative (Multi-pattern), Spot",
    "mac operating systems supported": [
        "Yes",
        "Yes"
    ],
    "macro focusing range tele": "1.5 - 3.5m",
    "macro focusing range wide": "0.1 - 0.8m",
    "manufacturer": "Samsung",
    "maximum aperture": "2.8",
    "maximum focal length 35mm film equiv": "48.3 cm",
    "maximum image resolution": "4608 x 3456 pixels",
    "maximum memory card size": "64 GB",
    "maximum video resolution": "1920 x 1080 pixels",
    "megapixel": "16.3 MP",
    "memory slots": "1",
    "minimum focal length 35mm film equiv": "2.3 cm",
    "minimum hard disk space": "250 MB",
    "minimum processor": "Intel Core 2 Duo 1.66 GHz / AMD Athlon X2 Dual-Core 2.2 GHz",
    "minimum ram": "512 MB",
    "motion jpeg frame rate": "30 fps",
    "near field communication nfc": "Yes",
    "number of batteries supported": "1",
    "operating relative humidity hh": "5 - 85%",
    "operating temperature tt": "0 - 40 \u00b0C",
    "optical zoom": "21x",
    "pdf url": "No",
    "power source type": "Battery",
    "product promotion": "N/A",
    "scene modes": "Backlight, Fireworks, Landscape, Night, Night portrait, Panorama, Portrait, Spotlight, Sunset",
    "selftimer": "2, 10s",
    "sensor type": "CMOS",
    "short description": "16.3MP, 1/2.3\" BSI CMOS, OIS, f=4.1-86.1mm, 21x zoom, 1080p, 30fps, 7.62 cm (3 \") LCD TFT, Wi-Fi, NFC, MicroSD, USB 2.0, AV, 216g",
    "sku": "EC-WB350FBPWGB",
    "specification": "Picture qualityImage sensor size25.4/58.4 mm (1/2.3\")Still image resolution(s)4608 x 3456, 4608 x 3072, 3648 x 2736, 4608 x 2592, 2592 x 1944, 1984 x 1488, 1920 x 1080, 1024 x 768, 2832 x 2832Image stabilizerYesTotal megapixels16.7 MPImage formats supportedEXIF, JPGMaximum image resolution4608 x 3456 pixelsSensor typeCMOSCamera typeCompactMegapixel16.3 MPLens systemFocal length range (f-f)4.1 - 86.1 mmMinimum focal length (35mm film equiv)2.3 cmMaximum focal length (35mm film equiv)48.3 cmMaximum aperture2.8Digital zoom5xOptical zoom21xFocusingFocusTTLFocus adjustmentAuto/ManualAuto focusing (AF) modesCentre weighted Auto Focus, Face detection, Multi Point Auto Focus, Tracking Auto FocusMacro focusing range (wide)0.1 - 0.8mMacro focusing range (tele)1.5 - 3.5mAuto Mode focusing range (wide)0.8 - ?Auto Mode focusing range (tele)3.5 - ?Light exposureISO sensitivity80, 100, 200, 400, 800, 1600, 3200, AutoLight exposure modesAperture priority AE, Auto, Manual, Shutter priority AELight exposure controlProgram AELight exposure correction\u00b1 2EV (1/3EV step)Light meteringCentre-weighted, Evaluative (Multi-pattern), SpotISO sensitivity (min)80ISO sensitivity (max)3200ShutterCamera shutter speed (min)16sCamera shutter speed (max)0.0005sFlashFlash modesAuto, Fill-in, Flash off, Red-eye reduction, Slow synchronizationFlash recharging time4sFlash range (wide)0.3 - 4.1mFlash range (tele)0.5 - 2.9mVideoVideo resolutions640 x 480, 1280 x 720, 1920 x 1080 pixelsVideo formats supportedH.264, MP4, MPEG4Motion JPEG frame rate30 fpsFull HDYesAnalog signal format systemNTSC, PALMaximum video resolution1920 x 1080 pixelsAudioBuilt-in microphoneYesVoice recordingYesAudio systemMonoMemoryInternal memory9.5 MBCompatible memory cardsMicroSD (TransFlash), MicroSDHC, MicroSDXCMemory slots1Maximum memory card size64 GBDisplayDisplayTFTDisplay diagonal7.62 cm (3\")Display resolution (numeric)460000 pixelsTouch sensitive screenYesPorts & interfacesUSB version2.0DC-in jackYesHDMINoNetworkingNear Field Communication (NFC)YesWi-FiYesCameraColour of productWhiteWhite balanceAuto, Cloudy, Custom modes, Daylight, Fluorescent H, Fluorescent L, TungstenScene modesBacklight, Fireworks, Landscape, Night, Night portrait, Panorama, Portrait, Spotlight, SunsetSelf-timer2, 10sCamera playbackMovie, Single image, Slide show, ThumbnailsCamera file systemDCF, Exif 2.21BatteryBattery life (CIPA standard)310 shotsBattery life (max)2.6hBattery typeSLB-10ANumber of batteries supported1Power source typeBatteryOperating system/softwareWindows operating systems supportedYesMac operating systems supportedYesTechnical detailsHDMINoAudio systemMonoDesignColour of productWhiteOperational conditionsOperating temperature (T-T)0 - 40 \u00b0COperating relative humidity (H-H)5 - 85%System requirementsMinimum hard disk space250 MBMinimum RAM512 MBMinimum processorIntel Core 2 Duo 1.66 GHz / AMD Athlon X2 Dual-Core 2.2 GHzWindows operating systems supportedYesMac operating systems supportedYesWeight & dimensionsWidth11.36 cmDepth2.5 cmHeight6.51 cmWeight216gTechnical detailsSmartphone remote supportYesBuilt-in speaker(s)YesAudio recording formatsAAC",
    "still image resolutions": "4608 x 3456, 4608 x 3072, 3648 x 2736, 4608 x 2592, 2592 x 1944, 1984 x 1488, 1920 x 1080, 1024 x 768, 2832 x 2832",
    "total megapixels": "16.7 MP",
    "touch sensitive screen": "Yes",
    "usb version": "2.0",
    "video formats supported": "H.264, MP4, MPEG4",
    "video resolutions": "640 x 480, 1280 x 720, 1920 x 1080 pixels",
    "voice recording": "Yes",
    "weight": "216g",
    "white balance": "Auto, Cloudy, Custom modes, Daylight, Fluorescent H, Fluorescent L, Tungsten",
    "width": "11.36 cm",
    "wifi": "Yes",
    "windows operating systems supported": [
        "Yes",
        "Yes"
    ]
}