{
    "<page title>": "Canon PowerShot SX700 HS - Digital Cameras - Photo - Visual | ILGS.net",
    "ac adapter included": "Yes",
    "audio formats supported": "LC-AAC",
    "auto exposure ae lock": "Yes",
    "auto focus af points selection": "Auto, Manual",
    "auto focusing af modes": "Continuous Auto Focus, Servo Auto Focus, Single Auto Focus, Tracking Auto Focus",
    "batteries included": "Yes",
    "battery charger included": "Yes",
    "battery life cipa standard": "250 shots",
    "battery technology": "Lithium-Ion (Li-Ion)",
    "battery type": [
        "NB-6LH",
        "Rechargeable Li-ion Battery NB-6LH"
    ],
    "builtin flash": [
        "Yes",
        "Yes"
    ],
    "builtin microphone": "Yes",
    "bundled software": [
        "ImageBrowser EX\nPhotoStitch\nMap Utility",
        "ImageBrowser EX\nPhotoStitch\nMap Utility"
    ],
    "cables included": "USB",
    "camera file system": "DCF, DPOF 1.1, Exif 2.3",
    "camera shutter speed": "1 \u2013 1/3200 sec. (factory default) 15 \u2013 1/3200 sec. (total range \u2013 varies by shooting mode)",
    "camera shutter speed max": "0.0003125s",
    "camera shutter speed min": "1s",
    "camera type": "Compact",
    "colour of product": [
        "Black",
        "Black",
        "Black"
    ],
    "compatible memory cards": [
        "SD, SDHC, SDXC",
        "SD SDHC SDXC"
    ],
    "depth": "3.48 cm",
    "digital zoom": [
        "60 x",
        "120x"
    ],
    "dimensions w x d x h": "112.7 x 34.8 x 65.8 mm",
    "display": "LCD",
    "display diagonal": "7.62 cm (3\")",
    "display resolution numeric": "922000 pixels",
    "ean": "8714574617527",
    "field of view": "100%",
    "flash exposure correction": "\u00b12EV (1/3 EV step)",
    "flash exposure lock": "Yes",
    "flash modes": "Auto, Flash off, Flash on, Manual, Red-eye reduction, Slow synchronization",
    "flash range tele": "1 - 2m",
    "flash range wide": "0.5 - 3.5m",
    "focal length range ff": "4.5 - 135 mm",
    "focus": "TTL",
    "full hd": "Yes",
    "hdmi": [
        "Yes",
        "Yes"
    ],
    "hdmi connector type": "Micro",
    "height": "6.58 cm",
    "histogram": "Yes",
    "image formats supported": "JPG",
    "image processor": "DIGIC 6",
    "image sensor size": "25.4/58.4 mm (1/2.3\")",
    "image stabilizer": "Yes",
    "iso sensitivity": [
        "AUTO 100 200 400 800 1600 3200",
        "100, 200, 400, 800, 1600, 3200, Auto"
    ],
    "lcd screen size": "3",
    "lens structure elementsgroups": "13/10",
    "light exposure correction": "\u00b1 2EV (1/3EV step)",
    "light exposure modes": "Aperture priority AE, Auto, Manual, Shutter priority AE",
    "light metering": "Centre-weighted, Evaluative (Multi-pattern), Spot",
    "mac operating systems supported": [
        "Mac OS X 10.7 Lion, Mac OS X 10.8 Mountain Lion, Mac OS X 10.9 Mavericks",
        "Mac OS X 10.7 Lion, Mac OS X 10.8 Mountain Lion, Mac OS X 10.9 Mavericks"
    ],
    "manufacturer": "Canon",
    "maximum aperture": "6.9",
    "maximum focal length 35mm film equiv": "75 cm",
    "maximum image resolution": "4608 x 3456 pixels",
    "maximum video resolution": "1920 x 1080 pixels",
    "megapixel": [
        "16.1 MP",
        "16.1"
    ],
    "minimum aperture": "3.2",
    "minimum focal length 35mm film equiv": "2.5 cm",
    "on screen display osd languages": "ARA, CHI (SIMPL), CHI (TR), CZE, DAN, DEU, DUT, ENG, ESP, FIN, FRE, GRE, HEB, HUN, IND, ITA, JPN, KOR, NOR, PER, POL, POR, RUM, RUS, SWE, THA, TUR, UKR, VIE",
    "operating relative humidity hh": "10 - 90%",
    "operating temperature tt": "0 - 40 \u00b0C",
    "optical zoom": [
        "30 x",
        "30x"
    ],
    "orientation sensor": "Yes",
    "pdf url": "No",
    "photo effects": "Black&White, Neutral, Positive film, Sepia, Vivid",
    "pictbridge": "Yes",
    "playback zoom max": "10x",
    "power source type": "Battery",
    "product promotion": "N/A",
    "scene modes": "Fireworks, Portrait, Snow, Sports",
    "selftimer": "2, 10s",
    "sensor type": [
        "CMOS",
        "DIGIC 6 with iSAPS technology"
    ],
    "shooting modes": "Aperture priority, Program, Shutter priority",
    "short description": "16.1 MP CMOS, 30x, ISO 100-3200, Full-HD, DIGIC 6, 7.62 cm (3.0 \") LCD, USB, micro-HDMI, Wi-Fi",
    "sku": "9338B014AA",
    "smile detection": "Yes",
    "specification": "Picture qualityImage sensor size25.4/58.4 mm (1/2.3\")Still image resolution(s)4608 x 3456, 3264 x 2448, 2048 x 1536, 640 x 480, 4608 x 2592, 3264 x 1832, 1920 x 1080, 640 x 360, 4608 x 3072, 3264 x 2176, 2048 x 1368, 640 x 424, 3456 x 3456, 2448 x 2448, 1536 x 1536, 480 x 480Image stabilizerYesImage formats supportedJPGMaximum image resolution4608 x 3456 pixelsSensor typeCMOSCamera typeCompactMegapixel16.1 MPLens systemFocal length range (f-f)4.5 - 135 mmMinimum focal length (35mm film equiv)2.5 cmMaximum focal length (35mm film equiv)75 cmMinimum aperture3.2Maximum aperture6.9Lens structure (elements/groups)13/10Digital zoom120xOptical zoom30xFocusingFocusTTLAuto focusing (AF) modesContinuous Auto Focus, Servo Auto Focus, Single Auto Focus, Tracking Auto FocusSmile detectionYesAuto Focus (AF) points selectionAuto, ManualLight exposureISO sensitivity100, 200, 400, 800, 1600, 3200, AutoLight exposure modesAperture priority AE, Auto, Manual, Shutter priority AELight exposure correction\u00b1 2EV (1/3EV step)Light meteringCentre-weighted, Evaluative (Multi-pattern), SpotAuto Exposure (AE) lockYesShutterCamera shutter speed (min)1sCamera shutter speed (max)0.0003125sFlashFlash modesAuto, Flash off, Flash on, Manual, Red-eye reduction, Slow synchronizationBuilt-in flashYesFlash range (wide)0.5 - 3.5mFlash range (tele)1 - 2mFlash exposure lockYesFlash exposure correction\u00b12EV (1/3 EV step)VideoVideo formats supportedAVC, H.264, MP4, MPEG4Full HDYesMaximum video resolution1920 x 1080 pixelsAudioBuilt-in microphoneYesAudio formats supportedLC-AACMemoryCompatible memory cardsSD, SDHC, SDXCDisplayDisplayLCDDisplay diagonal7.62 cm (3\")Display resolution (numeric)922000 pixelsField of view100%Ports & interfacesUSB version2.0HDMI connector typeMicroPictBridgeYesUSB connector typeMini-USB BHDMIYesNetworkingWi-Fi standards802.11b, 802.11g, 802.11nWi-FiYesCameraColour of productBlackWhite balanceAuto, Cloudy, Custom modes, Daylight, Fluorescent, Fluorescent H, Manual, TungstenScene modesFireworks, Portrait, Snow, SportsShooting modesAperture priority, Program, Shutter priorityPhoto effectsBlack&White, Neutral, Positive film, Sepia, VividSelf-timer2, 10sPlayback zoom (max)10xOrientation sensorYesOn Screen Display (OSD) languagesARA, CHI (SIMPL), CHI (TR), CZE, DAN, DEU, DUT, ENG, ESP, FIN, FRE, GRE, HEB, HUN, IND, ITA, JPN, KOR, NOR, PER, POL, POR, RUM, RUS, SWE, THA, TUR, UKR, VIEHistogramYesCamera file systemDCF, DPOF 1.1, Exif 2.3BatteryBattery technologyLithium-Ion (Li-Ion)Battery life (CIPA standard)250 shotsBattery typeNB-6LHPower source typeBatteryOperating system/softwareWindows operating systems supportedYesMac operating systems supportedMac OS X 10.7 Lion, Mac OS X 10.8 Mountain Lion, Mac OS X 10.9 MavericksBundled softwareImageBrowser EX\nPhotoStitch\nMap UtilityTechnical detailsCarrying caseYesHDMIYesDesignColour of productBlackOperational conditionsOperating temperature (T-T)0 - 40 \u00b0COperating relative humidity (H-H)10 - 90%System requirementsWindows operating systems supportedYesMac operating systems supportedMac OS X 10.7 Lion, Mac OS X 10.8 Mountain Lion, Mac OS X 10.9 MavericksWeight & dimensionsWidth12.27 cmDepth3.48 cmHeight6.58 cmWeight (including battery)269gPackaging contentCarrying caseYesBundled softwareImageBrowser EX\nPhotoStitch\nMap UtilityCables includedUSBBattery charger includedYesBatteries includedYesAC adapter includedYesTechnical detailsImage processorDIGIC 6",
    "still image resolutions": "4608 x 3456, 3264 x 2448, 2048 x 1536, 640 x 480, 4608 x 2592, 3264 x 1832, 1920 x 1080, 640 x 360, 4608 x 3072, 3264 x 2176, 2048 x 1368, 640 x 424, 3456 x 3456, 2448 x 2448, 1536 x 1536, 480 x 480",
    "usb connector type": "Mini-USB B",
    "usb version": "2.0",
    "video capability": "Yes",
    "video formats supported": "AVC, H.264, MP4, MPEG4",
    "weight": "269 g",
    "weight including battery": "269g",
    "white balance": "Auto, Cloudy, Custom modes, Daylight, Fluorescent, Fluorescent H, Manual, Tungsten",
    "width": "12.27 cm",
    "wifi": [
        "Built-In",
        "Yes"
    ],
    "wifi standards": "802.11b, 802.11g, 802.11n",
    "windows operating systems supported": [
        "Yes",
        "Yes"
    ]
}