{
    "<page title>": "Canon EOS 1200D - Digital Cameras - Photo - Visual | ILGS.net",
    "auto focus af assist beam": "Yes",
    "auto focus af lock": "Yes",
    "auto focus af points": "9",
    "auto focus af points selection": "Auto, Manual",
    "batteries included": "Yes",
    "battery charger included": "Yes",
    "battery life cipa standard": "500 shots",
    "battery technology": "Lithium-Ion (Li-Ion)",
    "battery type": "Rechargeable Li-ion Battery LP-E10",
    "brightness adjustment": "Yes",
    "builtin flash": [
        "Yes",
        "Yes"
    ],
    "cables included": "AC, USB",
    "camera file system": "DCF 2.0",
    "camera shutter speed min": "0.000250s",
    "camera shutter type": "Electronic",
    "camera type": "SLR Body",
    "colour of product": [
        "Black",
        "Black",
        "Black"
    ],
    "compatible memory cards": [
        "SD, SDHC, SDXC",
        "SD SDHC SDXC"
    ],
    "depth": "7.79 cm",
    "dimensions w x d x h": "129.6 x 77.9 x 99.7 mm",
    "dioptre correction": "Yes",
    "direct printing": [
        "Yes",
        "Yes",
        "Yes"
    ],
    "display": "TFT",
    "display diagonal": "7.62 cm (3\")",
    "ean": "8714574618166",
    "external flash connector": "Yes",
    "flash exposure compensation": "Yes",
    "flash exposure correction": "\u00b12EV (1/2, 1/3 EV step)",
    "flash exposure lock": "Yes",
    "flash modes": "Auto, Flash off, Flash on",
    "flash recharging time": "2s",
    "focus": "TTL",
    "full hd": "Yes",
    "gps": [
        "O",
        "O",
        "O"
    ],
    "hdmi": [
        "Yes",
        "Yes"
    ],
    "hdmi connector type": "Mini",
    "height": "9.97 cm",
    "histogram": "Yes",
    "image sensor size w x h": "22.3 x 14.9 mm",
    "iso sensitivity": [
        "AUTO(100-6400) 100-6400 in 1-stop increments ISO can be expanded to H: 12800 During Movie shooting: Auto (100-6400) 100-6400 (Whole stop increments)",
        "100, 125, 160, 200, 250, 320, 400, 500, 640, 800, 1000, 1250, 1600, 2000, 2250, 2500, 3200, 4000, 5000, 6400"
    ],
    "iso sensitivity max": "6400",
    "iso sensitivity min": "100",
    "languages support": [
        "ARA, CHI (SIMPL), CHI (TR), CZE, DAN, DEU, DUT, ENG, ESP, FIN, FRE, GRE, HUN, ITA, JPN, KOR, NOR, POL, POR, RUM, RUS, SWE, THA, TUR, UKR",
        "ARA, CHI (SIMPL), CHI (TR), CZE, DAN, DEU, DUT, ENG, ESP, FIN, FRE, GRE, HUN, ITA, JPN, KOR, NOR, POL, POR, RUM, RUS, SWE, THA, TUR, UKR"
    ],
    "lcd screen size": "3",
    "lens mount interface": "Canon EF, Canon EF-S",
    "light exposure correction": "\u00b15EV (1/2; 1/3 EV step)",
    "light exposure modes": "Auto, Manual",
    "live view": "Yes",
    "manufacturer": "Canon",
    "material": [
        "Carbon, Glass, Polycarbonate",
        "Carbon, Glass, Polycarbonate"
    ],
    "maximum image resolution": "5184 x 3456 pixels",
    "maximum video resolution": "1920 x 1080 pixels",
    "megapixel": [
        "18 MP",
        "18"
    ],
    "mounting type": "Bayonet",
    "operating relative humidity hh": "0 - 85%",
    "operating temperature tt": "0 - 40 \u00b0C",
    "orientation sensor": "Yes",
    "pdf url": "http://pdfs.icecat.biz/pdf/40844863-1471.pdf",
    "pictbridge": "Yes",
    "power source type": "Battery",
    "product promotion": "N/A",
    "scene modes": "Close-up (macro), Landscape, Night portrait, Sports",
    "selftimer": "2, 10s",
    "sensor type": [
        "DIGIC 4",
        "CMOS"
    ],
    "shooting modes": "Aperture priority, Auto, Manual, Movie, Program, Scene, Shutter priority",
    "short description": "18MP, 22.3 x 14.9mm, 3:2, CMOS, TFT, 7.62 cm (3 \")",
    "sku": "9127B020AA",
    "specification": "Picture qualitySupported aspect ratios1:1, 3:2, 4:3, 16:9Still image resolution(s)JPEG 3:2: (L) 5184x3456, (M) 3456x2304, (S1) 2592x1728, (S2) 1920x1280, (S3) 720x480\nJPEG 4:3: (L) 4608x3456, (M) 3072x2304, (S1) 2304x1728, (S2) 1696x1280, (S3) 640x480\nJPEG 16:9: (L) 5184x2912, (M) 3456x1944, (S1) 2592x1456 (S2) 1920x1080, (S3) 720x400\nJPEG 1:1: (L) 3456x3456, (M) 2304x2304, (S1) 1728x1728, (S2) 1280x1280, (S3) 480x480Total megapixels18.7 MPImage sensor size (W x H)22.3 x 14.9 mmMaximum image resolution5184 x 3456 pixelsSensor typeCMOSCamera typeSLR BodyMegapixel18 MPLens systemMounting typeBayonetLens mount interfaceCanon EF, Canon EF-SFocusingFocusTTLAuto Focus (AF) points selectionAuto, ManualAuto Focus (AF) points9Auto Focus (AF) lockYesAuto Focus (AF) assist beamYesLight exposureISO sensitivity100, 125, 160, 200, 250, 320, 400, 500, 640, 800, 1000, 1250, 1600, 2000, 2250, 2500, 3200, 4000, 5000, 6400Light exposure modesAuto, ManualLight exposure correction\u00b15EV (1/2; 1/3 EV step)ISO sensitivity (min)100ISO sensitivity (max)6400ShutterCamera shutter speed (min)0.000250sCamera shutter typeElectronicFlashFlash modesAuto, Flash off, Flash onBuilt-in flashYesFlash recharging time2sFlash exposure lockYesFlash exposure correction\u00b12EV (1/2, 1/3 EV step)Flash exposure compensationYesExternal flash connectorYesVideoVideo resolutions640 x 480, 1280 x 720, 1920 x 1080 pixelsVideo formats supportedH.264Full HDYesMaximum video resolution1920 x 1080 pixelsMemoryCompatible memory cardsSD, SDHC, SDXCDisplayDisplayTFTDisplay diagonal7.62 cm (3\")Ports & interfacesHDMI connector typeMiniPictBridgeYesHDMIYesCameraColour of productBlackWhite balanceCloudy, Custom modes, Daylight, Flash, Fluorescent L, Shade, TungstenScene modesClose-up (macro), Landscape, Night portrait, SportsShooting modesAperture priority, Auto, Manual, Movie, Program, Scene, Shutter prioritySelf-timer2, 10sOrientation sensorYesLive viewYesLanguages supportARA, CHI (SIMPL), CHI (TR), CZE, DAN, DEU, DUT, ENG, ESP, FIN, FRE, GRE, HUN, ITA, JPN, KOR, NOR, POL, POR, RUM, RUS, SWE, THA, TUR, UKRHistogramYesGPSODirect printingYesDioptre correctionYesCamera file systemDCF 2.0Brightness adjustmentYesBatteryBattery technologyLithium-Ion (Li-Ion)Battery life (CIPA standard)500 shotsPower source typeBatteryTechnical detailsWrist strap includedYesMaterialCarbon, Glass, PolycarbonateLanguages supportARA, CHI (SIMPL), CHI (TR), CZE, DAN, DEU, DUT, ENG, ESP, FIN, FRE, GRE, HUN, ITA, JPN, KOR, NOR, POL, POR, RUM, RUS, SWE, THA, TUR, UKRHDMIYesGPSODirect printingYesDesignMaterialCarbon, Glass, PolycarbonateColour of productBlackPerformanceGPSODirect printingYesOperational conditionsOperating temperature (T-T)0 - 40 \u00b0COperating relative humidity (H-H)0 - 85%Weight & dimensionsWidth12.96 cmDepth7.79 cmHeight9.97 cmWeight (including battery)480gPackaging contentWrist strap includedYesCables includedAC, USBBattery charger includedYesBatteries includedYes",
    "still image resolutions": "JPEG 3:2: (L) 5184x3456, (M) 3456x2304, (S1) 2592x1728, (S2) 1920x1280, (S3) 720x480\nJPEG 4:3: (L) 4608x3456, (M) 3072x2304, (S1) 2304x1728, (S2) 1696x1280, (S3) 640x480\nJPEG 16:9: (L) 5184x2912, (M) 3456x1944, (S1) 2592x1456 (S2) 1920x1080, (S3) 720x400\nJPEG 1:1: (L) 3456x3456, (M) 2304x2304, (S1) 1728x1728, (S2) 1280x1280, (S3) 480x480",
    "supported aspect ratios": "1:1, 3:2, 4:3, 16:9",
    "total megapixels": "18.7 MP",
    "type": "Digital SLR",
    "video capability": "Yes",
    "video formats supported": "H.264",
    "video resolutions": "640 x 480, 1280 x 720, 1920 x 1080 pixels",
    "weight": "480 g",
    "weight including battery": "480g",
    "white balance": "Cloudy, Custom modes, Daylight, Flash, Fluorescent L, Shade, Tungsten",
    "width": "12.96 cm",
    "wrist strap included": [
        "Yes",
        "Yes"
    ]
}