{
    "<page title>": "Canon PowerShot D30 - Digital Cameras - Photo - Visual | ILGS.net",
    "analog signal format system": "NTSC, PAL",
    "auto exposure ae lock": "Yes",
    "auto focus af assist beam": "Yes",
    "auto focus af lock": "Yes",
    "auto focusing af modes": "Continuous Auto Focus, Face detection, Servo Auto Focus, Single Auto Focus, Tracking Auto Focus",
    "battery life cipa standard": "300 shots",
    "battery technology": "Lithium-Ion (Li-Ion)",
    "battery type": "Rechargeable Li-ion Battery NB-6LH",
    "builtin flash": [
        "Yes",
        "Yes"
    ],
    "builtin microphone": "Yes",
    "builtin processor": [
        "DIGIC 4",
        "DIGIC 4",
        "DIGIC 4"
    ],
    "camera file system": "DPOF 1.1, Exif 2.3",
    "camera shutter speed": "1 \u2013 1/1600 sec. (factory default) 15 \u2013 1/1600 sec. (total range \u2013 varies by shooting mode)",
    "camera shutter speed max": "0.000625s",
    "camera shutter speed min": "15s",
    "camera type": "Compact",
    "closest focusing distance": "0.01m",
    "colour of product": [
        "Blue",
        "Blue",
        "Blue"
    ],
    "combined zoom": "20x",
    "compatible memory cards": [
        "SD SDHC SDXC",
        "SD, SDHC, SDXC"
    ],
    "depth": "2.75 cm",
    "digital zoom": [
        "Approx. 4 x",
        "4x"
    ],
    "dimensions w x d x h": "109.4 x 27.5 x 68 mm",
    "display": "LCD",
    "display diagonal": "7.62 cm (3\")",
    "durable": "Yes",
    "ean": "8714574616001",
    "flash exposure compensation": "Yes",
    "flash exposure lock": "Yes",
    "flash modes": "Auto, Flash off, Flash on, Manual, Red-eye reduction, Slow synchronization",
    "flash range tele": "1 - 3m",
    "flash range wide": "0.3 - 3.5m",
    "flash syncspeed": "0.000625s",
    "focal length range ff": "5 - 25 mm",
    "focus": "TTL",
    "focus adjustment": "Auto/Manual",
    "freeze proof": "Yes (-10?C)",
    "full hd": "Yes",
    "gps": [
        "Yes",
        "Yes",
        "Yes"
    ],
    "hdmi": [
        "Yes",
        "Yes"
    ],
    "hdmi connector type": "Mini",
    "height": "6.8 cm",
    "histogram": "Yes",
    "image formats supported": "JPG",
    "image sensor size": "25.4/58.4 mm (1/2.3\")",
    "image stabilizer": "Yes",
    "iso sensitivity": [
        "AUTO 100 200 400 800 1600 3200",
        "100, 200, 400, 1600, 3200, Auto"
    ],
    "iso sensitivity max": "3200",
    "iso sensitivity min": "100",
    "languages support": [
        "Multi",
        "Multi"
    ],
    "lcd screen size": "3",
    "lens structure elementsgroups": "12/10",
    "light exposure correction": "\u00b1 2EV (1/3EV step)",
    "light metering": "Centre-weighted, Evaluative (Multi-pattern), Spot",
    "mac operating systems supported": [
        "Mac OS X 10.7 Lion, Mac OS X 10.8 Mountain Lion, Mac OS X 10.9 Mavericks",
        "Mac OS X 10.7 Lion, Mac OS X 10.8 Mountain Lion, Mac OS X 10.9 Mavericks"
    ],
    "manufacturer": "Canon",
    "maximum aperture": "4.8",
    "maximum focal length 35mm film equiv": "14 cm",
    "maximum image resolution": "4000 x 3000 pixels",
    "maximum video resolution": "1920 x 1080 pixels",
    "megapixel": [
        "12.1",
        "12.1 MP"
    ],
    "memory slots": "1",
    "minimum aperture": "3.9",
    "minimum focal length 35mm film equiv": "2.8 cm",
    "number of batteries supported": "1",
    "operating relative humidity hh": "10 - 90%",
    "operating temperature tt": "-10 - 40 \u00b0C",
    "optical zoom": [
        "5 x",
        "5x"
    ],
    "pdf url": "No",
    "photo effects": "Black&White, Neutral, Positive film, Sepia, Skin tones, Vivid",
    "pictbridge": "Yes",
    "playback zoom max": "10x",
    "power source type": "Battery",
    "product promotion": "N/A",
    "resolution at capture speed": [
        "1280\u00d7720@30fps, 1920x1080@24fps, 640x480@120fps, 640x480@30fps",
        "1280\u00d7720@30fps, 1920x1080@24fps, 640x480@120fps, 640x480@30fps"
    ],
    "scene modes": "Fireworks, Night, Portrait, Snow, Underwater",
    "selftimer": "2, 10s",
    "sensor type": [
        "DIGIC 4 with iSAPS technology",
        "CMOS"
    ],
    "shock proof": "Yes (2m)",
    "short description": "12.1 MP (4000 x 3000 max.), 1/2.3\" CMOS, 5x optical/4x digital zoom, ISO 100-3200, FHD video, 7.62 cm (3 \") TFT LCD, USB 2.0, Mini HDMI, 218 g",
    "sku": "9337B012AA",
    "specification": "Picture qualityImage sensor size25.4/58.4 mm (1/2.3\")Still image resolution(s)4:3 - (L) 4000 x 3000, (M1) 2816 x 2112, (M2) 1600 x 1200, (S) 640 x 480\n16:9 - (L) 4000 x 2248, (M1) 2816 x 1584, (M2) 1920 x 1080, (S) 640 x 360\n3:2 - (L) 4000 x 2664, (M1) 2816 x 1880, (M2) 1600 x 1064, (S) 640 x 424\n1:1 - (L) 2992 x 2992, (M1) 2112 x 2112, (M2) 1200 x 1200, (S) 480 x 480Image stabilizerYesImage formats supportedJPGMaximum image resolution4000 x 3000 pixelsSensor typeCMOSCamera typeCompactMegapixel12.1 MPLens systemFocal length range (f-f)5 - 25 mmMinimum focal length (35mm film equiv)2.8 cmMaximum focal length (35mm film equiv)14 cmMinimum aperture3.9Maximum aperture4.8Lens structure (elements/groups)12/10Combined zoom20xDigital zoom4xOptical zoom5xFocusingFocusTTLFocus adjustmentAuto/ManualAuto focusing (AF) modesContinuous Auto Focus, Face detection, Servo Auto Focus, Single Auto Focus, Tracking Auto FocusClosest focusing distance0.01mAuto Focus (AF) lockYesAuto Focus (AF) assist beamYesLight exposureISO sensitivity100, 200, 400, 1600, 3200, AutoLight exposure correction\u00b1 2EV (1/3EV step)Light meteringCentre-weighted, Evaluative (Multi-pattern), SpotAuto Exposure (AE) lockYesISO sensitivity (min)100ISO sensitivity (max)3200ShutterCamera shutter speed (min)15sCamera shutter speed (max)0.000625sFlashFlash modesAuto, Flash off, Flash on, Manual, Red-eye reduction, Slow synchronizationBuilt-in flashYesFlash sync-speed0.000625sFlash range (wide)0.3 - 3.5mFlash range (tele)1 - 3mFlash exposure lockYesFlash exposure compensationYesVideoVideo resolutions320 x 240, 640 x 480, 1280 x 720, 1920 x 1080 pixelsResolution at capture speed1280\u00d7720@30fps, 1920x1080@24fps, 640x480@120fps, 640x480@30fpsVideo formats supportedMOVFull HDYesAnalog signal format systemNTSC, PALMaximum video resolution1920 x 1080 pixelsAudioBuilt-in microphoneYesMemoryCompatible memory cardsSD, SDHC, SDXCMemory slots1DisplayDisplayLCDDisplay diagonal7.62 cm (3\")Ports & interfacesUSB version2.0HDMI connector typeMiniPictBridgeYesUSB connector typeMini-USB BHDMIYesCameraColour of productBlueWhite balanceAuto, Cloudy, Custom modes, Daylight, Fluorescent, Fluorescent H, Tungsten, UnderwaterScene modesFireworks, Night, Portrait, Snow, UnderwaterPhoto effectsBlack&White, Neutral, Positive film, Sepia, Skin tones, VividSelf-timer2, 10sPlayback zoom (max)10xLanguages supportMultiHistogramYesGPSYesCamera file systemDPOF 1.1, Exif 2.3Built-in processorDIGIC 4BatteryBattery technologyLithium-Ion (Li-Ion)Battery life (CIPA standard)300 shotsNumber of batteries supported1Power source typeBatteryOperating system/softwareWindows operating systems supportedYesMac operating systems supportedMac OS X 10.7 Lion, Mac OS X 10.8 Mountain Lion, Mac OS X 10.9 MavericksTechnical detailsResolution at capture speed1280\u00d7720@30fps, 1920x1080@24fps, 640x480@120fps, 640x480@30fpsLanguages supportMultiHDMIYesGPSYesProcessorBuilt-in processorDIGIC 4DesignColour of productBluePerformanceGPSYesBuilt-in processorDIGIC 4Operational conditionsOperating temperature (T-T)-10 - 40 \u00b0COperating relative humidity (H-H)10 - 90%System requirementsWindows operating systems supportedYesMac operating systems supportedMac OS X 10.7 Lion, Mac OS X 10.8 Mountain Lion, Mac OS X 10.9 MavericksWeight & dimensionsWidth10.94 cmDepth2.75 cmHeight6.8 cmWeight218g",
    "still image resolutions": "4:3 - (L) 4000 x 3000, (M1) 2816 x 2112, (M2) 1600 x 1200, (S) 640 x 480\n16:9 - (L) 4000 x 2248, (M1) 2816 x 1584, (M2) 1920 x 1080, (S) 640 x 360\n3:2 - (L) 4000 x 2664, (M1) 2816 x 1880, (M2) 1600 x 1064, (S) 640 x 424\n1:1 - (L) 2992 x 2992, (M1) 2112 x 2112, (M2) 1200 x 1200, (S) 480 x 480",
    "usb connector type": "Mini-USB B",
    "usb version": "2.0",
    "video capability": "Yes",
    "video formats supported": "MOV",
    "video resolutions": "320 x 240, 640 x 480, 1280 x 720, 1920 x 1080 pixels",
    "water proof": "Yes (25m)",
    "weight": [
        "218 g",
        "218g"
    ],
    "white balance": "Auto, Cloudy, Custom modes, Daylight, Fluorescent, Fluorescent H, Tungsten, Underwater",
    "width": "10.94 cm",
    "windows operating systems supported": [
        "Yes",
        "Yes"
    ]
}