{
    "<page title>": "Sony DSC-H400 Compact Camera with 63x Optical Zoom - Digital Cameras - Photo - Visual | ILGS.net",
    "accessories included": [
        "Rechargeable Battery Pack NP-BX1;AC AdaptorAC-UB10C;Multi USB cable;Shoulder Strap;Lens Cap;Instruction Manual",
        "Rechargeable Battery Pack NP-BX1;AC AdaptorAC-UB10C;Multi USB cable;Shoulder Strap;Lens Cap;Instruction Manual"
    ],
    "battery type": "NP-BX1",
    "builtin flash": "Yes",
    "camera shutter speed": "iAuto (2 - 1/2000) / Program Auto (1 - 1/2000) / Manual (30 - 1/2000)",
    "colour of product": "Black",
    "compatible memory cards": [
        "Memory Stick\u2122 Duo;Memory Stick PRO Duo\u2122;Memory Stick PRO Duo\u2122(high speed);Memory Stick PRO HG Duo\u2122;Memory Stick XC-HG Duo\u2122;Memory Stick Micro;Memory Stick Micro (Mark2);SD Memory Card;SDHC Memory Card;SDXC Memory Card;microSD Memory Card;microSDHC Memory Card;microSDXC Memory Card",
        "Memory Stick\u2122 Duo;Memory Stick PRO Duo\u2122;Memory Stick PRO Duo\u2122(high speed);Memory Stick PRO HG Duo\u2122;Memory Stick XC-HG Duo\u2122;Memory Stick Micro;Memory Stick Micro (Mark2);SD Memory Card;SDHC Memory Card;SDXC Memory Card;microSD Memory Card;microSDHC Memory Card;microSDXC Memory Card"
    ],
    "digital zoom": "Approx. 126 x",
    "dimensions w x d x h": "129.6 x 122.3 x 95 mm",
    "display": "3.0'' (7.5 cm) (4:3) / 460,800 dots / Xtra Fine / TFT LCD",
    "ean": "4905524981650",
    "filter size": "Yes",
    "flash exposure compensation": "+/- 2.0 EV (1/3 EV steps)",
    "flash modes": "Auto,Flash On,Flash Off\nAuto / Flash On / Slow Synchro / Flash Off / Advanced Flash",
    "focal length range ff": "4.4 - 277 mm",
    "image processor": "Sorry, this data isn\u2032t available",
    "internal memory": [
        "55mb",
        "Approx. 55MB"
    ],
    "iso sensitivity": [
        "Auto/80/100/200/400/800/1600/3200",
        "Auto: (ISO100-ISO800 Level)\nISO 80-3200"
    ],
    "lcd screen size": "3",
    "lens system": [
        "Sony Lens",
        "Sony Lens"
    ],
    "light metering": "Multi Pattern",
    "manufacturer": "Sony",
    "megapixel": "20.1",
    "optical zoom": [
        "63x",
        "63 x"
    ],
    "pdf url": "No",
    "picture effects": [
        "Still: Toy camera / Pop Color / Partial Color / Soft High-key, Movie: Toy camera, Pop Color, Partial Color, Soft High-key",
        "Still: Toy camera / Pop Color / Partial Color / Soft High-key, Movie: Toy camera, Pop Color, Partial Color, Soft High-key"
    ],
    "product promotion": "N/A",
    "recording format": [
        "Still Images: JPEG (DCF, Exif, MPF Baseline) compliant, DPOF compatible",
        "Still Images: JPEG (DCF, Exif, MPF Baseline) compliant, DPOF compatible"
    ],
    "scene modes": "Night Portrait, Portrait, Landscape, Portrait, Beach, Snow, Fireworks",
    "selftimer": "Off / 10sec. / 2sec. / portrait1 / portrait2",
    "sensor type": [
        "1/2.3\" type (7.76mm) Super HAD CCD",
        "1/2.3 type (7.76mm) Super HAD CCD"
    ],
    "shooting modes": "Aperture Priority",
    "short description": "H400 compact camera with a 20.1MP sensor, 63x optical zoom, Optical SteadyShot, & X Type lithium-ion battery",
    "sku": "DSCH400B.CEH",
    "specification": "Picture qualitySensor type1/2.3\" type (7.76mm) Super HAD CCDLens systemFocal length range (f-f)4.4 - 277 mmFilter sizeYes Optical zoom63xLight exposureISO sensitivityAuto: (ISO100-ISO800 Level)\nISO 80-3200Light meteringMulti PatternFlashFlash modesAuto,Flash On,Flash Off\nAuto / Flash On / Slow Synchro / Flash Off / Advanced FlashFlash exposure compensation+/- 2.0 EV (1/3 EV steps)MemoryCompatible memory cardsMemory Stick\u2122 Duo;Memory Stick PRO Duo\u2122;Memory Stick PRO Duo\u2122(high speed);Memory Stick PRO HG Duo\u2122;Memory Stick XC-HG Duo\u2122;Memory Stick Micro;Memory Stick Micro (Mark2);SD Memory Card;SDHC Memory Card;SDXC Memory Card;microSD Memory Card;microSDHC Memory Card;microSDXC Memory CardDisplayDisplay3.0'' (7.5 cm) (4:3) / 460,800 dots / Xtra Fine / TFT LCDViewfinderViewfinder type0.2-type electronic viewfinderCameraPlayback modesDate view, Slideshow with MusicWhite balanceAuto, Daylight, Cloudy, Incandescent, FlashScene modesNight Portrait, Portrait, Landscape, Portrait, Beach, Snow, FireworksShooting modesAperture PriorityTechnical detailsPlayback modesDate view, Slideshow with MusicAccessories includedRechargeable Battery Pack NP-BX1;AC AdaptorAC-UB10C;Multi USB cable;Shoulder Strap;Lens Cap;Instruction ManualRecording formatStill Images: JPEG (DCF, Exif, MPF Baseline) compliant, DPOF compatibleLens systemSony LensPicture effectsStill: Toy camera / Pop Color / Partial Color / Soft High-key, Movie: Toy camera, Pop Color, Partial Color, Soft High-keySelf-timerOff / 10sec. / 2sec. / portrait1 / portrait2Image processorSorry, this data isn\u2032t availableF-number (relative aperture)F3.4 - 6.5 Flash typeSorry, this data isn\u2032t availableSteadyShotOpticalShutter speediAuto (2 - 1/2000) / Program Auto (1 - 1/2000) / Manual (30 - 1/2000)Display brightness control5(Bright) / 4 / 3 / 2 / 1(Dark)Built-in WiFi?Effective megapixels20.1 MPDimensions (WxHxD)129.6 x 95 x 122.3 mmBattery lifeUp to 300 shots / 150 minutesInternal memoryApprox. 55MBOther featuresAccessories includedRechargeable Battery Pack NP-BX1;AC AdaptorAC-UB10C;Multi USB cable;Shoulder Strap;Lens Cap;Instruction ManualRecording formatStill Images: JPEG (DCF, Exif, MPF Baseline) compliant, DPOF compatibleLens systemSony LensPicture effectsStill: Toy camera / Pop Color / Partial Color / Soft High-key, Movie: Toy camera, Pop Color, Partial Color, Soft High-key",
    "steadyshot": "Optical",
    "video capability": "Yes",
    "viewfinder type": "0.2-type electronic viewfinder",
    "weight": "655 g",
    "white balance": "Auto, Daylight, Cloudy, Incandescent, Flash"
}