{
    "<page title>": "Sony HX400V Compact Camera with 50x Optical Zoom - Digital Cameras - Photo - Visual | ILGS.net",
    "ac adapter included": "Yes",
    "auto focusing af modes": "Continuous Auto Focus, Single Auto Focus",
    "auto mode focusing range tele": "2.4 - ?",
    "auto mode focusing range wide": "0.01 - ?",
    "batteries included": "Yes",
    "battery life cipa standard": "300 shots",
    "battery life max": "2.5h",
    "battery type": [
        "NP-BX1",
        "NP-BX1"
    ],
    "builtin flash": [
        "Yes",
        "Yes"
    ],
    "builtin microphone": "Yes",
    "cables included": "AC, USB",
    "camera file system": "Exif, DCF, DPOF, MPF",
    "camera shutter speed": "iAuto (4 - 1/4000) / Program Auto (1 - 1/4000) / Aperture Priority (8 - 1/2000) / Shutter Priority (30 - 1/4000) / Manual (30 - 1/4000)",
    "camera shutter speed max": "0.00025s",
    "camera shutter speed min": "30s",
    "camera type": "Bridge",
    "colour of product": [
        "Black",
        "Black",
        "Black"
    ],
    "compatible memory cards": [
        "Memory Stick Duo;Memory Stick PRO Duo\u2122;Memory Stick PRO Duo\u2122(high speed);Memory Stick PRO HG Duo\u2122;Memory Stick XC-HG Duo\u2122;Memory Stick Micro;Memory Stick Micro (Mark2);SD Memory Card;SDHC Memory Card;SDXC Memory Card;microSD Memory Card;microSDHC Memory Card;microSDXC Memory Card",
        "MicroSD (TransFlash), MicroSDHC, MicroSDXC, MS Duo, MS Micro (M2), MS PRO Duo, MS Pro-HG Duo, MS XC-HG Duo, SD, SDHC, SDXC"
    ],
    "depth": "10.32 cm",
    "digital zoom": [
        "Approx. 200 x",
        "810x"
    ],
    "dimensions w x d x h": "129.6 x 103.2 x 93.2 mm",
    "display": "LCD",
    "display diagonal": "7.62 cm (3\")",
    "display resolution numeric": "921600 pixels",
    "ean": "4905524981483",
    "external flash connector": "Yes",
    "filter size": "5.5 cm",
    "flash modes": "Auto, Fill-in, Flash off, Slow synchronization",
    "flash range tele": "2.4 - 3.5m",
    "flash range wide": "0.5 - 8.5m",
    "focal length range ff": "4.3 - 215 mm",
    "focus adjustment": "Auto/Manual",
    "full hd": "Yes",
    "gps": [
        "Yes",
        "Yes",
        "Yes"
    ],
    "hdmi": [
        "Yes",
        "Yes"
    ],
    "hdmi connector type": "Micro",
    "height": "9.32 cm",
    "image formats supported": "JPG",
    "image processor": "BIONZ X",
    "image sensor size": "25.4/58.4 mm (1/2.3\")",
    "image stabilizer": "Yes",
    "iso sensitivity": [
        "80, 100, 125, 160, 200, 250, 320, 400, 500, 640, 800, 1000, 1250, 1600, 2000, 2500, 3200, 6400, 12800, Auto",
        "Auto(ISO80-3200 selectable with upper / lower limit) 80/100/125/160/200/250/320/400/500/640/800/1000/1250/1600/2000/2500/3200 Multi-Frame NR:Auto(ISO80-3200)100/200/400/800/1600/3200/6400/12800"
    ],
    "iso sensitivity max": "12800",
    "iso sensitivity min": "80",
    "lcd screen size": "3",
    "lens structure elementsgroups": "15/10",
    "light exposure correction": "\u00b1 2EV (1/3EV step)",
    "light exposure modes": "Auto",
    "light metering": "Centre-weighted, Evaluative (Multi-pattern), Spot",
    "manufacturer": "Sony",
    "maximum image resolution": "5184 x 3888 pixels",
    "maximum video resolution": "1920 x 1080 pixels",
    "megapixel": [
        "20.4 MP",
        "20.4"
    ],
    "motion jpeg frame rate": "50 fps",
    "optical zoom": [
        "50x",
        "50 x"
    ],
    "pdf url": "No",
    "photo effects": "Antique, Black&White",
    "power source type": "Battery",
    "product promotion": "N/A",
    "scene modes": "Beach, Fireworks, Food, Landscape, Night, Night portrait, Pet, Portrait, Snow, Sports, Twilight",
    "selftimer": "2, 10s",
    "sensor type": [
        "1/2.3 type (7.82mm) Exmor R CMOS sensor",
        "CMOS"
    ],
    "shooting modes": "Aperture priority, Auto, Manual, Movie, Program, Scene, Shutter priority",
    "short description": "20.4MP, 1/2.3\" Exmor R CMOS, ZEISS Vario Sonnar T*, f=4.3-215mm, F2.8 (W) - 6.3 (T), Wi-Fi, GPS",
    "sku": "DSCHX400VB.CEH",
    "specification": "Picture qualityImage sensor size25.4/58.4 mm (1/2.3\")Still image resolution(s)3:2 - 18M(5184\u00d73456) / 8.9M(3648\u00d72432) / 4.5M(2592\u00d71728)\n4:3 - 20M(5184\u00d73888) / 10M(3648\u00d72736) / 5M(2592\u00d71944) / VGA\n16:9 - 15M(5184\u00d72920) / 7.5M(3648\u00d72056) / 2.1M(1920\u00d71080)\n1:1 - 15M(3888\u00d73888) / 7.5M(2736\u00d72736) / 3.7M(1920\u00d71920)\n7152\u00d71080 / 4912\u00d71920 / 4912\u00d71080 / 3424\u00d71920 / 11520\u00d71080Image stabilizerYesImage formats supportedJPGMaximum image resolution5184 x 3888 pixelsSensor typeCMOSCamera typeBridgeMegapixel20.4 MPLens systemFocal length range (f-f)4.3 - 215 mmLens structure (elements/groups)15/10Number of aspheric elements3Filter size5.5 cmDigital zoom810xOptical zoom50xFocusingFocus adjustmentAuto/ManualAuto focusing (AF) modesContinuous Auto Focus, Single Auto FocusAuto Mode focusing range (wide)0.01 - ?Auto Mode focusing range (tele)2.4 - ?Light exposureISO sensitivity80, 100, 125, 160, 200, 250, 320, 400, 500, 640, 800, 1000, 1250, 1600, 2000, 2500, 3200, 6400, 12800, AutoLight exposure modesAutoLight exposure correction\u00b1 2EV (1/3EV step)Light meteringCentre-weighted, Evaluative (Multi-pattern), SpotISO sensitivity (min)80ISO sensitivity (max)12800ShutterCamera shutter speed (min)30sCamera shutter speed (max)0.00025sFlashFlash modesAuto, Fill-in, Flash off, Slow synchronizationBuilt-in flashYesFlash range (wide)0.5 - 8.5mFlash range (tele)2.4 - 3.5mExternal flash connectorYesVideoVideo resolutions640 x 480, 1440 x 1080, 1920 x 1080 pixelsMotion JPEG frame rate50 fpsFull HDYesMaximum video resolution1920 x 1080 pixelsAudioBuilt-in microphoneYesMemoryCompatible memory cardsMicroSD (TransFlash), MicroSDHC, MicroSDXC, MS Duo, MS Micro (M2), MS PRO Duo, MS Pro-HG Duo, MS XC-HG Duo, SD, SDHC, SDXCDisplayDisplayLCDDisplay diagonal7.62 cm (3\")Display resolution (numeric)921600 pixelsPorts & interfacesUSB version2.0HDMI connector typeMicroHDMIYesNetworkingWi-Fi standards802.11b, 802.11g, 802.11nWi-FiYesCameraColour of productBlackWhite balanceAuto, Cloudy, Custom modes, Daylight, Flash, Fluorescent, IncandescentScene modesBeach, Fireworks, Food, Landscape, Night, Night portrait, Pet, Portrait, Snow, Sports, TwilightShooting modesAperture priority, Auto, Manual, Movie, Program, Scene, Shutter priorityPhoto effectsAntique, Black&WhiteSelf-timer2, 10sGPSYesCamera file systemExif, DCF, DPOF, MPFBatteryBattery life (CIPA standard)300 shotsBattery life (max)2.5hBattery typeNP-BX1Power source typeBatteryTechnical detailsHDMIYesGPSYesDesignColour of productBlackPerformanceGPSYesWeight & dimensionsWidth12.96 cmDepth10.32 cmHeight9.32 cmWeight633gWeight (including battery)660gPackaging contentCables includedAC, USBBatteries includedYesAC adapter includedYesTechnical detailsImage processorBIONZ X",
    "still image resolutions": "3:2 - 18M(5184\u00d73456) / 8.9M(3648\u00d72432) / 4.5M(2592\u00d71728)\n4:3 - 20M(5184\u00d73888) / 10M(3648\u00d72736) / 5M(2592\u00d71944) / VGA\n16:9 - 15M(5184\u00d72920) / 7.5M(3648\u00d72056) / 2.1M(1920\u00d71080)\n1:1 - 15M(3888\u00d73888) / 7.5M(2736\u00d72736) / 3.7M(1920\u00d71920)\n7152\u00d71080 / 4912\u00d71920 / 4912\u00d71080 / 3424\u00d71920 / 11520\u00d71080",
    "usb version": "2.0",
    "video capability": "Yes",
    "video resolutions": "640 x 480, 1440 x 1080, 1920 x 1080 pixels",
    "warranty": "1 Year",
    "weight": [
        "660 g",
        "633g"
    ],
    "weight including battery": "660g",
    "white balance": "Auto, Cloudy, Custom modes, Daylight, Flash, Fluorescent, Incandescent",
    "width": "12.96 cm",
    "wifi": "Yes",
    "wifi standards": "802.11b, 802.11g, 802.11n"
}