{
    "<page title>": "Canon PowerShot SX270 HS - Digital Cameras - Photo - Visual | ILGS.net",
    "ac adapter included": "Yes",
    "analog signal format system": "NTSC, PAL",
    "auto exposure ae lock": "Yes",
    "auto focus af assist beam": "Yes",
    "auto focus af lock": "Yes",
    "auto focus af points": "1",
    "auto focusing af modes": "Continuous Auto Focus, Face detection, Servo Auto Focus, Single Auto Focus, Tracking Auto Focus",
    "av output": "Yes",
    "batteries included": "Yes",
    "battery charger included": "Yes",
    "battery life cipa standard": "260 shots",
    "battery life max": "3.5h",
    "battery technology": "Lithium-Ion (Li-Ion)",
    "battery type": "NB-6L",
    "brightness adjustment": "Yes",
    "builtin flash": "Yes",
    "builtin processor": [
        "DIGIC 6",
        "DIGIC 6",
        "DIGIC 6"
    ],
    "cables included": "AC, USB",
    "camera file system": "DCF, DPOF 1.1, Exif 2.3",
    "camera playback": "Movie, Single image",
    "camera shutter speed max": "15s",
    "camera shutter speed min": "0.0003125s",
    "camera type": "Compact",
    "closest focusing distance": "0.05m",
    "colour of product": [
        "Grey",
        "Grey"
    ],
    "compatible memory cards": "SD, SDHC, SDXC",
    "contrast adjustment": "Yes",
    "custom colour": "Yes",
    "depth": "3.26 cm",
    "digital zoom": "4x",
    "direct printing": [
        "Yes",
        "Yes",
        "Yes"
    ],
    "display": "TFT",
    "display diagonal": "7.62 cm (3\")",
    "display resolution numeric": "461000 pixels",
    "ean": "8714574598697",
    "external flash connector": "Yes",
    "field of view": "100%",
    "flash exposure compensation": "Yes",
    "flash exposure correction": "\u00b12EV (1/3 EV step)",
    "flash exposure lock": "Yes",
    "flash modes": "Auto, Flash off, Flash on, Manual, Red-eye reduction, Slow synchronization",
    "flash range tele": "1 - 2m",
    "flash range wide": "0.5 - 3.5m",
    "flash syncspeed": "0.0005s",
    "focal length range ff": "4.5 - 90 mm",
    "focus": "TTL",
    "focus adjustment": "Auto/Manual",
    "full hd": "Yes",
    "hand strap": "Yes",
    "hdmi ports quantity": [
        "1",
        "1",
        "1"
    ],
    "height": "6.11 cm",
    "histogram": "Yes",
    "image formats supported": "EXIF, JPG",
    "image sensor size": "25.4/58.4 mm (1/2.3\")",
    "image stabilizer": "Yes",
    "iso sensitivity": "80, 100, 200, 400, 800, 1600, 3200, 6400, Auto",
    "iso sensitivity max": "6400",
    "iso sensitivity min": "80",
    "languages support": [
        "ARA, CHI (SIMPL), CHI (TR), CZE, DAN, DEU, DUT, ENG, ESP, FIN, FRE, GRE, HUN, ITA, JPN, KOR, NOR, POL, POR, RUM, RUS, SWE, THA, TUR, UKR",
        "ARA, CHI (SIMPL), CHI (TR), CZE, DAN, DEU, DUT, ENG, ESP, FIN, FRE, GRE, HUN, ITA, JPN, KOR, NOR, POL, POR, RUM, RUS, SWE, THA, TUR, UKR"
    ],
    "lens structure elementsgroups": "12/10",
    "lens type": "Wide-angle zoom",
    "light exposure control": "Program AE",
    "light exposure correction": "\u00b1 2EV (1/3EV step)",
    "light exposure modes": "Aperture priority AE, Auto, Manual, Shutter priority AE",
    "light metering": "Centre-weighted, Evaluative (Multi-pattern), Spot",
    "mac operating systems supported": [
        "Mac OS X 10.6 Snow Leopard, Mac OS X 10.7 Lion, Mac OS X 10.8 Mountain Lion",
        "Mac OS X 10.6 Snow Leopard, Mac OS X 10.7 Lion, Mac OS X 10.8 Mountain Lion"
    ],
    "manufacturer": "Canon",
    "maximum aperture": "6.8",
    "maximum focal length 35mm film equiv": "50 cm",
    "maximum image resolution": "4000 x 3000 pixels",
    "maximum video resolution": "1920 x 1080 pixels",
    "megapixel": "12.1 MP",
    "memory slots": "1",
    "minimum aperture": "3.5",
    "minimum focal length 35mm film equiv": "2.5 cm",
    "motion jpeg frame rate": "60 fps",
    "number of batteries supported": "1",
    "operating relative humidity hh": "10 - 90%",
    "operating temperature tt": "0 - 40 \u00b0C",
    "optical zoom": "20x",
    "orientation sensor": "Yes",
    "pdf url": "http://pdfs.icecat.biz/pdf/37807233-242.pdf",
    "photo effects": "Black&White, Neutral, Positive film, Sepia, Vivid",
    "pictbridge": "Yes",
    "power source type": "Battery",
    "product promotion": "N/A",
    "quick start guide": [
        "Yes",
        "Yes"
    ],
    "resolution at capture speed": [
        "1280\u00d7720@30fps, 640x480@30fps",
        "1280\u00d7720@30fps, 640x480@30fps"
    ],
    "scene modes": "Fireworks, Night, Portrait, Snow, Sports, Underwater",
    "selftimer": "2, 10s",
    "sensor type": "CMOS",
    "shooting modes": "Aperture priority, Auto, Manual, Movie, Program, Scene, Shutter priority",
    "short description": "PowerShot SX270 HS - 12.1MP, 4000 x 3000, 1/2.3\" CMOS, DIGIC 6, f/3.5 - f/6.8, TTL, ISO: 80-6400, 7.62 cm (3.0 \") PureColor II G (TFT), 1920x1080/60fps, USB, mini HDMI, PAL/NTSC, SD/SDHC/SDXC, 227g, Grey",
    "sku": "8228B011AA",
    "smile detection": "Yes",
    "specification": "Picture qualityImage sensor size25.4/58.4 mm (1/2.3\")Supported aspect ratios3:2, 4:3, 16:9Still image resolution(s)480 x 480, 640 x 360, 640 x 424, 640 x 480, 1200 x 1200, 1600 x 1064, 1600 x 1200, 1920 x 1080, 2112 x 2112, 2816 x 1584, 2816 x 1880, 2816 x 2112, 2992 x 2992, 4000 x 2248, 4000 x 2664, 4000 x 3000Image stabilizerYesImage formats supportedEXIF, JPGMaximum image resolution4000 x 3000 pixelsSensor typeCMOSCamera typeCompactMegapixel12.1 MPLens systemFocal length range (f-f)4.5 - 90 mmMinimum focal length (35mm film equiv)2.5 cmMaximum focal length (35mm film equiv)50 cmMinimum aperture3.5Maximum aperture6.8Lens structure (elements/groups)12/10Lens typeWide-angle zoomDigital zoom4xOptical zoom20xFocusingFocusTTLFocus adjustmentAuto/ManualAuto focusing (AF) modesContinuous Auto Focus, Face detection, Servo Auto Focus, Single Auto Focus, Tracking Auto FocusSmile detectionYesClosest focusing distance0.05mAuto Focus (AF) points1Auto Focus (AF) lockYesAuto Focus (AF) assist beamYesLight exposureISO sensitivity80, 100, 200, 400, 800, 1600, 3200, 6400, AutoLight exposure modesAperture priority AE, Auto, Manual, Shutter priority AELight exposure controlProgram AELight exposure correction\u00b1 2EV (1/3EV step)Light meteringCentre-weighted, Evaluative (Multi-pattern), SpotAuto Exposure (AE) lockYesISO sensitivity (min)80ISO sensitivity (max)6400ShutterCamera shutter speed (min)0.0003125sCamera shutter speed (max)15sFlashFlash modesAuto, Flash off, Flash on, Manual, Red-eye reduction, Slow synchronizationBuilt-in flashYesFlash sync-speed0.0005sFlash range (wide)0.5 - 3.5mFlash range (tele)1 - 2mFlash exposure lockYesFlash exposure correction\u00b12EV (1/3 EV step)Flash exposure compensationYesExternal flash connectorYesVideoVideo resolutions320 x 240, 640 x 480, 1280 x 720, 1920 x 1080 pixelsResolution at capture speed1280\u00d7720@30fps, 640x480@30fpsVideo formats supportedH.263, H.264, MPEG2, MPEG4Motion JPEG frame rate60 fpsFull HDYesAnalog signal format systemNTSC, PALMaximum video resolution1920 x 1080 pixelsMemoryCompatible memory cardsSD, SDHC, SDXCMemory slots1DisplayDisplayTFTDisplay diagonal7.62 cm (3\")Display resolution (numeric)461000 pixelsField of view100%Ports & interfacesPictBridgeYesUSB 2.0 ports quantity1USB connector typeMini-USB BHDMI ports quantity1AV outputYesCameraColour of productGreyWhite balanceAuto, Cloudy, Custom modes, Daylight, Fluorescent, Fluorescent H, Tungsten, UnderwaterScene modesFireworks, Night, Portrait, Snow, Sports, UnderwaterShooting modesAperture priority, Auto, Manual, Movie, Program, Scene, Shutter priorityPhoto effectsBlack&White, Neutral, Positive film, Sepia, VividSelf-timer2, 10sContrast adjustmentYesCamera playbackMovie, Single imageOrientation sensorYesLanguages supportARA, CHI (SIMPL), CHI (TR), CZE, DAN, DEU, DUT, ENG, ESP, FIN, FRE, GRE, HUN, ITA, JPN, KOR, NOR, POL, POR, RUM, RUS, SWE, THA, TUR, UKRHistogramYesDirect printingYesCustom colourYesCamera file systemDCF, DPOF 1.1, Exif 2.3Built-in processorDIGIC 6Brightness adjustmentYesBatteryBattery technologyLithium-Ion (Li-Ion)Battery life (CIPA standard)260 shotsBattery life (max)3.5hBattery typeNB-6LNumber of batteries supported1Power source typeBatteryOperating system/softwareWindows operating systems supportedWindows 7 Home Basic, Windows 7 Home Basic x64, Windows 7 Home Premium, Windows 7 Home Premium x64, Windows 7 Professional, Windows 7 Professional x64, Windows 7 Starter, Windows 7 Starter x64, Windows 7 Ultimate, Windows 7 Ultimate x64, Windows 8, Windows 8 Enterprise, Windows 8 Enterprise x64, Windows 8 Pro, Windows 8 Pro x64, Windows 8 x64, Windows Vista Business, Windows Vista Business x64, Windows Vista Enterprise, Windows Vista Enterprise x64, Windows Vista Home Basic, Windows Vista Home Basic x64, Windows Vista Home Premium, Windows Vista Home Premium x64, Windows Vista Ultimate, Windows Vista Ultimate x64, Windows XP Home, Windows XP Home x64, Windows XP Professional, Windows XP Professional x64Mac operating systems supportedMac OS X 10.6 Snow Leopard, Mac OS X 10.7 Lion, Mac OS X 10.8 Mountain LionTechnical detailsQuick start guideYesUSB 2.0 ports quantity1HDMI ports quantity1Resolution at capture speed1280\u00d7720@30fps, 640x480@30fpsLanguages supportARA, CHI (SIMPL), CHI (TR), CZE, DAN, DEU, DUT, ENG, ESP, FIN, FRE, GRE, HUN, ITA, JPN, KOR, NOR, POL, POR, RUM, RUS, SWE, THA, TUR, UKRDirect printingYesProcessorBuilt-in processorDIGIC 6DesignColour of productGreyPerformanceDirect printingYesBuilt-in processorDIGIC 6Operational conditionsOperating temperature (T-T)0 - 40 \u00b0COperating relative humidity (H-H)10 - 90%System requirementsWindows operating systems supportedWindows 7 Home Basic, Windows 7 Home Basic x64, Windows 7 Home Premium, Windows 7 Home Premium x64, Windows 7 Professional, Windows 7 Professional x64, Windows 7 Starter, Windows 7 Starter x64, Windows 7 Ultimate, Windows 7 Ultimate x64, Windows 8, Windows 8 Enterprise, Windows 8 Enterprise x64, Windows 8 Pro, Windows 8 Pro x64, Windows 8 x64, Windows Vista Business, Windows Vista Business x64, Windows Vista Enterprise, Windows Vista Enterprise x64, Windows Vista Home Basic, Windows Vista Home Basic x64, Windows Vista Home Premium, Windows Vista Home Premium x64, Windows Vista Ultimate, Windows Vista Ultimate x64, Windows XP Home, Windows XP Home x64, Windows XP Professional, Windows XP Professional x64Mac operating systems supportedMac OS X 10.6 Snow Leopard, Mac OS X 10.7 Lion, Mac OS X 10.8 Mountain LionWeight & dimensionsWidth10.64 cmDepth3.26 cmHeight6.11 cmWeight (including battery)227gPackaging contentQuick start guideYesHand strapYesCables includedAC, USBBattery charger includedYesBatteries includedYesAC adapter includedYesOther featuresUSB 2.0 ports quantity1HDMI ports quantity1",
    "still image resolutions": "480 x 480, 640 x 360, 640 x 424, 640 x 480, 1200 x 1200, 1600 x 1064, 1600 x 1200, 1920 x 1080, 2112 x 2112, 2816 x 1584, 2816 x 1880, 2816 x 2112, 2992 x 2992, 4000 x 2248, 4000 x 2664, 4000 x 3000",
    "supported aspect ratios": "3:2, 4:3, 16:9",
    "usb 20 ports quantity": [
        "1",
        "1",
        "1"
    ],
    "usb connector type": "Mini-USB B",
    "video formats supported": "H.263, H.264, MPEG2, MPEG4",
    "video resolutions": "320 x 240, 640 x 480, 1280 x 720, 1920 x 1080 pixels",
    "weight including battery": "227g",
    "white balance": "Auto, Cloudy, Custom modes, Daylight, Fluorescent, Fluorescent H, Tungsten, Underwater",
    "width": "10.64 cm",
    "windows operating systems supported": [
        "Windows 7 Home Basic, Windows 7 Home Basic x64, Windows 7 Home Premium, Windows 7 Home Premium x64, Windows 7 Professional, Windows 7 Professional x64, Windows 7 Starter, Windows 7 Starter x64, Windows 7 Ultimate, Windows 7 Ultimate x64, Windows 8, Windows 8 Enterprise, Windows 8 Enterprise x64, Windows 8 Pro, Windows 8 Pro x64, Windows 8 x64, Windows Vista Business, Windows Vista Business x64, Windows Vista Enterprise, Windows Vista Enterprise x64, Windows Vista Home Basic, Windows Vista Home Basic x64, Windows Vista Home Premium, Windows Vista Home Premium x64, Windows Vista Ultimate, Windows Vista Ultimate x64, Windows XP Home, Windows XP Home x64, Windows XP Professional, Windows XP Professional x64",
        "Windows 7 Home Basic, Windows 7 Home Basic x64, Windows 7 Home Premium, Windows 7 Home Premium x64, Windows 7 Professional, Windows 7 Professional x64, Windows 7 Starter, Windows 7 Starter x64, Windows 7 Ultimate, Windows 7 Ultimate x64, Windows 8, Windows 8 Enterprise, Windows 8 Enterprise x64, Windows 8 Pro, Windows 8 Pro x64, Windows 8 x64, Windows Vista Business, Windows Vista Business x64, Windows Vista Enterprise, Windows Vista Enterprise x64, Windows Vista Home Basic, Windows Vista Home Basic x64, Windows Vista Home Premium, Windows Vista Home Premium x64, Windows Vista Ultimate, Windows Vista Ultimate x64, Windows XP Home, Windows XP Home x64, Windows XP Professional, Windows XP Professional x64"
    ]
}