{
    "<page title>": "Canon Digital IXUS 140 - Digital Cameras - Photo - Visual | ILGS.net",
    "ac adapter included": "Yes",
    "auto exposure ae lock": "Yes",
    "auto focus af assist beam": "Yes",
    "auto focus af lock": "Yes",
    "auto focus af points": "9",
    "auto focus af points selection": "Auto",
    "auto focusing af modes": "Centre weighted Auto Focus, Face detection",
    "batteries included": "Yes",
    "battery charger included": "Yes",
    "battery life cipa standard": "190 shots",
    "battery technology": "Lithium-Ion (Li-Ion)",
    "brightness adjustment": "Yes",
    "builtin flash": "Yes",
    "cables included": "AC, USB",
    "camera file system": "DCF",
    "camera shutter speed max": "0.0005s",
    "camera shutter speed min": "0.0005s",
    "camera type": "Compact",
    "closest focusing distance": "0.01m",
    "colour of product": [
        "Red",
        "Red"
    ],
    "combined zoom": "32x",
    "compatible memory cards": "SD, SDHC, SDXC",
    "depth": "2.06 cm",
    "digital zoom": "4x",
    "direct printing": [
        "Yes",
        "Yes",
        "Yes"
    ],
    "display": "TFT",
    "display diagonal": "7.62 cm (3\")",
    "display resolution numeric": "460000 pixels",
    "ean": "8714574599151",
    "flash exposure compensation": "Yes",
    "flash exposure lock": "Yes",
    "flash modes": "Auto, Flash off, Flash on, Slow synchronization",
    "focal length range ff": "5 - 40 mm",
    "focus": "TTL",
    "full hd": "No",
    "height": "5.6 cm",
    "histogram": "Yes",
    "image sensor size": "25.4/58.4 mm (1/2.3\")",
    "image stabilizer": "Yes",
    "image stabilizer location": [
        "Lens",
        "Lens"
    ],
    "iso sensitivity": "100, 200, 400, 800, 1600, Auto",
    "iso sensitivity max": "1600",
    "iso sensitivity min": "100",
    "languages support": [
        "ARA, CHI (SIMPL), CHI (TR), CZE, DAN, DEU, DUT, ENG, ESP, FIN, FRE, GRE, HUN, ITA, JPN, KOR, NOR, POL, POR, RUM, RUS, SWE, THA, TUR, UKR",
        "ARA, CHI (SIMPL), CHI (TR), CZE, DAN, DEU, DUT, ENG, ESP, FIN, FRE, GRE, HUN, ITA, JPN, KOR, NOR, POL, POR, RUM, RUS, SWE, THA, TUR, UKR"
    ],
    "lens structure elementsgroups": "8/7",
    "manufacturer": "Canon",
    "maximum focal length 35mm film equiv": "22.4 cm",
    "maximum image resolution": "4608 x 3456 pixels",
    "maximum video resolution": "1280 x 720 pixels",
    "megapixel": "16 MP",
    "minimum focal length 35mm film equiv": "2.8 cm",
    "operating relative humidity hh": "10 - 90%",
    "operating temperature tt": "0 - 40 \u00b0C",
    "optical zoom": "8x",
    "pdf url": "http://pdfs.icecat.biz/pdf/40398741-1034.pdf",
    "pictbridge": "Yes",
    "playback zoom max": "10x",
    "power source type": "Battery",
    "product promotion": "N/A",
    "resolution at capture speed": [
        "1280x720@25fps, 640x480@30fps",
        "1280x720@25fps, 640x480@30fps"
    ],
    "selftimer": "2, 10s",
    "sensor type": "CCD",
    "short description": "16MP, 8x(4x digital), 7.62 cm (3 \") , TFT, DIGIC 4",
    "sku": "8198B006AA",
    "specification": "Picture qualityImage sensor size25.4/58.4 mm (1/2.3\")Supported aspect ratios1:1, 3:2, 4:3, 16:9Still image resolution(s)4:3 - (L) 4608 x 3456, (M1) 3264 x 2448, (M2) 1600 x 1200, (S) 640 x 480\n16:9 - (L) 4608 x 2592, (M1) 3264 x 1832, (M2) 1920 x 1080, (S) 640 x 360\n3:2 - (L) 4608 x 3072, (M1) 3264 x 2176, (M2) 1600 x 1064, (S) 640 x 424\n1:1 - (L) 3456 x 3456, (M1) 2448 x 2448, (M2) 1200 x 1200, (S) 480 x 480Image stabilizerYesImage stabilizer locationLensMaximum image resolution4608 x 3456 pixelsSensor typeCCDCamera typeCompactMegapixel16 MPLens systemFocal length range (f-f)5 - 40 mmMinimum focal length (35mm film equiv)2.8 cmMaximum focal length (35mm film equiv)22.4 cmLens structure (elements/groups)8/7Extra/Smart zoom16xCombined zoom32xDigital zoom4xOptical zoom8xFocusingFocusTTLAuto focusing (AF) modesCentre weighted Auto Focus, Face detectionClosest focusing distance0.01mAuto Focus (AF) points selectionAutoAuto Focus (AF) points9Auto Focus (AF) lockYesAuto Focus (AF) assist beamYesLight exposureISO sensitivity100, 200, 400, 800, 1600, AutoAuto Exposure (AE) lockYesISO sensitivity (min)100ISO sensitivity (max)1600ShutterCamera shutter speed (min)0.0005sCamera shutter speed (max)0.0005sFlashFlash modesAuto, Flash off, Flash on, Slow synchronizationBuilt-in flashYesFlash exposure lockYesFlash exposure compensationYesVideoVideo resolutions640 x 480, 1280 x 720 pixelsResolution at capture speed1280x720@25fps, 640x480@30fpsFull HDNoMaximum video resolution1280 x 720 pixelsMemoryCompatible memory cardsSD, SDHC, SDXCDisplayDisplayTFTDisplay diagonal7.62 cm (3\")Display resolution (numeric)460000 pixelsPorts & interfacesPictBridgeYesUSB connector typeMini-USB BNetworkingWi-Fi standards802.11b, 802.11g, 802.11nWi-FiYesCameraImage stabilizer locationLensColour of productRedWhite balanceAuto, Cloudy, Custom modes, Daylight, Fluorescent, Fluorescent H, TungstenSelf-timer2, 10sPlayback zoom (max)10xLanguages supportARA, CHI (SIMPL), CHI (TR), CZE, DAN, DEU, DUT, ENG, ESP, FIN, FRE, GRE, HUN, ITA, JPN, KOR, NOR, POL, POR, RUM, RUS, SWE, THA, TUR, UKRHistogramYesDirect printingYesCamera file systemDCFBrightness adjustmentYesBatteryBattery technologyLithium-Ion (Li-Ion)Battery life (CIPA standard)190 shotsPower source typeBatteryTechnical detailsWrist strap includedYesResolution at capture speed1280x720@25fps, 640x480@30fpsLanguages supportARA, CHI (SIMPL), CHI (TR), CZE, DAN, DEU, DUT, ENG, ESP, FIN, FRE, GRE, HUN, ITA, JPN, KOR, NOR, POL, POR, RUM, RUS, SWE, THA, TUR, UKRDirect printingYesDesignColour of productRedPerformanceDirect printingYesOperational conditionsOperating temperature (T-T)0 - 40 \u00b0COperating relative humidity (H-H)10 - 90%Weight & dimensionsWidth9.54 cmDepth2.06 cmHeight5.6 cmWeight133gPackaging contentWrist strap includedYesCables includedAC, USBBattery charger includedYesBatteries includedYesAC adapter includedYes",
    "still image resolutions": "4:3 - (L) 4608 x 3456, (M1) 3264 x 2448, (M2) 1600 x 1200, (S) 640 x 480\n16:9 - (L) 4608 x 2592, (M1) 3264 x 1832, (M2) 1920 x 1080, (S) 640 x 360\n3:2 - (L) 4608 x 3072, (M1) 3264 x 2176, (M2) 1600 x 1064, (S) 640 x 424\n1:1 - (L) 3456 x 3456, (M1) 2448 x 2448, (M2) 1200 x 1200, (S) 480 x 480",
    "supported aspect ratios": "1:1, 3:2, 4:3, 16:9",
    "usb connector type": "Mini-USB B",
    "video resolutions": "640 x 480, 1280 x 720 pixels",
    "weight": "133g",
    "white balance": "Auto, Cloudy, Custom modes, Daylight, Fluorescent, Fluorescent H, Tungsten",
    "width": "9.54 cm",
    "wifi": "Yes",
    "wifi standards": "802.11b, 802.11g, 802.11n",
    "wrist strap included": [
        "Yes",
        "Yes"
    ]
}