{
    "<page title>": "Samsung NX EK-GN120 - Digital Cameras - Photo - Visual | ILGS.net",
    "ac adapter included": "Yes",
    "audio formats supported": "AAC",
    "auto focusing af modes": "Contrast Detection Auto Focus, Face detection",
    "battery capacity": "4360 mAh",
    "battery life cipa standard": "440 shots",
    "bluetooth": "Yes",
    "bluetooth version": "4.0",
    "builtin flash": "Yes",
    "builtin microphone": "Yes",
    "builtin processor": [
        "Quad Core",
        "Quad Core",
        "Quad Core"
    ],
    "camera shutter speed max": "30s",
    "camera shutter type": "Electronic",
    "colour of product": [
        "Black",
        "Black"
    ],
    "compatible memory cards": "microSD (TransFlash), SDHC, SDXC",
    "data network": "4G, HSPA+, LTE",
    "depth": "10.12 cm",
    "display": "LCD",
    "display aspect ratio": "16:9",
    "display diagonal": "12.12 cm (4.77\")",
    "display resolution": "1280 x 720 pixels",
    "ean": "8806085645233",
    "flash modes": "Auto, Fill-in, Flash off, Red-eye reduction",
    "focus adjustment": "Auto/Manual",
    "full hd": "Yes",
    "hdmi ports quantity": [
        "1",
        "1",
        "1"
    ],
    "height": "2.57 cm",
    "image formats supported": "JPEG XR",
    "image stabilizer": "Yes",
    "internal memory": "16 MB",
    "iso sensitivity": "100, 200, 400, 800, 1600, 3200, 6400, 12800, 25600, Auto",
    "iso sensitivity max": "25600",
    "iso sensitivity min": "100",
    "light exposure correction": "\u00b1 3EV (1/3EV step)",
    "light exposure modes": "Aperture priority AE, Auto, Manual, Shutter priority AE",
    "magnification": "0.68x",
    "manufacturer": "Samsung",
    "maximum image resolution": "5472 x 3648 pixels",
    "maximum memory card size": "64 GB",
    "maximum video resolution": "1920 x 1080 pixels",
    "megapixel": "20.3 MP",
    "memory slots": "1",
    "motion jpeg frame rate": "30 fps",
    "operating relative humidity hh": "5 - 85%",
    "operating temperature tt": "0 - 40 \u00b0C",
    "pdf url": "No",
    "photo effects": "Black&White, Negative film, Sepia",
    "pictbridge": "No",
    "power source type": "Battery",
    "product promotion": "N/A",
    "reviews": "No",
    "scene modes": "Close-up (macro), Fireworks, Landscape, Night, Panorama, Party (indoor), Pet, Portrait, Snow, Sunrise, Sunset",
    "second display": "No",
    "selftimer": "2, 5, 10, 30s",
    "sensor type": "CMOS",
    "short description": "20.3 Mpix, ScLCD 4.77\" 1280 x 720 HD, 16 GB, 1.6GHz CPU, USB 2.0, HDMI 1.4b",
    "sku": "EK-GN120ZKABTU",
    "specification": "Picture qualitySupported aspect ratios1:1, 3:2, 16:9Still image resolution(s)JPEG (3:2):20.0M (5472 x 3648), 10.1M (3888 x 2592), 5.9M (2976 x 1984), 2.0M (1728 x 1152), 5.0M (2736 x 1824): Burst mode only JPEG (16:9):16.9M (5472 x 3080), 7.8M (3712 x 2088), 4.9M (2944 x 1656), 2.1M (1920 x 1080) JPEG (1:1):13.3M (3648 x 3648), 7.0M (2640 x 2640), 4.0M (2000 x 2000), 1.1M (1024 x 1024) RAW : 20.0M (5472 x 3648) * 3D Lens Image Size: JPEG (16:9) 4.1M (2688 x 1512), (16:9) 2.1M (1920 x 1080)Image stabilizerYesTotal megapixels21.6 MPImage formats supportedJPEG XRMaximum image resolution5472 x 3648 pixelsSensor typeCMOSMegapixel20.3 MPFocusingFocus adjustmentAuto/ManualAuto focusing (AF) modesContrast Detection Auto Focus, Face detectionLight exposureISO sensitivity100, 200, 400, 800, 1600, 3200, 6400, 12800, 25600, AutoLight exposure modesAperture priority AE, Auto, Manual, Shutter priority AELight exposure correction\u00b1 3EV (1/3EV step)ISO sensitivity (min)100ISO sensitivity (max)25600ShutterCamera shutter speed (max)30sCamera shutter typeElectronicFlashShoe mounting point typeHotFlash modesAuto, Fill-in, Flash off, Red-eye reductionBuilt-in flashYesVideoVideo resolutions320 x 240, 640 x 480, 1280 x 720, 1920 x 810, 1920 x 1080 pixelsVideo formats supportedH.264, MP4Motion JPEG frame rate30 fpsFull HDYesMaximum video resolution1920 x 1080 pixelsAudioBuilt-in microphoneYesVoice recordingYesAudio formats supportedAACMemoryInternal memory16 MBCompatible memory cardsmicroSD (TransFlash), SDHC, SDXCMemory slots1Maximum memory card size64 GBDisplayDisplay aspect ratio16:9DisplayLCDDisplay diagonal12.12 cm (4.77\")Display resolution1280 x 720 pixelsTouch sensitive screenYesSecond displayNoViewfinderMagnification0.68xPorts & interfacesPictBridgeNoUSB 2.0 ports quantity1HDMI ports quantity1NetworkingData network4G, HSPA+, LTEWi-Fi standards802.11a, 802.11b, 802.11g, 802.11nBluetoothYesBluetooth version4.0Wi-FiYesCameraColour of productBlackWhite balanceAuto, Cloudy, Custom modes, Daylight, Flash, Fluorescent H, Fluorescent L, TungstenScene modesClose-up (macro), Fireworks, Landscape, Night, Panorama, Party (indoor), Pet, Portrait, Snow, Sunrise, SunsetPhoto effectsBlack&White, Negative film, SepiaSelf-timer2, 5, 10, 30sProcessor clock speed1.6 MHzBuilt-in processorQuad CoreBatteryBattery life (CIPA standard)440 shotsBattery capacity4360 mAhPower source typeBatteryTechnical detailsUSB 2.0 ports quantity1HDMI ports quantity1ProcessorProcessor clock speed1.6 MHzBuilt-in processorQuad CoreDesignColour of productBlackPerformanceProcessor clock speed1.6 MHzBuilt-in processorQuad CoreOperational conditionsOperating temperature (T-T)0 - 40 \u00b0COperating relative humidity (H-H)5 - 85%Weight & dimensionsWidth13.65 cmDepth10.12 cmHeight2.57 cmWeight410gWeight (including battery)495gPackaging contentAC adapter includedYesOther featuresUSB 2.0 ports quantity1HDMI ports quantity1",
    "still image resolutions": "JPEG (3:2):20.0M (5472 x 3648), 10.1M (3888 x 2592), 5.9M (2976 x 1984), 2.0M (1728 x 1152), 5.0M (2736 x 1824): Burst mode only JPEG (16:9):16.9M (5472 x 3080), 7.8M (3712 x 2088), 4.9M (2944 x 1656), 2.1M (1920 x 1080) JPEG (1:1):13.3M (3648 x 3648), 7.0M (2640 x 2640), 4.0M (2000 x 2000), 1.1M (1024 x 1024) RAW : 20.0M (5472 x 3648) * 3D Lens Image Size: JPEG (16:9) 4.1M (2688 x 1512), (16:9) 2.1M (1920 x 1080)",
    "supported aspect ratios": "1:1, 3:2, 16:9",
    "total megapixels": "21.6 MP",
    "touch sensitive screen": "Yes",
    "usb 20 ports quantity": [
        "1",
        "1",
        "1"
    ],
    "video formats supported": "H.264, MP4",
    "video resolutions": "320 x 240, 640 x 480, 1280 x 720, 1920 x 810, 1920 x 1080 pixels",
    "voice recording": "Yes",
    "weight": "410g",
    "weight including battery": "495g",
    "white balance": "Auto, Cloudy, Custom modes, Daylight, Flash, Fluorescent H, Fluorescent L, Tungsten",
    "width": "13.65 cm",
    "wifi": "Yes",
    "wifi standards": "802.11a, 802.11b, 802.11g, 802.11n"
}