{
    "<page title>": "Ricoh WG-20 - Digital Cameras - Photo - Visual | ILGS.net",
    "audio formats supported": "WAV",
    "auto focus af assist beam": "Yes",
    "auto focus af points": "9",
    "auto focusing af modes": "Multi Point Auto Focus, Spot Auto Focus, Tracking Auto Focus",
    "batteries included": "Yes",
    "battery charger included": "Yes",
    "battery life cipa standard": "260 shots",
    "battery technology": "Lithium-Ion (Li-Ion)",
    "battery type": "D-LI92",
    "builtin flash": [
        "Yes",
        "Yes"
    ],
    "builtin microphone": "Yes",
    "cables included": "USB",
    "camera file system": "DCF 2.0, DPOF, Exif 2.3, PRINT Image Matching III",
    "camera playback": "Movie, Single image, Slide show, Thumbnails",
    "camera shutter speed": "1/1500 - 1/4sec.",
    "camera shutter speed max": "0.000667s",
    "camera shutter speed min": "0.25s",
    "camera type": "Compact",
    "closest focusing distance": "0.01m",
    "colour of product": [
        "Red",
        "Red",
        "Red"
    ],
    "compatible memory cards": [
        "SD SDHC and SDXC",
        "SD, SDHC, SDXC"
    ],
    "depth": "2.85 cm",
    "digital zoom": [
        "6.7x",
        "6.7 x"
    ],
    "dimensions w x d x h": "58.5 x 28.5 x 115.5 mm",
    "display": "TFT",
    "display diagonal": "6.86 cm (2.7\")",
    "display resolution numeric": "230000 pixels",
    "durable": "Yes",
    "ean": "0027075275102",
    "flash modes": "Auto, Flash off, Flash on, Red-eye reduction",
    "flash range tele": "0.2 - 2.5m",
    "flash range wide": "0.2 - 3.9m",
    "focal length range ff": "5 - 25 mm",
    "focus": "TTL",
    "focus adjustment": "Auto/Manual",
    "freeze proof": "Yes (-10?C)",
    "full hd": "No",
    "hdmi": [
        "Yes",
        "Yes"
    ],
    "hdmi connector type": "Micro",
    "height": "5.85 cm",
    "image editing": "Crop, Resizing, Rotating",
    "image formats supported": "JPG",
    "image sensor size": "25.4/58.4 mm (1/2.3\")",
    "image stabilizer": "Yes",
    "internal memory": "97 MB",
    "iso sensitivity": [
        "80, 6400, Auto",
        "AUTO Manual (ISO 80 - 6400)"
    ],
    "iso sensitivity max": "6400",
    "iso sensitivity min": "80",
    "lcd screen size": "2.7",
    "lens structure elementsgroups": "11/9",
    "light exposure correction": "\u00b1 2EV (1/3EV step)",
    "light metering": "Centre-weighted, Evaluative (Multi-pattern), Spot",
    "mac operating systems supported": [
        "Mac OS X 10.6 Snow Leopard, Mac OS X 10.7 Lion, Mac OS X 10.8 Mountain Lion, Mac OS X 10.9 Mavericks",
        "Mac OS X 10.6 Snow Leopard, Mac OS X 10.7 Lion, Mac OS X 10.8 Mountain Lion, Mac OS X 10.9 Mavericks"
    ],
    "manufacturer": "Ricoh",
    "maximum aperture": "3.5",
    "maximum focal length 35mm film equiv": "14 cm",
    "maximum image resolution": "4228 x 3216 pixels",
    "maximum video resolution": "1280 x 720 pixels",
    "megapixel": [
        "14",
        "14 MP"
    ],
    "minimum aperture": "4.2",
    "minimum focal length 35mm film equiv": "2.8 cm",
    "motion jpeg frame rate": "30 fps",
    "normal focusing range": "0.5 - ?",
    "on screen display osd languages": "CHI (SIMPL), CHI (TR), CZE, DAN, DEU, DUT, ENG, ESP, FIN, FRE, GRE, HUN, ITA, JPN, KOR, POL, POR, RUS, SWE, THA, TUR",
    "optical zoom": [
        "5x",
        "5 x"
    ],
    "pdf url": "No",
    "photo effects": "Antique, Black&White, Sepia",
    "power source type": "Battery",
    "product promotion": "N/A",
    "reviews": "No",
    "scene modes": "Candlelight, Children, Fireworks, Food, Landscape, Night, Night portrait, Pet, Portrait, Snow, Sports, Surf, Underwater",
    "selftimer": "2, 10s",
    "sensor type": [
        "1/2.3 CCD",
        "CCD"
    ],
    "short description": "14MP, 1/2.3\" CCD, PENTAX 5-25mm lens, 6.858 cm (2.7 \") LCD, USB, HDMI",
    "sku": "08076",
    "specification": "Picture qualityImage sensor size25.4/58.4 mm (1/2.3\")Still image resolution(s)14M (4228x3216)\n10M (1:1) (3216x3216)\n10M (16:9) (4224x2376)\n7M (3072x2304)\n5M (16:9) (3072x1728)\n5M (2592x1944)\n4M (16:9) (2592x1464)\n3M (2048x1536)\n2M (16:9) (1920x1080)\n1024 (1024x768)\n640 (640x480)Image stabilizerYesTotal megapixels14.48 MPImage formats supportedJPGMaximum image resolution4228 x 3216 pixelsSensor typeCCDCamera typeCompactMegapixel14 MPLens systemFocal length range (f-f)5 - 25 mmMinimum focal length (35mm film equiv)2.8 cmMaximum focal length (35mm film equiv)14 cmMinimum aperture4.2Maximum aperture3.5Lens structure (elements/groups)11/9Digital zoom6.7xOptical zoom5xFocusingFocusTTLFocus adjustmentAuto/ManualAuto focusing (AF) modesMulti Point Auto Focus, Spot Auto Focus, Tracking Auto FocusNormal focusing range0.5 - ?Closest focusing distance0.01mAuto Focus (AF) points9Auto Focus (AF) assist beamYesLight exposureISO sensitivity80, 6400, AutoLight exposure correction\u00b1 2EV (1/3EV step)Light meteringCentre-weighted, Evaluative (Multi-pattern), SpotISO sensitivity (min)80ISO sensitivity (max)6400ShutterCamera shutter speed (min)0.25sCamera shutter speed (max)0.000667sFlashFlash modesAuto, Flash off, Flash on, Red-eye reductionBuilt-in flashYesFlash range (wide)0.2 - 3.9mFlash range (tele)0.2 - 2.5mVideoVideo resolutions320 x 240, 640 x 480, 1280 x 720 pixelsVideo formats supportedAVIMotion JPEG frame rate30 fpsFull HDNoMaximum video resolution1280 x 720 pixelsAudioBuilt-in microphoneYesAudio formats supportedWAVMemoryInternal memory97 MBCompatible memory cardsSD, SDHC, SDXCDisplayDisplayTFTDisplay diagonal6.86 cm (2.7\")Display resolution (numeric)230000 pixelsViewfinderViewfinder typeElectricalPorts & interfacesUSB version2.0HDMI connector typeMicroHDMIYesCameraColour of productRedWhite balanceAuto, Custom modes, Daylight, Fluorescent, Shade, TungstenScene modesCandlelight, Children, Fireworks, Food, Landscape, Night, Night portrait, Pet, Portrait, Snow, Sports, Surf, UnderwaterPhoto effectsAntique, Black&White, SepiaSelf-timer2, 10sCamera playbackMovie, Single image, Slide show, ThumbnailsOn Screen Display (OSD) languagesCHI (SIMPL), CHI (TR), CZE, DAN, DEU, DUT, ENG, ESP, FIN, FRE, GRE, HUN, ITA, JPN, KOR, POL, POR, RUS, SWE, THA, TURImage editingCrop, Resizing, RotatingCamera file systemDCF 2.0, DPOF, Exif 2.3, PRINT Image Matching IIIBatteryBattery technologyLithium-Ion (Li-Ion)Battery life (CIPA standard)260 shotsBattery typeD-LI92Power source typeBatteryOperating system/softwareWindows operating systems supportedYesMac operating systems supportedMac OS X 10.6 Snow Leopard, Mac OS X 10.7 Lion, Mac OS X 10.8 Mountain Lion, Mac OS X 10.9 MavericksTechnical detailsProtection featuresCrash proof, Dust resistant, Water resistantHDMIYesDesignProtection featuresCrash proof, Dust resistant, Water resistantColour of productRedSystem requirementsWindows operating systems supportedYesMac operating systems supportedMac OS X 10.6 Snow Leopard, Mac OS X 10.7 Lion, Mac OS X 10.8 Mountain Lion, Mac OS X 10.9 MavericksWeight & dimensionsWidth11.55 cmDepth2.85 cmHeight5.85 cmWeight143gWeight (including battery)164gPackaging contentCables includedUSBBattery charger includedYesBatteries includedYes",
    "still image resolutions": "14M (4228x3216)\n10M (1:1) (3216x3216)\n10M (16:9) (4224x2376)\n7M (3072x2304)\n5M (16:9) (3072x1728)\n5M (2592x1944)\n4M (16:9) (2592x1464)\n3M (2048x1536)\n2M (16:9) (1920x1080)\n1024 (1024x768)\n640 (640x480)",
    "total megapixels": "14.48 MP",
    "usb version": "2.0",
    "video capability": "Yes",
    "video formats supported": "AVI",
    "video resolutions": "320 x 240, 640 x 480, 1280 x 720 pixels",
    "viewfinder type": "Electrical",
    "water proof": "Yes (10m)",
    "weight": [
        "164 g",
        "143g"
    ],
    "weight including battery": "164g",
    "white balance": "Auto, Custom modes, Daylight, Fluorescent, Shade, Tungsten",
    "width": "11.55 cm",
    "windows operating systems supported": [
        "Yes",
        "Yes"
    ]
}