{
    "<page title>": "Canon Digital IXUS 265 HS - Digital Cameras - Photo - Visual | ILGS.net",
    "analog signal format system": "NTSC, PAL",
    "audio formats supported": "AAC",
    "auto exposure ae lock": "Yes",
    "auto focus af assist beam": "Yes",
    "auto focus af lock": "Yes",
    "auto focusing af modes": "Continuous Auto Focus, Face detection, Servo Auto Focus, Single Auto Focus, Tracking Auto Focus",
    "batteries included": "Yes",
    "battery charger included": "Yes",
    "battery life cipa standard": "190 shots",
    "battery technology": "Lithium-Ion (Li-Ion)",
    "battery type": [
        "NB-11LH",
        "Lithium (NB-11LH)"
    ],
    "box contents": "IXUS 265 HS Battery Pack NB-11LH Wrist Strap WS-800 User Manual Kit Battery Charger CB-2LFE AC Cable",
    "builtin flash": "Yes",
    "builtin microphone": "Yes",
    "builtin processor": [
        "DIGIC 4+ iSAPS",
        "DIGIC 4+ iSAPS",
        "DIGIC 4+ iSAPS"
    ],
    "bundled software": [
        "ImageBrowser EX",
        "ImageBrowser EX"
    ],
    "camera file system": "DPOF 1.1, Exif 2.3",
    "camera playback": "Movie, Single image",
    "camera shutter speed max": "15s",
    "camera shutter speed min": "0.0005s",
    "camera type": "Compact",
    "closest focusing distance": "0.01m",
    "colour of product": [
        "Purple",
        "Purple",
        "Purple"
    ],
    "combined zoom": "48x",
    "compatible memory cards": [
        "SD, SDHC, SDXC",
        "SD SDHC SDXC"
    ],
    "depth": "2.24 cm",
    "digital zoom": [
        "4x",
        "ZoomPlus 24 x"
    ],
    "dimensions w x d x h": "99.7 x 22.4 x 57.6 mm mm",
    "direct printing": [
        "Yes",
        "Yes",
        "Yes"
    ],
    "display": "TFT",
    "display diagonal": "7.62 cm (3\")",
    "display resolution numeric": "461000 pixels",
    "ean": "8714574616247",
    "external flash connector": "Yes",
    "field of view": "100%",
    "flash exposure lock": "Yes",
    "flash modes": "Auto, Flash off, Flash on, Manual, Red-eye reduction, Slow synchronization",
    "flash range tele": "1 - 2m",
    "flash range wide": "0.5 - 4m",
    "flash syncspeed": "1/2000s",
    "focal length range ff": "4.5 - 54 mm",
    "focus": "TTL",
    "full hd": "Yes",
    "hand strap": "Yes",
    "hdmi": [
        "Yes",
        "Yes"
    ],
    "hdmi connector type": "Micro",
    "height": "5.76 cm",
    "image formats supported": "JPG",
    "image sensor size": "25.4/58.4 mm (1/2.3\")",
    "interface": "Hi-Speed USB (MTP PTP) dedicated connector (Mini-B compatible) HDMI Micro Connector (HDMI-CEC compatible) A/V output (PAL/NTSC Wi-Fi (IEEE802.11b/g/n) (2.4 GHz only) with NFC support??",
    "iso sensitivity": [
        "AUTO 100 200 400 800 1600 3200",
        "100, 200, 400, 800, 1600, 3200, Auto"
    ],
    "iso sensitivity max": "3200",
    "iso sensitivity min": "100",
    "lcd screen size": "3.0",
    "lens structure elementsgroups": "9/7",
    "light exposure correction": "\u00b1 2EV (1/3EV step)",
    "light metering": "Centre-weighted, Evaluative (Multi-pattern), Spot",
    "mac operating systems supported": [
        "Mac OS X 10.7 Lion, Mac OS X 10.8 Mountain Lion, Mac OS X 10.9 Mavericks",
        "Mac OS X 10.7 Lion, Mac OS X 10.8 Mountain Lion, Mac OS X 10.9 Mavericks"
    ],
    "manufacturer": "Canon",
    "maximum aperture": "3.6",
    "maximum focal length 35mm film equiv": "30 cm",
    "maximum image resolution": "4608 x 3456 pixels",
    "maximum video resolution": "1920 x 1080 pixels",
    "megapixel": [
        "16",
        "16 MP"
    ],
    "memory slots": "1",
    "minimum aperture": "7",
    "minimum focal length 35mm film equiv": "2.5 cm",
    "motion jpeg frame rate": "30 fps",
    "near field communication nfc": "Yes",
    "number of batteries supported": "1",
    "on screen display osd languages": "ARA, CHI (SIMPL), CHI (TR), CZE, DAN, DEU, DUT, ENG, ESP, FIN, FRE, GRE, HEB, HUN, ITA, JPN, KOR, NOR, POL, POR, RUM, RUS, SWE, THA, UKR",
    "operating relative humidity hh": "10 - 90%",
    "operating temperature tt": "0 - 40 \u00b0C",
    "optical zoom": [
        "12x",
        "12 x"
    ],
    "orientation sensor": "Yes",
    "pdf url": "No",
    "photo effects": "Black&White, Neutral, Positive film, Sepia, Vivid",
    "pictbridge": "Yes",
    "playback zoom max": "10x",
    "power source type": "Battery",
    "product promotion": "N/A",
    "reviews": "No",
    "scene modes": "Fireworks, Portrait, Snow",
    "selftimer": "2, 10s",
    "sensor type": "CMOS",
    "short description": "Digital IXUS 265 HS - CMOS 1/2.3\", 16MP, 4608 x 3456, DIGIC 4+ iSAPS, 4.5 - 54.0 mm, f/3.6 - f/7.0, 7.5 cm (3.0 inch) LCD (TFT), (Full HD) 1920 x 1080, USB2.0, HDMI-micro, Wi-Fi (IEEE802.11b/g/n), SD, SDHC, SDXC, 147g",
    "sku": "9351B007AA",
    "specification": "Picture qualityImage sensor size25.4/58.4 mm (1/2.3\")Still image resolution(s)4608 x 3456, 3264 x 2448, 2048 x 1536, 640 x 480, 4608 x 2592, 3264 x 1832, 1920 x 1080, 640 x 360, 4608 x 3072, 3264 x 2176, 2048 x 1368, 640 x 424, 3456 x 3456, 2448 x 2448, 1536 x 1536, 480 x 480Image formats supportedJPGMaximum image resolution4608 x 3456 pixelsSensor typeCMOSCamera typeCompactMegapixel16 MPLens systemFocal length range (f-f)4.5 - 54 mmMinimum focal length (35mm film equiv)2.5 cmMaximum focal length (35mm film equiv)30 cmMinimum aperture7Maximum aperture3.6Lens structure (elements/groups)9/7Combined zoom48xDigital zoom4xOptical zoom12xFocusingFocusTTLAuto focusing (AF) modesContinuous Auto Focus, Face detection, Servo Auto Focus, Single Auto Focus, Tracking Auto FocusClosest focusing distance0.01mAuto Focus (AF) lockYesAuto Focus (AF) assist beamYesLight exposureISO sensitivity100, 200, 400, 800, 1600, 3200, AutoLight exposure correction\u00b1 2EV (1/3EV step)Light meteringCentre-weighted, Evaluative (Multi-pattern), SpotAuto Exposure (AE) lockYesISO sensitivity (min)100ISO sensitivity (max)3200ShutterCamera shutter speed (min)0.0005sCamera shutter speed (max)15sFlashFlash modesAuto, Flash off, Flash on, Manual, Red-eye reduction, Slow synchronizationBuilt-in flashYesFlash sync-speed1/2000sFlash range (wide)0.5 - 4mFlash range (tele)1 - 2mFlash exposure lockYesExternal flash connectorYesVideoVideo resolutions640 x 480, 1280 x 720, 1920 x 1080 pixelsVideo formats supportedH.264, MP4, MPEG4Motion JPEG frame rate30 fpsFull HDYesAnalog signal format systemNTSC, PALMaximum video resolution1920 x 1080 pixelsAudioBuilt-in microphoneYesAudio formats supportedAACMemoryCompatible memory cardsSD, SDHC, SDXCMemory slots1DisplayDisplayTFTDisplay diagonal7.62 cm (3\")Display resolution (numeric)461000 pixelsField of view100%Ports & interfacesUSB version2.0HDMI connector typeMicroPictBridgeYesUSB connector typeMini-USB BHDMIYesNetworkingWi-Fi standards802.11b, 802.11g, 802.11nNear Field Communication (NFC)YesWi-FiYesCameraColour of productPurpleWhite balanceAuto, Cloudy, Custom modes, Daylight, Fluorescent, Fluorescent H, TungstenScene modesFireworks, Portrait, SnowPhoto effectsBlack&White, Neutral, Positive film, Sepia, VividSelf-timer2, 10sCamera playbackMovie, Single imagePlayback zoom (max)10xOrientation sensorYesOn Screen Display (OSD) languagesARA, CHI (SIMPL), CHI (TR), CZE, DAN, DEU, DUT, ENG, ESP, FIN, FRE, GRE, HEB, HUN, ITA, JPN, KOR, NOR, POL, POR, RUM, RUS, SWE, THA, UKRDirect printingYesCamera file systemDPOF 1.1, Exif 2.3Built-in processorDIGIC 4+ iSAPSBatteryBattery technologyLithium-Ion (Li-Ion)Battery life (CIPA standard)190 shotsBattery typeNB-11LHNumber of batteries supported1Power source typeBatteryOperating system/softwareWindows operating systems supportedWindows 7 Home Basic, Windows 7 Home Basic x64, Windows 7 Home Premium, Windows 7 Home Premium x64, Windows 7 Professional, Windows 7 Professional x64, Windows 7 Starter, Windows 7 Starter x64, Windows 7 Ultimate, Windows 7 Ultimate x64, Windows 8, Windows 8 Enterprise, Windows 8 Enterprise x64, Windows 8 Pro, Windows 8 Pro x64, Windows 8 x64, Windows Vista Business, Windows Vista Business x64, Windows Vista Enterprise, Windows Vista Enterprise x64, Windows Vista Home Basic, Windows Vista Home Basic x64, Windows Vista Home Premium, Windows Vista Home Premium x64, Windows Vista Ultimate, Windows Vista Ultimate x64, Windows XP Home, Windows XP Home x64, Windows XP Professional, Windows XP Professional x64Mac operating systems supportedMac OS X 10.7 Lion, Mac OS X 10.8 Mountain Lion, Mac OS X 10.9 MavericksBundled softwareImageBrowser EXTechnical detailsHDMIYesDirect printingYesProcessorBuilt-in processorDIGIC 4+ iSAPSDesignColour of productPurplePerformanceDirect printingYesBuilt-in processorDIGIC 4+ iSAPSOperational conditionsOperating temperature (T-T)0 - 40 \u00b0COperating relative humidity (H-H)10 - 90%System requirementsWindows operating systems supportedWindows 7 Home Basic, Windows 7 Home Basic x64, Windows 7 Home Premium, Windows 7 Home Premium x64, Windows 7 Professional, Windows 7 Professional x64, Windows 7 Starter, Windows 7 Starter x64, Windows 7 Ultimate, Windows 7 Ultimate x64, Windows 8, Windows 8 Enterprise, Windows 8 Enterprise x64, Windows 8 Pro, Windows 8 Pro x64, Windows 8 x64, Windows Vista Business, Windows Vista Business x64, Windows Vista Enterprise, Windows Vista Enterprise x64, Windows Vista Home Basic, Windows Vista Home Basic x64, Windows Vista Home Premium, Windows Vista Home Premium x64, Windows Vista Ultimate, Windows Vista Ultimate x64, Windows XP Home, Windows XP Home x64, Windows XP Professional, Windows XP Professional x64Mac operating systems supportedMac OS X 10.7 Lion, Mac OS X 10.8 Mountain Lion, Mac OS X 10.9 MavericksWeight & dimensionsWidth9.97 cmDepth2.24 cmHeight5.76 cmWeight147gPackaging contentBundled softwareImageBrowser EXHand strapYesBattery charger includedYesBatteries includedYes",
    "still image resolutions": "4608 x 3456, 3264 x 2448, 2048 x 1536, 640 x 480, 4608 x 2592, 3264 x 1832, 1920 x 1080, 640 x 360, 4608 x 3072, 3264 x 2176, 2048 x 1368, 640 x 424, 3456 x 3456, 2448 x 2448, 1536 x 1536, 480 x 480",
    "usb connector type": "Mini-USB B",
    "usb version": "2.0",
    "video capability": "Full HD",
    "video formats supported": "H.264, MP4, MPEG4",
    "video resolutions": "640 x 480, 1280 x 720, 1920 x 1080 pixels",
    "warranty": "1 Year",
    "weight": [
        "147 g",
        "147g"
    ],
    "white balance": "Auto, Cloudy, Custom modes, Daylight, Fluorescent, Fluorescent H, Tungsten",
    "width": "9.97 cm",
    "wifi": [
        "Yes",
        "Yes"
    ],
    "wifi standards": "802.11b, 802.11g, 802.11n",
    "windows operating systems supported": [
        "Windows 7 Home Basic, Windows 7 Home Basic x64, Windows 7 Home Premium, Windows 7 Home Premium x64, Windows 7 Professional, Windows 7 Professional x64, Windows 7 Starter, Windows 7 Starter x64, Windows 7 Ultimate, Windows 7 Ultimate x64, Windows 8, Windows 8 Enterprise, Windows 8 Enterprise x64, Windows 8 Pro, Windows 8 Pro x64, Windows 8 x64, Windows Vista Business, Windows Vista Business x64, Windows Vista Enterprise, Windows Vista Enterprise x64, Windows Vista Home Basic, Windows Vista Home Basic x64, Windows Vista Home Premium, Windows Vista Home Premium x64, Windows Vista Ultimate, Windows Vista Ultimate x64, Windows XP Home, Windows XP Home x64, Windows XP Professional, Windows XP Professional x64",
        "Windows 7 Home Basic, Windows 7 Home Basic x64, Windows 7 Home Premium, Windows 7 Home Premium x64, Windows 7 Professional, Windows 7 Professional x64, Windows 7 Starter, Windows 7 Starter x64, Windows 7 Ultimate, Windows 7 Ultimate x64, Windows 8, Windows 8 Enterprise, Windows 8 Enterprise x64, Windows 8 Pro, Windows 8 Pro x64, Windows 8 x64, Windows Vista Business, Windows Vista Business x64, Windows Vista Enterprise, Windows Vista Enterprise x64, Windows Vista Home Basic, Windows Vista Home Basic x64, Windows Vista Home Premium, Windows Vista Home Premium x64, Windows Vista Ultimate, Windows Vista Ultimate x64, Windows XP Home, Windows XP Home x64, Windows XP Professional, Windows XP Professional x64"
    ]
}