{
    "<page title>": "Sony HX300 Digital compact camera - Digital Cameras - Photo - Visual | ILGS.net",
    "auto focusing af modes": "Centre weighted Auto Focus, Flexible Spot Auto Focus, Multi Point Auto Focus, Spot Auto Focus",
    "av output": "No",
    "battery life cipa standard": "400 shots",
    "battery technology": "Lithium",
    "battery type": "NP-BX1",
    "builtin flash": "Yes",
    "camera shutter speed max": "30s",
    "camera shutter speed min": "0.00025s",
    "camera type": "Compact",
    "colour of product": [
        "Black",
        "Black"
    ],
    "compatible memory cards": "MS Duo, MS PRO Duo, MS Pro-HG Duo, SD, SDHC, SDXC",
    "depth": "10.32 cm",
    "digital zoom": "100x",
    "display": "TFT",
    "display diagonal": "7.62 cm (3\")",
    "display resolution numeric": "921600 pixels",
    "ean": "4905524936735",
    "electrical viewfinder": [
        "Yes",
        "Yes"
    ],
    "face detection": [
        "Yes",
        "Yes"
    ],
    "flash modes": "Auto, Flash off, Flash on, Slow synchronization",
    "flash range tele": "2 - 5.9m",
    "flash range wide": "0.3 - 12.4m",
    "focal length range ff": "4.3 - 215 mm",
    "focus adjustment": "Auto/Manual",
    "full hd": "Yes",
    "gps": [
        "No",
        "No",
        "No"
    ],
    "hdmi": [
        "Yes",
        "Yes"
    ],
    "hdmi connector type": "Micro",
    "height": "9.32 cm",
    "image sensor size": "25.4/58.4 mm (1/2.3\")",
    "iso sensitivity": "80, 1600, 3200, 12800",
    "iso sensitivity max": "12800",
    "iso sensitivity min": "80",
    "light exposure control": "Program AE",
    "light exposure correction": "\u00b1 2EV (1/3EV step)",
    "light exposure modes": "Aperture priority AE, Auto, Manual, Shutter priority AE",
    "light metering": "Centre-weighted, Spot",
    "macro focusing range tele": "2.4 - ?",
    "macro focusing range wide": "0.01 - ?",
    "manual focus": [
        "Yes",
        "Yes"
    ],
    "manufacturer": "Sony",
    "maximum aperture": "6.3",
    "maximum focal length 35mm film equiv": "130 cm",
    "maximum image resolution": "5184 x 3888 pixels",
    "maximum video resolution": "1440 x 1080 pixels",
    "megapixel": "20.4 MP",
    "minimum aperture": "2.8",
    "minimum focal length 35mm film equiv": "2.4 cm",
    "optical viewfinder": [
        "No",
        "No"
    ],
    "optical zoom": "50x",
    "pdf url": "No",
    "pictbridge": "No",
    "power source type": "Battery",
    "product promotion": "N/A",
    "scene modes": "Backlight, Beach, Fireworks, Landscape, Night portrait, Snow",
    "sensor type": "CMOS",
    "short description": "20.4MPx, Exmor R CMOS, 50x optical zoom, 7.5cm (3.0\") LCD, Full HD, Intelligent Auto, manual control",
    "sku": "DSCHX300B.CEH",
    "specification": "Picture qualityImage sensor size25.4/58.4 mm (1/2.3\")Supported aspect ratios3:2, 16:9Still image resolution(s)5184 x 3888, 4896 x 3672, 4320 x 3240, 4224 x 3168, 4000 x 3000, 3648 x 2736, 3456 x 2592, 3264 x 2448, 3072 x 2304, 2592 x 1944, 2048 x 1536, 640 x 480, 1920 x 1080, 4896 x 2752, 4608 x 2592, 4320 x 2432, 4000 x 2248, 4000 x 2672, 3648 x 2432, 3456 x 2304Maximum image resolution5184 x 3888 pixelsSensor typeCMOSCamera typeCompactMegapixel20.4 MPLens systemFocal length range (f-f)4.3 - 215 mmMinimum focal length (35mm film equiv)2.4 cmMaximum focal length (35mm film equiv)130 cmMinimum aperture2.8Maximum aperture6.3Digital zoom100xOptical zoom50xFocusingFocus adjustmentAuto/ManualAuto focusing (AF) modesCentre weighted Auto Focus, Flexible Spot Auto Focus, Multi Point Auto Focus, Spot Auto FocusMacro focusing range (wide)0.01 - ?Macro focusing range (tele)2.4 - ?Light exposureISO sensitivity80, 1600, 3200, 12800Light exposure modesAperture priority AE, Auto, Manual, Shutter priority AELight exposure controlProgram AELight exposure correction\u00b1 2EV (1/3EV step)Light meteringCentre-weighted, SpotISO sensitivity (min)80ISO sensitivity (max)12800ShutterCamera shutter speed (min)0.00025sCamera shutter speed (max)30sFlashFlash modesAuto, Flash off, Flash on, Slow synchronizationBuilt-in flashYesFlash range (wide)0.3 - 12.4mFlash range (tele)2 - 5.9mVideoVideo resolutions640 x 480, 1440 x 1080, 1920 x 1080 pixelsVideo formats supportedMPEGFull HDYesMaximum video resolution1440 x 1080 pixelsMemoryCompatible memory cardsMS Duo, MS PRO Duo, MS Pro-HG Duo, SD, SDHC, SDXCDisplayDisplayTFTDisplay diagonal7.62 cm (3\")Display resolution (numeric)921600 pixelsPorts & interfacesUSB version2.0HDMI connector typeMicroPictBridgeNoHDMIYesAV outputNoCameraColour of productBlackWhite balanceAuto, Cloudy, Daylight, Fluorescent, Fluorescent H, Fluorescent LScene modesBacklight, Beach, Fireworks, Landscape, Night portrait, SnowGPSNoBatteryBattery technologyLithiumBattery life (CIPA standard)400 shotsBattery typeNP-BX1Power source typeBatteryTechnical detailsWaterproofNoTrimmingYesOptical viewfinderNoManual focusYesHDMIYesGPSNoFace detectionYesElectrical viewfinderYesCool shot functionYesConversion functionNoDesignColour of productBlackPerformanceGPSNoWeight & dimensionsWidth12.96 cmDepth10.32 cmHeight9.32 cmWeight623gWeight (including battery)650gOther featuresWaterproofNoTrimmingYesOptical viewfinderNoManual focusYesFocal length (35mm film equivalent)24 - 1200 mmFace detectionYesElectrical viewfinderYesCool shot functionYesConversion functionNo",
    "still image resolutions": "5184 x 3888, 4896 x 3672, 4320 x 3240, 4224 x 3168, 4000 x 3000, 3648 x 2736, 3456 x 2592, 3264 x 2448, 3072 x 2304, 2592 x 1944, 2048 x 1536, 640 x 480, 1920 x 1080, 4896 x 2752, 4608 x 2592, 4320 x 2432, 4000 x 2248, 4000 x 2672, 3648 x 2432, 3456 x 2304",
    "supported aspect ratios": "3:2, 16:9",
    "trimming": [
        "Yes",
        "Yes"
    ],
    "usb version": "2.0",
    "video formats supported": "MPEG",
    "video resolutions": "640 x 480, 1440 x 1080, 1920 x 1080 pixels",
    "waterproof": [
        "No",
        "No"
    ],
    "weight": "623g",
    "weight including battery": "650g",
    "white balance": "Auto, Cloudy, Daylight, Fluorescent, Fluorescent H, Fluorescent L",
    "width": "12.96 cm"
}