{
    "<page title>": "Canon Digital IXUS 150 - Digital Cameras - Photo - Visual | ILGS.net",
    "analog signal format system": "NTSC, PAL",
    "auto exposure ae lock": "Yes",
    "auto focus af assist beam": "Yes",
    "auto focus af lock": "Yes",
    "auto focus af points": "9",
    "auto focusing af modes": "Continuous Auto Focus, Face detection, Servo Auto Focus, Single Auto Focus, Tracking Auto Focus",
    "battery life cipa standard": "210 shots",
    "battery technology": "Lithium-Ion (Li-Ion)",
    "battery type": [
        "NB-11L",
        "Rechargeable Li-ion Battery NB-11L (battery and charger supplied)"
    ],
    "bluetooth": "No",
    "builtin flash": [
        "Yes",
        "Yes"
    ],
    "builtin microphone": "Yes",
    "builtin processor": [
        "DIGIC 4+",
        "DIGIC 4+",
        "DIGIC 4+"
    ],
    "bundled software": [
        "ImageBrowser EX",
        "ImageBrowser EX"
    ],
    "camera file system": "DPOF 1.1, Exif 2.3",
    "camera shutter speed": "1 \u2013 1/2000 sec. (factory default) 15 \u2013 1/2000 sec. (total range \u2013 varies by shooting mode)",
    "camera shutter speed max": "15s",
    "camera shutter speed min": "0.0005s",
    "camera type": "Compact",
    "closest focusing distance": "0.01m",
    "colour of product": [
        "Grey",
        "Grey",
        "Silver"
    ],
    "combined zoom": "32x",
    "compatible memory cards": [
        "SD, SDHC, SDXC",
        "SD SDHC SDXC"
    ],
    "depth": "2.21 cm",
    "digital zoom": [
        "4x",
        "4 x"
    ],
    "dimensions w x d x h": "95.2 x 22.1 x 54.3 mm",
    "display": "LCD",
    "display diagonal": "6.86 cm (2.7\")",
    "display resolution numeric": "230000 pixels",
    "ean": "8714574615349",
    "flash exposure lock": "Yes",
    "flash modes": "Auto, Flash off, Flash on, Manual, Red-eye reduction, Slow synchronization",
    "flash range tele": "1.3 - 1.5m",
    "flash range wide": "0.5 - 3m",
    "flash syncspeed": "0.0005s",
    "focal length range ff": "5 - 40 mm",
    "focus": "TTL",
    "full hd": "No",
    "hdmi": [
        "No",
        "No"
    ],
    "height": "5.43 cm",
    "histogram": "Yes",
    "image formats supported": "JPG",
    "image sensor size": "25.4/58.4 mm (1/2.3\")",
    "image stabilizer": "Yes",
    "iso sensitivity": [
        "100, 200, 400, 800, 1600, Auto",
        "AUTO 100 200 400 800 1600"
    ],
    "iso sensitivity max": "1600",
    "iso sensitivity min": "100",
    "languages support": [
        "ARA, CHI (SIMPL), CHI (TR), CZE, DAN, DEU, DUT, ENG, ESP, FIN, FRE, GRE, HEB, HUN, ITA, JPN, KOR, NOR, POL, POR, RUM, RUS, SWE, THA, TUR, UKR",
        "ARA, CHI (SIMPL), CHI (TR), CZE, DAN, DEU, DUT, ENG, ESP, FIN, FRE, GRE, HEB, HUN, ITA, JPN, KOR, NOR, POL, POR, RUM, RUS, SWE, THA, TUR, UKR"
    ],
    "lcd screen size": "2.7",
    "lens structure elementsgroups": "8/7",
    "light exposure correction": "\u00b1 2EV (1/3EV step)",
    "light metering": "Centre-weighted, Evaluative (Multi-pattern), Spot",
    "mac operating systems supported": [
        "Mac OS X 10.7 Lion, Mac OS X 10.8 Mountain Lion, Mac OS X 10.9 Mavericks",
        "Mac OS X 10.7 Lion, Mac OS X 10.8 Mountain Lion, Mac OS X 10.9 Mavericks"
    ],
    "manufacturer": "Canon",
    "maximum aperture": "3.2",
    "maximum focal length 35mm film equiv": "22.4 cm",
    "maximum image resolution": "4608 x 3456 pixels",
    "maximum video resolution": "1280 x 720 pixels",
    "megapixel": [
        "16 MP",
        "16"
    ],
    "memory slots": "1",
    "minimum aperture": "6.9",
    "minimum focal length 35mm film equiv": "2.8 cm",
    "number of batteries supported": "1",
    "operating relative humidity hh": "10 - 90%",
    "operating temperature tt": "0 - 40 \u00b0C",
    "optical zoom": [
        "8x",
        "8 x"
    ],
    "pdf url": "No",
    "photo effects": "Black&White, Vivid",
    "pictbridge": "Yes",
    "playback zoom max": "10x",
    "power source type": "Battery",
    "product promotion": "N/A",
    "reviews": "No",
    "scene modes": "Fireworks, Portrait, Self-portrait, Snow",
    "selftimer": "2, 10s",
    "sensor type": [
        "CCD",
        "1/2.3 type CCD"
    ],
    "short description": "Digital IXUS 150 - 16 MP (4608 x 3456), 1/2.3\" CCD, ISO 100-1600, 6.858 cm (2.7 \") LCD, USB 2.0, 130 g",
    "sku": "9145B007AA",
    "specification": "Picture qualityImage sensor size25.4/58.4 mm (1/2.3\")Still image resolution(s)4608 x 3456, 3264 x 2448, 2048 x 1536, 640 x 480, 4608 x 2592Image stabilizerYesImage formats supportedJPGMaximum image resolution4608 x 3456 pixelsSensor typeCCDCamera typeCompactMegapixel16 MPLens systemFocal length range (f-f)5 - 40 mmMinimum focal length (35mm film equiv)2.8 cmMaximum focal length (35mm film equiv)22.4 cmMinimum aperture6.9Maximum aperture3.2Lens structure (elements/groups)8/7Combined zoom32xDigital zoom4xOptical zoom8xFocusingFocusTTLAuto focusing (AF) modesContinuous Auto Focus, Face detection, Servo Auto Focus, Single Auto Focus, Tracking Auto FocusClosest focusing distance0.01mAuto Focus (AF) points9Auto Focus (AF) lockYesAuto Focus (AF) assist beamYesLight exposureISO sensitivity100, 200, 400, 800, 1600, AutoLight exposure correction\u00b1 2EV (1/3EV step)Light meteringCentre-weighted, Evaluative (Multi-pattern), SpotAuto Exposure (AE) lockYesISO sensitivity (min)100ISO sensitivity (max)1600ShutterCamera shutter speed (min)0.0005sCamera shutter speed (max)15sFlashFlash modesAuto, Flash off, Flash on, Manual, Red-eye reduction, Slow synchronizationBuilt-in flashYesFlash sync-speed0.0005sFlash range (wide)0.5 - 3mFlash range (tele)1.3 - 1.5mFlash exposure lockYesVideoVideo resolutions640 x 480, 1280 x 720 pixelsVideo formats supportedH.264, MOVFull HDNoAnalog signal format systemNTSC, PALMaximum video resolution1280 x 720 pixelsAudioBuilt-in microphoneYesMemoryCompatible memory cardsSD, SDHC, SDXCMemory slots1DisplayDisplayLCDDisplay diagonal6.86 cm (2.7\")Display resolution (numeric)230000 pixelsPorts & interfacesUSB version2.0PictBridgeYesUSB connector typeMini-USB BHDMINoNetworkingBluetoothNoCameraColour of productGreyWhite balanceAuto, Cloudy, Custom modes, Daylight, Fluorescent, Fluorescent H, TungstenScene modesFireworks, Portrait, Self-portrait, SnowPhoto effectsBlack&White, VividSelf-timer2, 10sPlayback zoom (max)10xLanguages supportARA, CHI (SIMPL), CHI (TR), CZE, DAN, DEU, DUT, ENG, ESP, FIN, FRE, GRE, HEB, HUN, ITA, JPN, KOR, NOR, POL, POR, RUM, RUS, SWE, THA, TUR, UKRHistogramYesCamera file systemDPOF 1.1, Exif 2.3Built-in processorDIGIC 4+BatteryBattery technologyLithium-Ion (Li-Ion)Battery life (CIPA standard)210 shotsBattery typeNB-11LNumber of batteries supported1Power source typeBatteryOperating system/softwareWindows operating systems supportedWindows 7 Home Basic, Windows 7 Home Basic x64, Windows 7 Home Premium, Windows 7 Home Premium x64, Windows 7 Professional, Windows 7 Professional x64, Windows 7 Starter, Windows 7 Starter x64, Windows 7 Ultimate, Windows 7 Ultimate x64, Windows 8, Windows 8 Enterprise, Windows 8 Enterprise x64, Windows 8 Pro, Windows 8 Pro x64, Windows 8 x64, Windows 8.1, Windows 8.1 Enterprise, Windows 8.1 Enterprise x64, Windows 8.1 Pro, Windows 8.1 Pro x64, Windows 8.1 x64, Windows Vista Business, Windows Vista Business x64, Windows Vista Enterprise, Windows Vista Enterprise x64, Windows Vista Home Basic, Windows Vista Home Basic x64, Windows Vista Home Premium, Windows Vista Home Premium x64, Windows Vista Ultimate, Windows Vista Ultimate x64, Windows XP Home, Windows XP Home x64, Windows XP Professional, Windows XP Professional x64Mac operating systems supportedMac OS X 10.7 Lion, Mac OS X 10.8 Mountain Lion, Mac OS X 10.9 MavericksBundled softwareImageBrowser EXTechnical detailsLanguages supportARA, CHI (SIMPL), CHI (TR), CZE, DAN, DEU, DUT, ENG, ESP, FIN, FRE, GRE, HEB, HUN, ITA, JPN, KOR, NOR, POL, POR, RUM, RUS, SWE, THA, TUR, UKRHDMINoProcessorBuilt-in processorDIGIC 4+DesignColour of productGreyPerformanceBuilt-in processorDIGIC 4+Operational conditionsOperating temperature (T-T)0 - 40 \u00b0COperating relative humidity (H-H)10 - 90%System requirementsWindows operating systems supportedWindows 7 Home Basic, Windows 7 Home Basic x64, Windows 7 Home Premium, Windows 7 Home Premium x64, Windows 7 Professional, Windows 7 Professional x64, Windows 7 Starter, Windows 7 Starter x64, Windows 7 Ultimate, Windows 7 Ultimate x64, Windows 8, Windows 8 Enterprise, Windows 8 Enterprise x64, Windows 8 Pro, Windows 8 Pro x64, Windows 8 x64, Windows 8.1, Windows 8.1 Enterprise, Windows 8.1 Enterprise x64, Windows 8.1 Pro, Windows 8.1 Pro x64, Windows 8.1 x64, Windows Vista Business, Windows Vista Business x64, Windows Vista Enterprise, Windows Vista Enterprise x64, Windows Vista Home Basic, Windows Vista Home Basic x64, Windows Vista Home Premium, Windows Vista Home Premium x64, Windows Vista Ultimate, Windows Vista Ultimate x64, Windows XP Home, Windows XP Home x64, Windows XP Professional, Windows XP Professional x64Mac operating systems supportedMac OS X 10.7 Lion, Mac OS X 10.8 Mountain Lion, Mac OS X 10.9 MavericksWeight & dimensionsWidth9.52 cmDepth2.21 cmHeight5.43 cmWeight130gPackaging contentBundled softwareImageBrowser EX",
    "still image resolutions": "4608 x 3456, 3264 x 2448, 2048 x 1536, 640 x 480, 4608 x 2592",
    "usb connector type": "Mini-USB B",
    "usb version": "2.0",
    "video capability": "Yes",
    "video formats supported": "H.264, MOV",
    "video resolutions": "640 x 480, 1280 x 720 pixels",
    "warranty": "1 Year",
    "weight": [
        "130g",
        "127 g"
    ],
    "white balance": "Auto, Cloudy, Custom modes, Daylight, Fluorescent, Fluorescent H, Tungsten",
    "width": "9.52 cm",
    "wifi": "No",
    "windows operating systems supported": [
        "Windows 7 Home Basic, Windows 7 Home Basic x64, Windows 7 Home Premium, Windows 7 Home Premium x64, Windows 7 Professional, Windows 7 Professional x64, Windows 7 Starter, Windows 7 Starter x64, Windows 7 Ultimate, Windows 7 Ultimate x64, Windows 8, Windows 8 Enterprise, Windows 8 Enterprise x64, Windows 8 Pro, Windows 8 Pro x64, Windows 8 x64, Windows 8.1, Windows 8.1 Enterprise, Windows 8.1 Enterprise x64, Windows 8.1 Pro, Windows 8.1 Pro x64, Windows 8.1 x64, Windows Vista Business, Windows Vista Business x64, Windows Vista Enterprise, Windows Vista Enterprise x64, Windows Vista Home Basic, Windows Vista Home Basic x64, Windows Vista Home Premium, Windows Vista Home Premium x64, Windows Vista Ultimate, Windows Vista Ultimate x64, Windows XP Home, Windows XP Home x64, Windows XP Professional, Windows XP Professional x64",
        "Windows 7 Home Basic, Windows 7 Home Basic x64, Windows 7 Home Premium, Windows 7 Home Premium x64, Windows 7 Professional, Windows 7 Professional x64, Windows 7 Starter, Windows 7 Starter x64, Windows 7 Ultimate, Windows 7 Ultimate x64, Windows 8, Windows 8 Enterprise, Windows 8 Enterprise x64, Windows 8 Pro, Windows 8 Pro x64, Windows 8 x64, Windows 8.1, Windows 8.1 Enterprise, Windows 8.1 Enterprise x64, Windows 8.1 Pro, Windows 8.1 Pro x64, Windows 8.1 x64, Windows Vista Business, Windows Vista Business x64, Windows Vista Enterprise, Windows Vista Enterprise x64, Windows Vista Home Basic, Windows Vista Home Basic x64, Windows Vista Home Premium, Windows Vista Home Premium x64, Windows Vista Ultimate, Windows Vista Ultimate x64, Windows XP Home, Windows XP Home x64, Windows XP Professional, Windows XP Professional x64"
    ]
}