{
    "<page title>": "Fujifilm XQ1 - Digital Cameras - Photo - Visual | ILGS.net",
    "ac adapter included": "Yes",
    "audio formats supported": "LPCM",
    "auto focusing af modes": "Continuous Auto Focus, Face detection, Multi Point Auto Focus, Single Auto Focus, Tracking Auto Focus",
    "auto mode focusing range tele": "0.8 - ?",
    "auto mode focusing range wide": "0.5 - ?",
    "batteries included": "Yes",
    "battery life cipa standard": "240 shots",
    "battery technology": "Lithium-Ion (Li-Ion)",
    "battery type": "NP-48",
    "builtin flash": "Yes",
    "builtin microphone": "Yes",
    "cables included": "USB",
    "camera file system": "DPOF 1.1, Exif 2.3, RAW",
    "camera shutter speed max": "0.25s",
    "camera shutter speed min": "0.003s",
    "camera type": "Compact",
    "colour of product": [
        "Black",
        "Black"
    ],
    "compatible memory cards": "SD, SDHC, SDXC",
    "depth": "3.33 cm",
    "digital zoom": "4x",
    "display": "LCD",
    "display diagonal": "7.62 cm (3\")",
    "display resolution numeric": "920000 pixels",
    "ean": "4547410263312",
    "field of view": "100%",
    "flash modes": "Auto, Forced off, Red-eye reduction, Slow synchronization, Suppressed",
    "flash range tele": "0.8 - 2.7m",
    "flash range wide": "0.5 - 7.4m",
    "focal length range ff": "6.4 - 25.6 mm",
    "focus": "TTL",
    "full hd": "Yes",
    "hand strap": "Yes",
    "hdmi": [
        "Yes",
        "Yes"
    ],
    "hdmi connector type": "Micro",
    "height": "5.85 cm",
    "image formats supported": "JPG, RAW",
    "image sensor size": "25.4/58.4 mm (1/2.3\")",
    "image stabilizer": "Yes",
    "internal memory": "66 MB",
    "iso sensitivity max": "12800",
    "iso sensitivity min": "100",
    "lens structure elementsgroups": "7/6",
    "light exposure control": "Program AE",
    "light exposure correction": "\u00b1 3EV (1/3EV step)",
    "light exposure modes": "Aperture priority AE, Auto, Manual, Shutter priority AE",
    "light metering": "Centre-weighted, Evaluative (Multi-pattern), Spot",
    "macro focusing range tele": "0.50 - 3.0m",
    "macro focusing range wide": "0.03 - 3.0m",
    "manufacturer": "Fujifilm",
    "maximum aperture": "11",
    "maximum focal length 35mm film equiv": "10 cm",
    "maximum image resolution": "4000 x 3000 pixels",
    "maximum video resolution": "1920 x 1080 pixels",
    "megapixel": "12 MP",
    "memory slots": "1",
    "minimum aperture": "1.8",
    "minimum focal length 35mm film equiv": "2.5 cm",
    "number of batteries supported": "1",
    "operating relative humidity hh": "10 - 80%",
    "operating temperature tt": "0 - 40 \u00b0C",
    "optical zoom": "4x",
    "pdf url": "http://pdfs.icecat.biz/pdf/40256129-7955.pdf",
    "pictbridge": "Yes",
    "power source type": "Battery",
    "product promotion": "N/A",
    "quick start guide": [
        "Yes",
        "Yes"
    ],
    "scene modes": "Beach, Close-up (macro), Documents, Fireworks, Landscape, Night, Party (indoor), Portrait, Snow, Sunset, Underwater",
    "selftimer": "2, 10s",
    "sensor type": "CMOS",
    "short description": "12MP, 2/3\" CMOS, Full-HD 1920x108060p/30p, Wi-Fi 802.11b/g/n, PictBridge, SD/SDHC/SDXC, USB 2.0, microHDMI, 7.62 cm (3.0 \") LCD 920K, 206g",
    "sku": "P10NC11760A",
    "specification": "Picture qualityImage sensor size25.4/58.4 mm (1/2.3\")Supported aspect ratios1:1, 3:2, 4:3, 16:9Still image resolution(s)4000 x 3000\n4000 x 2664\n4000 x 2248\n2992 x 2992\n2816 x 2112\n2816 x 1864\n2816 x 1584\n2112 x 2112\n2048 x 1536\n2048 x 1360\n1920 x 1080\n1536 x 1536Image stabilizerYesTotal megapixels14.5 MPImage formats supportedJPG, RAWMaximum image resolution4000 x 3000 pixelsSensor typeCMOSCamera typeCompactMegapixel12 MPLens systemFocal length range (f-f)6.4 - 25.6 mmMinimum focal length (35mm film equiv)2.5 cmMaximum focal length (35mm film equiv)10 cmMinimum aperture1.8Maximum aperture11Lens structure (elements/groups)7/6Digital zoom4xOptical zoom4xFocusingFocusTTLAuto focusing (AF) modesContinuous Auto Focus, Face detection, Multi Point Auto Focus, Single Auto Focus, Tracking Auto FocusMacro focusing range (wide)0.03 - 3.0mMacro focusing range (tele)0.50 - 3.0mAuto Mode focusing range (wide)0.5 - ?Auto Mode focusing range (tele)0.8 - ?Light exposureLight exposure modesAperture priority AE, Auto, Manual, Shutter priority AELight exposure controlProgram AELight exposure correction\u00b1 3EV (1/3EV step)Light meteringCentre-weighted, Evaluative (Multi-pattern), SpotISO sensitivity (min)100ISO sensitivity (max)12800ShutterCamera shutter speed (min)0.003sCamera shutter speed (max)0.25sFlashFlash modesAuto, Forced off, Red-eye reduction, Slow synchronization, SuppressedBuilt-in flashYesFlash range (wide)0.5 - 7.4mFlash range (tele)0.8 - 2.7mVideoVideo resolutions640 x 480, 1280 x 720, 1920 x 1080 pixelsVideo formats supportedMOVFull HDYesMaximum video resolution1920 x 1080 pixelsAudioBuilt-in microphoneYesVoice recordingYesAudio formats supportedLPCMMemoryInternal memory66 MBCompatible memory cardsSD, SDHC, SDXCMemory slots1DisplayDisplayLCDDisplay diagonal7.62 cm (3\")Display resolution (numeric)920000 pixelsField of view100%ViewfinderViewfinder typeNoPorts & interfacesUSB version2.0HDMI connector typeMicroPictBridgeYesHDMIYesNetworkingWi-Fi standards802.11b, 802.11g, 802.11nWi-FiYesCameraColour of productBlackWhite balanceAuto, Custom modes, Fluorescent H, Fluorescent L, Incandescent, Shade, UnderwaterScene modesBeach, Close-up (macro), Documents, Fireworks, Landscape, Night, Party (indoor), Portrait, Snow, Sunset, UnderwaterSelf-timer2, 10sCamera file systemDPOF 1.1, Exif 2.3, RAWBatteryBattery technologyLithium-Ion (Li-Ion)Battery life (CIPA standard)240 shotsBattery typeNP-48Number of batteries supported1Power source typeBatteryOperating system/softwareWindows operating systems supportedYesTechnical detailsQuick start guideYesHDMIYesDesignColour of productBlackOperational conditionsOperating temperature (T-T)0 - 40 \u00b0COperating relative humidity (H-H)10 - 80%System requirementsWindows operating systems supportedYesWeight & dimensionsWidth10 cmDepth3.33 cmHeight5.85 cmWeight187gWeight (including battery)206gPackaging contentQuick start guideYesHand strapYesCables includedUSBBatteries includedYesAC adapter includedYes",
    "still image resolutions": "4000 x 3000\n4000 x 2664\n4000 x 2248\n2992 x 2992\n2816 x 2112\n2816 x 1864\n2816 x 1584\n2112 x 2112\n2048 x 1536\n2048 x 1360\n1920 x 1080\n1536 x 1536",
    "supported aspect ratios": "1:1, 3:2, 4:3, 16:9",
    "total megapixels": "14.5 MP",
    "usb version": "2.0",
    "video formats supported": "MOV",
    "video resolutions": "640 x 480, 1280 x 720, 1920 x 1080 pixels",
    "viewfinder type": "No",
    "voice recording": "Yes",
    "weight": "187g",
    "weight including battery": "206g",
    "white balance": "Auto, Custom modes, Fluorescent H, Fluorescent L, Incandescent, Shade, Underwater",
    "width": "10 cm",
    "wifi": "Yes",
    "wifi standards": "802.11b, 802.11g, 802.11n",
    "windows operating systems supported": [
        "Yes",
        "Yes"
    ]
}